university,department_code,course_number,title,description,progressive_signal,western_canon_signal,climate_narrow_signal,climate_broad_signal
University of Virginia,ENWR,210,Advanced Academic Writing,,False,False,False,False
University of Virginia,ENWR,230,Poetry Writing,,False,False,False,False
University of Virginia,ENWR,250,Fiction Writing,,False,False,False,False
University of Virginia,ENWR,270,News Writing,(S) Credits: 3 Back to Top | Print-Friendly Page (opens a new window) All catalogs © 2026 University of Virginia. Powered by Modern Campus Catalog™ .,False,False,False,False
University of Virginia,ENWR,106,Academic Writing II,"Covers elements of audience analysis, cohesion, focus, and style. Graded A+ to C- or NC. . Includes a tutorial at the Writing Center. Fulfills the first writing requirement. (Y) Prerequisites & Notes Prerequisite: ENWR 105. Credits: 3 Back to Top | Print-Friendly Page (opens a new window) All catalogs © 2026 University of Virginia. Powered by Modern Campus Catalog™ .",False,False,False,False
University of Virginia,ENWR,105,Academic Writing I,,False,False,False,False
University of Virginia,ENWR,331,Intermediate Poetry Writing I,,False,False,False,False
University of Virginia,ENWR,332,Intermediate Poetry Writing II,,False,False,False,False
University of Virginia,ENWR,351,Intermediate Fiction Writing,,False,False,False,False
University of Virginia,ENWR,372,Magazine Writing,,False,False,False,False
University of Virginia,ENWR,282,Television Texts; Scripting and Directing,Cross-listed as DRAM 282. (Y) Credits: 3 Back to Top | Print-Friendly Page (opens a new window) All catalogs © 2026 University of Virginia. Powered by Modern Campus Catalog™ .,False,False,False,False
University of Virginia,ENWR,220,Special Topics in Writing,(IR) Prerequisites & Notes Prerequisite: Completion of first writing requirement. Credits: 3 Back to Top | Print-Friendly Page (opens a new window) All catalogs © 2026 University of Virginia. Powered by Modern Campus Catalog™ .,False,False,False,False
University of Virginia,ENWR,370,Intermediate News Writing,,False,False,False,False
University of Virginia,ENWR,352,Intermediate Fiction Writing,,False,False,False,False
University of Virginia,ENWR,483,Advanced Poetry Writing I,Student work is discussed in class and in individual conferences. Reading in contemporary poetry is also assigned. May be repeated with different instructor. (Y) Prerequisites & Notes Prerequisite: Instructor permission. Credits: 3 Back to Top | Print-Friendly Page (opens a new window) All catalogs © 2026 University of Virginia. Powered by Modern Campus Catalog™ .,False,False,False,False
University of Virginia,ENWR,484,Advanced Poetry Writing II,,False,False,False,False
University of Virginia,ENWR,495,Independent Project in Creative Writing,,False,False,False,False
University of Virginia,ENWR,531,Advanced Poetry Writing,,False,False,False,False
University of Virginia,ENWR,496,Independent Project in Creative Writing,,False,False,False,False
University of Virginia,ENWR,541,Playwriting,,False,False,False,False
University of Virginia,ENWR,542,Playwriting,,False,False,False,False
University of Virginia,ENWR,110,Accelerated Academic Writing,"Designed for students scoring 490-660 on the SAT II Writing Test. Covers framing and developing effective academic arguments, with an emphasis on essays and reports. Graded A+ to C- or NC. Special topics sections are listed on the English department’s web site. Students whose student I.D. numbers end in an even digit must take ENWR 110 in the fall; those with I.D. numbers ending in an odd digit take it in the spring. (S) Credits: 3 Back to Top | Print-Friendly Page (opens a new window) All catalogs © 2026 University of Virginia. Powered by Modern Campus Catalog™ .",False,False,False,False
University of Virginia,ENWR,561,Scriptwriting,,False,False,False,False
University of Virginia,ENWR,301,Advanced Writing I,,False,False,False,False
University of Virginia,ACCT,202,Introductory Accounting II,"Approximately one third of the course deals with additional financial accounting topics, emphasizing managerial considerations and financial analysis. Cost accumulation, allocation, and product cost methods are studied in a manufacturing setting. Matters such as evaluation of performance planning, cost behavior, and special decisions are emphasized. Prerequisites & Notes Prerequisite: ACCT 201. Credits: 3 Back to Top | Print-Friendly Page (opens a new window) All catalogs © 2025 University of Virginia. Powered by Modern Campus Catalog™ .",False,False,False,False
University of Virginia,ACCT,311,Intermediate Accounting I,,False,False,False,False
University of Virginia,ACCT,201,Introductory Accounting,Credits: 3 Back to Top | Print-Friendly Page (opens a new window) All catalogs © 2025 University of Virginia. Powered by Modern Campus Catalog™ .,False,False,False,False
University of Virginia,ENWR,551,Advanced Fiction Writing,,False,False,False,False
University of Virginia,ENWR,302,Advanced Writing II,,False,False,False,False
University of Virginia,ACCT,445,Federal Taxation I,A study is made of problems covering personal and business tax situations. Several cases are assigned for which the student prepares illustrative tax returns. Prerequisites & Notes Prerequisite: ACCT 202 or instructor permission. Credits: 3 Back to Top | Print-Friendly Page (opens a new window) All catalogs © 2025 University of Virginia. Powered by Modern Campus Catalog™ .,False,False,False,False
University of Virginia,ENWR,371,News Magazine Writing,,False,False,False,False
University of Virginia,ENWR,481,Advanced Fiction Writing I,,False,False,False,False
University of Virginia,ACCT,531,Selected Topics in Advanced Accounting,,False,False,False,False
University of Virginia,ACCT,533,Accounting for Non-Business Organizations,Studies the theory and techniques of accounting and reporting for various funds and groups of accounts. Prerequisites & Notes Prerequisite: ACCT 312. Credits: 3 Back to Top | Print-Friendly Page (opens a new window) All catalogs © 2025 University of Virginia. Powered by Modern Campus Catalog™ .,False,False,False,False
University of Virginia,ACCT,312,Intermediate Accounting II,,False,False,False,False
University of Virginia,ACCT,546,Federal Taxation II,Prerequisites & Notes Prerequisite: ACCT 445. Credits: 3 Back to Top | Print-Friendly Page (opens a new window) All catalogs © 2025 University of Virginia. Powered by Modern Campus Catalog™ .,False,False,False,False
University of Virginia,AAS,101,Introduction to African-American and African Studies I,,False,False,False,False
University of Virginia,AAS,205,Travel Accounts of Africa,,False,False,False,False
University of Virginia,AAS,206,Travel Accounts of Africa,"Subjects change from term to term, and vary with instructor. (IR) Credits: 3 Back to Top | Print-Friendly Page (opens a new window) All catalogs © 2026 University of Virginia. Powered by Modern Campus Catalog™ .",False,False,False,False
University of Virginia,ENWR,482,Advanced Fiction Writing II,,False,False,False,False
University of Virginia,ENWR,552,Advanced Fiction Writing,,False,False,False,False
University of Virginia,AAS,305,Travel Accounts of Africa,,False,False,False,False
University of Virginia,AAS,324,Plantations in Africa and the Americas,,False,False,False,False
University of Virginia,AAS,401,Independent Study,,False,False,False,False
University of Virginia,AAS,406,Advanced Seminar in African-American and African Studies,,False,False,False,False
University of Virginia,ENWR,532,Advanced Poetry Writing,,False,False,False,False
University of Virginia,AAS,451,Directed Reading and Research,Students in the DMP enroll under these numbers for thesis writing. (Y) Credits: 6 Back to Top | Print-Friendly Page (opens a new window) All catalogs © 2026 University of Virginia. Powered by Modern Campus Catalog™ .,False,False,False,False
University of Virginia,AAS,528,Topics in Race Theory,,False,False,False,False
University of Virginia,AAS,102,Introduction to African-American and African Studies II,,False,False,False,False
University of Virginia,ACCT,711,Accounting Theory,"Includes the historical development of accounting thought and how it has been influenced by social, political, and economic forces. Analyzes the structure and methodology of theory; examines objectives, postulates, and principles; and explores income determination and the valuation, classification, and reporting of assets and equities. Prerequisites & Notes Prerequisite: ACCT 312. Credits: 3 Back to Top | Print-Friendly Page (opens a new window) All catalogs © 2025 University of Virginia. Powered by Modern Campus Catalog™ .",False,False,False,False
University of Virginia,HIAF,100,Introductory Seminar in African History,,False,False,False,False
University of Virginia,HIAF,201,Early African History,,False,False,False,False
University of Virginia,HIAF,202,Modern African History,,False,False,False,False
University of Virginia,HIAF,301,North African History from Carthage to the Algerian Revolution,,False,False,False,False
University of Virginia,HIAF,302,History of Southern Africa,,False,False,False,False
University of Virginia,ENWR,380,Academic and Professional Writing,,False,False,False,False
University of Virginia,HIAF,403,Topics in African History,,False,False,False,False
University of Virginia,HIAF,404,Independent Study in African History,,False,False,False,False
University of Virginia,ACCT,314,Cost Accounting,Prerequisites & Notes Prerequisite: ACCT 202. Credits: 3 Back to Top | Print-Friendly Page (opens a new window) All catalogs © 2025 University of Virginia. Powered by Modern Campus Catalog™ .,False,False,False,False
University of Virginia,RELA,276,African Religions in the Americas,,False,False,False,False
University of Virginia,HIAF,401,Seminar in African History,,False,False,False,False
University of Virginia,ACCT,521,Introductory Auditing,,False,False,False,False
University of Virginia,HIAF,203,The African Diaspora,,False,False,False,False
University of Virginia,AIRS,110,The Foundations of the U.S. Air Force,,False,False,False,False
University of Virginia,AAS,405,Advanced Seminar in African-American and African Studies,,False,False,False,False
University of Virginia,ACCT,525,Advanced Auditing,,False,False,False,False
University of Virginia,AIRS,210,The Evolution of Air and Space Power,"Presents historical examples of the development of Air Force capabilities and missions to demonstrate the evolution of what has become today’s USAF air and space power. Investigates several fundamental truths associated with war in the third dimension (e.g., Principles of War and Tenets of Air and Space Power). Considers the general element and employment of air and space power from institutional, doctrinal, and historical perspectives. Discusses the importance of Air Force core values using operational examples and historical Air Force leaders. Continues to develop communication skills. (S) Prerequisites & Notes Corequisite: AIRS A. Credits: 1 Back to Top | Print-Friendly Page (opens a new window) All catalogs © 2026 University of Virginia. Powered by Modern Campus Catalog™ .",False,False,False,False
University of Virginia,RELA,389,Christianity in Africa,,False,False,False,False
University of Virginia,AAS,452,Directed Reading and Research,,False,False,False,False
University of Virginia,RELA,275,African Religions,,False,False,False,False
University of Virginia,AIRS,320,Concepts of Air Force Leadership and Management,,False,False,False,False
University of Virginia,AIRS,220,The Evolution of Air and Space Power,"Presents historical examples of the development of Air Force capabilities and missions to demonstrate the evolution of what has become today’s USAF air and space power. Investigates several fundamental truths associated with war in the third dimension (e.g., Principles of War and Tenets of Air and Space Power). Considers the general element and employment of air and space power from institutional, doctrinal, and historical perspectives. Discusses the importance of Air Force core values using operational examples and historical Air Force leaders. Continues to develop communication skills. (S) Prerequisites & Notes Corequisite: AIRS A. Credits: 1 Back to Top | Print-Friendly Page (opens a new window) All catalogs © 2026 University of Virginia. Powered by Modern Campus Catalog™ .",False,False,False,False
University of Virginia,AAS,250,The Health of Black Folks,"The course is co-taught by Norm Oliver, M.D. (UVa Department of Family Medicine), and offers political, economic, and post-structuralist lenses with which to interpret the individual and socio/cultural health and disease of African-Americans. Readings range across several disciplines including anthropology, epidemiology/public health, folklore, history, science studies, political science, sociology and literary criticism. Topics will vary and may include: HIV/AIDS; reproductive issues; prison, crime and drugs; and body size/image and obesity; the legacy of the Tuskegee Syphilis Trials. Cross listed as ANTH 250. (SI) Credits: 3 Back to Top | Print-Friendly Page (opens a new window) All catalogs © 2026 University of Virginia. Powered by Modern Campus Catalog™ .",False,False,False,False
University of Virginia,AIRS,420,National Security Affairs/Preparation for Active Duty,"Topics include the military as a profession, officership, military justice, civilian control of the military, preparation for active duty, and current issues affecting the military. Emphasizes refining communication skills. (Y) Prerequisites & Notes Prerequisite: AIRS 310 and/or 320; corequisite: AIRS A. Credits: 3 Back to Top | Print-Friendly Page All catalogs © 2019 University of Virginia. Powered by the Acalog™ Academic Catalog Management System™ (ACMS™) . Mobile Site .",False,False,False,False
University of Virginia,ENAM,311,American Literature to 1865,(IR) Credits: 3 Back to Top | Print-Friendly Page (opens a new window) All catalogs © 2026 University of Virginia. Powered by Modern Campus Catalog™ .,False,False,False,False
University of Virginia,ENAM,313,African-American Survey I,,False,False,False,False
University of Virginia,ENAM,314,African-American Survey II,,False,False,False,False
University of Virginia,RELA,410,Yoruba Religion,(IR) Credits: 3 Back to Top | Print-Friendly Page (opens a new window) All catalogs © 2026 University of Virginia. Powered by Modern Campus Catalog™ .,False,False,False,False
University of Virginia,ENAM,315,The American Renaissance,(IR) Credits: 3 Back to Top | Print-Friendly Page (opens a new window) All catalogs © 2026 University of Virginia. Powered by Modern Campus Catalog™ .,False,True,False,False
University of Virginia,ENAM,316,Realism and Naturalism in America,Powered by Modern Campus Catalog™ .,False,False,False,False
University of Virginia,HIAF,402,Colloquium in African History,,False,False,False,False
University of Virginia,ENAM,330,American Poetry,,False,False,False,False
University of Virginia,RELA,390,Islam in Africa,,False,False,False,False
University of Virginia,AIRS,120,The Foundations of the U.S. Air Force,,False,False,False,False
University of Virginia,ENAM,357,Women in American Art,Some background in either art history or gender studies is desirable. (IR) Credits: 3 Back to Top | Print-Friendly Page (opens a new window) All catalogs © 2026 University of Virginia. Powered by Modern Campus Catalog™ .,False,False,False,False
University of Virginia,ENAM,381,Studies in African-American Literature and Culture,,False,False,False,False
University of Virginia,ENAM,383,American Introspection (1770-1990),"Emphasizes the relation of forms to ideas, and recurring myths and motifs. (IR) Credits: 3 Back to Top | Print-Friendly Page (opens a new window) All catalogs © 2026 University of Virginia. Powered by Modern Campus Catalog™ .",False,False,False,False
University of Virginia,ENAM,387,Literature of the West,,False,False,False,False
University of Virginia,ENAM,388,The Literature of the South,,False,False,False,False
University of Virginia,ENAM,389,Mass Media and American Culture,,False,False,False,False
University of Virginia,ENAM,312,American Literature Since 1865,(IR) Credits: 3 Back to Top | Print-Friendly Page (opens a new window) All catalogs © 2026 University of Virginia. Powered by Modern Campus Catalog™ .,False,False,False,False
University of Virginia,ENAM,482,Advanced Studies in American Literature II,,False,False,False,False
University of Virginia,ENAM,322,Major American Authors,,False,False,False,False
University of Virginia,AIRS,410,National Security Affairs/Preparation for Active Duty,"Topics include the military as a profession, officership, military justice, civilian control of the military, preparation for active duty, and current issues affecting the military. Emphasizes refining communication skills. (Y) Prerequisites & Notes Prerequisite: AIRS 310 and/or 320; corequisite: AIRS A. Credits: 3 Back to Top | Print-Friendly Page All catalogs © 2019 University of Virginia. Powered by the Acalog™ Academic Catalog Management System™ (ACMS™) . Mobile Site .",False,False,False,False
University of Virginia,ENAM,481B,Afro-American Women Authors,,False,False,False,False
University of Virginia,PLAP,227,Public Opinion and Political Behavior,,False,False,False,False
University of Virginia,ENAM,355,American Sentimentalism,,False,False,False,False
University of Virginia,PLAP,266,"Ideas, Institutions, and Public Policy",,False,False,False,False
University of Virginia,ENAM,484,Black Women Writers,,False,False,False,False
University of Virginia,AIRS,310,Concepts of Air Force Leadership and Management,,False,False,False,False
University of Virginia,ENAM,481,Advanced Studies in American Literature I,,False,False,False,False
University of Virginia,PLAP,321,Political Parties and Group Politics,,False,False,False,False
University of Virginia,PLAP,331,American Presidency,,False,False,False,False
University of Virginia,ENAM,482,Advanced Studies in American Literature II: Harlem Renaissance,,False,True,False,False
University of Virginia,PLAP,335,American Congress,,False,False,False,False
University of Virginia,ENAM,358,Science and Identity in American Literature,(IR) Credits: 3 Back to Top | Print-Friendly Page (opens a new window) All catalogs © 2026 University of Virginia. Powered by Modern Campus Catalog™ .,False,False,False,False
University of Virginia,PLAP,341,State and Local Politics,,False,False,False,False
University of Virginia,PLAP,338,Politics of the Policy Process,,False,False,False,False
University of Virginia,PLAP,355,Gender Politics,,False,False,False,False
University of Virginia,PLAP,101,Introduction to American Politics,,False,False,False,False
University of Virginia,ENAM,345,American Short Novel,,False,False,False,False
University of Virginia,PLAP,381,Constitutional Interpretation: Separation of Powers and Federalism,,False,False,False,False
University of Virginia,ENAM,385,Folklore in America,,False,False,False,False
University of Virginia,PLAP,412,Electoral Behavior and Political Participation,,False,False,False,False
University of Virginia,PLAP,319,Judicial Process and Policy-Making,,False,False,False,False
University of Virginia,PLAP,413,Citizen Competence in American Democracy,,False,False,False,False
University of Virginia,PLAP,415,Political Psychology,,False,False,False,False
University of Virginia,PLAP,424,Special Topics in Politics/Center for Politics,,False,False,False,False
University of Virginia,PLAP,430,Political Analysis,,False,False,False,False
University of Virginia,PLAP,361,Introduction to Public Administration,,False,False,False,False
University of Virginia,PLAP,436,Campaigns and Elections,,False,False,False,False
University of Virginia,PLAP,438,The Politics of the Policy Process,,False,False,False,False
University of Virginia,PLAP,351,Minority Group Politics,,False,False,False,False
University of Virginia,PLAP,322,President and Congress,,False,False,False,False
University of Virginia,PLAP,471,"Values, Resources, and Public Policy",,False,False,False,False
University of Virginia,PLAP,498,Senior Thesis,,False,False,False,False
University of Virginia,PLAP,484,Race and Constitution,,False,False,False,False
University of Virginia,PLAP,370,Racial Politics,,False,False,False,False
University of Virginia,PLAP,314,Mass Media and American Politics,,False,False,False,False
University of Virginia,PLAP,514,"Sex Differences: Biology, Culture, Politics and Policy",,False,False,False,False
University of Virginia,PLAP,530,Politics of Mental Health,,False,False,False,False
University of Virginia,PLAP,344,Urban Government and Politics,,False,False,False,False
University of Virginia,PLAP,545,Virginia Government and Politics,,False,False,False,False
University of Virginia,PLAP,450,Voting Rights and Representation,,False,False,False,False
University of Virginia,PLAP,595,Selected Problems in American Politics,,False,False,False,False
University of Virginia,PLAP,315,Political Psychology of Citizen Politics,,False,False,False,False
University of Virginia,ASL,101,Elementary American Sign Language,,False,False,False,False
University of Virginia,PLAP,543,Intergovernmental Relations,,False,False,False,False
University of Virginia,ASL,102,Elementary American Sign Language,,False,False,False,False
University of Virginia,PLAP,434,American Political Leadership,,False,False,False,False
University of Virginia,ASL,355,Comparative Linguistics: ASL and English,,False,False,False,False
University of Virginia,PLAP,565,"Economics, Values, and Public Policy",,False,False,False,False
University of Virginia,PLAP,483,First Amendment,,False,False,False,False
University of Virginia,ASL,481,Deafness in Literature and Film,,False,False,False,False
University of Virginia,AMST,201,Major Works for American Studies,,False,False,False,False
University of Virginia,ASL,202,Intermediate American Sign Language,,False,False,False,False
University of Virginia,AMST,301,Introduction to the American Studies Major,,False,False,False,False
University of Virginia,PLAP,526,Special Topics in Public Policy or Public Administration,,False,False,False,False
University of Virginia,AMST,302,Introduction to the American Studies Major,,False,False,False,False
University of Virginia,ANTH,101,Introduction to Anthropology,,False,False,False,False
University of Virginia,ASL,475,Topics in Deaf Studies,,False,False,False,False
University of Virginia,AMST,401,Fourth-Year Seminar in American Studies,,False,False,False,False
University of Virginia,PLAP,585,Seminar on Constitutional Law and Theory,,False,False,False,False
University of Virginia,AMST,493,Independent Study,,False,False,False,False
University of Virginia,ANTH,221,Marriage and the Family,,False,False,False,False
University of Virginia,ANTH,223,Fantasy and Social Values,,False,False,False,False
University of Virginia,ANTH,109,Colloquia for First-Year Students,,False,False,False,False
University of Virginia,ASL,201,Intermediate American Sign Language,,False,False,False,False
University of Virginia,ANTH,224,Progress,,False,False,False,False
University of Virginia,ANTH,226,Poverty and Meritocracy,,False,False,False,False
University of Virginia,ANTH,231,Symbol and Myth,,False,False,False,False
University of Virginia,PLAP,382,Constitutional Limitations: Civil Liberties and Civil Rights,,False,False,False,False
University of Virginia,ANTH,232,Anthropology of Religion,,False,False,False,False
University of Virginia,ANTH,234,Anthropology of Birth and Death,,False,False,False,False
University of Virginia,ANTH,235,Introduction to Folklore,,False,False,False,False
University of Virginia,ASL,301,Conversational ASL,,False,False,False,False
University of Virginia,PLAP,592,Judicial Policymaking,,False,False,False,False
University of Virginia,ANTH,242,Language and Gender,,False,False,False,False
University of Virginia,ANTH,240,Language and Culture,,False,False,False,False
University of Virginia,ANTH,228,Introduction to Medical Anthropology,,False,False,False,False
University of Virginia,AMST,494,Independent Study,,False,False,False,False
University of Virginia,ANTH,237,The Culture and History of Still Photography,,False,False,False,False
University of Virginia,ANTH,247,Reflections of Exile: Jewish Languages and their Communities,,False,False,False,False
University of Virginia,ANTH,253,North American Indians,,False,False,False,False
University of Virginia,ANTH,266,Peoples of Polynesia,,False,False,False,False
University of Virginia,ANTH,220,Dynamics of Social Organization,,False,False,False,False
University of Virginia,ANTH,267,How Others See Us,,False,False,False,False
University of Virginia,ANTH,268,Reading the New York Times,,False,False,False,False
University of Virginia,ANTH,281,Human Origins,,False,False,False,False
University of Virginia,ANTH,225,"Nationalism, Racism, Culture, Multiculturalism",,False,False,False,False
University of Virginia,ANTH,285,American Material Culture,,False,False,False,False
University of Virginia,ANTH,215,Introduction to Classical Archaeology,,False,False,False,False
University of Virginia,ANTH,256,Peoples and Cultures of Africa,,False,False,False,False
University of Virginia,ANTH,301,Theory and History of Anthropology,,False,False,False,False
University of Virginia,ANTH,280,Introduction to Archaeology,,False,False,False,False
University of Virginia,ANTH,317,Visual Anthropology,,False,False,False,False
University of Virginia,ANTH,318,Social Histories of Commodities: Linkages between Africa and the Americas,,False,False,False,False
University of Virginia,ANTH,320,"Marriage, Gender, Political Economy",,False,False,False,False
