university,department_code,course_number,title,description,progressive_signal,western_canon_signal,climate_narrow_signal,climate_broad_signal
University of Virginia,ANTH,243,Languages of the World,,False,False,False,False
University of Virginia,ANTH,250,The Health of Black Folks,,False,False,False,False
University of Virginia,ANTH,260,Introduction to Civilization of India,,False,False,False,False
University of Virginia,ANTH,236,Don Juan and Castaneda,,False,False,False,False
University of Virginia,ANTH,305,Travel Accounts of Africa,,False,False,False,False
University of Virginia,ANTH,322,Introduction to Economic Anthropology,,False,False,False,False
University of Virginia,ANTH,289,Unearthing the Past,,False,False,False,False
University of Virginia,ANTH,227,"Race, Gender, and Medical Science",,False,False,False,False
University of Virginia,ANTH,282,Rise of Civilization,,False,False,False,False
University of Virginia,ANTH,290,The Cultural Politics of American Family Values,,False,False,False,False
University of Virginia,ANTH,321,Kinship and Social Organization,,False,False,False,False
