university,academic_year,academic_year_label,department_code,course_number,title,description,broad_area,level,progressive_signal,western_canon_signal,climate_narrow_signal,climate_broad_signal,cross_listed,deduplicated
holycross,2026,2026-2027,PSYC,225,Developmental Psychology,"A survey of theory and research pertaining to both cognitive and social development from birth to adolescence. Special topics include prenatal development, early experience, perception, learning, memory, language, emotions, achievement, moral development, gender role development, parenting, schools, and peer relationships.",Social Sciences,undergraduate,True,False,False,False,False,True
holycross,2026,2026-2027,PSYC,225C,Development Psychology CBL,,Social Sciences,undergraduate,False,False,False,False,False,True
holycross,2026,2026-2027,PSYC,226,Personality and the Life Story,"Covers several major conceptions of personality such as the psychoanalytic, humanistic, cognitive, trait, and behavioral approaches. The theories of such psychologists as Freud, Maslow, Kelly, Allport, and Skinner are presented to attain a broad understanding of human personality.",Social Sciences,undergraduate,False,False,False,False,False,True
holycross,2026,2026-2027,PSYC,227,Social Psychology,"An overview of the methods and research findings of social psychology. Emphasis is on the experimental analysis of topics such as person perception, interpersonal attraction, prosocial behavior, aggression, social exchange, and group behavior.",Social Sciences,undergraduate,False,False,False,False,False,True
holycross,2026,2026-2027,PSYC,228,Psychology of Adolescence,"A survey of research and theories related to physical, social and cognitive development during adolescence with a particular emphasis on identity and school, family, and peer contexts.  Topics include puberty and brain development, social transitions and culture, peer pressure, motivation and achievement, identity formation, extracurricular involvement, autonomy and moral development, sexuality, problem behaviors, eating disorders, and emerging adulthood.  One unit.",Social Sciences,undergraduate,True,False,False,False,False,True
holycross,2026,2026-2027,PSYC,228C,Psychology of Adolescence CBL,,Social Sciences,undergraduate,False,False,False,False,False,True
holycross,2026,2026-2027,PSYC,229,Psychopathology,"Examines mental illness throughout the life span, with discussions of the developmental, biological, behavioral, psychosocial, cultural, and other theories that attempt to explain emotional and behavioral problems. One goal for the course is to develop an understanding of how information about mental illness and mental health is obtained, and the problems associated with the evaluation and interpretation of this information.",Social Sciences,undergraduate,False,False,False,False,False,True
holycross,2026,2026-2027,PSYC,232,Developmental Science & Educ,"This course considers the ways in which the scientific research in developmental psychology has relevance for practice in educational settings. The course focuses primarily on research on cognitive development and how it helps us to understand childrens literacy, mathematical reasoning, and scientific thinking. Other topics include motivation, social cognition, and specific problems in learning such as ADHD. Students participate in a community based learning project in local schools as part of this course.",Social Sciences,undergraduate,False,False,False,False,False,True
holycross,2026,2026-2027,PSYC,235,Cognitive Neuroscience,"This course is a topical introduction to the field of cognitive neuroscience, in which we look specifically at the neural substrates of cognitive function: from how we remember and see, to how we control our own actions and thoughts and have conscious awareness. We will cover the experimental toolkit of cognitive neuroscience (ranging from reaction time tests to functional MRI), and the results of recent research into perception, attention, learning and memory, and their neurological underpinnings. Throughout the course, special attention is given to dysfunctions of cognitive functioning resulting from brain damage or psychopathologies.",Social Sciences,undergraduate,False,False,False,False,False,True
holycross,2026,2026-2027,PSYC,236,Cognition & Memory,"Examines current perspectives on how a physical system can have intelligence and know its world.  Historical, cognitive science (computer metaphor) and connectionist perspectives will be surveyed.  Of interest is how we can model cognitive 'machinery' and how this machinery produces such phenomena as attention, pattern recognition, and information storage.  One unit.",Social Sciences,undergraduate,False,False,False,False,False,True
holycross,2026,2026-2027,PSYC,237,Psychology of Language,"An overview of the psychology and neuropsychological bases of language. Language is defined through the evaluation of human and animal communication. Topics such as Chomsky's linguistic principles, speech perception, speech production, language acquisition, reading and bilingualism are included. These basic concepts of language are then applied to an understanding of different forms that language can take: spoken, written, and sign, and language disorders (e.g. aphasia, dyslexia).",Social Sciences,undergraduate,False,False,False,False,False,True
holycross,2026,2026-2027,PSYC,238,Judgment and Decision Making,"This course will provide an overview of the psychological research on human choice and decision making. It will investigate sources of bias and error in decision making and consider whether the actual choices that people make in their own lives align with theories that prescribe how decisions should ideally be made. Topics will include risk and uncertainty, emotion and intuitive judgment, self-control, moral decisions, and social influences on decision making. When possible, the course will consider how existing research findings can be applied to reduce biases and improve the quality of decision making.",Social Sciences,undergraduate,False,False,False,False,False,True
holycross,2026,2026-2027,PSYC,239,Psychology & Aging,"While much is known about the development and changes that take place from infancy through adolescence, we are only at the beginning of really understanding typical and atypical development throughout adulthood into later life. This class will examine methods of developmental research in adult populations, and a number of key issues in the field of adult development and aging including normative cognitive, biological, and emotional changes, as well as the ways these changes impact social interactions in the context of successful aging and resilience. This class will also look at some of the challenges associated with aging, including forms of dementia such as Alzheimers Disease, partner loss, and bereavement.",Social Sciences,undergraduate,False,False,False,False,False,True
holycross,2026,2026-2027,PSYC,244,Health Psychology,"This course provides an introduction to major theories, methodologies, and concepts in health psychology. Students will consider what health means; appraise strengths and weaknesses of biomedical and Ayurvedic health care approaches; identify how health behaviors and stress contribute to the onset of chronic illnesses (e.g., diabetes, cancer, cardiovascular disease); appreciate how sociopolitical and historical contexts shape the etiology and treatment of HIV/AIDS and cancer in the U.S.; and improve the ability to locate, read, and synthesize original research.",Social Sciences,undergraduate,False,False,False,False,False,True
holycross,2026,2026-2027,PSYC,249,"People, Power, & Politics","What is political? How do we acquire political knowledge? How is political understanding shaped across generations? What is the relationship between power, gender, race, and politics? Why do people participate in social movements? What is a peaceful protest? How do people make decisions when they vote? In this course we will examine the interplay between people, power, and politics. We will examine participation in some of the large-scale historic and contemporary social movements in the U.S., including the Civil Rights, Womens Liberation, pro-choice and pro-life, LGBTQ Rights, Black Lives Matter, white nationalist, Pro-Palestine movements. We will use these movements as examples to examine how individuals shape social structures, political systems, culture and history, while being shaped by them. This course will give you some familiarity with important classical and modern psychological and sociological theories relevant to politics and the functioning of political systems, as well as a sense of how social science research can be used to evaluate theories and generate new knowledge. At the same time, the course emphasizes the need to take into account differences in the social contexts (cultures, nations, social classes, historical eras) when theorizing or doing research.",Social Sciences,undergraduate,True,True,False,False,False,True
holycross,2026,2026-2027,PSYC,254,Psychology and Law,"The purpose of this class is to introduce you to many topics, representing major fields of study within psychology and law. In this course, you will learn about the diversity of interests among legal psychologists as well as innovative and important ideas, theories, and research findings. This class concentrates on the scientific study of psychology and law. The main goal is to provide students with an understanding of relevant theory, empirical findings, and research methodology. Guest speakers will enhance the course by giving students an idea of applied jobs in the field.",Social Sciences,undergraduate,True,False,False,False,False,True
holycross,2026,2026-2027,PSYC,256,Animal Minds,"Animals often surprise the idle observer through startling feats of communication or ingenuity  the true complexity of which only systematic investigations can reveal. This course offers an introduction into the various domains of animal behaviors and their investigation from a cognitive science perspective. Spanning a wide array of topics from the fundamentals of perception, categorization, and memorization to the more complex behaviors of inferential logic, navigation, social awareness, and language, we will explore how different animal species process our common  and uncommon - spaces.",Social Sciences,undergraduate,False,False,False,False,False,True
holycross,2026,2026-2027,PSYC,267,Motivation and Goal Pursuit,"Motivation is a psychological term used to describe the broad needs, desires, and reasons for actions of living beings. In this course, we will explore the multiple ways in which human motivationspecifically, the goals, values, needs, and desires that drive and energize us on a day-to-day basiscan affect our impressions, perceptions, decisions, explanations, and behaviors. Because this field focuses on investigating everyday human thought and behavior, special attention will be paid to promoting students understanding of how motivation science can be used to understand everyday, real-world experiences. Overarching themes include how to succeed at your personal goals, how to become an expert, and how to motivate others, with the domains of education, sports, health, and relationships being highlighted.",Social Sciences,undergraduate,False,False,False,False,False,True
holycross,2026,2026-2027,PSYC,285,Social Oppression and Change,"This course introduces students to various forms of oppression and resistance to oppression in the contemporary United States. Centering anti-Blackness and the history and experiences of Black peoples in the U.S., the course draws on a diverse range of texts from psychology, education, sociology, history, and popular culture to explore the roots and effects of different types of oppression in various domains of powermore specifically, racism, classism, sexism, and heterosexism within the interpersonal, ideological, and institutional domains of power. A primary context for this course U.S public education and schools in urbanized communities.",Social Sciences,undergraduate,True,False,False,False,False,True
holycross,2026,2026-2027,PSYC,299,Cultural Psychology,"What is culture? How does culture shape individuals lived experiences while being shaped by them? How does psychology as a social science relate to the study of culture historically? What are different methodologies psychologists commonly use to study people in relation to culture? How does studying culture enable a critique of the discipline? In this course, you will learn about the examples of how to study person in context while starting to develop a meta-perspective of psychology as a discipline. We will begin the course with a discussion of various subfields in psychology (cultural, cross-cultural, indigenous, decolonial) that give us the tools to understand the person in context. Each of these subfields are accompanied by different theoretical and methodological assumptions which are key for us to understand before we begin to study empirical examples of person in context. Along with creating a foundation, we will look at examples of how people in various contexts interact with rituals, objects, systems and institutions that are symbolic markers of culture.",Social Sciences,undergraduate,True,False,False,False,False,True
holycross,2026,2026-2027,PSYC,305,History & Theory,"An examination in historical perspective of what are considered to be the major systems (e.g., psychoanalysis, behaviorism, existential psychology) of psychology. The course begins by using a number of philosophical questions regarding the status of psychology as a scientific discipline, moves on to a comprehensive treatment of the systems themselves, and finally, returns to initial questions to determine the extent to which they have been answered.",Social Sciences,undergraduate,False,False,False,False,False,True
holycross,2026,2026-2027,PSYC,314,"Science, Medicine & the Holocaust","What can be learned of biomedical ethics from a study of the Holocaust? How did a healing profession justify its murderous actions? Were physicians and scientists pawns of a totalitarian regime, or were they active contributors to the racial Nazi ideology? Is the study of genetics susceptible to the same political forces that corrupted the field of eugenics? How did the Holocaust come to shape our current code of ethics in human experimentation? This seminar will seek answers to these and many related questions from a voluminous literature that is populated by contributions from historians, biomedical ethicists, philosophers, theologians, journalists, and artists. Far from a value-free discipline, ideological forces will be shown to be at the core of scientific inquiry. This lesson is of particular importance to aspiring scientists and health practitioners.",Social Sciences,undergraduate,True,False,False,False,False,True
holycross,2026,2026-2027,PSYC,315,Biology of Mental Disorders,"A brief consideration of the historical and philosophical basis of biological psychiatry is followed by a thorough overview of the major neurotransmitter systems and behavioral genetics necessary for an understanding of the biological aspects of major psychological disorders, including anxiety disorders, psychosomatic disorders, affective disorders (unipolar and bipolar depression), schizophrenia, and Alzheimer's disease. For each of these disorders, the current state of knowledge concerning modes of treatment is reviewed, with an emphasis on the relative efficacy of pharmacotherapeutic agents, including minor tranquilizers, antidepressants, and antipsychotics.",Social Sciences,undergraduate,False,False,False,False,False,True
holycross,2026,2026-2027,PSYC,316,Drug Abuse: Brain and Behavior,"Drug addiction is the central theme of this course. Understanding drug action begins with a consideration of how drugs affect the brain. A basic working knowledge of brain chemistry is established with emphasis on information concerning the various major neurotransmitter systems that are affected by drugs of abuse. Considered next are the different addictive drugs, including alcohol, cannabis, heroin, cocaine and amphetamines, and the hallucinogens, and specific issues pertaining to the drug addict. The impact of drugs and addiction on society is the subject of the last part of the course. Issues with regard to prevention and treatment are considered. The ultimate goal of this course is to provide sound biological and psychological information from which a rational drug policy can be formed. Fulfills the Advanced Course Requirement or the Elective Course Requirement.",Social Sciences,undergraduate,False,False,False,False,False,True
holycross,2026,2026-2027,PSYC,321,Neuroanatomy & Behavior,"Open to third- and fourth-year students interested in a comprehensive study of brain and spinal cord anatomy and function. Structure is studied to provide a foundation for understanding clinical applications of nervous system injury and disease. Begins with study of gross anatomy of the sheep brain. Topics include motor and sensory systems, limbic system, cranial nerves, cerebral cortex, and blood supply to the brain.",Social Sciences,undergraduate,False,False,False,False,False,True
holycross,2026,2026-2027,PSYC,326,Cognition Across Cultures,This course examines empirical and theoretical approaches to understanding human thinking across languages and cultures.,Social Sciences,undergraduate,False,False,False,False,False,True
holycross,2026,2026-2027,PSYC,327,Predictive Coding in the Brain,"Prediction, or the ability to expect a particular input or outcome based on past experience, plays a central role in perception and cognition.  It may also be a fundamental principle of the neural computations supporting these behaviors.  In this course, we will explore the role of prediction in neural systems and behavior through readings and discussion of recent research utilizing a wide range of behavioral, electrophysiological, neuroimaging, and computational methods.",Social Sciences,undergraduate,False,False,False,False,False,True
holycross,2026,2026-2027,PSYC,328,Adolescent Health,"An advanced seminar in the field of adolescent development that focuses on the epidemiology and etiology of health-related behaviors during adolescence.  This course emphasizes a public health perspective and covers topics such as reproductive health, substance use, nutrition and exercise, sleep, violence, mental health, injuries, and disease.  Further, students will explore health disparities, health education, and domestic and global perspectives on adolescent health.",Social Sciences,undergraduate,False,False,False,False,False,True
holycross,2026,2026-2027,PSYC,328C,Adolescent Health CBL,,Social Sciences,undergraduate,False,False,False,False,False,True
holycross,2026,2026-2027,PSYC,332,Processes in Psychotherapy,"What are the common mechanisms by which psychotherapy works? To answer this question, this seminar will examine the theoretical foundations of contemporary psychotherapies, such as psychodynamic, cognitive-behavioral, and acceptance-based treatments. Through readings, videos, and lectures by experts in the field, we will consider how change occurs within and across the types of therapy and the best practices for studying symptom change over time. Additionally, by integrating research methodology into the course structure, we will examine how randomized controlled trials test the efficacy of psychological therapies.",Social Sciences,undergraduate,False,False,False,False,False,True
holycross,2026,2026-2027,PSYC,334,Eating and Its Disorders,"An advanced seminar in the field of clinical psychology that closely examines contemporary research in the eating disorder field. Students explore topics such as the following: problems in the assessment, diagnosis, and classification of eating disorders; risk factors for developing disordered eating; comorbidities between eating pathology and other psychiatric conditions; the roles of gender, sexuality, ethnicity, and culture in the etiology and maintenance of disordered eating; prevention and treatment of eating disorders.",Social Sciences,undergraduate,True,False,False,False,False,True
holycross,2026,2026-2027,PSYC,337,Substance Use and Recovery,"An advanced seminar in the field of clinical psychology that closely examines the substance (ab)use field, with a particular emphasis on alcohol. Students explore topics such as the following: definitions of harmful/hazardous drinking, familial transmission of alcohol use problems; alcohol, sex, and sports on college campuses; legal debates in the substance use field; philosophies regarding, and clinical approaches to, substance abuse recovery.",Social Sciences,undergraduate,False,False,False,False,False,True
holycross,2026,2026-2027,PSYC,337C,"Substance Use, Misuse & Abuse CBL",,Social Sciences,undergraduate,False,False,False,False,False,True
holycross,2026,2026-2027,PSYC,338,Consciousness & Control,"This seminar focuses on the neurobiological mechanisms underlying cognitive control and consciousness and its disturbances following brain injury or psychiatric illness. We define cognitive control as the ability to flexibly adapt behavior to current demands, by promoting task-relevant information and behaviors over temporally-extended periods and in the face of interference or competition. Consciousness we define as a subjective awareness of the world and free will. These abilities seem central to most higher cognitive functions, and contribute to the unique character of human behavior. Our goals are to define the neural mechanisms that underlie cognitive control and consciousness, to understand how these mechanisms govern behavior, and to use this knowledge to improve our understanding of the relationship between brain and behavior in psychiatric disorders and neurological damage.",Social Sciences,undergraduate,False,False,False,False,False,True
holycross,2026,2026-2027,PSYC,342,Seminar: Gender-Role Development,"Provides an examination of the role that gender plays in psychological development. Topics include depression and self-esteem, aggression, emotion control and emotion expression, and social interaction. Theoretical perspectives as well as the empirical literature on gender development will be explored to assess the nature of gender-patterned behaviors.",Social Sciences,undergraduate,True,False,False,False,False,True
holycross,2026,2026-2027,PSYC,350,Intervention and Social Change,"In addition to developing and testing scientific theories, many contemporary psychologists use theoretical findings to develop interventions in the hopes of addressing some of the major social challenges facing our world. This course is designed to equip students with the knowledge and skills to analyze these challenges, examine and critique existing psychological interventions, and consider the ethical implications of intervention. Overarching themes include systemic disparities in education, health, and criminal justice, interpersonal prejudice and discrimination, poverty, political division, and environmental action.",Social Sciences,undergraduate,False,False,False,False,False,True
holycross,2026,2026-2027,PSYC,353,Seminar: Language Thought and Culture,"Do language and culture affect how people perceive their physical and social world? This seminar will examine a variety of topics relevant to this question. Specific topics will include cross-linguistic differences in areas ranging from color categorization to person perception; the universal and culture-specific effects of status on interpersonal communication; gender differences in communication style; cultural differences in the understanding of the self and their effect on basic psychological processes; and expert-novice differences in perception, categorization, and communication.",Social Sciences,undergraduate,True,False,False,False,False,True
holycross,2026,2026-2027,PSYC,354,Psychology of Stigma,This is a seminar course that provides students with the opportunity to more deeply understand the phenomenological experience of stigmatization and to critically evaluate the empirical psychological literature examining the causes and consequences of stigmatization.,Social Sciences,undergraduate,False,False,False,False,False,True
holycross,2026,2026-2027,PSYC,355,Seminar: Resilience and  Development,"Covers risk and resiliency from early childhood through adulthood and focuses on defining resilience; sources of risk and protection within families, schools, and communities; and prevention programs. Special topics will include strengths-based models of resiliency, child maltreatment and health, problem-solving and creativity, resiliency across cultures, mentoring, and school- and community-based prevention and intervention. Fulfills the Advanced Course Requirement or the Elective Course Requirement.",Social Sciences,undergraduate,False,False,False,False,False,True
holycross,2026,2026-2027,PSYC,356,Animal Cognition,"Animal minds easily complete some tasks as a matter of course -- the same tasks that have taken us decades to get computers to do poorly, like recognize faces and navigating streets. This course considers animals' capacity for intelligent behavior in the  domains of communication, sociality, recognition, categorization, navigation, timing, perception, and learning. Using original research articles studying a broad array of species and some summary text, we'll discuss these concepts from perspectives of evolution, biology, and computation.",Social Sciences,undergraduate,False,False,False,False,False,True
holycross,2026,2026-2027,PSYC,362,Cognitive Neuropsychiatry,"Prerequisite: PSYC 100 , or PSYC 221 , or PSYC 235 .",Social Sciences,undergraduate,False,False,False,False,False,True
