university,academic_year,academic_year_label,department_code,course_number,title,description,broad_area,level,progressive_signal,western_canon_signal,climate_narrow_signal,climate_broad_signal,cross_listed,deduplicated
holycross,2026,2026-2027,HIST,291,Making Modrn MidEast 19th Century,"The nineteenth century was a time of profound change in the region we today call the Middle East. Over the course of the 1800s, European powers began to encroach on the Ottoman and Qajar empires, exerting informal imperial influence as well as actively seizing and administering Ottoman and Qajar territories. During this period, the Ottoman Empire, Qajar Iran, and a semi-independent Egypt carried out a series of reforms in a bid to push back against European interference in their domestic affairs and ensure their territorial integrity. This course explores the transformations that colonial intrusions and local reforms engendered and their consequences for the peoples of the region in the build up to the First World War. In doing so, it aims to challenge overarching teleological, Orientalist, and historicist perspectives on the region as well as long-standing narratives about Ottoman decline, Oriental despotism, and eternal and inherent sectarianism in the Middle East. The three main themes of this course are imperialism, anti-imperialism, and reform.",Humanities,undergraduate,True,False,False,False,False,True
holycross,2026,2026-2027,HIST,292,Making of the Mod Mid East II,"This course examines the cultural and political history of the Middle East (Egypt, the Levant, Palestine/Israel, Iraq, Iran, Turkey and the Gulf States) from World War II until the recent Arab Uprisings. Through literature and film, the course highlights the major trends and themes in the history of the region including the effects of European imperialism and the Cold War, the Iranian Revolution, the birth of the oil economy, the rise of political Islam, the Arab-Israeli conflict, and the U.S. led invasions of Iraq, and most recently, the Arab Uprisings and the rise of ISIS.",Humanities,undergraduate,False,False,False,False,False,True
holycross,2026,2026-2027,HIST,293,Ottoman Empire 1/1300-1600,"In the mid-16th century, all of Europe feared the power of the ""Grand Turk,"" whose empire stretched from Baghdad to Budapest and from the Adriatic to the ports of the Red Sea. Its population was made up of Muslims, Christians, Jews, Turks, Greeks, Armenians, Arabs, Kurds, Serbs and Bosnians, to name a few. This course surveys the emergence of this demographically diverse and geographically vast Ottoman state from a small frontier principality into a world empire in its social, political and cultural contexts. Fulfills one non-Western requirement and one pre-modern/pre-industrial requirement for the major.",Humanities,undergraduate,True,False,False,False,False,True
holycross,2026,2026-2027,HIST,296,South Africa & Apartheid,"South Africa's past is a painful history of deep racial discrimination, racialized violence, and segregation. But it is also a history of human resilience and the struggle for equality. This resilience is exemplified by the participation of women and men from diverse racial and social backgrounds, who struggled to end the racist policies of apartheid in South Africa. A course such as this one therefore draws students to debate some of the most important philosophies of an engaged Jesuit education, including a deep commitment to the well-being of the human community and the pursuit of a more just society. In dealing with the many controversies that mark South African history, students will develop their abilities to think critically and logically via weekly journal responses to course readings.",Humanities,undergraduate,True,False,False,False,False,True
holycross,2026,2026-2027,HIST,297,History of Disease and Healing,"Experiences of disease and healing, as Covid-19 has shown, are inseparable from social, political, economic, and environmental circumstances. Taking a global historical approach, this course examines diverse human diseases (malaria, pellagra, influenza, HIV/AIDS) and one livestock disease (rinderpest) to better understand these circumstances. Two general inquiries will guide our studies: 1) How have varied social groups such as rich and poor and men and women experienced disease and healing across time and space? 2) How have research, policies, and treatments been produced and circulated? We will explore different places and time periods, from malaria in the earliest human communities to rinderpest in 1890s Africa to the global AIDS pandemic. Materials include historical scholarship, medical and scientific reports, literature, and film.",Humanities,undergraduate,True,False,False,False,False,True
holycross,2026,2026-2027,HIST,310,Global Modernities: Polities of Difference,"Modernity, modern, and modernization are often used interchangeably to refer to distinct concepts in history including a global capitalist system, European imperialism and Eurocentricism, the division of the world population into racial and gender categories, and a hegemonic conceptualization of a linear, progressive time. Modernitys uses and abuses are a highly contested terrain not only among historians today, but among peoples who experienced, resisted, and fractured the forces of modernization. Indian historian Dipesh Chakrabarty refers to both the events and their theories as the muddle of modernity. This course delves into this muddle by studying moments in history in which Europeans Others fractured modernity in multiple ways: through narratives, representations, images of dislocation and splintering, and individual and collective resistance (i.e., liberation, anticolonial, Marxist, feminist, decolonial movements). Thus, the course privileges Indigenous, African, Asian voices, knowledges, and cosmologies that point to powerful polities of difference.",Humanities,undergraduate,True,False,False,False,False,True
holycross,2026,2026-2027,HIST,314,Music/Sport/Cultural Encounter,"From aristocratic flute recitals to playoff games and rock festivals, human cultural expression takes place in social and political settings. Audiences are an intrinsic part of culture: Jackie Robinson integrated the stands, not just the playing field; some of George Harrison's fans learned Eastern Zen practice; Soviet teenagers sang ""Jesus Christ Superstar."" Inherently sensual, music and sports lend themselves viscerally to political, racial, ethnic, economic, and gendered contestation. We will explore case studies in this history: Bach, religion, and enlightened despotism; Robert and Clara Schumann's struggles with gendered expectations of artistry and family; ballet, ""The Rite of Spring,"" bourgeois morals, and the modern audience as spectacle; the Olympics as proving grounds for liberal democracy and totalitarianism; Hispanics and racial categorization in North American baseball; the transatlantic musical invasions (rock/jazz in Europe, the Beatles in America); the Cold War as culture war; Korean hip-hop; and gender in rock and sport. As historic sites of participatory spectatorship and cross-cultural encounter, what can music halls and sports arenas teach us?",Humanities,undergraduate,True,False,False,False,False,True
holycross,2026,2026-2027,HIST,317,Pain & Suffering: US History,"This is a course in American religious and social thought from the late-18th century to the present. Through reading, discussion, and written assignments, students will explore the development of competing assumptions  rooted in various religious, political, and moral traditions  about the meaning of suffering in society in terms of causes, consequences, and obligations it creates within in the larger community. It begins with the development of humanitarianism in the context of American antislavery debates. It continues through the late-19th and early-20th centuries when the emergence of total war, systemic poverty, industrialization, and public health crises provoked widespread moral concern and political response through new media technologies that brought images of suffering to wider audiences. In studying the post-WWII era, the course revisits ongoing debates over the causes and consequences of poverty in an age of affluence, explores the role of suffering in nonviolent direct action movements of the civil rights and Vietnam era, and examines the sources of modern discourses on just war, humanitarian interventionism, torture, and human rights in the present. Students will have options to explore one or more of these themes in-depth through research projects.",Humanities,undergraduate,False,False,False,False,False,True
holycross,2026,2026-2027,HIST,319,Joan of Arc & Medieval Warfare,"Joan of Arc has fascinated for centuries, yet continually eluded easy description.   She is one of the most famous and best documented of all medieval individuals, yet she participated in public events for only two years, and died while still in her teens.  This course explores Joan's history and legacy, through sources generated during her lifetime, and those, including film, created in later centuries.  It also examines the 115-year-long conflict between England and France and their allies, known as the Hundred Years' War (1340-1455), in the context of medieval warfare in general. One unit.",Humanities,undergraduate,False,False,False,False,False,True
holycross,2026,2026-2027,HIST,327,Cultures of Cold War,"The superpower struggle that shaped the world post-1945 involved a competition not only for military might, but also for moral supremacy. During this time, the United States and the Soviet Union came to define themselves in opposition to each other, both seeking to demonstrate the superiority of their respective social and political systems and advertise the alleged degeneracy of those of their arch-rivals. This course looks at how each country portrayed its own society and imagined that of its major global foe, and the way these representations often differed from reality. Because the major emphasis is on the shaping and re-shaping of values and identities, it draws heavily on cultural sources such as novels, short stories, films, cartoons, and music lyrics, as well as other more traditional primary and secondary historical texts. One unit.",Humanities,undergraduate,True,False,False,False,False,True
holycross,2026,2026-2027,HIST,329,Collapse of Communism,"What led to the surprise collapse of the Soviet Union in 1991 and how has Russia defined itself since the USSRs sudden disintegration?  What has replaced the Soviet system  and how is the capitalist Russia of today different from the country as it was under Communist rule? What kind of lessons about power, ideology, and freedom are to be found in the fate of the former Soviet superpower? This course will explore Russias troubled transition from one political and economic system to another, and the consequent evolution of Communist and post-Communist identities and values. In addition, the course will examine the politics of history, looking at the different accounts of Russias past, present and future that have been championed by different groups with different agendas at different times.",Humanities,undergraduate,True,False,False,False,False,True
holycross,2026,2026-2027,HIST,352,Rebels & Radical Thinkers,"This course examines revolutionary movements in Latin America from the early 1900s to the present, focusing on the radical ideas that inspired the rebels. The course will discuss both the words and actions of some of the most salient radicals of the region--e.g., Emiliano Zapata, Jose Carlos Mariategui, Frantz Fanon, and Che Guevara, and their relevance today. We will also trace some of these ideas/rebels as depicted in films-produced either in Latin America, the United States or Europe-analyzing their significance in popular culture. This course fulfills one cross­ cultural requirement.",Humanities,undergraduate,True,False,False,False,False,True
holycross,2026,2026-2027,HIST,361,"Germans, Jews and Memory","Explores the place of Jews in German life before, during, and after the Nazi period. Commences with an examination of the centuries-old issue of assimilation. Explores the 20th-century ""German world"" of Einstein and Freud, everyday Jewish life in Nazi Germany, the Holocaust, survivors and their problems, the place of Jews in divided Germany after 1945, the growing Jewish community in contemporary reunified Germany, and the changing relationships among the children and grandchildren of the Holocaust's perpetrators, victims, and bystanders. Special attention is given to memory issues in postwar Germany. These issues too have a history. How have Germans dealt with their past? How has the passing of generations affected this issue? Are Jews and non-Jews in today's Germany comfortable with each other?",Humanities,undergraduate,False,False,False,False,False,True
holycross,2026,2026-2027,HIST,365,Resistance & Rev in Mod Africa,"A critical study of anti-colonial nationalist struggles and their outcomes in sub-Saharan Africa. The course traces the political economy of colonialism; the origins, rise and dynamics of anti-colonial nationalism; the strategy of armed insurrection and the role of revolutionary socialism. Lastly, it grapples with aspects of post-colonial Africa that reveal the changing balance between internal and external forces in specific African nations, the ambiguities of African independence, and post-colonial debates on nation and nationalism.",Humanities,undergraduate,True,False,False,False,False,True
holycross,2026,2026-2027,HIST,370,"Capital & Empire: United States in the World, 1870s-1920s","The era from the 1870s to the 1920s witnessed a global integration of markets, technological and corporate change (known as the Second Industrial Revolution), a new wave of imperialism, surging nationalisms, and a crisis of rising inequality. People, commodities, ideas, and cultural currents crossed borders at an unprecedented rate and scale. We will investigate how those who experienced the Gilded Age and First Globalization reckoned with migrations and dislocations, pursued international investment and endured economic panics, participated in the transnational transfer of social policy, elaborated and contested imperial civilizing missions, and reimagined theories of society. Recently, historian Leon Fink has proposed the Long Gilded Age to designate the period from the 1870s to the 1920s. Analytically, he challenges the problem-solution structure of the Gilded Age followed by the Progressive Era. Instead, he reminds us that the late nineteenth century was far from devoid of plans, radical and reformist, to remake society, while pervasive income and wealth inequality persisted deep into the 1920s. Consequently, we will examine the Long Gilded Age as a continuous period, albeit one wracked by transformations.",Humanities,undergraduate,False,False,False,False,False,True
holycross,2026,2026-2027,HIST,392,Palestinian-Israeli Conflict,"The history of the Arab-Israeli conflict is often defined in terms of competing Palestinian and Israeli national ambitions in the land of Palestine. Yet this was not always the case. In the early years of Israel's existence, Israeli prime minister, Golda Meir allegedly declared that Palestine was ""a land without a people for a people without a land"" thus drawing on a highly polemical  argument originally coined in the mid-19th century to describe the relationship between the Jewish diaspora and the Holy Land. It implied, on the one hand, that the Palestinian people did not exist in the land of Palestine and on the other, that the Jewish people had a special/ primordial right to this land. This course takes this expression as a starting point for considering the history  and historiography of the Palestinian-Israeli conflict from the British Mandate period through the 1967 Six Day War and its aftermath. Through intensive reading and discussion about the rise of Zionism and Palestinian nationalism, the demise of the Ottoman empire, the advent of the British Mandate for Palestine, and the broader conflict between the Arab states and Israel, this course will consider the historiographical revisions that Israeli and Palestinian historians have offered in order to address the ""land without a people for a people without a land"" polemic. We will investigate the reasons for the emergence of such historical revisionism and more broadly, the implications of newer historical paradigms for the history of the conflict and for its resolution.",Humanities,undergraduate,True,False,False,False,False,True
holycross,2026,2026-2027,HIST,401,Seminar,An intensive research-oriented study on various themes; offered each semester; limited to 12 participants.,Humanities,undergraduate,False,False,False,False,False,True
holycross,2026,2026-2027,HIST,408,Tutorial,"Reading of selected sources, with individual written reports and discussion, under the direction of a member of the department. Students enrolled in a tutorial must receive the approval of the instructor. One unit.",Humanities,undergraduate,False,False,False,False,False,True
holycross,2026,2026-2027,HIST,420,Fourth Year Thesis,"An individual, student-designed, professor-directed, major research project. Usually available only to outstanding fourth-year majors. A lengthy final paper and public presentation are expected. Students engaged in a thesis may be nominated for Honors in History.",Humanities,undergraduate,False,False,False,False,False,True
holycross,2026,2026-2027,HIST,421,Fourth Year Thesis,"An individual, student-designed, professor-directed, major research project. Usually available only to outstanding fourth-year majors. A lengthy final paper and public presentation are expected. Students engaged in a thesis may be nominated for Honors in History.",Humanities,undergraduate,False,False,False,False,False,True
holycross,2026,2026-2027,HIST,422,Advanced Research & Writing Colloquium,"This course is required of all History thesis writers who are working on research-based projects during their senior year. The colloquium has two aims: first, to assist students in developing and adapting the skills they will use in the course of researching, writing, and revising a 60-100 page manuscript and presenting their work orally to a broader audience (an advanced form of The Historian's Craft); and second, to alleviate, as much as possible, the isolation of the thesis writing process by offering students both formal and informal opportunities for peer support and review.",Humanities,undergraduate,False,False,False,False,False,True
holycross,2026,2026-2027,HIST,423,Advanced Research & Writing Colloquium,"This course is required of all History thesis writers who are working on research-based projects during their senior year. The colloquium has two aims: first, to assist students in developing and adapting the skills they will use in the course of researching, writing, and revising a 60-100 page manuscript and presenting their work orally to a broader audience (an advanced form of The Historian's Craft); and second, to alleviate, as much as possible, the isolation of the thesis writing process by offering students both formal and informal opportunities for peer support and review.",Humanities,undergraduate,False,False,False,False,False,True
holycross,2026,2026-2027,HNRS,294,Second Year Honors Colloquium,"Evening workshops and discussions focused on developing academic skills and interests. Formal workshops prepare students to write an intellectual autobiography, submit applications for grants and fellowships, and make formal academic presentations. Pass/No Pass.",Other,undergraduate,False,False,False,False,False,True
holycross,2026,2026-2027,HNRS,295,Third Year Honors Colloquium,"Evening workshops and discussions focused on developing academic skills and interests. Formal workshops prepare students to write an intellectual autobiography, submit applications for grants and fellowships, and make formal academic presentations. Pass/No Pass.",Other,undergraduate,False,False,False,False,False,True
holycross,2026,2026-2027,HNRS,296,Fourth Year Honors Colloquium,"Evening workshops and discussions focused on developing academic skills and interests. Formal workshops prepare students to write an intellectual autobiography, submit applications for grants and fellowships, and make formal academic presentations. Pass/No Pass.",Other,undergraduate,False,False,False,False,False,True
holycross,2026,2026-2027,HNRS,299,Honors Seminar,"Required seminar for sophomore honors students. Faculty engage newly-admitted honors students in a multidisciplinary approach to the metaphysical, cultural, spiritual, and material aspects of human nature. More generally, this course hopes to model integrative thinking and study. One unit.",Other,undergraduate,False,False,False,False,False,True
holycross,2026,2026-2027,HNRS,395,Honors Seminar,Prerequisite: Enrollment is limited to 3rd and 4th year students in the College Honors Program.,Other,undergraduate,False,False,False,False,False,True
holycross,2026,2026-2027,HNRS,494,Honors Thesis,"Honors seniors take one unit's worth of thesis credit each semester, which is graded at the end of the second semester by the student's advisor, with input from readers. The thesis is a substantial independent project either in or out of a student's major, which means that it may count for major credit or not. Two units.",Other,undergraduate,False,False,False,False,False,True
holycross,2026,2026-2027,HNRS,495,Honors Thesis,"Honors seniors take one unit's worth of thesis credit each semester, which is graded at the end of the second semester by the student's advisor, with input from readers. The thesis is a substantial independent project either in or out of a student's major, which means that it may count for major credit or not. Two units.",Other,undergraduate,False,False,False,False,False,True
holycross,2026,2026-2027,CISS,113,Business Fundamentals Lab,"The Business Fundamentals Lab aims to help students develop a clear, basic understanding of the central unit of the institution of business: a company.  Led by a practitioner, students will learn the components and functions common to companies, and explore the internal workings by which companies assess their ability to achieve multiple goals while generating profit. Acting as the managerial and executive staff of a hypothetical company named ""Helios,"" students will experiment with making complex decisions while addressing competing demands, not only concerns about immediate, short-term profit but also broader concerns about shareholders, stakeholders, ethical impact, and company culture.  The Lab is designed to fulfill the Fundamentals requirement for the minor in Business, Ethics, and Society, but is open to any student interested in understanding how businesses function and the decision making processes they follow.  Students should have Microsoft Office on their computers.",Other,undergraduate,False,False,False,False,False,True
holycross,2026,2026-2027,CISS,150,Intro to Global Health,"It is  recognized  that  poverty  plays  a  central  role  in  many  preventable  diseases. With  the development of nations have come improvements in health. The linkages between health and development can only be understood within the broader context of socio-political and economic factors. In the landscape of globalization and international development there has emerged a vast international health regime. This course focuses on these linkages in the context of this international political economy of health. Key aspects are critically examined including the concepts and architecture  of  global  health,  the  global  burden  and  epidemiology  of  disease,  health  and development of nations, and political-economic determinants of health and development. This foundational course in global health will use a variety of analytical perspectives including political, legal, economic and epidemiological. The course focuses on developing countries. One unit.",Other,undergraduate,False,False,False,False,False,True
holycross,2026,2026-2027,CISS,191,Vienna Around 1900,"The course focuses on the final glory days of Austria. After dominating Europe as imperial city and court of the Holy Roman Empire for centuries until 1806, Austria steadily diminished in geographical size and as a political powerhouse. However, at the turn-of-the-century, intellectual and aesthetic achievements secure Vienna's fame apart form the house of Habsburg. The course strives to convey the awe-inspiring diversity of innovations in art, architecture, design, music, journalism, criticism, literature, philosophy, and science through texts, slides and recordings. At the same time, the course addresses the cultural phenomena in the historical, political, and social context of events leading up to and following WWI.",Other,undergraduate,True,False,False,False,False,True
holycross,2026,2026-2027,CISS,199,Service For and With Others,"This course seeks to explore the norms of institutionalized service and volunteerism today, a phenomenon that includes service programs, service trips, end postgraduate years of service. We will dive into the past and follow where these programs came from, what ideas shaped them, what values this normalized idea of service draws from, who serves, who they serve, the limits of this kind of service, and ask how we may do this better. Along the way, this class will range over an array of influences that includes pacifist Quakers, progressive educational practitioners, the Civil Rights Movement, and the War on Poverty, and larger evolving American conceptions of service to the state and to each other.",Other,undergraduate,False,False,False,False,False,True
