university,academic_year,academic_year_label,department_code,course_number,title,description,broad_area,level,progressive_signal,western_canon_signal,climate_narrow_signal,climate_broad_signal,cross_listed,deduplicated
holycross,2026,2026-2027,ACIP,203,Internship,"Typically Offered: Fall, Spring",Humanities,undergraduate,False,False,False,False,False,True
holycross,2026,2026-2027,ACIP,350,Exploring Data Science with Friends,"In this course you will explore the world of data science through the lens of nostalgic cultural references. This course will provide a broad introduction to the topics and tools used in the field of Data Science. We will use practical applications of data science techniques to learn new skills and address real world problems. We will also approach the field of Data Science from a critical perspective that examines the ethical implications of collecting data, data privacy, bias, and transparency. This course does not require a deep understanding of programming or statistics, but general knowledge of those topics will help inform your approach to the materials. Through our coursework you will learn to collect, clean, and analyze data. You will then learn how to communicate your findings using data visualization techniques. We will use data science tools like SQL, Tableau, Python and R to explore case studies inspired by the sitcom Friends that highlight ethical and cultural implications of data science. By examining case studies that reference nostalgic moments from the show, we will reflect on important considerations such as fairness and bias and the impact of data analytics on individuals and society.",Humanities,undergraduate,False,False,False,False,False,True
holycross,2026,2026-2027,ACIP,370,Leadership in the Sports World,"This course examines the qualities and skills necessary to lead a successful sport organization.  Students will research the sports industry and identify current and past leaders of sport organizations who have made a lasting impact on the industry with their respective leadership philosophies.  Strategic planning, goal setting, motivation, creative problem solving, effective communication and teamwork will be examined and practically applied through sports industry focused projects and activities.",Humanities,undergraduate,False,False,False,False,False,True
holycross,2026,2026-2027,ACIP,375,How Medical Clinicians Reason,"The content will expose students to the constructs and processes that govern critical thinking, including an assessment of the strengths and limitations of methods that clinicians typically utilize when exercising diagnostic reasoning. Upon completion of the course the student will be able to defend and employ a practical approach to hypothesis-driven diagnostic reasoning grounded in a self-validating epistemology. The course will aim to avoid the pitfalls of dense cognitive terminology and unduly abstract concepts, and will focus on concrete examples and practical approaches to reasoning in the care of patients. This course is tailored to students who are committed to or seriously considering a career in clinical care within a medical setting.",Humanities,undergraduate,False,False,False,False,False,True
holycross,2026,2026-2027,ACIP,376,The Primary Process in America,"The New Hampshire presidential primary is a distinctive institution in American politics. On one hand, its first-in-the nation status makes it a unique vantage point from which to forecast future national trends, making it an ideal laboratory for political science. On the other, it is a unique setting in which retail politics is still practiced, and in which citizens engage in politics at an extraordinarily intense level. This course places students at the center of the action of the New Hampshire primary, and at the center of intellectual inquiry about the current state of political parties, elections, and partisan competition in the US. Students are required to attend daily classes, to submit weekly papers, and to spend a minimum of 25 hours a week interning for a primary-related worksite.",Humanities,undergraduate,False,False,False,False,False,True
holycross,2026,2026-2027,ACIP,380,Academic Internship,An independent internship arranged by the student with a faculty sponsor. The internship commitment is eight hours per week. The student meets with the faculty sponsor in a weekly tutorial as well.,Humanities,undergraduate,False,False,False,False,False,True
holycross,2026,2026-2027,ACIP,381,Policy & Politics: The Midterm Elections,"This course is intended to provide students with an in-depth analysis of current political events as well as the consequences that relevant election outcomes may have on the major policy debates facing the nation and the world. This course will inspire creative and strategic thinking, and engage students in reasoned and thoughtful policy and politics discussions in a manner that rises above partisanship and focuses on informed debate, coupled with achieving political objectives.",Humanities,undergraduate,False,False,False,False,False,True
holycross,2026,2026-2027,ACIP,399,Business & Financial Management,"Through course content and internship experiences related to the industries of finance and business, students will gain a deeper understanding of contemporary economic, social, environmental, and ethical issues that individuals and organizations face in relation to the management of money. Students will reflect upon the skills necessary to achieve success in these industries and those talents that bridge multiple career paths. Specific emphasis will be on integrating ideas and diverse perspectives, discussing ideas with faculty and peers, formulating and analyzing new ideas, applying theories, developing strategies, and judging the value of information. Students will explore the role of relationships in business and examine their own strengths and weaknesses in developing interpersonal relationships. Finally, students will understand the strategies for the protection, accumulation and distribution of wealth while exploring the individual, societal, and ethical complexities associated with wealth.",Humanities,undergraduate,True,False,False,False,False,True
holycross,2026,2026-2027,ACCT,160,Sustainability and Citizenship,"This course will examine what it means to practice good organizational citizenship and how the introduction of sustainable practices can create value. We will explore how organizations make sound ethical decisions and how these decisions can bring about positive changes to address social and environmental concerns. The recognition of the need to be fiscally responsible and balance profit against these other factors including risk to achieve sustainable future growth will be discussed. The use of outside readings, real-world examples and a project with a sustainability focus will put the course material into practice.",Professional,undergraduate,False,False,False,True,False,True
holycross,2026,2026-2027,ACCT,181,Financial Accounting,"Introduces the fundamentals of the accounting process. Presents an overview of the accounting cycle, leading to preparation of basic financial statements including the income statement and balance sheet. Examines the proper accounting treatment of the major assets of merchandising and service companies including cash, accounts receivable, inventory, property, plant and equipment. Also includes an examination of economic activity related to liabilities and stockholders' equity. Introduces the cash flow statement and analysis of basic financial statements.",Professional,undergraduate,True,False,False,False,False,True
holycross,2026,2026-2027,ACCT,185,Excel Accounting Lab,"Offers an opportunity to use Excel spreadsheet tools to explore financial statements, build financial models, value transactions and evaluate economic opportunities. Provides additional development of the quantitative reasoning and technical skills introduced in the financial accounting coursework. Overload.",Professional,undergraduate,False,False,False,False,False,True
holycross,2026,2026-2027,ACCT,226,Operations Research,"Acquaints students with decision-making and application of mathematical and statistical techniques to economic problems. Emphasizes optimization of an objective, subject to constraints upon available action. Linear optimization models are treated in depth.",Professional,undergraduate,False,False,False,False,False,True
holycross,2026,2026-2027,ACCT,270,Governmental & Nonprofit Acctg,"Studies accounting and management issues pertinent to state and local government, voluntary health and welfare organizations, other nonprofit organizations, colleges and universities, and private nonprofit hospitals.",Professional,undergraduate,False,False,False,False,False,True
holycross,2026,2026-2027,ACCT,275,Corporation Finance,"Provides an overview of two important questions posed to corporate financial managers: 1) what long-term investments should the company make? and 2) how will the company finance those investments? Topics include: stock and bond valuation, financial markets, risk and return, project analysis, capital, dividends and leverage.",Professional,undergraduate,False,False,False,False,False,True
holycross,2026,2026-2027,ACCT,277,Intermediate Accounting 1,"Offers a thorough study of the proper valuation of assets, liabilities and stockholders' equity and the related problems of the proper matching of revenues and expenses. Emphasis is given to the preparation, analysis and interpretation of financial statements.",Professional,undergraduate,True,False,False,False,False,True
holycross,2026,2026-2027,ACCT,278,Intermediate Accounting 2,"Offers a thorough study of the proper valuation of assets, liabilities and stockholders' equity and the related problems of the proper matching of revenues and expenses. Emphasis is given to the preparation, analysis and interpretation of financial statements.",Professional,undergraduate,True,False,False,False,False,True
holycross,2026,2026-2027,ACCT,282,Auditing,"Considers the theory and practice of auditing, including professional ethics, professional standards and procedures and the legal environment in which the auditor functions. Emphasis is placed on the audit process as students gain an understanding of how to plan, design and execute an audit. Other topics include internal control, the nature of evidential matter and the auditors reporting responsibilities.",Professional,undergraduate,False,False,False,False,False,True
holycross,2026,2026-2027,ACCT,285,Accounting Information Systems,"Introduces students to the theory and terminology of information systems, investigates internal controls, security, privacy and ethics in the design, development and usage of information systems and provides students with tools to document and assess existing information systems. Also provides practical experience using database software.",Professional,undergraduate,False,False,False,False,False,True
holycross,2026,2026-2027,ACCT,286,Data Analytics,"This course introduces students to understanding when and how data analytics can address specific organizational questions. In addition, it provides the foundation to understand the impact of data quality, the need for data manipulation and analysis and the reporting of results to key decision makers using industry standard data visualization tools.",Professional,undergraduate,False,False,False,False,False,True
holycross,2026,2026-2027,ACCT,292,Federal Income Taxation,"A study of the federal income tax laws as they relate primarily to individuals.  Consideration is also given to the history of the federal income tax, various proposals for tax reform, the use of tax policy to achieve economic and social objectives and tax planning.",Professional,undergraduate,False,False,False,False,False,True
holycross,2026,2026-2027,ACCT,360,"Ethics, Acctg & Organizations","The course examines topics of current interest in organizational and professional ethics with particular attention focused on accountancy. The role of moral philosophy from the perspective of multiple ethical frameworks is discussed in terms of individual and public debates about controversial issues, such as the professional obligation, the responsibilities of individuals in government and corporations, and the role of the corporation as a ""legal person."" The goal of the course is to help students think, speak, and write clearly in the form of organizational and professional ethics.",Professional,undergraduate,False,False,False,False,False,True
holycross,2026,2026-2027,ACCT,362,Taxation of Entities,"A study of the federal tax laws as they apply to C Corporations, S Corporations, Partnerships, Trusts and Estates, both planning for and executing business transactions and decisions.",Professional,undergraduate,False,False,False,False,False,True
holycross,2026,2026-2027,ACCT,387,Business Law,"(Based on the Uniform Commercial Code) Includes contracts, agency, sales, negotiable instruments, the legal aspect of business associations, insurance and property, both real and personal.",Professional,undergraduate,False,False,False,False,False,True
holycross,2026,2026-2027,ACCT,389,Cost Accounting,"This course covers the use of accounting information for organizational decision making.  It focuses on the use of managerial accounting, with discussions of costing methods, cost control and analysis, and budgeting.",Professional,undergraduate,False,False,False,False,False,True
holycross,2026,2026-2027,ACCT,390,Advanced Accounting,"Covers advanced problems relating to partnership formation, operation and liquidation; a study of corporate business combinations and consolidated financial statements under the acquisition method; and other accounting topics such as accounting for derivatives and foreign currency transactions, consolidation of foreign subsidiaries and segment reporting.",Professional,undergraduate,False,False,False,False,False,True
holycross,2026,2026-2027,ACCT,400,Directed Reading,A program in reading and research in a specific topic open to majors with a minimum GPA of 3.25.,Professional,undergraduate,False,False,False,False,False,True
holycross,2026,2026-2027,ACCT,401,Directed Readings Lab,,Professional,undergraduate,False,False,False,False,False,True
holycross,2026,2026-2027,AFST,110,Intro To Africana Studies,"Interdisciplinary introduction to the study, research, and interpretation of historical, cultural, social and political knowledge of African American, African, and Caribbean peoples examining contemporary black identities, politics, and culture, particularly focusing on the role and place of blacks in modern American cities through exploration of international migrations, race relations, and 20th-century cultural movements, including civil rights, social protest music, art and literature. Addresses the cultural, historical, political, economic, and psychological consequences of the dispersal of Africans from their ancestral continent to the United States and the Caribbean and the impact of the cultures of West and central Africa in the United States and the Caribbean, through oral narratives, music, art, festivals, foodways, clothing, hairstyles, dance, and religious belief systems. Introduces literary and political movements including Pan-Africanism, black feminism, Negritude, Harlem Renaissance, and other activities reflecting shared theories, ideologies and political movements of Africans, African Americans and Caribbean blacks.",Humanities,undergraduate,True,True,False,False,False,True
holycross,2026,2026-2027,AFST,260,Black Europe,"Although often considered homogenously white, Europe's population is and always has been racially diverse. This diversity is the culmination of centuries of colonialist interventions around the globe, particularly in Africa and the West Indies. This course will explore the history and contemporary reality of this population diversity, with a particular focus on the African diaspora in Europe. Beginning with Europe's simultaneous expulsion of Jews and Muslims and ""discovery"" of Caribbean islands in 1492, the students will trace Europe's colonial history in Africa and the West Indies that ultimately resulted in return migration of current and former African colonial subjects to multiple metropoles in Europe. Students will then focus on the experiences of the African Diaspora in Europe, broadly, and in five countries (Britain, France, The Netherlands, Germany, and Italy) before addressing contemporary debates (the racialization of Muslims as the ""new Blacks"" in Europe, citizenship laws within and across the EU, and anti-racist movements) and concluding with discussion of the future of race and Africans in Europe.",Humanities,undergraduate,True,False,False,False,False,True
holycross,2026,2026-2027,AFST,300,Tutorial,"Typically Offered: Fall, Spring",Humanities,undergraduate,False,False,False,False,False,True
holycross,2026,2026-2027,AFST,399,The Old Neighborhood,"Looking at the development of communities of people of color through the 1920s in Worcester, Boston, Providence & elsewhere in New England.",Humanities,undergraduate,True,False,False,False,False,True
holycross,2026,2026-2027,AFST,400,Tutorial,"Typically Offered: Fall, Spring",Humanities,undergraduate,False,False,False,False,False,True
holycross,2026,2026-2027,ANTH,101,Anthropological Perspective,"A one-semester introduction to the main modes of cultural anthropological analysis of non-Western cultures, such as those of Africa, Latin America, Southeast Asia, Melanesia, Polynesia, sub-Saharan Africa and Native America. Topics include: ethnographic methods; concepts of culture; symbolic communication; ecological processes; introduction to anthropological approaches to kinship, religion, gender, hierarchy, economics, medicine, political life, transnational processes.",Social Sciences,undergraduate,True,False,False,True,False,True
holycross,2026,2026-2027,ANTH,101C,Anthropological Perspective CBL,,Social Sciences,undergraduate,False,False,False,False,False,True
holycross,2026,2026-2027,ANTH,199,Brazilian Immigration and Experiences in the U.S. and in Massachusetts,"Students will be introduced to current theoretical approaches used to explain Brazilian experiences of immigration to the U.S. and to an empirical overview of how social institutions affect the daily lives of Brazilians living in the U.S. Through collaborative community-engaged projects with institutions working with the Brazilian population in Massachusetts, such as the Brazilian American Center (BRACE), the Brazilian Worker Center, the Worcester Brazilian Association, Framingham Public Schools, Worcester Public Schools and Instituto Diaspora Brasil, students will have the opportunity to do ethnographic research and acquire first-hand knowledge about the third largest immigrant community in Massachusetts. The complex nature of identity, as a historical and cultural construct, will underlie the discussions about the categorizing of Brazilians within the largest minority in the U.S.: Latina/o/Latinx.",Social Sciences,undergraduate,True,False,False,False,False,True
holycross,2026,2026-2027,ANTH,250,Arab Women's Worlds: Remapping Feminist Geographies,"Taking the idea of worlding, or ways of collective living through the senses in relation to women's storytelling as a foundation, this course invites students to participate in a poetics of visceral encounter with Arab women's worlds. Through the lens of feminist ethnography, which questions the line between the fictional and the 'real', we will explore the intimate social, political and cultural geographies of Arab women in the MENA region and its diasporas. We will attend to the everyday and embodied realities of Arab women through themes of identity, power, violence, war, exile, memory, revolution, home, love, and belonging, from traditional ethnographic texts to literature, poetry and experimental art, film and life writing. In doing so, we summon the social worlds and gendered imaginaries that grow out of women's lives as ethnographic text.",Social Sciences,undergraduate,True,False,False,False,False,True
holycross,2026,2026-2027,ANTH,251,Informal Economies,"The UN reports that 2/3 of the global workforce operates in the ""informal economy."" This course develops an anthropological approach to that fact. Our foundation is the literature on the informal economy in Africa and other parts of the global south, but we will also explore economic processes closer to home. Topics include: the origin, development, and use of the ""informal economy"" concept, precarious livelihoods, micro-credit and ""bottom of the pyramid"" ventures, informal networks, illicit trade, smuggling, black markets, and organized crime.",Social Sciences,undergraduate,False,False,False,False,False,True
holycross,2026,2026-2027,ANTH,252,Anthropology of Law,"This course explores cross-cultural variation within and among legal institutions. Through the medium of ethnography, as well as original primary-source research into court proceedings and legal disputes, we consider how law becomes a mechanism for the maintenance of social order at the same time that it can contribute to social inequity. We will address central questions in the anthropology of law: How does our cultural background influence how we conceptualize justice? What are the consequences of finding oneself between competing legal systems? Why are questions of legality so often tied up with our conceptions of human nature? Our focus will be to examine critically the social and cultural dynamics behind dispute resolution, corporate law, crime, torts, religious law, and international courts, as well as dilemmas around policing and other ways people encounter the law in everyday life. Case studies from diverse legal environments in both industrialized and small-scale societies will help place Western law traditions in a comparative, global perspective.",Social Sciences,undergraduate,True,False,False,False,False,True
holycross,2026,2026-2027,ANTH,253,Gender & Development,"Is there any validity to the claim that women in the Global South have largely been ""left out"", ""marginalized"" and even ""harmed"" by development programs and ideologies? And is development a new form of imperialism? The course begins with discussion of anthropological and feminist critiques of ""development"" and then examines successes and shortfalls of different strategies used to ""bring women back"" into development. We then evaluate the gendered impacts of development policies, programs promoted by international development agencies.",Social Sciences,undergraduate,True,False,False,False,False,True
holycross,2026,2026-2027,ANTH,254,Reproductive Justice,"This course examines the concept of Reproductive Justice, understood as the complete physical, mental, spiritual, political, social and economic well-being of women and girls, based on the full achievement and protection of womens human rights. More than focusing solely on the pro-choice issue, the Reproductive Justice framework addresses the social reality of the inequality of opportunities available to women to control their reproductive destinies. In that sense, this framework attempts to analyze how the ability of any woman to determine her own reproductive destiny is linked directly to the conditions of her community. The course draws on various theoretical and analytic tools to explore the social, legal, and economic barriers for accessing reproductive health care domestically and internationally, specifically in Latin America. Three areas of focus are included in this framework: (1) the right not to have a child; (2) the right to have a child; (3) the right to parent children in safe and healthy environments.",Social Sciences,undergraduate,False,False,False,False,False,True
holycross,2026,2026-2027,ANTH,255,Gender & Sexualities,"Over the past few years the very limit of what is ""male"" and what is ""female"" seems to have become more unstable and fluid in our society and around the world.  Similarly, recent scholarship on ""gender"" has disputed conventional academic wisdom of how gender and sexuality are produced, embodied and performed by individuals.  Anthropology and feminist theory have furthered these debates by offering a significant reappraisal of ""gender"" - as a concept, social relationship and category of analysis.  In this course, we will develop a critical stance toward the study of gender and sexuality by taking anthropology's and feminism's insights into account as we explore the power dynamics that play into the social construction of the body.  We will pay attention to how various peoples (including ourselves), living at different times, have fashioned social distinctions based on gender and sexuality, and how these distinctions have played a role in the organization of political, religious, economic and ideological practices.  Among the topics we will cover are: the nature/nurture debate, kinship, psychoanalysis, transgender identity, race, gender under colonialism, and performativity.",Social Sciences,undergraduate,True,False,False,False,False,True
