university,academic_year,academic_year_label,department_code,course_number,title,description,broad_area,level,progressive_signal,western_canon_signal,climate_narrow_signal,climate_broad_signal,cross_listed,deduplicated
tsu,2026,2026-2027,ACCT,300,Accounting Information Systems,Inquiry into the fundamental principles and concepts underlying accounting information systems.  Three hours of lecture per week.,Professional,lower,no,no,no,no,no,no
tsu,2026,2026-2027,ACCT,332,Intermediate Accounting II,"Accounting procedures for plant assets and intangible assets, requirements peculiar to corporate accounting, analysis and interpretation of accounting data, and current trends in the application of basic concepts.",Professional,lower,no,no,no,no,no,no
tsu,2026,2026-2027,ACCT,333,Intermediate Accounting III,"Current accounting problems, including international accounting with special emphasis on published pronouncements or professional accounting organizations.  Exploration of contemporary controversial topics included with written research paper required.",Professional,lower,no,no,no,no,no,no
tsu,2026,2026-2027,ACCT,334,Fed Income Tax Acctg I,"Interpretation of the Internal Revenue Code and related regulations and instructions.  Concepts of income tax determination and reporting requirements for individuals, partnerships, and corporations; payroll tax requirements and reporting procedures.",Other,lower,no,no,no,no,no,no
tsu,2026,2026-2027,ACCT,335,Tax Practicum,Preparation of federal income tax returns for individuals as part of the Voluntary Income Tax Assistance program. Students provide tax compliance services and prepare tax returns primarily for individuals who cannot aFford professional tax services.,Other,lower,no,no,no,no,no,no
tsu,2026,2026-2027,ACCT,336,Cost Accounting,"Provision of a basis for using Accounting as a management tool through the development of knowledge of accounting techniques for planning, controlling, and product costing.",Professional,lower,no,no,no,no,no,no
tsu,2026,2026-2027,ACCT,339,Business Law,Study of the basic legal concepts and principles pertaining to fundamental business transactions and of the Uniform Commercial Code.  Three hours of lecture per week.,Professional,lower,no,no,no,no,no,no
tsu,2026,2026-2027,ACCT,400,Intro to Energy Accounting,"Financial reporting and tax practices of the energy industry. Accounting for cost activities relating
to, acquisition of mineral interest in properties, exploration, development and production of oil and
gas. Designed to enhance knowledge and skill level of accounting students in order to improve their
accounting skills and marketability in the global energy market.",Humanities,lower,no,no,no,no,no,no
tsu,2026,2026-2027,ACCT,430,Ethics for Accountants,Philosophical understanding of ethical complexities of the modern business enterprise and a fundamental base of ethical knowledge necessary for a career in Accounting and Finance.,Professional,lower,no,no,no,no,no,no
tsu,2026,2026-2027,ACCT,431,Advanced Accounting,"Purchase and pooling-of-interest methods of accounting and special topics, including partnership formation and liquidation, government accounting, and international accounting. T",Professional,lower,no,no,no,no,no,no
tsu,2026,2026-2027,ACCT,433,Auditing,"Study of auditing principles, techniques, and procedures; professional ethics and legal responsibility; the audit program, field work, and the audit report.",Other,lower,no,no,no,no,no,no
tsu,2026,2026-2027,ACCT,436,Fed Income Tax Acctg II,"Continuation of ACCT 334 with emphasis on research in taxation; accounting methods; payment of taxes; guides for partnerships, estates, trusts, and corporations; preparation and filing of required returns.",Professional,lower,no,no,no,no,no,no
tsu,2026,2026-2027,ACCT,438,Govt Not -For-Profit,"An introduction to budgeting, accounting, and fnancial reporting of governmental entities as well as
private and public not-for-profIt organizations.",Professional,lower,no,no,no,no,no,no
tsu,2026,2026-2027,ACCT,445,Contemp Topics in Accounting,"Contemporary Topics in Accounting	(3) 
Applied study and research on emerging issues in the field of Accounting and Information Systems.  Three hours of lecture per week.",Professional,lower,no,no,no,no,no,no
tsu,2026,2026-2027,ACCT,446,Accounting Internship,Faculty supervised work experience where written reports are required.,Professional,lower,no,no,no,no,no,no
tsu,2026,2026-2027,ACCT,2301,Principles Of Accounting I,"Fundamental concepts of double-entry theory, recording procedures, worksheet techniques, and financial statement preparation. Accounting for cash, receivables, inventories, plant assets, and liabilities.",Professional,lower,no,no,no,no,no,no
tsu,2026,2026-2027,ACCT,2302,Principles of Accounting II,Emphasis on the preparation of reports and the use of accounting data for internal management.,Professional,lower,no,no,no,no,no,no
tsu,2026,2026-2027,ACCT,3331,Intermediate Accounting I,"Techniques in adjusting, correcting, and revising accounting records and statements. Conventional standards and acceptable alternatives in accounting for cash, receivables, liabilities, inventories, and plant assets.",Professional,upper,no,no,no,no,no,no
tsu,2026,2026-2027,AJ,100,Intro to Criminology,,Social Sciences,lower,no,no,no,no,no,no
tsu,2026,2026-2027,AJ,105,Intro Admin Of Justice,,Other,lower,no,no,no,no,no,no
tsu,2026,2026-2027,AJ,211,Intro to Court Systems(LS),,Other,lower,no,no,no,no,no,no
tsu,2026,2026-2027,AJ,220,Intro To Corrections,,Other,lower,no,no,no,no,no,no
tsu,2026,2026-2027,AJ,240,Intro To Law Enfrmnt,,Professional,lower,no,no,no,no,no,no
tsu,2026,2026-2027,AJ,241,Security Management,,Professional,lower,no,no,no,no,no,no
tsu,2026,2026-2027,AJ,250,Legal Aspects Law Enforcement,,Professional,lower,no,no,no,no,no,no
tsu,2026,2026-2027,AJ,300,Substance Abuse,,Other,lower,no,no,no,no,no,no
tsu,2026,2026-2027,AJ,301,Research Methods in AJ,,Other,lower,no,no,no,no,no,no
tsu,2026,2026-2027,AJ,302,Statistics in AJ,,STEM,lower,no,no,no,no,no,no
tsu,2026,2026-2027,AJ,310,Criminal Law and Procedure,,Professional,lower,no,no,no,no,no,no
tsu,2026,2026-2027,AJ,313,Judicial Admin,,Other,lower,no,no,no,no,no,no
tsu,2026,2026-2027,AJ,321,Probation & Parole Admin,,Other,lower,no,no,no,no,no,no
tsu,2026,2026-2027,AJ,322,Juvenile Justice Sys,,Other,lower,no,no,no,no,no,no
tsu,2026,2026-2027,AJ,323,Correctional Counseling,,Other,lower,no,no,no,no,no,no
tsu,2026,2026-2027,AJ,333,Police & Comm Relations,,Other,lower,no,no,no,no,no,no
tsu,2026,2026-2027,AJ,334,Criminal Invest,,Other,lower,no,no,no,no,no,no
tsu,2026,2026-2027,AJ,335,Commun Based Corrections,,Other,lower,no,no,no,no,no,no
tsu,2026,2026-2027,AJ,338,Spatial Analysis,,Other,lower,no,no,no,no,no,no
tsu,2026,2026-2027,AJ,345,Comparative AJ,,Other,lower,no,no,no,no,no,no
tsu,2026,2026-2027,AJ,411,Sem Admin Of Justice Ethics,,Other,lower,no,no,no,no,no,no
tsu,2026,2026-2027,AJ,412,Selected Topics in AJ,,Other,lower,no,no,no,no,no,no
tsu,2026,2026-2027,AJ,441,Correctional Admin,,Other,lower,no,no,no,no,no,no
tsu,2026,2026-2027,AJ,450,Police Admin,,Other,lower,no,no,no,no,no,no
tsu,2026,2026-2027,AJ,451,Seminar on Adm of Justice,,Other,lower,no,no,no,no,no,no
tsu,2026,2026-2027,AJ,452,Race and AJ,,Other,lower,no,no,no,no,no,no
tsu,2026,2026-2027,AJ,453,Admin of Justice Theories,,Other,lower,no,no,no,no,no,no
tsu,2026,2026-2027,AJ,460,Admin of Justice Internship,,Other,lower,no,no,no,no,no,no
tsu,2026,2026-2027,AJ,499,Admin of Justice Capstone,,Other,lower,no,no,no,no,no,no
tsu,2026,2026-2027,AFS,132,Introduction to African Studies,"Introduction to African Studies (3)
This course is a multi-disciplinary course designed to give students a broad overview of African history, culture, economics, and art. Three hours of lecture per week.",Social Sciences,lower,no,no,no,no,no,no
tsu,2026,2026-2027,AFSC,1201,Foundations of the USAF I,"Foundations of the USAF I (2)
Overall roles and missions of the USAF; career f elds available. Emphasis on military customs and
courtesies, appearance standards, core values, written and personal communication. Introduction to American military history.",Social Sciences,lower,no,no,no,no,no,no
tsu,2026,2026-2027,AFSC,1201L,Foundations of the USAF Lab,College/School: The School of Public Affairs,Other,lower,no,no,no,no,no,no
tsu,2026,2026-2027,AFSC,1202,Foundations of the USAF II,"Foundations of the USAF II (2)
Overall roles and missions of the USAF; career fi elds available. Emphasis on military customs and
courtesies, appearance standards, core values, written and personal communication. Introduction to American military history.",Social Sciences,lower,no,no,no,no,no,no
tsu,2026,2026-2027,AFSC,1202L,Foundations of the USAF II Lab,College/School: The School of Public Affairs,Other,lower,no,no,no,no,no,no
tsu,2026,2026-2027,AFSC,2201,Evolution of Air Power I,"Evolution of Air Power I (2)
Key historical events and milestones in the development of air power as a primary instrument of United States national security. Core values and competencies of leaders in the United States Air Force. Tenets of leadership and ethics.",Other,lower,no,no,no,no,no,no
tsu,2026,2026-2027,AFSC,2201L,Evolution of Air Power Lab,College/School: The School of Public Affairs,Other,lower,no,no,no,no,no,no
tsu,2026,2026-2027,AFSC,2202,Evolution of Air Power II,"Evolution of Air Power II (2)
Key historical events and milestones in the development of air power as a primary instrument of United States national security. Core values and competencies of leaders in the United States Air Force. Tenets of leadership and ethics.",Other,lower,no,no,no,no,no,no
tsu,2026,2026-2027,AFSC,2202L,Evolution of Air Power II Lab,College/School: The School of Public Affairs,Other,lower,no,no,no,no,no,no
tsu,2026,2026-2027,AFSC,3301,Air Force Leadership I,"Air Force Leadership Studies I (3)
Leadership, management fundamentals, professional knowledge, Air Force personnel and evaluation systems, and leadership ethics. Case studies of Air Force leadership and management situations.",Professional,upper,no,no,no,no,no,no
tsu,2026,2026-2027,AFSC,3301L,Air Force Leadership Lab I,College/School: The School of Public Affairs,Other,upper,no,no,no,no,no,no
tsu,2026,2026-2027,AFSC,3302,Air Force Leadership II,"Air Force Leadership Studies II (3)
Leadership, management fundamentals, professional knowledge, Air Force personnel and evaluation systems, and leadership ethics. Case studies of Air Force leadership and management situations.",Professional,upper,no,no,no,no,no,no
tsu,2026,2026-2027,AFSC,3302L,Air Force Leadership II Lab,College/School: The School of Public Affairs,Other,upper,no,no,no,no,no,no
tsu,2026,2026-2027,AFSC,3801,Field Training,College/School: The School of Public Affairs,Other,upper,no,no,no,no,no,no
tsu,2026,2026-2027,AFSC,4301,National Security Affairs I,"National Security Affairs I (3)
Evolution of the role of national security in a democratic society with emphasis on policy formation,
competing values, and organizations. Civilian control of the military; roles of the services; functions of the Air Force Commands.",Other,upper,no,no,no,no,no,no
tsu,2026,2026-2027,AFSC,4301L,National Security Lab I,College/School: The School of Public Affairs,Other,upper,no,no,no,no,no,no
tsu,2026,2026-2027,AFSC,4302,National Security Affairs II,"National Security Affairs II (3)
Evolution of the role of national security in a democratic society with emphasis on policy formation,
competing values, and organizations. Civilian control of the military; roles of the services; functions of the Air Force Commands.",Other,upper,no,no,no,no,no,no
tsu,2026,2026-2027,AFSC,4302L,National Security Aff. II Lab,College/School: The School of Public Affairs,Other,upper,no,no,no,no,no,no
tsu,2026,2026-2027,AWS,101L,Intro To Aviation Lab,"Introduction to Aviation Laboratory	(1)
Introduction to rudimentary flight procedures and techniques required for basic flight. Two hours of laboratory per week. Corequisite: AWS 101.",Other,lower,no,no,no,no,no,no
tsu,2026,2026-2027,AWS,102,Aviation History,"Aviation History (3)
This course covers an overview of aviation history with a focus on the United States. Additionally, the course will discuss the origin of aircraft equipment. Three hours of lecture per week.",Humanities,lower,no,no,no,no,no,no
tsu,2026,2026-2027,AWS,105,Private Pilot Flight,"This course prepares the student for the FAA Private Pilot Practical Examination. Successful
completion of this course will permit the student to perform as a pilot in command of single engine
aircraft transport of passengers or property; excluding fees or employment. T",Other,lower,no,no,no,no,no,no
tsu,2026,2026-2027,AWS,200,Basics of Communications,"Basics of Communications (3)
In accordance with FAA orders 7110.65 and 7110.10, the student will identify basic radio and
interphone communications, ICAO phonetics, numbers usage, basic phraseology, coordination
procedures, purpose and steps of the position relief briefi ng. Three hours of lecture per week.",Social Sciences,lower,no,no,no,no,no,no
tsu,2026,2026-2027,AWS,201L,Flight Met Lab,"Flight Meteorology Laboratory	(1)
Introduction to the methods and techniques of flight meteorology. Two hours of laboratory per week. Corequisite: AWS 201.",Other,lower,no,no,no,no,no,no
tsu,2026,2026-2027,AWS,203,Intro To Air Traffic Control,"Introduction to Air Traffi c Control (3)
Study of the role of centers, approach towers, fl ight service stations, communication, and navigation procedures. Three hours of lecture per week.",Social Sciences,lower,no,no,no,no,no,no
tsu,2026,2026-2027,AWS,313,Int Flight Theory,"Intermediate Flight Theory	(3)
Aerodynamics, weight and balance computations, performance problems, flight maneuvers, aircraft power plant operations, flight physiology, cockpit instrumentation, and associated FAA regulations. Preparation for FAA commercial pilot written examination. Three hours of lecture per week.",Other,lower,no,no,no,no,no,no
tsu,2026,2026-2027,AWS,321L,Air Traffic Control Lab,"Air Traffic Control Laboratory	(1)
Practical application of air traffic control skills in a laboratory setting. Two hours of laboratory per week. Corequisite: AWS 321.",Other,lower,no,no,no,no,no,no
tsu,2026,2026-2027,AWS,345,Principles Aviation Property,"Study of the processes of planning, organizing, directing, and controlling aviation property at fi xed
based operations.",Other,lower,no,no,no,no,no,no
tsu,2026,2026-2027,AWS,371,Airport Mgmt,"Airport Management	(3)
Origin of early legislation shaping development of present National Airport System; procedures for financing airport construction, phases of airport master planning, daily operations, and contractual provisions governing the operations of an airline. Three hours of lecture per week.",Professional,lower,no,no,no,no,no,no
tsu,2026,2026-2027,AWS,380,Flight Instruction Airplane,"This course is a study of the fundamentals of airplane fl ight instruction involving educational principles of the learning and teaching process, communication, teaching methods, critiquing, evaluating, and planning instructional activity.",Social Sciences,lower,no,no,no,no,no,no
tsu,2026,2026-2027,AWS,402,Effective HSEM CM & Leadership,Prepares future aviation professionals with communication and leadership skills to fulfi ll teambuilding roles with government and non-government agencies during times of aviation disasters.,Social Sciences,lower,no,no,no,no,no,no
tsu,2026,2026-2027,AWS,425,Flight Physiology,"A study of the causes, symptoms, treatment, and prevention of medical issues associated with fl ight.",Other,lower,no,no,no,no,no,no
tsu,2026,2026-2027,MUSA,111,Applied Music,"Applied Music	(1)
Performance in a secondary medium emphasizing the development of musicianship and technical skills. Offered each semester for minors and non-majors and as a secondary MUSA course for majors. One-half hour of laboratory per week.",Other,lower,no,no,no,no,no,no
tsu,2026,2026-2027,MUSA,111B,Applied Music Brass,"Applied Music (1)
Performance in a secondary medium emphasizing the development of musicianship and technical
skills. Offered each semester for minors and as a secondary MUSA course for majors. One-half hour of laboratory per week.",Other,lower,no,no,no,no,no,no
tsu,2026,2026-2027,MUSA,111K,Applied Music Piano,"Applied Music (1)
Performance in a secondary medium emphasizing the development of musicianship and technical
skills. Offered each semester for minors and as a secondary MUSA course for majors. One-half hour of laboratory per week.",Other,lower,no,no,no,no,no,no
tsu,2026,2026-2027,MUSA,111P,Applied Music Perc,"Applied Music (1)
Performance in a secondary medium emphasizing the development of musicianship and technical
skills. Offered each semester for minors and as a secondary MUSA course for majors. One-half hour of laboratory per week.",Other,lower,no,no,no,no,no,no
tsu,2026,2026-2027,MUSA,111S,Applied Music String,"Applied Music (1)
Performance in a secondary medium emphasizing the development of musicianship and technical
skills. Offered each semester for minors and as a secondary MUSA course for majors. One-half hour of laboratory per week.",Other,lower,no,no,no,no,no,no
tsu,2026,2026-2027,MUSA,111V,Applied Music Voice,"Applied Music (1)
Performance in a secondary medium emphasizing the development of musicianship and technical
skills. Offered each semester for minors and as a secondary MUSA course for majors. One-half hour of laboratory per week.",Other,lower,no,no,no,no,no,no
tsu,2026,2026-2027,MUSA,111W,Applied Music Woodwind,"Applied Music (1)
Performance in a secondary medium emphasizing the development of musicianship and technical
skills. Offered each semester for minors and as a secondary MUSA course for majors. One-half hour of laboratory per week.",Other,lower,no,no,no,no,no,no
tsu,2026,2026-2027,MUSA,112,Applied Music,Continuation of MUSA 111 . Offered each semester for minors and non-majors and as a secondary MUSA course for majors.,Other,lower,no,no,no,no,no,no
tsu,2026,2026-2027,MUSA,112B,Applied Music Brass,Continuation of MUSA 111 . Offered each semester for minors and as a secondary MUSA course for majors.,Other,lower,no,no,no,no,no,no
tsu,2026,2026-2027,MUSA,112K,Applied Music Piano,Continuation of MUSA 111 . Offered each semester for minors and as a secondary MUSA course for majors.,Other,lower,no,no,no,no,no,no
tsu,2026,2026-2027,MUSA,112P,Applied Music,"Applied Music (1)
Continuation of MUSA 111 . Offered each semester for minors and as a secondary MUSA course for majors. One-half hour of laboratory per week. Prerequisite: MUSA 111 .",Other,lower,no,no,no,no,no,no
tsu,2026,2026-2027,MUSA,112S,Applied Music String,Continuation of MUSA 111 . Offered each semester for minors and as a secondary MUSA course for majors.,Other,lower,no,no,no,no,no,no
tsu,2026,2026-2027,MUSA,112V,Applied Music Voice,Continuation of MUSA 111 . Offered each semester for minors and as a secondary MUSA course for majors.,Other,lower,no,no,no,no,no,no
tsu,2026,2026-2027,MUSA,112W,Applied Music Woodwind,Continuation of MUSA 111 . Offered each semester for minors and as a secondary MUSA course for majors.,Other,lower,no,no,no,no,no,no
tsu,2026,2026-2027,MUSA,121,Applied Music,"Applied Music	(2)
Performance in a principal medium emphasizing the development of musicianship and technical skills. Offered each semester for majors. One hour of laboratory per week.",Other,lower,no,no,no,no,no,no
tsu,2026,2026-2027,MUSA,121B,Applied Music Brass,"Applied Music (1)
Performance in a principal medium emphasizing the development of musicianship and technical skills. Offered each semester for majors. One hour of laboratory per week.",Other,lower,no,no,no,no,no,no
tsu,2026,2026-2027,MUSA,121K,Applied Music Piano,"Applied Music (1)
Performance in a principal medium emphasizing the development of musicianship and technical skills. Offered each semester for majors. One hour of laboratory per week.",Other,lower,no,no,no,no,no,no
tsu,2026,2026-2027,MUSA,121P,Applied Music Perc,"Applied Music (1)
Performance in a principal medium emphasizing the development of musicianship and technical skills. Offered each semester for majors. One hour of laboratory per week.",Other,lower,no,no,no,no,no,no
tsu,2026,2026-2027,MUSA,121S,Applied Music String,"Applied Music (1)
Performance in a principal medium emphasizing the development of musicianship and technical skills. Offered each semester for majors. One hour of laboratory per week.",Other,lower,no,no,no,no,no,no
tsu,2026,2026-2027,MUSA,121V,Applied Music Voice,"Applied Music (1)
Performance in a principal medium emphasizing the development of musicianship and technical skills. Offered each semester for majors. One hour of laboratory per week.",Other,lower,no,no,no,no,no,no
tsu,2026,2026-2027,MUSA,121W,Applied Music Woodwind,"Applied Music (1)
Performance in a principal medium emphasizing the development of musicianship and technical skills. Offered each semester for majors. One hour of laboratory per week.",Other,lower,no,no,no,no,no,no
tsu,2026,2026-2027,MUSA,122,Applied Music,Continuation of MUSA 121 . Offered each semester for majors.,Other,lower,no,no,no,no,no,no
tsu,2026,2026-2027,MUSA,122B,Applied Music Brass,Continuation of MUSA 121 . Offered each semester for majors.,Other,lower,no,no,no,no,no,no
tsu,2026,2026-2027,MUSA,122K,Applied Music Piano,Continuation of MUSA 121 . Offered each semester for majors.,Other,lower,no,no,no,no,no,no
tsu,2026,2026-2027,MUSA,122P,Applied Music Perc,Continuation of MUSA 121 . Offered each semester for majors.,Other,lower,no,no,no,no,no,no
tsu,2026,2026-2027,MUSA,122S,Applied Music String,Continuation of MUSA 121 . Offered each semester for majors.,Other,lower,no,no,no,no,no,no
tsu,2026,2026-2027,MUSA,122V,Applied Music Voice,Continuation of MUSA 121 . Offered each semester for majors.,Other,lower,no,no,no,no,no,no
tsu,2026,2026-2027,MUSA,122W,Applied Music Woodwind,Continuation of MUSA 121 . Offered each semester for majors.,Other,lower,no,no,no,no,no,no
tsu,2026,2026-2027,MUSA,131,Applied Music,Intensive performance in a principal medium emphasizing the development of musicianship and technical skills. Offered each semester for majors.,Other,lower,no,no,no,no,no,no
tsu,2026,2026-2027,MUSA,131B,Applied Music Brass,Intensive performance in a principal medium emphasizing the development of musicianship and technical skills. Offered each semester for majors.,Other,lower,no,no,no,no,no,no
tsu,2026,2026-2027,MUSA,131K,Applied Music Piano,Intensive performance in a principal medium emphasizing the development of musicianship and technical skills. Offered each semester for majors.,Other,lower,no,no,no,no,no,no
tsu,2026,2026-2027,MUSA,131P,Applied Music Perc,Intensive performance in a principal medium emphasizing the development of musicianship and technical skills. Offered each semester for majors.,Other,lower,no,no,no,no,no,no
tsu,2026,2026-2027,MUSA,131S,Applied Music String,Intensive performance in a principal medium emphasizing the development of musicianship and technical skills. Offered each semester for majors.,Other,lower,no,no,no,no,no,no
tsu,2026,2026-2027,MUSA,131V,Applied Music Voice,Intensive performance in a principal medium emphasizing the development of musicianship and technical skills. Offered each semester for majors.,Other,lower,no,no,no,no,no,no
tsu,2026,2026-2027,MUSA,131W,Applied Music Woodwind,Intensive performance in a principal medium emphasizing the development of musicianship and technical skills. Offered each semester for majors.,Other,lower,no,no,no,no,no,no
tsu,2026,2026-2027,MUSA,132,Applied Music,Continuation of MUSA 131 .,Other,lower,no,no,no,no,no,no
tsu,2026,2026-2027,MUSA,132B,Applied Music Brass,Continuation of MUSA 131 .,Other,lower,no,no,no,no,no,no
tsu,2026,2026-2027,MUSA,132K,Applied Music Piano,Continuation of MUSA 131 .,Other,lower,no,no,no,no,no,no
tsu,2026,2026-2027,MUSA,132P,Applied Music Perc,Continuation of MUSA 131 .,Other,lower,no,no,no,no,no,no
tsu,2026,2026-2027,MUSA,132S,Applied Music String,Continuation of MUSA 131 .,Other,lower,no,no,no,no,no,no
tsu,2026,2026-2027,MUSA,132V,Applied Music Voice,Continuation of MUSA 131 .,Other,lower,no,no,no,no,no,no
tsu,2026,2026-2027,MUSA,132W,Applied Music Woodwind,Continuation of MUSA 131 .,Other,lower,no,no,no,no,no,no
tsu,2026,2026-2027,MUSA,211,Applied Music,Performance in a secondary medium emphasizing the development of musicianship and technical skills. Offered each semester for minors and non-majors and as a secondary MUSA course for majors.,Other,lower,no,no,no,no,no,no
tsu,2026,2026-2027,MUSA,211B,Applied Music Brass,Performance in a secondary medium emphasizing the development of musicianship and technical skills. Offered each semester for minors and as a secondary MUSA course for majors.,Other,lower,no,no,no,no,no,no
tsu,2026,2026-2027,MUSA,211K,Applied Music Piano,Performance in a secondary medium emphasizing the development of musicianship and technical skills. Offered each semester for minors and as a secondary MUSA course for majors.,Other,lower,no,no,no,no,no,no
tsu,2026,2026-2027,MUSA,211P,Applied Music Perc,Performance in a secondary medium emphasizing the development of musicianship and technical skills. Offered each semester for minors and as a secondary MUSA course for majors.,Other,lower,no,no,no,no,no,no
tsu,2026,2026-2027,MUSA,211S,Applied Music,"Applied Music (1)
Performance in a secondary medium emphasizing the development of musicianship and technical
skills. Offered each semester for minors and as a secondary MUSA course for majors. One-half hour of laboratory per week. Prerequisite: MUSA 112 .",Other,lower,no,no,no,no,no,no
