university,academic_year,academic_year_label,department_code,course_number,title,description,broad_area,level,progressive_signal,western_canon_signal,climate_narrow_signal,climate_broad_signal,cross_listed,deduplicated
tsu,2026,2026-2027,ES,443,Remote Sensing and Image Interpretation,"Application of remote sensing for environmental monitoring.
Introduction to remote sensing and image processing is designed to introduce and explore the basic applications of remotely sensed data in the evaluation of environmental problems.  The course includes the theories and principles of remote sensing, types of sensors, identification and mapping the materials.",Other,lower,no,no,no,no,no,no
tsu,2026,2026-2027,ES,445,Geospatial Modeling,"Geospatial Modeling for environmental, ecological issues.
The geospatial analytical and simulation models helps to identify and better understand the knowledge and data gaps in the fields of environmental and ecological sciences, to develop better monitoring and management strategies and to make simulation and predictions of the patterns and processes into the future.",Professional,lower,no,no,no,yes,no,no
tsu,2026,2026-2027,FCS,334,Career Opprtunities,"Career Opportunities in Family and Consumer Sciences (3)
Survey of current professional opportunities and preparation for the job search process. Overview of the transition from a student to professional role. Three hours of lecture per week.",Other,lower,no,no,no,no,no,no
tsu,2026,2026-2027,FCS,411,Ind. Study in Fam & Cons. Sci.,"Independent Study in Family and Consumer Sciences (1)
Independent study in an area of specialization.",Other,lower,no,no,no,no,no,no
tsu,2026,2026-2027,FCS,420,Ind Study in Fam & Cons Sci.,"Independent Study in Family and Consumer Sciences (2)
Independent study in an area of specialization.",Other,lower,no,no,no,no,no,no
tsu,2026,2026-2027,FCS,430,Special Topics,"Intensive study of professional interest in family & consumer sciences. With class designation, this course may be used up to four (4) times for a total of twelve (12) hours.",Other,lower,no,no,no,no,no,no
tsu,2026,2026-2027,FCS,431,Aging & Health Needs*,"Aging and Health Needs (3)
Analysis of specifi c programs and services impacting the needs of an aging population, including
health care, health care management, consumer issues, public policies, and familial relations.",Professional,lower,no,no,no,no,no,no
tsu,2026,2026-2027,FCS,432,Program Planning and Methodology,"Program Planning and Methodology in Human Services and Consumer Sciences (3)
Methods and procedures for planning, developing, and implementing programs in Human Services &
Consumer Sciences. Three hours of lecture per week.",Other,lower,no,no,no,no,no,no
tsu,2026,2026-2027,FCS,434,Occu Prog & Public Policy,"Occupational Programs Public Policy (3)
Planning and implementing programs in occupational family sciences. Study and evaluation of
selected legislation and public policy related to family science and its impact of families. Three hours
of lecture per week.",Social Sciences,lower,no,no,no,no,no,no
tsu,2026,2026-2027,FCS,435,Communication: Fam & Marriage*,"Communication: Family and Marriage (3)
Personal and professional growth and development through more effective communication within the
family milieu and the marital unit. Three hours of lecture per week.",Social Sciences,lower,no,no,no,no,no,no
tsu,2026,2026-2027,FCS,436,Consumer Resource Mgt,"Study of attitudes, concepts, skills, and understanding of consumers which contribute to their satisfaction in the choice of goods and services.",Other,lower,no,no,no,no,no,no
tsu,2026,2026-2027,FCS,438,Fam & Conumer Economics,Study of consumer management principles and income distribution patterns relative to time and money use decision by the family.,Social Sciences,lower,no,no,no,no,no,no
tsu,2026,2026-2027,FCS,439,Family & Com Services,"Utilization of family and consumer sciences perspectives in family service agencies within government, public, and private sectors.",Other,lower,no,no,no,no,no,no
tsu,2026,2026-2027,FCS,439L,Family & Comm Serv Lab,Practicum to accompany FCS 439 .,Other,lower,no,no,no,no,no,no
tsu,2026,2026-2027,FIN,300,Personal Financial Planning,"Various aspects of personal and family finances including financial goal setting, budgeting, use of credit, investments, insurance, estate planning, retirement planning, taxation and housing.",Professional,lower,no,no,no,no,no,no
tsu,2026,2026-2027,FIN,302,Management & Financial Insts,"Asset and liability management in the context of risk, liquidity, and profitability in the Financial Services Industry.",Professional,lower,no,no,no,no,no,no
tsu,2026,2026-2027,FIN,303,Treasury Management,Issues and current developments in cash and treasury management as a part of the CTM (Corporate Treasury Management) Program. The successful completion of this course with a grade of ?B? or higher will satisfy the eligibility criteria for  students to  sit for the CTP (Certified Treasury Professional) exam offered by the Association for Finance Professionals (AFP).,Professional,lower,no,no,no,no,no,no
tsu,2026,2026-2027,FIN,304,Finance Boot Camp,This course is designed for students to develop an understanding of investment banking and the role played by financial analysts in the valuation of corporations.,Professional,lower,no,no,no,no,no,no
tsu,2026,2026-2027,FIN,319,Commercial Bank Management,"An understanding of commercial banking with a focus on managerial decision-making, the risks banks face, and how risk management affect profitability.",Professional,lower,no,no,no,no,no,no
tsu,2026,2026-2027,FIN,320,Selling of Financial Services,A study of the process and principles involved in selling financial instruments and services with emphasis in the banking industry.,Other,lower,no,no,no,no,no,no
tsu,2026,2026-2027,FIN,338,International Finance,"Introduction to the international financial environment and international financial tools and techniques, including the foreign exchange markets, exchange rates, financing international operations, and foreign investments.",Professional,lower,no,no,no,no,no,no
tsu,2026,2026-2027,FIN,411,Advanced Topics in Investments,"Methods of investment analysis and selection; analysis of options, futures, and convertible securities; term structure of interest rate with portfolio theory and management.",Professional,lower,no,no,no,no,no,no
tsu,2026,2026-2027,FIN,413,Risk Mgmt Ins,Fundamentals of risk management and insurance including the nature of potential loss exposures and alternative methods of managing them.,Professional,lower,no,no,no,no,no,no
tsu,2026,2026-2027,FIN,415,Sm Bus Entr Fin,"Application of the theories and concepts of financial issues within the framework of small business and entrepreneurship. Topics include financial analysis and forecasting, valuations, investment and growth strategies.",Professional,lower,no,no,no,no,no,no
tsu,2026,2026-2027,FIN,417,Global Energy Markets,"This course provides a review ofo natural gas, oil and pet roleum products, coal, liquefied natural gas and electricity including energy forecasting and supply and cost curves.",Other,lower,no,no,no,no,no,no
tsu,2026,2026-2027,FIN,418,Derivatives For Energy Markets,"The course provides comprehensive coverage of a wide range of financial derivative products, including natural gas, foreign exhange and interest rate markets.",Other,lower,no,no,no,no,no,no
tsu,2026,2026-2027,FIN,419,Commercial Credit Analysis,"Introduction to commercial lending activities of banks with a focus on analysis, structuring, pricing, documentation and monitoring of loans.",Other,lower,no,no,no,no,no,no
tsu,2026,2026-2027,FN,111,Intro To Dietetics,"Introduction to Dietetics	(1) 
Introduction to Dietetics and the American Dietetic Association (ADA), including its purpose, membership requirements, professional ethics, and by-laws, and career opportunities in dietetics, food service industries, and health care facilities. One hour of lecture per week.",Professional,lower,no,no,no,no,no,no
tsu,2026,2026-2027,FN,233,Elementary Nutrition,"Elementary Nutrition	(3)
Fundamental concepts of nutrition: terminology, physical and chemical properties of nutrients, food sources and functions. The body's utilization of food, nutrients, and calories (absorption, transport, and metabolism) included. Three hours of lecture per week.",Medical Sciences,lower,no,no,no,no,no,no
tsu,2026,2026-2027,FN,253,Meal Management,"Meal Management	(3) 
Application of nutritional knowledge to:   basic menu planning; food purchasing and storage; basic techniques of food preparation and service; evaluation of family meals at various income levels; and experiences in meal service for various occasions. One hour of lecture and four hours of laboratory per week.",Medical Sciences,lower,no,no,no,no,no,no
tsu,2026,2026-2027,FN,333,Diet Therapy For Helth Profs,"Introduction to scientific principles and practices in the dietary care of  patients during various stages of the life cycle. Emphasis on: team approach, nutrition assessment, documenting and charting, diet modification, and counseling.",Medical Sciences,lower,no,no,no,no,no,no
tsu,2026,2026-2027,FN,336,Independent Study in Dietetics,Independent study in area of specialization.,Other,lower,no,no,no,no,no,no
tsu,2026,2026-2027,FN,337,Human Nutrition,"Advanced study of fundamental nutrition concepts (nutrients, digestion, absorption, metabolism, and fluid): electrolytes, and acid-base balances as they relate to the chemistry and physiology of the human body throughout the life cycle.",STEM,lower,no,no,no,no,no,no
tsu,2026,2026-2027,FN,341,Mgmt Prins Food Serv Systems,"Management Principles of Food Service Systems	(4)
Study of: organization and management theories, functions, and applications; food service organization; safety and sanitation policies; equipment selection, layout, and design; consumer protection laws; regulations, laws, and standards affecting dietetic practice. Three hours of lecture and two hours of laboratory per week.",Professional,lower,no,no,no,no,no,no
tsu,2026,2026-2027,FN,343,Junior Seminar in Dietetics,"Comprehensive review of dietetics academic core and pre-professional requirements:  emphasis on nutrition, medical nutrition therapy and principles/theories and food service management concepts.",Medical Sciences,lower,no,no,no,no,no,no
tsu,2026,2026-2027,FN,413,Independent Study,Independent study in area of specialization.,Other,lower,no,no,no,no,no,no
tsu,2026,2026-2027,FN,414,Sem Foods & Nutrition,"Presentations on professional ethics, American Dietetic Association (ADA) standards, computer applications in problem solving, and interviewing techniques. Oral presentation required.",STEM,lower,no,no,no,no,no,no
tsu,2026,2026-2027,FN,427,Independent Study in Dietetics,Independent study in area of specialization.,Other,lower,no,no,no,no,no,no
tsu,2026,2026-2027,FN,428,Nutrition Counseling,"Learning theories, observations, and techniques used in applying educational methodology, strategies, and competencies related to effective communication and documentations in methods of teaching; interviewing and counseling individuals and groups.",Social Sciences,lower,no,no,no,no,no,no
tsu,2026,2026-2027,FN,432,Medical NutritionTherapy I,"Modifications of normal diets and the application of scientific principles of human nutrition in health and disease; latest developments in dietary treatment of disease; interviewing and counseling, diet instruction; charting. Emphasis on quality assurance, adequacy of modified diets, and nutritional care to patients with clinical problems.",Medical Sciences,lower,no,no,no,no,no,no
tsu,2026,2026-2027,FN,433,Medical Nutrition Therapy II,Continuation of FN 432 .,Medical Sciences,lower,no,no,no,no,no,no
tsu,2026,2026-2027,FN,434,Experimental Foods,"Physical and chemical properties of basic food materials and processes by which they are prepared for consumption; application of scientific methods of inquiry to designing, implementing, evaluating, and reporting research results. Research paper required.",Other,lower,no,no,no,no,no,no
tsu,2026,2026-2027,FN,436,Community Nutrition,"Fundamentals of nutritional care delivery systems in community health programs and services with special references to nutritional problems of indigent population groups. Practical approach to nutrition education, interviewing, counseling, and changing food habits.",Medical Sciences,lower,no,no,no,no,no,no
tsu,2026,2026-2027,FN,437,Capstone in Dietetics,Comprehensive study of the fi eld of Dietetics and Nutrition. Required Senior Exit Exam.,Medical Sciences,lower,no,no,no,no,no,no
tsu,2026,2026-2027,FN,438,Independent Study,Independent study in area of specialization.,Other,lower,no,no,no,no,no,no
tsu,2026,2026-2027,FN,441,Org & Mgmt Fd Serv Systems,"Application of organization and management principles and techniques of financial management in food service systems. Emphasis on budgets, operating costs, forecasting, computer applications, quality assurance, and procurement.",STEM,lower,no,no,no,no,no,no
tsu,2026,2026-2027,FN,442,Independent Study in Dietetics,Independent study in area of specialization.,Other,lower,no,no,no,no,no,no
tsu,2026,2026-2027,FN,461,Comm Food Production,"Application of principles of menu planning and large quantity food processing, production, and distribution according to established quality standards for individuals and groups in health and disease.",Other,lower,no,no,no,no,no,no
tsu,2026,2026-2027,FN,461L,Comm Food Production Lab,Laboratory experiences in quantity food production and merchandising.,Other,lower,no,no,no,no,no,no
tsu,2026,2026-2027,FORS,226,Intro to Forensic Science,"This course provides the beginning student with an overview of the forensic sciences, including exposure to the rules of evidence, evidence collection and handling, expert witness testimony and an introduction to the various sub-disciplines that fall under the umbrella of the forensic sciences. The course is open to undergraduates as an elective.",Other,lower,no,no,no,no,no,no
tsu,2026,2026-2027,FORS,236,Forensic Evidence & Collection,This course serves as a comprehensive review of all aspects of evidence collection and preservation.,Other,lower,no,no,no,no,no,no
tsu,2026,2026-2027,FORS,326,Forensic Analysis & Lab,This course is an introduction to classical and modern forensic science laboratory techniques.,Other,lower,no,no,no,no,no,no
tsu,2026,2026-2027,FORS,416,Forensic Science Seminar,"This course will focus on criminal and civil cases as well as forensic science literature research. Students will conduct forensic science research, including case reviews, searches for forensic literature, and analysis of trial testimony.",Humanities,lower,no,no,no,no,no,no
tsu,2026,2026-2027,FORS,616,Special Topic in Forensic Sc.,"This is a new course, with 3 hrs. lecture. This course is an examination of current issues in forensic sciences as they relate to the administration of justice. Special topic course offerings vary from semester.   3 hours per week.",Other,lower,no,no,no,no,no,no
tsu,2026,2026-2027,FORS,626,Forensic Science Management and Policies,"This course provides a thorough examination into Forensic Science Policies and Management. It also offers a
critical insight into the implementation of sustainable policies that will be beneficial in crisis management.",Professional,lower,no,no,no,yes,no,no
tsu,2026,2026-2027,FORS,636,Quality Control Assurance: Standardization and Best Practices,"This course presents an overview into the overall quality and accreditation requirements required in forensic
science disciplines such forensic science laboratories, products, and forensic science personnel and law
enforcements practitioners.",Professional,lower,no,no,no,no,no,no
tsu,2026,2026-2027,FORS,646,Root Cause Analysis Fiscal Resource Management,This course will provide students with the applicable skills and knowledge to effectively analyze root cause analysis and implement appropriate actions during a crisis management.,Professional,lower,no,no,no,no,no,no
tsu,2026,2026-2027,FORS,656,International Standards Organization(ISO) Accreditation,This course provides the familiarization of related International Standards Organization (ISO) accreditation requirements designed to ensure reliable processes and methods in the forensic science disciplines.,Other,lower,no,no,no,no,no,no
tsu,2026,2026-2027,FORS,676,Forensic Science Statistics,"This course provides an introduction to statistical analysis techniques that are commonly employed in
forensic science data analysis. This course will provide students with best practices for the collection and han",STEM,lower,no,no,no,no,no,no
tsu,2026,2026-2027,FR,131,Elementary French I,Fundamentals of French pronunciation and grammar with drills in spoken and written French. Listed as FREN 1311 in the Texas Common Course Numbering System.,Humanities,lower,no,no,no,no,no,no
tsu,2026,2026-2027,FR,132,Elementary French II,Continuation of FR 131 . Listed as FREN 1312 in the Texas Common Course Numbering System.,Humanities,lower,no,no,no,no,no,no
tsu,2026,2026-2027,FR,331,Review Grammar & Composition,Review of French grammar with emphasis on the more difficult structures and idioms. Concurrent practice in conversation and diction provided. Conducted in both English and French.,Humanities,lower,no,no,no,no,no,no
tsu,2026,2026-2027,FR,336,African Franchophone Literature,Survey of the Literary movements and writers in Francophone Literature Africa from the French Colonization to the Independence. 3 credit hours.,Humanities,lower,no,no,no,no,no,no
tsu,2026,2026-2027,FR,347,Contemporary France I,"Study of French institutions and movements since the beginning of the twentieth century, including transportation, politics, education, geography, industrialization, social classes, world wars, and fine arts. Conducted in both English and French.",Social Sciences,lower,no,no,no,no,no,no
tsu,2026,2026-2027,FR,348,Contemporary Francophone Film,College/School: Liberal Arts & Behavioral Scie,Other,lower,no,no,no,no,no,no
tsu,2026,2026-2027,FR,438,Directed Study,"Study of a single topic, particular work, or author under the direction of a faculty member. Prior approval for enrollment needed from the Faculty Chair. May be retaken for credit.",Other,lower,no,no,no,no,no,no
tsu,2026,2026-2027,FR,439,French Influence in Africa,Study of the importance of the French presence in French-speaking African countries utilizing critical and analytical approaches that will allow students to acquire an understanding of the language and culture of contemporary French Africa.,Humanities,lower,no,no,no,no,no,no
tsu,2026,2026-2027,FREN,2311,Intermediate French I,Intermediate French I (3) Review of French pronunciation and grammar using a reader and more advanced classroom and laboratory materials. Two hours of lecture and one hour of laboratory per week.,Humanities,lower,no,no,no,no,no,no
tsu,2026,2026-2027,FREN,2312,Intermediate French II,Intermediate French II (3) Continuation of FR 231. Two hours of lecture and one hour of laboratory per week,Humanities,lower,no,no,no,no,no,no
tsu,2026,2026-2027,FS,102,Freshman Seminar/ first Year Experience,"COURSE DESCRIPTION: 
This course serves as Texas Southern University’s first-year experience student success course.  It is designed to provide first year students with an opportunity to attain maximum success at the University and in life.  It will assist students in realizing their full potential by facilitation activities that promote effective learning and personal and professional growth.  This course aims to achieve this goal by helping new students connect with TSU resources and by promoting a positive and successful University experience that leads to completion. 

COURSE GOALS:
•	Connection to TSU history and resources
•	Ensure readiness
•	Enhance overall performance in University courses
•	Facilitate successful completion of a degree or certificate
•	Facilitate activities that promote effective learning and personal and professional growth",Humanities,lower,no,no,no,no,no,no
tsu,2026,2026-2027,GEOG,330,Intro To Cartography,"Introduction to Cartography	(3)
Introduction to the fundamentals of cartography, including basic computer mapping techniques. Three hours of lecture per week.",STEM,lower,no,no,no,no,no,no
tsu,2026,2026-2027,GEOG,331,Geography Of Texas,"Geography of Texas	(3)
Designed to acquaint students with the principal geographic factors influencing the development of the state of Texas. Three hours of lecture per week.",Social Sciences,lower,no,no,no,no,no,no
tsu,2026,2026-2027,GEOG,332,Economic Geography,"Economic Geography	(3)
Consideration of oceans, rivers, and highways as carriers of trade and of factors of location, minerals, and population as determinants in the commercial development of our civilization. Three hours of lecture per week.",Social Sciences,lower,no,no,no,no,no,no
tsu,2026,2026-2027,GEOG,334,Urban Geography,"Urban Geography (3)
This course examines city systems and theories of urban location, internal spatial structure of the city, commercial and industrial location, social areas, neighborhood use and land use change, urban trends, and public policy. Three hours of lecture per week",Social Sciences,lower,no,no,no,no,no,no
tsu,2026,2026-2027,GEOG,338,Geographic Information Systems,Survey of computerized spatial data handling systems for visual display or analytic modeling purposes.,STEM,lower,no,no,no,no,no,no
tsu,2026,2026-2027,GEOG,430,People & Culture of Africa,"Integrated overview of the African cultural history, social organizations, economic and political geography.",Social Sciences,lower,no,no,no,no,no,no
tsu,2026,2026-2027,GEOG,432,Geog Of Transportation,"Geography and Transportation	(3)
Consideration of the nature of spatial interactions, the various kinds of transport media, and the relationship between transportation and economic and social patterns. Three hours of lecture per week.",Social Sciences,lower,no,no,no,no,no,no
tsu,2026,2026-2027,GEOG,1303,World Regional Geography,"World Regional Geography	(3)
Survey of the regions and nations of the planet and the geographical foundations of their physical and cultural characteristics. Three hours of lecture per week. Listed as GEO 1303 in the Texas Common Course Numbering System.",Social Sciences,lower,no,no,no,no,no,no
tsu,2026,2026-2027,GEOL,1103,Intro To The Earth Lab,"College/School: Col of Science, Engr & Tech",Other,lower,no,no,no,no,no,no
tsu,2026,2026-2027,GEOL,1303,Introduction To The Earth,"Introduction to the Earth	(3)
Introduction to the study of the earth: the evolution of its landscapes, its weather, its climate, and its place in the universe. Three hours of lecture and one hour of laboratory per week. Listed as GEOL 1403 in the Texas Common Course Numbering System.",Other,lower,no,no,no,yes,no,no
tsu,2026,2026-2027,HED,223,Basic C P R,"Basic CPR	(2)
Basic concepts in cardiopulmonary resuscitation; certification in basic cardiac life support. One hour of lecture and two hours of laboratory per week.",Other,lower,no,no,no,no,no,no
tsu,2026,2026-2027,HED,224,Swimming II,"This course on swimming encourages cardiovascular fitness through the fours competitive strokes:  freestyly, backstroke, breaststroke and butterfly.  This course is an introductory course that requires students to effectively learn the four competitive strokes at a mastery level of 80 percent.  Emphasis is placed on swimming techniques.",Other,lower,no,no,no,no,no,no
tsu,2026,2026-2027,HED,227,Gymnastics,"This course is designed to introduce, develop, and examine the gymnastic skills, aerobics activities, movements and exercises that can improve physical fitness and aerobic capacity as well as rhytmic/dance activities and skills.  Emphasis is placed on guilding students to deveop and design their own gymnastics routine with gymnastics skills that they can utilize in everyday life as a fitness routine and as a lifelong activity.  2 credit hours.",Other,lower,no,no,no,no,no,no
tsu,2026,2026-2027,HED,230,Introduction to Health,"Discussion of the components of health and how health status is maintained throughout the lifespan, including the role of health care professionals.",Other,lower,no,no,no,no,no,no
tsu,2026,2026-2027,HED,231,Introduction to Behavioral Health Theory,Review of variables involved in creating behavior change.,Other,lower,no,no,no,no,no,no
tsu,2026,2026-2027,HED,233,History & Principles of Health,"History and Principles of Health	(2)
Discussion of the historical and philosophical development of health. Consideration given to those illnesses and health hazards of major significance and concern in contemporary society. Two hours of lecture per week.",Humanities,lower,no,no,no,no,no,no
tsu,2026,2026-2027,HED,234,Hlth & Biolfuncs,"History and Biological Function	(3)
Organizational components of the human body; types of diseases; biological defense mechanisms; healing processes; and human biological growth and development. Three hours of lecture per week.",Humanities,lower,no,no,no,no,no,no
tsu,2026,2026-2027,HED,235,Health and the Human Body,Structure and function of human body systems and the impact of disease on each system.,Other,lower,no,no,no,no,no,no
tsu,2026,2026-2027,HED,236,Socioeconomic and Culture Influences on Health,"Examination of the relationship between socioeconomic status and culture on health including outcomes, utilization, and delivery.",Other,lower,no,no,no,no,no,no
tsu,2026,2026-2027,HED,329,Health Promotion Theory and Practice,"Overview of health behavior theories and their application to health education, disease prevention, and health promotion.",Professional,lower,no,no,no,no,no,no
