university,academic_year,academic_year_label,department_code,course_number,title,description,broad_area,level,progressive_signal,western_canon_signal,climate_narrow_signal,climate_broad_signal,cross_listed,deduplicated
tsu,2026,2026-2027,CLSC,307,Comprehensive Clinical Lab II,College/School: College Of Pharmacy/Hlth Sci.,Medical Sciences,lower,no,no,no,no,no,no
tsu,2026,2026-2027,CLSC,357,Pract I,Performance of serological and urinalysis techniques and methods in an affiliated clinical facility. Includes quality assurance practices and procedures and equipment maintenance.,Other,lower,no,no,no,no,no,no
tsu,2026,2026-2027,CLSC,358,Clinical Immunology,Clinical rotation in an affiliated clinical facility with emphasis on technical skills and applications.,Other,lower,no,no,no,no,no,no
tsu,2026,2026-2027,CLSC,457,Clinical Pract Preceptorship,Clinical Preceptorship and designated Laboratory Site. 3 hours per week.,Other,lower,no,no,no,no,no,no
tsu,2026,2026-2027,CLSC,458,Clinical Immunology Preceptorship,Clinical Preceptorship at designated Clinical Immunology Laboratory Site.,Other,lower,no,no,no,no,no,no
tsu,2026,2026-2027,CLSC,466,Clin Hema,Clinical practicum in an affiliated clinical facility with emphasis on practical/technical skills and applications.,Other,lower,no,no,no,no,no,no
tsu,2026,2026-2027,CLSC,467,Blood Bank,"Clinical practicum focusing on the performance of antibody assessments, compatibility phlebotomy, component preparation, donor processing of donated blood, and quality assurance.",Other,lower,no,no,no,no,no,no
tsu,2026,2026-2027,CLSC,468,Clinical Micro Preceptorship,Clinical rotation at an affiliated clinical site to emphasize practical/technical skills and applications.,Other,lower,no,no,no,no,no,no
tsu,2026,2026-2027,CLSC,469,Clinical Biochemistry Precept.,Clinical rotation at an affiliated clinical site to emphasize practical/technical skills and applications.,STEM,lower,no,no,no,no,no,no
tsu,2026,2026-2027,CLSC,3105,CLS Practice Management,"An introduction to clinical laboratory science which provides a comprehensive understanding of a clinical lab with an inclusive overview of overview of the profession, laboratory safety, compliance, regulatory agencies, and instrumentation.  Didactic instruction and case studies will be integrated.  One hour of lecture per week.",Professional,upper,yes,no,no,no,no,no
tsu,2026,2026-2027,CLSC,3204,Basic Laboratory Techniques,"An introduction to basic laboratory techniques in clinical laboratory science (safety, pipetting, dilutions, spectrophotometry, lab math, QC/QA, microscopy, phlebotomy),  The course integrates didactic instruction and lab procedures to provide an understanding of basic lab techniques. Lecture 1 hour, lab 1 hour per week.",Other,upper,no,no,no,no,no,no
tsu,2026,2026-2027,CLSC,3256,Hemostasis,"Hemostasis (primary and secondary hemostasis, and fibrinolysis) is introduced.  Platelet function and disorders, coagulation and thrombotic disorders and their therapies are studied.  Didactic instruction is integrated with labs.  Eighty minutes of lecture and three hours of lab weekly.",Other,upper,no,no,no,no,no,no
tsu,2026,2026-2027,CLSC,3269,Clinical Microbiology II,"A study of the taxonomy, morphology, pathogenesis, and identification of human pathogenic parasites, fungi, and viruses, including the practical application of laboratory procedures, quality control, quality assurance, and safety.  One hour of lecture and two hours of laboratory weekly.",STEM,upper,no,no,no,no,no,no
tsu,2026,2026-2027,CLSC,3351,Diagnostic Immunology,"This course will provide students with a fundamental understanding of immunology including evaluating disorders of the Immune system, Infectious diseases, autoimmune diseases and hypersensitive states.  Didactic and laboratory will be integrated.  Two hours of lecture and 3 hours of lab weekly.",Other,upper,no,no,no,no,no,no
tsu,2026,2026-2027,CLSC,3353,Urinalysis and Body Fluids,"This course integrates theory of urinalysis, (including renal physiology) and body fluids, with laboratory procedures to provide the student with basic knowledge and technical skills necessary for performing urinalysis and Body Fluids testing.  Two hours of lecture and three hours of laboratory weekly.",Other,upper,no,no,no,no,no,no
tsu,2026,2026-2027,CLSC,3355,Clinical Chemistry I,"Basic clinical chemistry practices and lab procedures for carbohydrates, electrolytes and acid/base physiology, renal, and hepatic function and QC in normal and diseased states will be introduced.  Didactic instruction, case studies, and labs will be integrated.  Two hours of lecture and 3 hours of lab weekly.",STEM,upper,no,no,no,no,no,no
tsu,2026,2026-2027,CLSC,3359,Clinical Microbiology I,"Student will demonstrate knowledge of medically relevant microorganisms (gram stain, colony characteristics, basic biochemical reactions), and develop an understanding of the pathogenesis and pathology of infectious diseases in humans.  Three hours of lecture and three hours of lab per week.",STEM,upper,no,no,no,no,no,no
tsu,2026,2026-2027,CLSC,3362,Hematology II,"An advanced course in hematology focusing on Leukocyte Disorders.  Processes required to perform, interpret, classify, and evaluate cellular abnormalities specific to leukocytes will be taught.  Lab will be integrated with lectures.  There will be 2.7 lecture hours and 3 lab hours per week.",Other,upper,no,no,no,no,no,no
tsu,2026,2026-2027,CLSC,3364,Blood Bank II,"Advanced concepts in transfusion practice: indications for transfusions, component therapy, transfusion reactions, donor recruitment, processing blood components, transfusion therapy, HDFN, and AIHA, Federal and state regulations are examined.  Two lecture hours and 3 lab hours per week.",Other,upper,no,no,no,no,no,no
tsu,2026,2026-2027,CLSC,3365,Clinical Chemistry II,"Emphasis is on theory, practices and procedures for amino acids, proteins, enzymes, hormones, therapeutic drugs and toxicology testing.  Didactic and lab Instruction is correlated for these subjects with health and disease, states.  Two hours of lecture and three hours of laboratory activities weekly.",STEM,upper,no,no,no,no,no,no
tsu,2026,2026-2027,CLSC,3452,Hematology I,"The theory of development of cellular elements of the blood including principles to detect disease and recognize normal processes affecting the hematopoletic system.  Content will focus on red cell disorders: pathophysiology, diagnosis, and laboratory testing.  Three hours of lecture and 3 hours of lab weekly.",Other,upper,no,no,no,no,no,no
tsu,2026,2026-2027,CLSC,3454,Blood Bank I,"This course provides students with a fundamental understanding of Immunohematology; blood group systems, and pre- and post-transfusion testing methods.  Didactic Instruction will be Integrated with laboratory procedures, QC, and case studies.  Three hours of lecture and three hours of lab weekly.",Other,upper,no,no,no,no,no,no
tsu,2026,2026-2027,CLSC,4111,CLS Research and Education,"This course is designed to introduce students to the basic theories, principle, and concepts of Research and Education.  One hour of lecture per week.",Professional,upper,no,no,no,no,no,no
tsu,2026,2026-2027,CLSC,4206,CLS Management and Ethics,"Introduction to the basic theories and practices of management in the clinical laboratory: management principles, financial, operations, and human resources, and ethics.  Two hours of lecture weekly.",Professional,upper,no,no,no,no,no,no
tsu,2026,2026-2027,CLSC,4210,Clinical Molecular Biology,"This course will introduce the student to the theory, laboratory techniques, and quality control and quality assurance in molecular diagnostic testing.  Didactic and laboratory procedures will be integrated.  The course will be 80 minutes of lecture and 3 hours of lab per week.",STEM,upper,no,no,no,no,no,no
tsu,2026,2026-2027,CLSC,4307,Capstone Review,"This course will provide a reinforcement of theoretical core knowledge in Clinical Laboratory Science to facilitate successful completion of the ASCP board examination.  The student will research and present assigned topics in Clinical Laboratory Science, develop assessments for presentations, and practice online review exams.  Three hours of lecture weekly.",Other,upper,no,no,no,no,no,no
tsu,2026,2026-2027,CLSC,4458,Clinical Practicum I,"Clinical Practicum I applies the knowledge, skills, and professional attitudes of the CLS student in the assigned area of the clinical laboratory.  This course utilizes and depends upon external institutions to ensure adequate clinical education and training.  Student will be observing and performing clinical tests.  32 hr/week",Professional,upper,no,no,no,no,no,no
tsu,2026,2026-2027,CLSC,4459,Clinical Practicum II,"Clinical Practicum II applies the knowledge, skills, and professional attitudes of the CLS student in the assigned area of the clinical laboratory.  This course utilizes and depends upon external institutions to ensure adequate clinical education and training.  Student will be observing and performing tests.  32 hr/week",Professional,upper,no,no,no,no,no,no
tsu,2026,2026-2027,CLSC,4460,Clinical Practicum III,"Clinical Practicum III applies the knowledge, skills, and professional attitudes of the CLS student in the assigned area of the clinical laboratory.  This course utilizes and depends upon external institutions to ensure adequate clinical education and training.  Student will be observing and performing tests.  32 hr/week",Professional,upper,no,no,no,no,no,no
tsu,2026,2026-2027,CLSC,4461,Clinical Practicum IV,"Clinical Practicum IV applies the knowledge, skills, and professional attitudes of CLS student in the assigned area of the clinical laboratory.  This course utilizes and depends upon external institutions to ensure adequate clinical education and training.  Students will be observing and performing tests. 32 hr/week",Professional,upper,no,no,no,no,no,no
tsu,2026,2026-2027,COMM,110,Speech Proficiency Lab,"This course is intended to guide students, through the use of practical applications, to become effective speakers by understanding the speech mechanism and precise, profound, and proficient oral communication expected from majors in journalism, speech and RTF. Two hours of lab per week.",Social Sciences,lower,no,no,no,no,no,no
tsu,2026,2026-2027,COMM,130,Introduction to Communication Studies,"Basic concepts, theories and principles operative in the communication process; application of these principles to the acquisition of communication skills. Three hours of lecture per week.",Social Sciences,lower,no,no,no,no,no,no
tsu,2026,2026-2027,COMM,140,VOICE & DICTION,"Development of an effective speaking voice through the achievement of proper relaxation, breathing, and vocal resonance. Three hours of lecture per week. Listed as SPEC 1342 in the Texas Common Course Numbering System.",Other,lower,no,no,no,no,no,no
tsu,2026,2026-2027,COMM,200,Intro to Media Research Tech,"Basic skills development in research techniques and in-depth experience in written composition, emphasizing composition as a communication skill; analysis of student proficiency in the basic communication skills as they relate to professions in communication. Three hours of lecture per week.",Social Sciences,lower,no,no,no,no,no,no
tsu,2026,2026-2027,COMM,220,Media Literacy,"In this course, students develop analytical understanding of creative artifacts in media, including film, television, video games, social media, and so forth. The course presents clips, screenings, and other examples from a variety of cultures to provide a basis for critical, creative, and innovative written, oral, and visual communication about works of art. 3 hours per week",Social Sciences,lower,no,no,no,no,no,no
tsu,2026,2026-2027,COMM,221,Intercultural Communication,"Intercultural Communication focuses on the importance of culture in our everyday lives and the way in which culture informs and influences the communication process. This is a combination theory and application course, and it is designed to help you understand how to communicate.",Social Sciences,lower,no,no,no,no,no,no
tsu,2026,2026-2027,COMM,230,STUDIES URBAN RHETORICAL,Study of linguistic and rhetorical patterns of major ethnic and socioeconomic groups in urban areas. Three hours of lecture per week.,Other,lower,no,no,no,no,no,no
tsu,2026,2026-2027,COMM,232,INTERPERSONAL COMMUNICATION,Study of the interpersonal communication as a dynamic process utilizing verbal and nonverbal cues as the basis of meaningful human interaction. Three hours of lecture per week. Listed as SPCH 1318 in the Texas Common Course Numbering System.,Social Sciences,lower,no,no,no,no,no,no
tsu,2026,2026-2027,COMM,233,COMMUNICATION SKILL HEALTH PROFESSIONAL,Practice in the development of interpersonal skills in relating to the health professional; practice in the development of the skills of group and public communication. Three hours of lecture per week.,Social Sciences,lower,no,no,no,no,no,no
tsu,2026,2026-2027,COMM,236,ARGUMENTATION & DEBATE,"Exploration of principles of argumentation, training, and participation in various types of argumentative speeches and debate. Special inclusion of parliamentary procedures. Three hours of lecture per week. Listed as SPCH 2325 in the Texas Common Course Numbering System.",Other,lower,yes,no,no,no,no,no
tsu,2026,2026-2027,COMM,250,"Comm, Globalization & Int'l Me",This course will allow students to access all forms of international media and professional development. 3 hours per week,Other,lower,no,no,no,no,no,no
tsu,2026,2026-2027,COMM,251,Soc Media Campaigns Analytics,College/School: School of Communication,Social Sciences,lower,no,no,no,no,no,no
tsu,2026,2026-2027,COMM,330,PROFFESS DEVELOPMENT & ETHIC,"A preparatory course for entering into the job market. Covers a variety of topics including oral communication skills dress code, interview techniques, advanced resume writing, motivational skills, stress management, professional survival and cultural awareness skills. Three hours of lecture per week.",Social Sciences,lower,no,no,no,no,no,no
tsu,2026,2026-2027,COMM,331,Persuasion,Intensive examination of principles and techniques of persuasion and of the critical role of the consumer of persuasive messages. Three hours of lecture per week.,Other,lower,no,no,no,no,no,no
tsu,2026,2026-2027,COMM,332,Computer Applications in Communication,"Introduction to graphics, multimedia and web design techniques applicable to communication field. Three hours of lecture and lab per week.",Social Sciences,lower,no,no,no,no,no,no
tsu,2026,2026-2027,COMM,333,INTERVIEWING,Strategies and techniques of interviewing as purposive dyadic interaction for interviewer and interviewee. Includes the study of and practice with various types of interviews. Three hours of lecture per week.,Other,lower,no,no,no,no,no,no
tsu,2026,2026-2027,COMM,334,Group Comm,Role of communication theory in the making of individual and collective decisions; application of communication theory to principles of leadership in small group decision making. Three hours of lecture per week.,Social Sciences,lower,no,no,no,no,no,no
tsu,2026,2026-2027,COMM,335,RHETORICAL CRITICISM,This course involves the study of theory or rhetorical criticism with the emphasis on the analysis of standards and methods of evaluation. Offered as needed.,Other,lower,no,no,no,no,no,no
tsu,2026,2026-2027,COMM,336,Comm Research Design,"Students will learn and apply advanced methods and theories of communication discipline, producing a major research paper, literature review or performative writing project.  This course will cover advanced elements of source citation, style, research writing formats and content.  3 hours per week.",Social Sciences,lower,no,no,no,no,no,no
tsu,2026,2026-2027,COMM,337,Media Criticism,"Media criticism focuses on theory and method as related to the nature and forms of media, their effects on audiences and society, and literacy appropriate to their understanding and use.  Meet 3 hours per week.",Other,lower,no,no,no,no,no,no
tsu,2026,2026-2027,COMM,338,INTRODUCTION TO ORGANIZATIONAL COMMUNICATION,-asic principles and perspectives of organizational communication; communication networks and structures; decision making; conflict resolution with organizations; impact of styles of communication on organizational relations. Three hours of lecture per week.,Social Sciences,lower,no,no,no,no,no,no
tsu,2026,2026-2027,COMM,339,Perf. Theory & Methods,College/School: School of Communication,Social Sciences,lower,no,no,no,no,no,no
tsu,2026,2026-2027,COMM,340,"Media, Power & Society",College/School: School of Communication,Social Sciences,lower,no,no,no,no,no,no
tsu,2026,2026-2027,COMM,342,History of African American Film and Television,"This course focuses on the evolution of the popular images of African Americans as reflected in the visual media of television and film. This course surveys the history, theories, debates, and controversies that have characterized African American in television and film, with an emphasis on the relationship between African American film and American culture and politics more broadly. Student examine the discourse of Black identity, specifically representation, in film and film directed by African Americans.",Humanities,lower,no,no,no,no,no,no
tsu,2026,2026-2027,COMM,420,Theories of Pop Cultural Comm,"Intensive study of the theories and methods used to study popular culture as a communicative form. Areas covered include American media, literature, art and other markers of culture.  Meet 3 hours per week.",Humanities,lower,no,no,no,no,no,no
tsu,2026,2026-2027,COMM,421,Rhetoric of Social Movements,"In this course students evaluate the philosophical, social and cultural foundations of rhetorical theory and practices found in different social movements by focusing on the ways in which social groups and persuasive efforts shape public opinion. This course emphasizes the way in which language, symbols, writing and activities are used as a device of oppression and liberation.  Meet 3 hours per week",Other,lower,yes,no,no,no,no,no
tsu,2026,2026-2027,COMM,423,"Sexuality, Gender and Perform","This course centers on contemporary communication theory and research on interconnections between sexuality, gender and performative culture.  Meet 3 hours per week.",Social Sciences,lower,no,no,no,no,no,no
tsu,2026,2026-2027,COMM,430,Experiential Learning,The integration of process and content acquisition through application and practice in real-life situations; structured part-time or full-time internships. Three hours of lecture per week.,Other,lower,no,no,no,no,no,no
tsu,2026,2026-2027,COMM,431,NONVERBAL COMMUNICATION,The analysis of nonverbal aspects of human communication with special consideration of physical and spatial styles and cues. Three hours of lecture per week.,Social Sciences,lower,no,no,no,no,no,no
tsu,2026,2026-2027,COMM,432,INTERCULTURAL COMMUNICATION THEORY & METHOD,Importance of cultural and ethnic differences as they affect our communication processes in various aspects of personal relations. Three hours of lecture per week.,Social Sciences,lower,no,no,no,no,no,no
tsu,2026,2026-2027,COMM,433,HEALTH COMMUNICTION,"Current issues in delivery of health care, practitioner/patient relationships, the role of private and government agencies in health care, dissemination of health care information. Three hours of lecture per week. Offered as needed.",Other,lower,no,no,no,no,no,no
tsu,2026,2026-2027,COMM,434,PRINCIPLES OF LEADERSHIP,"Study of the phenomenon of leadership, leadership styles, and leadership techniques, including parliamentary procedures and other strategies of control and influence. Three hours of lecture per week.",Other,lower,no,no,no,no,no,no
tsu,2026,2026-2027,COMM,438,ORGANIZATION STRUCTURE & COMMUNICATION BEHAVIOR,"Analysis of the interdependence of organizational goals and communication behavior from the standpoint of those who must recognize, understand, or design communication systems. Three hours of lecture per week.",Social Sciences,lower,no,no,no,no,no,no
tsu,2026,2026-2027,COMM,450,SPECIAL TOPIC COMMUNICATION STUDIES,Problems of current concern in speech communication; topics vary according to time and instructor. May be repeated as topics change. Three hours of lecture per week. Offered as needed.,Social Sciences,lower,no,no,no,no,no,no
tsu,2026,2026-2027,COMM,460,Sports Communications,"This course explores the field of Sport Communication and reviews the different models of Sport Communication, such as print and electronic media, sport advertising, public relations, media relations, and employment opportunities. Students will have the opportunity to critically assess the communication efforts of Sports Organization as well as construct their own communications in the field of sports. 3 hours per week",Social Sciences,lower,no,no,no,no,no,no
tsu,2026,2026-2027,COMM,490,Special Topic in Media Studies,Intensive study of selected topics in communication studies in the area of media studies. Areas covered will rotate by term and instructor. This course is repeatable with change in topic.  Meet 3 hours per week.,Social Sciences,lower,no,no,no,no,no,no
tsu,2026,2026-2027,COMM,491,Special Topic in Org Comm,Intensive study of selected in communication studies in the area of organizational communication. Areas covered will rotate by term and instructor. This course is repeatable with change in topic.,Social Sciences,lower,no,no,no,no,no,no
tsu,2026,2026-2027,COMM,492,Spec Topics in Rhetoric & Cult,Intensive study of selected topics in communication studies in the area of rhetoric and culture.  Areas covered will rotate by term and instructor.  This course is repeatable. 3 hours per week.,Social Sciences,lower,no,no,no,no,no,no
tsu,2026,2026-2027,COMM,493,Special Topic in Health Comm,College/School: School of Communication,Social Sciences,lower,no,no,no,no,no,no
tsu,2026,2026-2027,COMM,494,Special Topic in Performance,College/School: School of Communication,Social Sciences,lower,no,no,no,no,no,no
tsu,2026,2026-2027,COMM,495,Independent Study,"Independent study in interpersonal/intercultural communication, organizational communication, or rhetorical theory and criticism. Three hours of lecture per week.",Social Sciences,lower,no,no,no,no,no,no
tsu,2026,2026-2027,COMM,1315,Public Address,"Principles of effective speaking and their application to the preparation, delivery, and evaluation of the basic forms of public messages; stresses public issues, their relevancy and effect. Three hours of lecture per week.",Other,lower,no,no,no,no,no,no
tsu,2026,2026-2027,COMM,1321,Business & Professional Comm,"Introduction to the basic oral communication skills needed for careers in business and the professions. Students make presentations, conduct interviews, and participate in problem-solving group discussions. Three hours of lecture per week.",Social Sciences,lower,no,no,no,no,no,no
tsu,2026,2026-2027,CMET,331,Microcomputer Operating System,"Basic functions, structure, and mechanism of modern operating systems; device management, input/output processing, and job management.",STEM,lower,no,no,no,no,no,no
tsu,2026,2026-2027,CMET,412,Senior Project I,"A capstone team project that includes a written proposal, with functional specifi cations and timetable of a project for approval by faculty members.",Other,lower,no,no,no,no,no,no
tsu,2026,2026-2027,CMET,415,Advanced Microcomp Network Lab,"Experiments utilizing hardware and software in the design, operation, and analysis of computer networks. Topics include LANS, WANS, networking components and techniques, standards and protocols.",STEM,lower,no,no,no,no,no,no
tsu,2026,2026-2027,CMET,416,Appl of Microproc Software Lab,"Applications of Microprocessor Software Laboratory (1)
Practice in writing industrial application programs, such as floating point mathematical routines and
special purposes languages utilizing micro assemblers. Two hours of laboratory per week. Co-requisite: CMET 436 .",Other,lower,no,no,no,no,no,no
tsu,2026,2026-2027,CMET,417,Data Communication Mthds Lab,"Data Communication Methods Laboratory (1)
Laboratory experiments in data communication devices. Modems, multiplexers, concentrators, frontend processor, error-checking, simplex/duplex transmission, and telecommunications. Two hours of laboratory per week. Co-requisite: CMET 437 .",Social Sciences,lower,no,no,no,no,no,no
tsu,2026,2026-2027,CMET,419,Peripheral Hardware Lab,"Experiments in the application of microprocessor peripheral hardware and interfacing, including the configuration and construction of a microprocessor system.",Other,lower,no,no,no,no,no,no
tsu,2026,2026-2027,CMET,432,Senior Project II,"A capstone team project that includes a written proposal, with functional specifications and timetable of a project for approval by faculty members. Formal oral and written presentations, and a prototype required.",Other,lower,no,no,no,no,no,no
tsu,2026,2026-2027,CMET,435,Advanced Microcomp Networks,"Advanced topics in the design, operation, and analysis of microcomputer networks, including internetworking and routers, network management, and etc.",STEM,lower,no,no,no,no,no,no
tsu,2026,2026-2027,CMET,436,Appl of Microproc Software,"Utilization of micro assemblers to write floating point mathematical routines, special purpose languages, generate relocatable code, etc.",Other,lower,no,no,no,no,no,no
tsu,2026,2026-2027,CMET,437,Data Communication Mthds,"Data Communication Methods (3)
Study of data communication devices and software, their functional and operational aspects, including modems, control units, multiplexers, concentrators, front-end processors, etc. Three hours of lecture per week. Co-requisite: CMET 417 .",Social Sciences,lower,no,no,no,no,no,no
