university,academic_year,academic_year_label,department_code,course_number,title,description,broad_area,level,progressive_signal,western_canon_signal,climate_narrow_signal,climate_broad_signal,cross_listed,deduplicated
tsu,2026,2026-2027,MSCI,121,Military Leadership I,"Introduction to Army and Marksmanship	(2) 
Introduction to the role of the U.S. Armed Forces in society. Emphasizes weapon safety, responsibility, and marksmanship techniques. No military obligation incurred for attendance. Open to all students at the University.",Other,lower,no,no,no,no,no,no
tsu,2026,2026-2027,MSCI,121L,Military Leadership I Lab,College/School: The School of Public Affairs,Other,lower,no,no,no,no,no,no
tsu,2026,2026-2027,MSCI,122,Military Leadership II,"Survival and Unarmed Self-Defense	(2) 
Basic concepts and techniques in unarmed self-defense, field expedient techniques, and basic field craft addressed. Rape prevention techniques also addressed. No military obligation incurred for attendance. Open to all students at the University.",Other,lower,no,no,no,no,no,no
tsu,2026,2026-2027,MSCI,122L,Military Leadership II Lab,College/School: The School of Public Affairs,Other,lower,no,no,no,no,no,no
tsu,2026,2026-2027,MSCI,125,Physical Readiness I,College/School: The School of Public Affairs,Other,lower,no,no,no,no,no,no
tsu,2026,2026-2027,MSCI,126,Physical Readiness II,College/School: The School of Public Affairs,Other,lower,no,no,no,no,no,no
tsu,2026,2026-2027,MSCI,131,Interm Phy Fitness I,College/School: The School of Public Affairs,Other,lower,no,no,no,no,no,no
tsu,2026,2026-2027,MSCI,132,Interm Phy Fitness II,College/School: The School of Public Affairs,Other,lower,no,no,no,no,no,no
tsu,2026,2026-2027,MSCI,221,Military Leadership Dev I,"Military Leadership Development	(2)
Introduction to leadership, problem analysis, decision making, oral communication, first aid, land navigation, basic radio communications, marksmanship, and repelling. Fitness training and laboratory required.",Social Sciences,lower,no,no,no,no,no,no
tsu,2026,2026-2027,MSCI,221L,Military Leadership Dev I Lab,College/School: The School of Public Affairs,Other,lower,no,no,no,no,no,no
tsu,2026,2026-2027,MSCI,222,Military Leadership Dev II,"Military Leadership Development	(2) 
Continuation of MSCI 221 . Fitness training and laboratory required.",Other,lower,no,no,no,no,no,no
tsu,2026,2026-2027,MSCI,222L,Military Leadership Dev II Lab,College/School: The School of Public Affairs,Other,lower,no,no,no,no,no,no
tsu,2026,2026-2027,MSCI,241,Basic Camp,"Six-week, off-campus field training practicum that introduces students to the military. Includes topics in leadership and repelling. No military obligation is required for attending course.",Other,lower,no,no,no,no,no,no
tsu,2026,2026-2027,MSCI,281,Basic Camp,College/School: The School of Public Affairs,Other,lower,no,no,no,no,no,no
tsu,2026,2026-2027,MSCI,319,Special Problems I,College/School: The School of Public Affairs,Other,lower,no,no,no,no,no,no
tsu,2026,2026-2027,MSCI,329,Special Problems II,College/School: The School of Public Affairs,Other,lower,no,no,no,no,no,no
tsu,2026,2026-2027,MSCI,331,Advanced Military Sci I,"Introduction to small unit leadership, troop leading procedures, leadership theory, and small unit patrolling. Fitness training required as part of the course.",Other,lower,no,no,no,no,no,no
tsu,2026,2026-2027,MSCI,331L,Advanced Military Sci I Lab,College/School: The School of Public Affairs,Other,lower,no,no,no,no,no,no
tsu,2026,2026-2027,MSCI,332,Advanced Military Science II,"Advanced Military Science 	(3) 
Introduction to combat orders and military principles, small unit tactics, and tactical communications. Fitness training required as part of the course. Prerequisite: Consent of the Faculty Chair.",Social Sciences,lower,no,no,no,no,no,no
tsu,2026,2026-2027,MSCI,332L,Advanced Military Sci II Lab,College/School: The School of Public Affairs,Other,lower,no,no,no,no,no,no
tsu,2026,2026-2027,MSCI,339,Special Problems III,College/School: The School of Public Affairs,Other,lower,no,no,no,no,no,no
tsu,2026,2026-2027,MSCI,349,Leadership Dev & Assessment,College/School: The School of Public Affairs,Other,lower,no,no,no,no,no,no
tsu,2026,2026-2027,MSCI,431,Adaptive Leadership,"Advanced Military Science 	(3)
Leadership and command, military law, administration/staff operations and procedures, dynamics of the military team, training management, ethics, and professionalism. Fitness training required as part of the course. Prerequisite: Consent of the Faculty Chair.",Professional,lower,no,no,no,no,no,no
tsu,2026,2026-2027,MSCI,431L,Adaptive Leadership Lab,College/School: The School of Public Affairs,Other,lower,no,no,no,no,no,no
tsu,2026,2026-2027,MSCI,432,Leadership In A Cplx Wrld,Continuation of MSCI 431 . Fitness training required as part of the course.,Other,lower,no,no,no,no,no,no
tsu,2026,2026-2027,MSCI,432L,Leadership In A Cplx Wrld Lab,College/School: The School of Public Affairs,Other,lower,no,no,no,no,no,no
tsu,2026,2026-2027,MSCI,439,Special Problems IV,College/School: The School of Public Affairs,Other,lower,no,no,no,no,no,no
tsu,2026,2026-2027,MSCI,450,Special Probs in Military Sci,College/School: The School of Public Affairs,Other,lower,no,no,no,no,no,no
tsu,2026,2026-2027,MSCI,1125,Phys Readiness Training,College/School: The School of Public Affairs,Other,lower,no,no,no,no,no,no
tsu,2026,2026-2027,MSCI,1131,Ranger Challenge,College/School: The School of Public Affairs,Other,lower,no,no,no,no,no,no
tsu,2026,2026-2027,MUSI,100,Seminar I,"Seminar I	(0-1)
Introductory course for majors which provides enrichment through the art of performing. May be repeated for up to three semester credits earned. During freshman and sophomore years of enrollment, counted as 0 credit; during junior and senior years of enrollment, counted as 1 semester credit. One hour of lecture per week.",Other,lower,no,no,no,no,no,no
tsu,2026,2026-2027,MUSI,131,Introduction To Music,"Introduction to Music	(3)
Survey of basic materials and the fundamentals of music. Open to all students, and required of majors. Students may test out. Three hours of lecture per week. Listed as MUSI 1301 in the Texas Common Course Numbering System.",Other,lower,no,no,no,no,no,no
tsu,2026,2026-2027,MUSI,132,Intro To Computer Music,"Introductory survey of computers and computer peripherals as used in various musical disciplines, including the fundamentals of computer literacy and music software applications. T",STEM,lower,no,no,no,no,no,no
tsu,2026,2026-2027,MUSI,141,Theory I,"Music theory, including basic musicianship, correlating diction, sight-singing, written and keyboard diatonic harmony, and harmonic analysis.",Humanities,lower,no,no,no,no,no,no
tsu,2026,2026-2027,MUSI,142,Theory II,Continuation of MUSI 141 .,Other,lower,no,no,no,no,no,no
tsu,2026,2026-2027,MUSI,146,Ear Training/Sight Singing I,"An aural skills course, to be taken concurrently with music theory. Includes ear training, sight singing and dictation. One hour of lecture and one hour of laboratory per week. Corequisite: MUSI 141 . Listed as MUSI 1116 in the Texas Common Course Numbering System.",Other,lower,no,no,no,no,no,no
tsu,2026,2026-2027,MUSI,147,Ear Training/Sight Singing II,"Continuation of MUSI 146 , to be taken concurrently with music theory. Listed as MUSI 1117 in the Texas Common Course Numbering System.",Other,lower,no,no,no,no,no,no
tsu,2026,2026-2027,MUSI,171,Class Piano I,"Study of keyboard functional skills such as harmonization, sight reading, improvisation, and transposition and how they relate to general musicianship.",Other,lower,no,no,no,no,no,no
tsu,2026,2026-2027,MUSI,172,Class Piano II,Continuation of MUSI 171 .,Other,lower,no,no,no,no,no,no
tsu,2026,2026-2027,MUSI,173,Voice Class I,"Voice Class I	(1)
Designed to teach the fundamental skills of tone production, breathing, posture, and to enhance the repertory by teaching simple songs in the classroom. Two hours of laboratory per week. Listed as MUSI II83 in the Texas Common Course Numbering System.",Other,lower,no,no,no,no,no,no
tsu,2026,2026-2027,MUSI,174,Class Voice II,Continuation of MUSI 173 .,Other,lower,no,no,no,no,no,no
tsu,2026,2026-2027,MUSI,223,Brass & Percussion,"Brass and Percussion	(2)
Practical performance course for majors, including principles of intonation, fingering, breathing, embouchure, transposition, sticking, and rudiments. Elementary proficiency on brass and percussion instruments taught. Offered during odd-numbered years only. Two hours of lecture and one hour of laboratory per week.",Other,lower,no,no,no,no,no,no
tsu,2026,2026-2027,MUSI,224,Woodwind Instruments,"Woodwind Instruments	(2)
Study of basic performance of woodwind instruments, including the concepts and procedures for woodwind instruction. Offered during even-numbered years only. Two hours of lecture and one hour of laboratory per week.",Other,lower,no,no,no,no,no,no
tsu,2026,2026-2027,MUSI,225,String Instrument,"String Instruments	(2)
Instruction in performing, teaching, and scoring for violin, viola, cello, and string bass. Organization, program planning, and terminology emphasized. Two hours of lecture and one hour of laboratory per week.",Other,lower,no,no,no,no,no,no
tsu,2026,2026-2027,MUSI,228,Jazz Improvisation I,"Basic techniques of improvisation of various styles, historical developments, and contributions.",Other,lower,no,no,no,no,no,no
tsu,2026,2026-2027,MUSI,229,Jazz Improvisation II,"Jazz Improvisation II (2)
Continuation of MUSI 228 . Prerequisite: MUSI 228 .",Other,lower,no,no,no,no,no,no
tsu,2026,2026-2027,MUSI,241,Theory III,"Continuation of the integrated course begun in MUSI 141 and MUSI 142 , including chromatic harmony, analysis, and the expression of musical ideas in elementary forms.",Other,lower,no,no,no,no,no,no
tsu,2026,2026-2027,MUSI,242,Theory IV,Continuation of MUSI 241 .,Other,lower,no,no,no,no,no,no
tsu,2026,2026-2027,MUSI,246,Ear Training/Sight Singing III,"Continuation of MUSI 147 , with greater complexity in rhythms and chromatic harmony, to be taken concurrently with music theory. Listed as MUSI 2116 in the Texas Common Course Numbering System.",Other,lower,no,no,no,no,no,no
tsu,2026,2026-2027,MUSI,247,Ear Training/Sight Singing IV,"Continuation of MUSI 246 , to be taken concurrently with music theory. Listed as MUSI 2117 in the Texas Common Course Numbering System.",Other,lower,no,no,no,no,no,no
tsu,2026,2026-2027,MUSI,253,Jazz Theory,"Identification and application of basic harmonic, melodic and rhythmic elements.",Other,lower,no,no,no,no,no,no
tsu,2026,2026-2027,MUSI,254,Jazz Composition,Composition study and analysis with application of advanced harmonic and rhythmic formats along with production of original student works.,Other,lower,no,no,no,no,no,no
tsu,2026,2026-2027,MUSI,271,Class Piano III,"Class Piano III (3)
Continuation of MUSI 172 . May be substituted for MUSA 211 when specified. Two hours laboratory
per week. Prerequisite: MUSI 172 . Listed as MUSI 2181 in the Texas Common Course Numbering
System.",Other,lower,no,no,no,no,no,no
tsu,2026,2026-2027,MUSI,272,Class Piano IV,"Class Piano IV (3)
Continuation of MUSI 271 . May be substituted for MUSA 212 when specified. Two hours of laboratory per week. Prerequisite: MUSI 271 . Listed as MUSI 2182 in the Texas Common Course Numbering System.",Other,lower,no,no,no,no,no,no
tsu,2026,2026-2027,MUSI,300,Junior Recital,"Solo recital required of students pursuing the B.A. in Music, Applied Performance Specialty.",Other,lower,no,no,no,no,no,no
tsu,2026,2026-2027,MUSI,322,Diction For Singers,"Diction for Singers	(3)
Application of vocal pronunciation and techniques of Italian, German, French, and English songs. Three hours of lecture per week. Offered during the spring semester only",Humanities,lower,no,no,no,no,no,no
tsu,2026,2026-2027,MUSI,325,Song Literature,"Song Literature	(3)
Study of the evolution of solo singing and the art of song, as well as song repertoire for all voice classifications. Three hours of lecture per week. Offered during the fall semester only. Three hours of lecture per week.",Humanities,lower,no,no,no,no,no,no
tsu,2026,2026-2027,MUSI,328,Instrumental Techniques,"Instrumental Techniques	(2)
Study of instrumental literature, management, rehearsal techniques, and problems of instrumental care and maintenance. Offered during the fall semester only. Two hours of lecture per week.",Humanities,lower,no,no,no,no,no,no
tsu,2026,2026-2027,MUSI,329,Teaching Music In Elem Class,"Fundamentals of Music Techniques	(3)
Study of musical concepts and principles involving traditional and contemporary learning techniques with the provision of creative experiences through rhythm, song, and instrumental performance. Offered during the spring semester only. Three hours of lecture per week.",Other,lower,no,no,no,no,no,no
tsu,2026,2026-2027,MUSI,331,Counterpoint,"Study of tonal counterpoint in two, three, and four voices; analysis and composition of 18th century polyphony with emphasis on canon, invention, and fugue.",Other,lower,no,no,no,no,no,no
tsu,2026,2026-2027,MUSI,333,Form & Analysis,"Study of small and large musical forms in a tonal context with emphasis on binary, ternary, sonata-allegro, rondo forms, concerto, and variation procedures.",Other,lower,no,no,no,no,no,no
tsu,2026,2026-2027,MUSI,335,Orchestration,Practical study of writing and arranging for the orchestral instruments as well as score reading and analysis of effects heard in extensive orchestral recordings.,Other,lower,no,no,no,no,no,no
tsu,2026,2026-2027,MUSI,337,History Of Music I,"Comprehensive study of the historical periods in music beginning with antiquity to the present. Listening, analysis, and research activities included.",Humanities,lower,no,no,no,no,no,no
tsu,2026,2026-2027,MUSI,338,History Of Music II,Continuation of MUSI 337,Humanities,lower,no,no,no,no,no,no
tsu,2026,2026-2027,MUSI,339,Music For Young Children,"Music for Young Children	(3)
Fundamental principles, methods, and materials of music for nursery and primary children with emphasis on contemporary and traditional methods for ages three through eight. Three hours of lecture per week.",Other,lower,no,no,no,no,no,no
tsu,2026,2026-2027,MUSI,343,Jazz History,"Jazz History	(3)
A chronological examination of jazz styles and major artists of jazz from pre-jazz forms to the present.  Offered as needed.",Humanities,lower,no,no,no,no,no,no
tsu,2026,2026-2027,MUSI,347,Basic Music Procedures,"Basic Music Procedures	(3)
Study of the development of basic music skills stressing the understanding of music fundamentals through activities in singing, listening, performing, and eurhythmics.  Three hours of lecture per week.",Other,lower,no,no,no,no,no,no
tsu,2026,2026-2027,MUSI,355,Jazz Arranging,Arranging compositions in various jazz styles and group combinations.,Other,lower,no,no,no,no,no,no
tsu,2026,2026-2027,MUSI,390,Independent Study in Music I,Selected topics in music and music education.  Developed to provide enhanced curricular options of the concentration for upper music majors.  May be repeated.  Variable hour course 2 to 3 credit hours.,Professional,lower,no,no,no,no,no,no
tsu,2026,2026-2027,MUSI,400,Senior Recital,Solo recital required of all students pursuing the B.A. in Music.,Other,lower,no,no,no,no,no,no
tsu,2026,2026-2027,MUSI,401,Capstone Sem in Music,"Capstone Seminar in Music (3)
Directed research, reading, and discussion to integrate historical, stylistic, and theoretical concepts
acquired throughout the major. The EXIT examination will be administered in this course.",Other,lower,no,no,no,no,no,no
tsu,2026,2026-2027,MUSI,431,Conducting Fundamentals,"Conducting Fundamentals	(3)
Fundamentals of choral and instrumental conducting, stylistic interpretation, terminology, instrumental transposition, score reading, and rehearsal skins. Three hours of lecture per week. Prerequisite: Junior standing.",Other,lower,no,no,no,no,no,no
tsu,2026,2026-2027,MUSI,435,Teaching Music Secondary Class,"Seminar in Music Studies	(3)
Study of the organization and activities of music for majors. Offered during the fall semester only. Three hours of lecture per week.",Other,lower,no,no,no,no,no,no
tsu,2026,2026-2027,MUSI,439,Piano-Voice Pedagogy,College/School: Liberal Arts & Behavioral Scie,Other,lower,no,no,no,no,no,no
tsu,2026,2026-2027,MUSI,480,Business of Music,"Business of Music	(3)
A study of contracts, copyrights, and marketing for the career musical artist.  Required of Jazz Studies music majors.  Open to all students as an elective.",Professional,lower,no,no,no,no,no,no
tsu,2026,2026-2027,MUSI,490,Independent Study in Music II,Selected topics in music education.  Developed to provide enhanced curricular options in the concentration for upper music majors.  May be repeated. Variable hour course 2 to 3 credit hours.,Professional,lower,no,no,no,no,no,no
tsu,2026,2026-2027,MUSI,1306,Music Appreciation,"Music Appreciation (3)
Understanding traditional Western Classical music through study of the cultural periods, major
composers and their works. A brief overview of musical styles from other world cultures will also be
included. Illustrations of music examples will be presented through recordings, in-class performances and outside concert events. Three hours of lecture per week.",Other,lower,no,no,no,no,no,no
tsu,2026,2026-2027,MUSI,1315,Fine Arts In Daily Living,"Fine Arts in Daily Living	(3)
Study of art, music, drama, and dance with emphasis on the interrelationship of these common elements and concepts and the contributions of noted artists. Three hours of lecture per week. Listed as HUMA 1301 in the Texas Common Course Numbering System.",Other,lower,no,no,no,no,no,no
tsu,2026,2026-2027,NAVA,101,Naval Orientation,"An introduction to naval traditions and customs, seamanship, naval organization and missions, and the fundamental concepts of sea power.",Other,lower,no,no,no,no,no,no
tsu,2026,2026-2027,NAVA,103,Sea Power and Maritime Affairs,"Readings, discussions, and research on selected topics related to the history, importance, and impact of sea power on modern civilization.",Humanities,lower,no,no,no,no,no,no
tsu,2026,2026-2027,NAVA,203,Leadership Management I,"An introduction to the principles and concepts of management, organization, leadership, information
systems, and decision making.",Professional,lower,no,no,no,no,no,no
tsu,2026,2026-2027,NAVA,301,Navigation I,"Marine navigators and laws of vessel operations. Includes coastal piloting, navigational aids, nautical astronomy, satellite and inertial systems, and rules of the nautical road.",STEM,lower,no,no,no,no,no,no
tsu,2026,2026-2027,NAVA,302,Naval Operations & Seamanship,"An analysis of ship movements, formations, and fleet operations. Includes Rules of the Road, maneuvering board, tactical publications and communications.",Social Sciences,lower,no,no,no,no,no,no
tsu,2026,2026-2027,NAVA,303,Evolution of Warfare,"Historical survey of the evolution of the conduct of warfare. Strategy, tactics, weapons, organization, and military leaders/thinkers are studied.",Other,lower,no,no,no,no,no,no
tsu,2026,2026-2027,NAVA,304,Naval Weapons Systems,"The theory and employment of weapons systems. The student explores the processes of detection, evaluation, threat analysis, weapon selection, delivery, guidance, and explosives. The physical aspects of radar and underwater sound are described in detail.",Other,lower,no,no,no,no,no,no
tsu,2026,2026-2027,NAVA,399,Independent Study I,College/School: The School of Public Affairs,Other,lower,no,no,no,no,no,no
tsu,2026,2026-2027,NAVA,402,Leadership and Ethics,"Leadership principles with particular emphasis on ethics, human resources management, military law and discipline, and administration.",Professional,lower,no,no,no,no,no,no
tsu,2026,2026-2027,NAVA,403,Naval Engineering,"Ship propulsion systems, auxiliary systems, steering systems, electrical power distribution, ship design, ship stability and damage control measures.",STEM,lower,no,no,no,no,no,no
tsu,2026,2026-2027,NAVA,410,Amphibious Warfare,"Study of the history of amphibious warfare, using case studies to examine doctrine tactics, and the
factors necessary for successful operations.",Humanities,lower,no,no,no,no,no,no
tsu,2026,2026-2027,NAVA,499,Independent Study II,College/School: The School of Public Affairs,Other,lower,no,no,no,no,no,no
tsu,2026,2026-2027,NUTR,116,Seminar In Nutrition and Dietetics,"Introduction to Dietetics and the Academy of Nutrition and Dietetics (AND), including its purpose, membership requirements, professional ethics, by-laws, and career opportunities in dietetics, food service industries, and health care facilities.   Class meets for two hours weekly.",Medical Sciences,lower,no,no,no,no,no,no
tsu,2026,2026-2027,NUTR,235,Introduction to Nutrition,"Introduction to essential nutrients - their food sources, physiological functions, human needs to meet nutritional requirements at different stages of the life cycle, current nutrition trends and controversies. 3 credit hour course per week.",Medical Sciences,lower,no,no,no,no,no,no
tsu,2026,2026-2027,NUTR,240,Introduction to Food Preparation,"Introduction to selection, preparation and storage of food based on chemical and physical properties, applying food preparation techniques, understanding food components and their specific nature and behavior during preparation, evaluation of quality in food products. Course includes ServSafe Certification.",Other,lower,no,no,no,no,no,no
tsu,2026,2026-2027,NUTR,335,Nutrition and Aging,Examines nutritional needs during aging due to physiological; factors influencing food intake and nutritional status of the elderly; therapeutic diets for chronic diseases commonly found in older adults.,Medical Sciences,lower,no,no,no,no,no,no
tsu,2026,2026-2027,NUTR,336,Nutrition Thru Life Cycle,"Examines nutritional needs through the life cycle with emphasis on physiological, metabolic, cultural, environmental, psychosocial, genetic, and environmental factors.",Medical Sciences,lower,no,no,no,no,no,no
tsu,2026,2026-2027,NUTR,337,Nutrition and  Physical Activity,Examines nutritional needs for optimum performance; physical activity and fitness.,Medical Sciences,lower,no,no,no,no,no,no
tsu,2026,2026-2027,NUTR,340,Experimental Food lab,"Analysis of chemical and physical properties of food, study of ingredient functions and factors affecting food product quality as measured by sensory and objective methods. Research design, data collection.",Other,lower,no,no,no,no,no,no
tsu,2026,2026-2027,NUTR,350,"Culture, Society and Foods","Discusses cultural beliefs and practices; religion, food supplies, and socioeconomic status and their impact on food choices and nutritional status.",Medical Sciences,lower,no,no,no,no,no,no
tsu,2026,2026-2027,NUTR,423,Community Nutrition,"Discusses the role of nutrition in promoting, maintaining and improving health in the community; financial, legislative, political, sociological, and scientific aspects of public and community health; analytical tools, grantsmanship; role of public and private agencies in community nutrition programs.",Social Sciences,lower,no,no,no,no,no,no
tsu,2026,2026-2027,NUTR,430,Nutrition Counseling Education,"The application of principles and hands-on experience of counseling, motivational techniques, and communication skills dietetics/nutrition practice.",Social Sciences,lower,no,no,no,no,no,no
tsu,2026,2026-2027,NUTR,440,Food Production Systems,"Discusses the principles in foodservice production systems with emphasis on equipment, principles of safe food handling, quality standards and controls, menu planning, and environmental issues.",Other,lower,no,no,no,no,no,no
tsu,2026,2026-2027,NUTR,440L,Food Production System Lab,"The application of principles in foodservice production systems with emphasis on equipment, safe food handling, quality standards and controls, menu planning, and environmental issues.",Other,lower,no,no,no,no,no,no
tsu,2026,2026-2027,NUTR,445,Food Systems Mgmt,"Discusses management principles with emphasis on how they apply to food systems - human resources, food, equipment and facilities to provide a quality product and service to customers/clients/patients.",Professional,lower,no,no,no,no,no,no
tsu,2026,2026-2027,NUTR,450,Nutr Status Assessment Lab,"Provides training in nutrition status assessment techniques - laboratory methods for collection and interpretation of demographic, dietary, anthropometric, biochemical and clinical data.",Medical Sciences,lower,no,no,no,no,no,no
tsu,2026,2026-2027,NUTR,456,Advanced Nutrition I,"Biochemical and molecular aspects carbohydrates, Lipids, and proteins; interrelationship of nutrients; principles determining the nutritional requirements of individuals and clinical applications.",Medical Sciences,lower,no,no,no,no,no,no
tsu,2026,2026-2027,NUTR,457,Advanced Nutrition II,Examines biochemical and molecular aspects of vitamins and minerals; interrelationship of nutrients; principles of determining nutritional requirements of individuals and clinical applications.,Medical Sciences,lower,no,no,no,no,no,no
tsu,2026,2026-2027,NUTR,460,Medical Nutrition TherapyI,The application of the Nutrition Care Process (NCP) and evidence-based practice to specific pathophysiological conditions.,Medical Sciences,lower,no,no,no,no,no,no
tsu,2026,2026-2027,NUTR,460L,Medical Nutrition Therapy I Lab,The application of the Nutrition Care Process (NCP) and evidence-based practice to specific pathophysiological conditions.,Medical Sciences,lower,no,no,no,no,no,no
