university,academic_year,academic_year_label,department_code,course_number,title,description,broad_area,level,progressive_signal,western_canon_signal,climate_narrow_signal,climate_broad_signal,cross_listed,deduplicated
findlay,2026,2025-2026,CSCI,424,Data Mining Methods of Business Analytics,"This course will focus on data mining techniques used to explore data, quantify and explain relationships between data and for prediction and classification of data. Topics covered in this course will include descriptive techniques of data exploration, data preprocessing and data reduction methods, predictive analytics, and text/social media analytics.",STEM,undergraduate,False,False,False,False,False,True
findlay,2026,2025-2026,CSCI,460,Computer Systems Administration,"This course provides an advanced study of computer systems administration of either a Unix-based or a Windows Server-based operating system. The course will provide the student with both theoretical understanding and practical experience in such things as user management, process control, data backups, software installation, and system security.",STEM,undergraduate,False,False,False,False,False,True
findlay,2026,2025-2026,CSCI,423,Statistical Methods of Business Analytics,This course will focus on the study of statistics from a business analytics perspective to give practical experience on how statistics can be used to help professionals make better decisions based on data.,STEM,undergraduate,False,False,False,False,False,True
findlay,2026,2025-2026,CSCI,496,Information Assurance Capstone,"This course will bring the previous learning together and help prepare students to become information assurance professionals. It will include a major research project and/or a community service component, grant writing principles, and participation in the management of a symposium. Topics will include development and implementation of security policies, internal security practices, roles of various personnel, system security validation, life cycle management, and grant writing. The students will learn professional standards, global management principles, and the principles of co-existence in a secure cyberspace.",STEM,undergraduate,False,False,False,False,False,True
findlay,2026,2025-2026,CSCI,330,Applied Operations Research,"Topics will include linear programming, sensitivity analysis, network analysis, CPM, PERT, queuing calculations, and simulations. There is an emphasis on the use of software packages for problem solving.",STEM,undergraduate,False,False,False,False,False,True
findlay,2026,2025-2026,CSCI,470,JavaScript and Android Application Development,JavaScript and Android applications will be developed. JavaScript and jQuery JavaScript library functions will be used to create web applications. JavaScript will extend the functionality of the CSS and HTML content that is covered in other courses. The Android Studio IDE will be used to develop Android mobile applications using XML and Java.,STEM,undergraduate,False,False,False,False,False,True
findlay,2026,2025-2026,CSCI,445,Computer Networking,"This course offers an advanced study of distributed computing environments and network architectures. The course will provide the student with both theoretical understanding and practical experience in such things as network design and implementation, network security, capacity planning, risk assessment, and feasibility studies.",STEM,undergraduate,False,False,False,False,False,True
findlay,2026,2025-2026,CSCI,490,Database Management Systems,"This course covers the concepts of design and implementation of database management systems, focusing primarily on the relational model.",STEM,undergraduate,False,False,False,False,False,True
findlay,2026,2025-2026,CSCI,480,Software Engineering,"This course is a study of software engineering including planning, requirements analysis, system design, program design, implementation, testing, delivery, and maintenance. Students will learn how to develop large software systems. Each student will participate as an active member of a team in the development of a software system.",STEM,undergraduate,False,False,False,False,False,True
findlay,2026,2025-2026,CSCI,475,Internet Programming Windows,"This course is an introduction to Internet scripting from both the client- and server-side. Covers core Web programming concepts necessary for Web programming in JavaScript, VBScript, and ASP.",STEM,undergraduate,False,False,False,False,False,True
findlay,2026,2025-2026,CSCI,497,Undergraduate Research Project,"The student, in conjunction with a department adviser, will select a semester-long project that utilizes the student's skills and integrates the student's learning in the field of computer science. This course will be graded S/U and is repeatable with no more than 12 semester hours counting towards the required 124 credit hours.",STEM,undergraduate,False,False,False,False,False,True
findlay,2026,2025-2026,CSCI,498,Internship in Computer Science,This course involves a guided work-study experience with a cooperating organization approved and supervised by the Department of Computer Science. Students will keep a detailed log of their work experience and will prepare a final report. Up to 12 hours may be earned in one semester. This course will be graded S/U and may be repeated with a maximum of 15 semester hours applying toward a degree.,STEM,undergraduate,False,False,False,False,False,True
findlay,2026,2025-2026,DMSA,400L,Introduction to Sonography Lab,"This course will use a lab-based approach to enhance lecture topics. Topics include screen orientation, patient position, image acquisition, and optimal machine settings.",Other,undergraduate,False,False,False,False,False,True
findlay,2026,2025-2026,DMSA,050,Sonography Student Club,"This club will provide opportunities for sonography students to learn more about the profession, participate in activities that build interpersonal skills, and determine educational and career goals. There is required participation in selected volunteer experiences. The course is graded S/U and is repeatable for up to five semester hours.",Other,undergraduate,False,False,False,False,False,True
findlay,2026,2025-2026,DMSA,400,Introduction to Sonography,"This course focuses on defining the scope of practice of the sonographer in the clinical setting and the basic skills required for patient care. Topics will include communication skills, basic vital signs, medical emergencies, invasive procedures and isolation techniques, history of sonography, career options, and professional societies.  Scanning planes are presented to include correlation with other imaging modalities.  Equipment knobology, sonographic characteristics, and scanning principles will be introduced.",Other,undergraduate,False,False,False,False,False,True
findlay,2026,2025-2026,DMSA,415,Physics and Instrumentation,"This course provides a comprehensive introduction to the principles of ultrasound physics and instrumentation. Topics include sound wave propagation, acoustic parameters, attenuation, reflection, refraction, Doppler effect, hemodynamics, and transducer technology. Students will explore the interaction of ultrasound with different tissue types, image formation, resolution, and artifacts. Additionally, the course covers the principles of bioeffects, safety, and quality assurance. Emphasis is placed on applying physical principles to optimize image quality and diagnostic accuracy.",Other,undergraduate,False,False,False,False,False,True
findlay,2026,2025-2026,DMSA,405,Clinical Anatomy,"Exploration of cross-sectional anatomy in the human body with an emphasis on ventral body cavities and organs of sonographic interest.  Pathogenesis of common disease processes and alteration of organ morphology and function will be discussed. Correlation of pertinent patient history, laboratory data, and imaging information will be emphasized to support development of analytical skills necessary for clinical practice. Emphasis will be placed on common pathologies encountered by the sonographer.",Other,undergraduate,False,False,False,False,False,True
findlay,2026,2025-2026,DMSA,410,Language of Sonography,"This course introduces the fundamental principles of medical terminology as applied to sonographic procedures and patient care. Students will develop proficiency in understanding and using medical terminology related to anatomy, pathology, and diagnostic imaging. The course also covers the basics of medical records, documentation, and healthcare communication, including electronic health records (EHR) and legal considerations. Emphasis is placed on correlating patient history, clinical indications, and laboratory values with sonographic examination criteria to enhance diagnostic accuracy. Through case studies and real-world scenarios, students will learn to apply critical thinking skills in integrating patient data with imaging protocols.",Other,undergraduate,False,False,False,False,False,True
findlay,2026,2025-2026,DMSA,425,Capstone,"This course will introduce the student to basic interview skills, professional portfolio and resume development. Emphasis will be placed on the Society of Diagnostic Medical Sonographers (SDMS) scope of practice and career options.",Other,undergraduate,False,False,False,False,False,True
findlay,2026,2025-2026,DMSE,400,Echocardiography I,"This course provides a foundation in the principles of echocardiography and gray scale duplex imaging of arterial and venous sonography. This course involves understanding and recognition of normal cardiovascular anatomy, the electrophysiology of the heart, the conduction system, and mechanical events of the cardiac cycle. This course discusses mechanical and electrical events in cardiovascular hemodynamics.",Other,undergraduate,False,False,False,False,False,True
findlay,2026,2025-2026,DMSE,405,Echocardiography II,"This course provides a foundation in the principles of pre-load and after-load, valvular disease, ischemic cardiac diseases, myocardial diseases as well as endocardial diseases, pulmonic arterial diseases, disease of the aorta and great vessels, and trauma. Each section of diseases will be discussed in detail regarding causes, signs, symptoms, echocardiographic findings, and complications.",Other,undergraduate,False,False,False,False,False,True
findlay,2026,2025-2026,DMSA,405L,Clinical Anatomy Lab,"This course will use a lab-based approach to enhance lecture topics. Topics include anatomic appearance, relational anatomy, and organ identification.",Other,undergraduate,False,False,False,False,False,True
findlay,2026,2025-2026,DMSE,405L,Echocardiography II Lab,"This course will use a lab-based approach to enhance lecture topics. Topics include sonographic appearance of various cardiac diseases, sonographic assessment for diagnosis, and additional protocol images required when encountering pathologies.",Other,undergraduate,False,False,False,False,False,True
findlay,2026,2025-2026,DMSE,400L,Echocardiography I Lab,"This course will use a lab-based approach to enhance lecture topics. Topics include normal cardiac structures, sonographic views of cardiac imaging, heart wall segments, and routine diagnostic measurements.",Other,undergraduate,False,False,False,False,False,True
findlay,2026,2025-2026,DMSE,415,Echocardiography IV,"This course covers prosthetic valves, cardiac surgeries in adult population, pericardial diseases, and cardiac tumors. Each section of diseases will be discussed in detail regarding causes, signs, symptoms, echocardiographic findings, and complications. This course also discusses echocardiographic evaluation of cardiac surgery patients.",Other,undergraduate,False,False,False,False,False,True
findlay,2026,2025-2026,DMSE,410,Echocardiography III,"This course involves understanding of clinical pharmacology. Pharmacology, indications and contraindications of common drugs used in cardiac patients. Pharmacology of provocative stress agents and their uses/adverse effects will be discussed. This course also discusses potential side effects of cardiac medications on the cardiac function and the related echocardiographic findings.",Other,undergraduate,False,False,False,False,False,True
findlay,2026,2025-2026,DMSE,415L,Echocardiography IV Lab,This course will use a lab-based approach to enhance lecture topics. The main focus will be on complete performance of a diagnostic quality echocardiogram.,Other,undergraduate,False,False,False,False,False,True
findlay,2026,2025-2026,DMSG,400L,General Sonography I Lab,"This course will use a lab-based approach to enhance lecture topics. Topics include sonographic appearance of abdominal organs, image acquisition of abdominal protocols, and routine diagnostic measurements.",Other,undergraduate,False,False,False,False,False,True
findlay,2026,2025-2026,DMSE,430,Clinical Education II,This course will provide basic instruction and scanning experience in sonography in a hospital or other healthcare setting. The student will be able to demonstrate the ability to perform basic sonographic examinations according to the protocols established by the program and healthcare facility utilizing sonographic equipment at the level of an entry-level sonographer.,Other,undergraduate,False,False,False,False,False,True
findlay,2026,2025-2026,DMSE,420,Echocardiography V,"This course also involves understanding the indications and utility of advances in echocardiography such as; stress echocardiography, transesophageal echocardiography, intraoperative echocardiography, contrast echocardiography, and also 3D echocardiography and echo guided procedures.",Other,undergraduate,False,False,False,False,False,True
findlay,2026,2025-2026,DMSE,425,Clinical Education I,This course will provide basic instruction and scanning experience in sonography in a hospital or other healthcare setting. The student will be able to demonstrate the ability to perform basic sonographic examinations according to the protocols established by the program and healthcare facility utilizing sonographic equipment.,Other,undergraduate,False,False,False,False,False,True
findlay,2026,2025-2026,DMSG,400,General Sonography I,"Discusses the normal anatomy and physiology related to the major abdominal organs, major abdominal vessels and superficial structures in the adult and pediatric patient. Topics include sonographic appearance, clinical assessment, evaluation protocols, technical factors, and image quality.",Other,undergraduate,False,False,False,False,False,True
findlay,2026,2025-2026,CSCI,499,Advanced Topics in Computer Science and Technology,"This course involves special studies and/or research in computer science and technology. Emerging technologies will be emphasized. Registration and selection of topic are subject to approval of instructor. This is a repeatable course, provided the topics are different.",STEM,undergraduate,False,False,False,False,False,True
findlay,2026,2025-2026,DMSG,405,General Sonography II,"Discusses the normal anatomy and physiology related to the breast, non-gravid female and pediatric pelvis, and normal obstetrics. Topics include sonographic appearance, clinical assessment, evaluation protocols, technical factors, and image quality.",Other,undergraduate,False,False,False,False,False,True
findlay,2026,2025-2026,DMSG,405L,General Sonography II Lab,"This course will use a lab-based approach to enhance lecture topics. Topics include sonographic appearance of pelvic and fetal anatomy, image acquisition of pelvic protocols, and routine diagnostic measurements.",Other,undergraduate,False,False,False,False,False,True
findlay,2026,2025-2026,DMSG,430,General Sonography V,"This course is designed to provide students with the sonographic examinations of the emergency department, emerging technology, interventional procedures, program and laboratory accreditation, and the Scope of Practice and Clinical Standards for the Diagnostic Medical Sonographer.",Other,undergraduate,False,False,False,False,False,True
findlay,2026,2025-2026,DMSG,415L,General Sonography IV Lab,"This course will use a lab-based approach to enhance lecture topics. Topics include sonographic appearance of various pelvic and obstetric disease states, sonographic assessment for diagnosis, additional protocol images required when encountering pathologies, and performance of diagnostic quality sonographic examinations.",Other,undergraduate,False,False,False,False,False,True
findlay,2026,2025-2026,DMSG,410,General Sonography III,"Discusses pathology of the major abdominal organs and major abdominal vessels and superficial structure in the adult and pediatric patient. Topics include sonographic appearance, clinical assessment, evaluation protocols, technical factors, and image quality.",Other,undergraduate,False,False,False,False,False,True
findlay,2026,2025-2026,DMSG,415,General Sonography IV,"Discusses the pathology related to the non-gravid female and pediatric pelvis as well as obstetrical exams. Topics include sonographic appearance, clinical assessment, evaluation protocols, technical factors, and image quality.",Other,undergraduate,False,False,False,False,False,True
findlay,2026,2025-2026,DMSG,410L,General Sonography III Lab,"This course will use a lab-based approach to enhance lecture topics. Topics include sonographic appearance of various disease states, sonographic assessment for diagnosis, additional protocol images required when encountering pathologies, and performance of diagnostic quality sonographic examinations.",Other,undergraduate,False,False,False,False,False,True
findlay,2026,2025-2026,DMSG,420,Clinical Education I,This course will provide basic instruction and scanning experience in sonography in a hospital or other healthcare setting. The student will be able to demonstrate the ability to perform basic sonographic examinations according to the protocols established by the program and healthcare facility utilizing sonographic equipment.,Other,undergraduate,False,False,False,False,False,True
findlay,2026,2025-2026,DMSV,405L,Vascular Sonography II Lab,"This course will use a lab-based approach to enhance lecture topics. Topics include sonographic appearance of pathology within the peripheral vascular system, image acquisition of protocols, diagnostic measurements, sonographic report writing, and abnormal finding evaluations.",Other,undergraduate,False,False,False,False,False,True
findlay,2026,2025-2026,DMSV,405,Vascular Sonography II,"This course is designed to provide students with pathology of the peripheral vascular system in adult and pediatric patients. Topics include sonographic appearance, clinical assessment, evaluation protocols, technical factors, and image quality.",Other,undergraduate,False,False,False,False,False,True
findlay,2026,2025-2026,ECON,200,Principles of Macroeconomics,"This course offers an introduction to macroeconomic theory including national income accounting and the theory of income, output, and employment. Emphasis on application of national fiscal and monetary policies in a business context is discussed from a liberal arts philosophical point of view.",Social Sciences,undergraduate,False,False,False,False,False,True
findlay,2026,2025-2026,DMSV,400L,Vascular Sonography I Lab,"This course will use a lab-based approach to enhance lecture topics. Topics include sonographic appearance of the peripheral vascular system, image acquisition of protocols, and routine diagnostic measurements.",Other,undergraduate,False,False,False,False,False,True
findlay,2026,2025-2026,ECON,199,Introduction to Economic Thinking,This course is an introduction to basic social science and economic reasoning techniques and the application of these skills to the study of several current economic problems.,Social Sciences,undergraduate,False,False,False,False,False,True
findlay,2026,2025-2026,DMSV,400,Vascular Sonography I,"This course is designed to provide students with the normal anatomy and physiology related to the major peripheral vessels, in the adult and pediatric patient. Topics include sonographic appearance, clinical assessment, evaluation protocols, technical factors, and image quality.",Other,undergraduate,False,False,False,False,False,True
findlay,2026,2025-2026,ECON,201,Principles of Microeconomics,"This course provides an introduction to microeconomic theory including the economics of the firm, resource allocation, and international economics. Emphasis is on the study of pricing by supply/demand analyses in a free enterprise economy and with respect to international trade problems. Lectures are presented from a liberal arts philosophical point of view.",Social Sciences,undergraduate,False,False,False,False,False,True
findlay,2026,2025-2026,ECON,320,Labor Economics,"This course builds on the principles learned in ECON 200 and ECON 201 to examine labor economics, trade unionism, collective bargaining, wage determination, employment and labor legislation as they apply in industrial relations and business contexts from both a contemporary and historical perspective.",Social Sciences,undergraduate,False,False,False,False,False,True
findlay,2026,2025-2026,ECON,340,Intermediate Microeconomic Theory,"This course builds on the principles learned in ECON 201 to expand the understanding of microeconomic theory in our economy and society. It has an emphasis on consumer theory, producer theory, market structure, market and pricing strategy as these relate to efficiency and competition in a contemporary dynamic world economy.",Social Sciences,undergraduate,False,False,False,False,False,True
findlay,2026,2025-2026,ECON,341,Intermediate Macroeconomic Theory,"This course builds on principles learned in ECON 200 to expand understanding of macroeconomic theory in our economy and society. It focuses on measurement and structure of national economies, economic performance, business cycle theory, fiscal and monetary policy implications on growth, unemployment, and price stability.",Social Sciences,undergraduate,False,False,False,False,False,True
findlay,2026,2025-2026,EDUC,088,The Oiler Experience for Education Majors,"This course is an introduction to the College of Education and campus life for all first-time, full-time education majors. Topics will include navigating the College of Education, the University, personal growth, leadership, and current issues in education. This course does not count toward the total hour requirement. This course will be graded S/U.",Social Sciences,undergraduate,False,False,False,False,False,True
findlay,2026,2025-2026,ECON,350,Principles of Econometrics,"This course will cover the basic methods of data analysis used in economics, including descriptive statistics, hypothesis testing, and regression analysis. Various methods of regression optimization as they relate to economics will also be discussed.",Social Sciences,undergraduate,False,False,False,False,False,True
findlay,2026,2025-2026,EDUC,134,Introduction to Special Education,"This course is an introduction to the philosophical, historical, and legal foundations of special education in public education. The course will explore the characteristics and abilities of students with disabilities, the Federal Laws surrounding their education including the Individuals with Disabilities Education Act (IDEA) and students' right to a Free Appropriate Public Education in the Least Restrictive Environment, optimally within the general education classroom. Emphasis is placed on including all learners in an integrated setting as well as the collaborative roles of the general education teacher and intervention specialist regarding referral and teaming.",Social Sciences,undergraduate,False,False,False,False,False,True
findlay,2026,2025-2026,ECON,400,Managerial Economics,This course builds on the principles learned in ECON 200 and ECON 201 to show how economic theory and decision science tools can assist in the formulation of optimal solutions to managerial decision makers. The course incorporates contemporary management issues and analyses of current business behavior.,Social Sciences,undergraduate,False,False,False,False,False,True
findlay,2026,2025-2026,DMSG,425,Clinical Education II,This course will provide basic instruction and scanning experience in sonography in a hospital or other healthcare setting. The student will be able to demonstrate the ability to perform basic sonographic examinations according to the protocols established by the program and healthcare facility utilizing sonographic equipment at the level of an entry-level sonographer.,Other,undergraduate,False,False,False,False,False,True
findlay,2026,2025-2026,EDUC,046,Teachers of Tomorrow,This activity allows education students to expand and apply topics discussed in the regular university classroom. This student organization provides professional development opportunities and social support for future teachers. This course is repeatable and graded S/U.,Social Sciences,undergraduate,False,False,False,False,False,True
findlay,2026,2025-2026,EDUC,151,Cultural Perspectives,"This course delves into the rich tapestry of human cultures, equipping students with the critical tools to navigate an increasingly interconnected world. The course will explore diverse cultural expressions, belief systems, and social structures, fostering a deep understanding of what shapes individual and collective identities. Students will identify their own cultural perspective and make meaningful comparisons to other cultural perspectives.",Social Sciences,undergraduate,True,False,False,False,False,True
