university,academic_year,academic_year_label,department_code,course_number,title,description,broad_area,level,progressive_signal,western_canon_signal,climate_narrow_signal,climate_broad_signal,cross_listed,deduplicated
findlay,2026,2025-2026,SYSA,499,Business Systems Internship,This internship is a one-semester work experience with a cooperating business firm supervised by the systems analysis faculty. This course will be graded S/U and may be repeated with a maximum of 12 semester hours applying toward a degree.,Other,undergraduate,False,False,False,False,False,True
findlay,2026,2025-2026,THEA,110,Stage Technology,"This is an introductory course covering the technological skills used in theatre production. Students will learn the basics of scenic construction, stage lighting and sound reinforcement through a series of practical applications. The course encompasses both lecture and experiential learning opportunities.",Humanities,undergraduate,False,False,False,False,False,True
findlay,2026,2025-2026,THEA,178,Costume Design,"This course involves beginning costume design, covering the principles and theories of costume design for the stage. Course covers all design aspects as well as rendering techniques, construction methods, and accessories.",Humanities,undergraduate,False,False,False,False,False,True
findlay,2026,2025-2026,THEA,130,Script Analysis,"This course is designed to introduce students to the methodologies, vocabulary, and critical thinking skills necessary for the interpretation of dramatic texts, with a view toward the practical considerations of developing such texts in performance and production. To this end, the course will survey the fundamentals of theatre criticism and explore representative works of dramatic literature for their theatrical possibilities.",Humanities,undergraduate,False,False,False,False,False,True
findlay,2026,2025-2026,THEA,120,Stage Management,"In this course students will learn the basic principles of stage management as they pertain to the theatre. The class focuses on a hands-on approach to understanding the role of stage managers, and developing a competency in the field. Concepts will include history and current practices in theatre stage management.",Humanities,undergraduate,False,False,False,False,False,True
findlay,2026,2025-2026,THEA,150,Acting I,"This introductory acting course explores acting techniques and theories as students develop their communication skills for an audience. This course emphases vocalization, physicality and self-expression. Students will apply techniques towards building a stage character, developing their improvisation skills and supporting critical analysis.",Humanities,undergraduate,False,False,False,False,False,True
findlay,2026,2025-2026,THEA,186,Sound Design,"This is a beginning sound design course covering the principles and theories of sound design for the stage. Students will learn research methods, analysis, and the execution of sound design. Students will develop sound plots and analog and digital audio presentations.",Humanities,undergraduate,False,False,False,False,False,True
findlay,2026,2025-2026,THEA,183,Scenic Design,"This is a beginning scenic design course, covering the principles and theories of design for the stage. Students will learn research methods, analysis, and visualization skills for theatre scenic design. Students will learn and develop ground plans, elevations, and basic model-building skills.",Humanities,undergraduate,False,False,False,False,False,True
findlay,2026,2025-2026,THEA,187,Lighting Design,"This is a beginning lighting design course covering the principles and theories of light design for the stage. Students will learn research methods, analysis, basic light console programing, and execution of lighting design. Students will develop basic light plots as a final project.",Humanities,undergraduate,False,False,False,False,False,True
findlay,2026,2025-2026,THEA,185,Makeup for the Stage,This course covers the design and application of stage makeup. Its emphasis will be on how to read details of facial structure and design makeup for characterization. A variety of styles and skills will be used throughout the course. Students will practice their art by participation in major productions.,Humanities,undergraduate,False,False,False,False,False,True
findlay,2026,2025-2026,THEA,220,Voice and Movement,"This studio course introduces students to various voice and movement methods and techniques used in the art of acting. Emphasis will be placed on the essential skills of articulation, projection, and basic dialect work, as well as body awareness, economy of movement, and physical expression in the interpretation of character.",Humanities,undergraduate,False,False,False,False,False,True
findlay,2026,2025-2026,SYSA,495,Seminar in Business Systems,This course is designed for special studies and/or research in the student's major. It is open for individual or seminar group work. The course is graded S/U.,Other,undergraduate,False,False,False,False,False,True
findlay,2026,2025-2026,THEA,190,Acting for Healthcare Simulation,"This course introduces students to the tenants of acting for healthcare simulation experiences. Simulated/standardized patients are individuals that portray various medical conditions to provide experiential-learning opportunities for healthcare students. In this course, students will explore the fundamentals of physical, emotional, and verbal expression along with improvisation, communication, and feedback techniques to effectively portray the role of a standardized/simulated patient.",Humanities,undergraduate,False,False,False,False,False,True
findlay,2026,2025-2026,THEA,210,Theatre Practicum,This course involves practical application of theatre skills in performance. Credit is open to anyone involved in a theatre production. Number of hours available dependent upon role/technical position. This course may be repeated up to three times.,Humanities,undergraduate,False,False,False,False,False,True
findlay,2026,2025-2026,THEA,235,Acting for Music Theatre,"This course continues the actor's work by using the techniques learned in THEA 150 , and adapting those techniques to solos from modern musical theatre. The course will also explore the connection between a Stanislavski-based acting process and music theatre needs, including vocal techniques, characterization, and physicalization of music and lyrics. This course may be repeated.",Humanities,undergraduate,False,False,False,False,False,True
findlay,2026,2025-2026,THEA,215,Audition/Portfolio,"This course covers development of professional résumé and audition material for the performer, and development of professional résumé and portfolio for production design and technology. Students will begin a file of audition monologues and songs and prepare pieces for presentation in actual auditions, begin compilation of a professional-level portfolio, and prepare materials for presentation in actual interviews. The course may be repeated up to three times.",Humanities,undergraduate,False,False,False,False,False,True
findlay,2026,2025-2026,THEA,230,Creative Drama,"This course explores young people's dramatic literature and pedagogical techniques for a children’s theatre production, the development of the performer’s imagination, storytelling methods and the use of drama for effective teaching.",Humanities,undergraduate,False,False,False,False,False,True
findlay,2026,2025-2026,THEA,261,Directing for the Theatre,"This is an introductory directing course that covers basic principles and theories. The course examines the full range of directorial duties as well as aesthetics of directing, focuses on decision-making, techniques, and selection. These concepts will be studied through the use of classroom experiential learning exercises.",Humanities,undergraduate,False,False,False,False,False,True
findlay,2026,2025-2026,THEA,252,Acting II,This course builds upon the foundation of basic acting techniques established in THEA 150 . Advanced skills of analysis and characterization are developed and applied to scene study. This is a repeatable course.,Humanities,undergraduate,False,False,False,False,False,True
findlay,2026,2025-2026,THEA,322,Theatre History and Literature-Origins to 17th Century,"This course offers an integration of dramatic literature and theatre history as well as aspects of history, art, architecture, and philosophy as they influence the world of theatre from its origins to the 17th century. Students will read representative works and important theatre criticism from each period. One focus of the course is to place theatrical works into societal context.",Humanities,undergraduate,False,False,False,False,False,True
findlay,2026,2025-2026,THEA,310,Advanced Theatre Technology,"In the world of advanced theatre technology, methods and skills are continually being updated and rewritten. This course provides learning experiences in working with a variety of materials other than standard stagecraft technology. Work with plastics, welding, various other materials, and upholstery. Learn new skills with advanced woodworking and be on the cutting edge of new developments in scenery construction.",Humanities,undergraduate,False,False,False,False,False,True
findlay,2026,2025-2026,THEA,335,Advanced Acting for Music Theatre,"In this course scene study and song repertoire are examined by era for the advanced music theatre student: 1900s-1930s (operetta, revue, and musical comedy), 1940s-1960s (book musicals), 1970s-present (new forms and Broadway opera). This course may be repeated.",Humanities,undergraduate,False,False,False,False,False,True
findlay,2026,2025-2026,THEA,320,Playwriting,This is a workshop course in the fundamentals of writing and devising original dramatic literature for the stage. The course will examine representative works of classical and contemporary plays before guiding students through the stages of various playwriting processes. Students will participate in in-class readings of the short plays they have written. The course culminates in the writing and sharing of one-act plays.,Humanities,undergraduate,False,True,False,False,False,True
findlay,2026,2025-2026,THEA,323,Theatre History and Literature-18th Century to Today,"This course covers the integration of dramatic literature and theatre history as well as aspects of history, art, architecture, and philosophy as they influence the world of theatre from the 18th century to today. Students will read representative works and important theatre criticism of the period. One focus of the course is to place theatrical works into societal context.",Humanities,undergraduate,False,False,False,False,False,True
findlay,2026,2025-2026,THEA,355,Acting III,"This course continues the actor's work by focusing on acting styles from ancient Greece to the present. Important aspects include: intensive verse work, period movement, period manners, and character research methods. This is a repeatable course.",Humanities,undergraduate,False,True,False,False,False,True
findlay,2026,2025-2026,THEA,356,Music Theatre Dance,This course provides an exploration of various dance styles from different eras of the musical theatre stage. This course is repeatable.,Humanities,undergraduate,False,False,False,False,False,True
findlay,2026,2025-2026,THEA,409,Professional Internship,Theatre majors are expected to audition for semi-professional and professional companies to further their experience. The University recognizes the importance of work outside the academic year in career preparation. This credit is available for positions in professional companies only. This course will be graded S/U and may be repeated with a maximum of 15 semester hours applying toward a degree.,Humanities,undergraduate,False,False,False,False,False,True
findlay,2026,2025-2026,THEA,360,Advanced Directing for the Stage,"Building on THEA 261 , this course culminates in a presentation of a one-act script. Students put their directing skills of organization, script selection, auditions and casting, rehearsals, and decision making to the practical test.",Humanities,undergraduate,False,False,False,False,False,True
findlay,2026,2025-2026,THEA,384,Advanced Theatre Design,"This advanced course continues the student's artistic and practical learning in theatre design. After completing this course, students are eligible to apply for main-stage design assignments.",Humanities,undergraduate,False,False,False,False,False,True
findlay,2026,2025-2026,THEA,490,Individual Study,Development of individual and independent theatre projects allows the student to pursue topics and areas not specified in the curriculum. Work is expected to be of superior quality and difficulty. All proposals must be approved by the theatre faculty. This is a repeatable course.,Humanities,undergraduate,False,False,False,False,False,True
findlay,2026,2025-2026,THEA,410,Design Practicum,"This course covers practical application of theatre skills in performance. Credit is open to any student creating a realized design for a main-stage production during the academic year. This course is open to realized designs in the areas of costumes, scenery, lighting, sound, or makeup. This course may be repeated up to three times.",Humanities,undergraduate,False,False,False,False,False,True
findlay,2026,2025-2026,THEA,256,Dance,"This course offers intensive physical work for all University students interested in improving flexibility of movement, integration of body language and meaning, etc. This course may be repeated up to three times.",Humanities,undergraduate,False,False,False,False,False,True
findlay,2026,2025-2026,ADDC,600,Clinical Application and Ethical Approaches to Substance Use Disorders,"This is a class that will discuss practical application of providing addiction services; assessment, interviewing, diagnosis, placement, treatment planning, ethical/legal issues and case management. This course will also explore helping strategies for reducing the negative effects of substance use disorders and will explore ethical issues related to additions' counseling.",Social Sciences,graduate,False,False,False,False,False,True
findlay,2026,2025-2026,ADDC,500,Fundamentals and Theoretical Approaches to Treatment of Substance Use Disorders,"This course will investigate historical and cultural attitudes towards various types of addictions, the physical, psychological, social, emotional and spiritual factors surrounding addiction, including the concept of addiction as a disease. The clinical manifestations of both prevention and treatment will be examined. The course will provide an emphasis on understanding modalities of treatment and care for diverse populations affected by substance abuse issues. Relevant state and federal legislation and the role of culture will also be discussed. The course also explores a variety of helping strategies for reducing the negative effects of substance use, abuse, dependence and addictive disorders.",Social Sciences,graduate,True,False,False,False,False,True
findlay,2026,2025-2026,BIOL,510,Introduction to Bioinformatics,"An introduction to the theory and practice of bioinformatics and computational biology. General topics include database searching, computer programming, analysis of sequence data, phylogenetics, protein structure and prediction, gene prediction and regulation, genomics, proteomics, genetic linkage and association, microarray analysis, and RNA structure and prediction.",STEM,graduate,False,False,False,False,False,True
findlay,2026,2025-2026,THEA,495,Theatre Seminar,"This exit-level course serves as the culmination of the theatre experience at The University of Findlay. The course topic changes but is always inclusive and integrative, investigating the canon of an author's work or the impact of a theatre or theatre artist or movement. This course strives to look at the total picture, bringing all of the elements of theatre together. Major research projects and seminar style provide assessment for the graduating student and graduate school preparation for the continuing student.",Humanities,undergraduate,True,False,False,False,False,True
findlay,2026,2025-2026,BIOL,515,Health and Disease Microbiology,"The molecular basis of disease will be examined through primary literature and case study review. Representative diseases from each body system will be studied for mode of infection, diagnosis and treatment methods.",STEM,graduate,False,False,False,False,False,True
findlay,2026,2025-2026,BLMC,505,Foundations of Differentiated Education,This course examines societal and linguistic differences that contribute to the educational and construction of English-based communities of practice within a classroom. Perspective teachers will learn how to differentiate material and how to bridge the gap between home and school environments to optimize learning results.,Humanities,graduate,False,False,False,False,False,True
findlay,2026,2025-2026,BLMC,501,Methods/Materials for the Adult ESL Learner,"This course involves oral and written analysis of adult ESL instructional materials and adult programming options for English for specific purposes. Second language and bilingual methodologies that target the development of the five language skills areas (reading, writing, speaking, listening and comprehension) will be presented and discussed. Methods and materials, as well as planning and implementation of lessons which meet international TESOL standards, are required.",Humanities,graduate,False,False,False,False,False,True
findlay,2026,2025-2026,BLMC,500,Designing ESL Instruction for P-12 Programs,"This course examines instructional methods, materials and assessment used in instructional design for the development of reading, writing, speaking and listening skills in the education of P-12 English language learners.",Humanities,graduate,False,False,False,False,False,True
findlay,2026,2025-2026,BLMC,515,"Foundations of ELL/Bilingual Education: Theory, Politics and Practices in Schools","This foundational course includes an examination of bilingual/English language learner (ELL) educational theory and the historical development of bilingual/TESOL education in the United States and abroad. Particular emphasis is placed on bilingual cognition, bilingual/bi-literate language development and domestic and international policy trends for the education of bilingual/English language learners (ELLs) in diverse settings.",Humanities,graduate,True,False,False,False,False,True
findlay,2026,2025-2026,BLMC,510,Introduction to Linguistics,"This foundational course introduces linguistic terminology and surveys the study of linguistics concepts to provide a foundation in the fields of phonology, phonemics, morphology, syntax, semantics, pragmatics and sociolinguistics. Special emphasis will be placed on the application of linguistic terminology and concepts to native and non-native production.",Humanities,graduate,False,False,False,False,False,True
findlay,2026,2025-2026,BLMC,516,Multi-Age Speaking and Listening Methods,"This course introduces students to various theories, methodologies and practices of second language (L2) speaking and listening pedagogy for implementation in the teaching of learners of all ages.",Humanities,graduate,False,False,False,False,False,True
findlay,2026,2025-2026,BLMC,520,Language Acquisition,This course presents the theoretical foundations of first and second language acquisition and the variables that effect acquisition outcomes.,Humanities,graduate,False,False,False,False,False,True
findlay,2026,2025-2026,BLMC,522,"ESL Educational History, Policy and Assessment Practices in P-12 Schools",This course examines the historical development of policies and practices for the education and assessment of non-native English speakers in US public P-12 settings. Special attention will be given to practices that apply to Ohio schools.,Humanities,graduate,False,False,False,False,False,True
findlay,2026,2025-2026,BLMC,540,Application of Discourse Analysis,This course examines the application of discourse analysis to both oral and written communication for use within the fields of linguistics and linguistic education.,Humanities,graduate,False,False,False,False,False,True
findlay,2026,2025-2026,BLMC,518,Multi-Age Reading and Writing Methods,"This course introduces students to various theories, methodologies and practices of second language reading and writing pedagogy for implementation in the teaching of learners of all ages.",Humanities,graduate,False,False,False,False,False,True
findlay,2026,2025-2026,BLMC,535,Language Assessment,"This course presents formal and informal evaluation techniques, methods, design and interpretation/reporting for the assessment of language learners.",Humanities,graduate,False,False,False,False,False,True
findlay,2026,2025-2026,BLMC,545,Advanced Linguistics,"This advanced linguistics course examines the interplay of syntactic, morphologic, semantic and pragmatic theory in the creation of grammar in order to develop skills in linguistic analysis and the teaching of grammar.",Humanities,graduate,False,False,False,False,False,True
findlay,2026,2025-2026,BLMC,560,Sociolinguistics,This course involves intensive study of linguistic and social variables that determine how language functions and is used in society.,Humanities,graduate,False,False,False,False,False,True
findlay,2026,2025-2026,BLMC,555,Reading in a Second Language,"This course examines the linguistic, cognitive, socio-cultural and developmental dimensions of literacy for first and second language learners of all age groups. Attention will be given to literacy theories and practices for emergent literacy, bi-literacy, literacy transfer and adult second language literacy development.",Humanities,graduate,False,False,False,False,False,True
findlay,2026,2025-2026,BLMC,565,ELL Writing Methods,"This course introduces students to various theories, methodologies, and practices of second language writing pedagogy with particular focus on addressing global concerns, teaching grammar in the context of writing, and teaching students how to apply rhetorical concepts when composing and designing multimodal compositions.",Humanities,graduate,False,False,False,False,False,True
findlay,2026,2025-2026,BLMC,585,Experiential Learning in TESOL/Applied Linguistics,This course is a one-semester experiential learning opportunity within the fields of TESOL or Applied Linguistics supervised by the TESOL and Applied Linguistics faculty.  Details available from the program director.  This course may be repeated with a maximum of 6 semester hours applying toward a degree.,Humanities,graduate,False,False,False,False,False,True
findlay,2026,2025-2026,BLMC,502,Curriculum/Program Design and Evaluation,This course will introduce students to the foundations of curriculum/program design and evaluation used in auditing or reviewing programs and designing curriculum for culturally and linguistically diverse populations.,Humanities,graduate,True,False,False,False,False,True
findlay,2026,2025-2026,BLMC,590,Special Topics in Bilingual/ESL Education,Topics will address current or emerging issues and areas of interest in TESOL/bilingual education. This course is repeatable for up to six semester hours of credit provided the topics are different.,Humanities,graduate,False,False,False,False,False,True
findlay,2026,2025-2026,BLMC,593,Research Methods in Linguistics,"Through an exploration of current topics in TESOL/Applied Linguistics this course introduces research methods, techniques, analytical tools, writing genres and the ethical issues of using human subjects in research within linguistic- and education-related fields.",Humanities,graduate,False,False,False,False,False,True
findlay,2026,2025-2026,BLMC,591,TESOL Conferences,"This course content is linked with appropriate TESOL conferences. Students selecting this course for one credit are expected to attend at least one full day (nine hours) of a conference; and those selecting this course for two credits are expected to attend two full days (18 hours). Students at each credit level will be held to different course assignment requirements which may include, but are not limited to, writing summaries of presentations and workshops attended, interviews with conference participants, review of new teaching materials and a research paper tied to a conference-related topic. This is a repeatable course.",Humanities,graduate,False,False,False,False,False,True
findlay,2026,2025-2026,CHEM,505,Computational Chemistry,Computational Chemistry is designed around computer-based exercises that illustrate theory and applications of computational chemistry. The work stresses the introduction and application of quantum mechanical models to understand and make predictions about the physical properties of chemical systems.,STEM,graduate,False,False,False,False,False,True
findlay,2026,2025-2026,BLMC,592,Integrating Technology and Language Skills into the ESL Classroom,"As a result of the widespread effects of technology throughout the world, it is no surprise that educators are being challenged to rethink and revise their approaches and goals in teaching in order to effectively prepare students for what will be expected of them in the ""real world."" The Internet also allows the educator to network with other ESL professionals and to share in lesson plans that are being created and posted for the ESL field. This workshop will allow participants to become familiar with the World Wide Web as an instructional tool for the ESL classroom. This is a repeatable course.",Humanities,graduate,False,False,False,False,False,True
