university,academic_year,academic_year_label,department_code,course_number,title,description,broad_area,level,progressive_signal,western_canon_signal,climate_narrow_signal,climate_broad_signal,cross_listed,deduplicated
findlay,2026,2025-2026,JAPN,420,Fourth-Year Japanese I,This course offers fourth-year language and culture training based on skills and knowledge gained from the courses through JAPN 321 . This course is designed to respond to each student's need to polish and to further develop skills in both spoken and written language and cultural understanding. The course requires a great amount of self-study based upon the assignments.,Other,undergraduate,False,False,False,False,False,True
findlay,2026,2025-2026,JAPN,495,Selected Topics in Japanese,"Taught in English and Japanese, depending on the topic covered, the course is designed to meet special interests of students wishing to study selected topics in Japanese culture and society. Topics may include adult and children's literature, films, art, and music. This course also serves as the training course for the student who wants to be licensed to teach Japanese as a foreign language. The course may be repeated for up to eight hours, provided the topics are different. It is strongly recommended for students in teacher education programs.",Other,undergraduate,False,False,False,False,False,True
findlay,2026,2025-2026,JAPN,499,Study/Internship in Japan,This course provides experiences in Japan for students to further develop their skills and knowledge of the Japanese language and culture gained from classroom and field experiences in the United States. Regular reporting of the progress to the supervising instructor is required. Semester hour(s) will be granted according to the nature and the length of the experience. This is a repeatable course.,Other,undergraduate,False,False,False,False,False,True
findlay,2026,2025-2026,MATH,132,Applied Mathematical Analysis,"This course provides an introduction to finite mathematics and mathematical analysis. Topics include matrices, linear programming, math of finance, algebraic functions, and logic. A graphing calculator is required.",STEM,undergraduate,False,False,False,False,False,True
findlay,2026,2025-2026,MATH,110,Intermediate Mathematics,"Topics include polynomials, rational expressions, inequalities, introduction to functions, graphing of linear and nonlinear equations and inequalities, systems of equations, and radicals.",STEM,undergraduate,False,False,False,False,False,True
findlay,2026,2025-2026,MATH,101,Fundamentals of Mathematics,"This course covers introductory algebra. Topics include linear equations, polynomials, factoring, quadratic equations, straight line graphing, and problem solving. Grades assigned for this course include the 12-point grading scale and the addition of an ""NC"" grade. ""NC"" stands for no credit and doesn't affect the GPA. Students receiving an ""NC"" will need to repeat the course successfully to meet the Prerequisites for other higher-level classes. (""NC"" may not be available in all off-campus programs due to state rulings on repeating courses).  This is a developmental course.",STEM,undergraduate,False,False,False,False,False,True
findlay,2026,2025-2026,MATH,133,Applied Calculus,The course content consists of a survey of differential and integral calculus of algebraic functions with an emphasis on applications in business and economics. A graphing calculator is required.,STEM,undergraduate,False,False,False,False,False,True
findlay,2026,2025-2026,MATH,123,Elementary Statistics,"This is a first course in the study of descriptive and inferential statistics utilizing only rudimentary skills of arithmetic and algebra. Elementary probability, measures of central tendency, measures of variability, confidence intervals, and hypothesis testing.",STEM,undergraduate,False,False,False,False,False,True
findlay,2026,2025-2026,MATH,130,Practical Perspectives in Math,"This is a course designed for the non-science major. A variety of topics in mathematics will be explored. These topics include problem solving, probability and statistics, financial math, and the mathematics of social choice. Optional topics may include, but are not limited to, the theory of numbers, networking, and mathematics in the arts.",STEM,undergraduate,False,False,False,False,False,True
findlay,2026,2025-2026,MATH,142,Calculus II,"A continuation of MATH 141 , this course includes a study of the techniques and applications of integral calculus. Topics include calculus of transcendental functions (logarithmic, exponential, and inverse trigonometric functions), techniques of integration, sequences, series, parametric equations, and polar equations of curves. A graphing calculator is required and projects that require use of computer algebra systems (Maple) are included.",STEM,undergraduate,False,False,False,False,False,True
findlay,2026,2025-2026,MATH,138,College Algebra,"This is a pre-calculus course emphasizing the function concept. It includes a study of the properties and applications of algebraic, exponential, and logarithmic functions. Other topics include graphing techniques and complex numbers. A graphing calculator is required.",STEM,undergraduate,False,False,False,False,False,True
findlay,2026,2025-2026,MATH,139,Trigonometry,"This is a pre-calculus course emphasizing the function concept. It includes a study of the properties and applications of trigonometric functions. Other topics include trigonometric identities, vectors, and polar coordinates. A graphing calculator is required.",STEM,undergraduate,True,False,False,False,False,True
findlay,2026,2025-2026,MATH,141,Calculus I,"This course is an introduction to a graphical, numerical, and symbolic approach to differential and integral calculus of one variable. Topics cover the rate of change of a function, limits, continuity, rules of differentiation, and definite and indefinite integrals. Applications to the study of motion, optimization, and related concepts in other areas of the natural and social sciences are included. A graphing calculator is required.",STEM,undergraduate,False,False,False,False,False,True
findlay,2026,2025-2026,MATH,205,Mathematics for Early Childhood Teachers I,"This course is a study of the mathematical concepts underlying mathematics. Topics include problem solving, sets, numeration systems, functions, number theory, rational and real numbers, money, and time.",STEM,undergraduate,False,False,False,False,False,True
findlay,2026,2025-2026,MATH,221,Integrated Statistical Analysis,"This is a one-semester course designed to give the student an understanding of basic methods of statistical analysis, as well as the means to utilize those methods in a scientific setting. Students will collect, summarize, analyze, and draw conclusions from research data. Topics will include various types of distributions of data, comparisons of samples, comparisons of categorical data, confidence intervals, and some of the techniques of data analysis: hypothesis testing, regression, ANOVA, chi square, and parametric and non-parametric.",STEM,undergraduate,False,False,False,False,False,True
findlay,2026,2025-2026,MATH,140,Precalculus,"This is a pre-calculus course emphasizing the function concept and trigonometry. It includes a study of the algebraic, exponential, logarithmic, and trigonometric functions. Other topics include graphing techniques, trigonometric identities, and complex numbers. A graphing calculator is required.",STEM,undergraduate,True,False,False,False,False,True
findlay,2026,2025-2026,MATH,223,Applied Statistics and Data Analysis,"This course in applied statistics provides a broad and practical overview of the statistical analysis methods used by researchers today to design experiments and collect, summarize, analyze, and draw conclusions from research data. Topics may include binomial distribution, the normal distribution, sampling distributions, confidence intervals, comparison of two independent samples, statistical principles of design, comparison of paired samples, analysis of categorical data, comparing the means of many independent samples, ANOVAs, single and multiple regression, and correlation, as well as parametric and non-parametric data analysis.",STEM,undergraduate,False,False,False,False,False,True
findlay,2026,2025-2026,MATH,250,Calculus III,"A continuation of MATH 142 , this course includes an introduction to the calculus of vectors, vector-valued functions, and three-dimensional surfaces. Topics include a development of vector calculus, motion in space, functions of two or more variables and their derivatives, multiple integrals, and line and surface integrals. A graphing calculator is required and projects that require use of computer algebra systems (Maple) are included.",STEM,undergraduate,False,False,False,False,False,True
findlay,2026,2025-2026,JAPN,421,Fourth-Year Japanese II,This course offers fourth-year language and culture training based on skills and knowledge gained from the courses through JAPN 321 . The course is designed to respond to each student's need to polish and to further develop skills in both spoken and written language and cultural understanding. The course requires a great amount of self-study based upon the assignments.,Other,undergraduate,False,False,False,False,False,True
findlay,2026,2025-2026,MATH,295,Introduction to Discrete Mathematics,"This course provides a bridge to higher-level mathematics through the use of proof and the study of topics in discrete mathematics. Topics include sets, logic, theorems, proofs, proof by induction, recurrence, permutations and combinations, order relations, matrices, and graph theory.",STEM,undergraduate,False,False,False,False,False,True
findlay,2026,2025-2026,MATH,301,Mathematics Technology,"A course designed for applied mathematicians and mathematics teachers. Mathematical problem solving and instruction will be facilitated by learning various technologies currently used in industry. Projects will be designed based on the background of the student. Technologies used in the course may include hand-held computer devices and software packages that can be used in a variety of settings that may include statistical analysis of data, geometric representations, symbolic manipulation, or measurement.",STEM,undergraduate,False,False,False,False,False,True
findlay,2026,2025-2026,MATH,310,Differential Equations,"This is a first course in differential equations, including such topics as separable variables, homogeneous equations, exact equations, integrating factors, and linear and higher order differential equations. It also includes the solution of nth order equations, and Laplace Transform solutions, and applications. This is an alternate-year course.",STEM,undergraduate,False,False,False,False,False,True
findlay,2026,2025-2026,MATH,330,Mathematical Modeling,"This course provides an introduction to the mathematical modeling process and applies this process to problems that require the student to reason analytically, and relate mathematical concepts to everyday activities. Emphasis will be placed on connections of mathematics to application areas such as business, industry, economics, and physical, biological, and social sciences. Topics may include optimization techniques, deterministic and stochastic models, and simulations. This is an alternate-year course.",STEM,undergraduate,False,False,False,False,False,True
findlay,2026,2025-2026,MATH,302,Number Theory with an Introduction to Cryptography,"This course offers an introduction to number theory with excursions into mathematical cryptography. Topics include prime numbers, modular arithmetic, division algorithm, Euler’s theorem, primitive roots, quadratic residues and quadratic reciprocity, and encryption.",STEM,undergraduate,False,False,False,False,False,True
findlay,2026,2025-2026,MATH,320,Concepts and Foundations of Mathematics,"This course is steeped in the history of mathematics, with emphasis on the beginnings of arithmetic, algebra, geometry, and calculus. It includes a study of number systems, sequences and patterns, the beginning of number theory, and an in-depth study of individual mathematicians.",STEM,undergraduate,False,False,False,False,False,True
findlay,2026,2025-2026,MATH,340,Financial Mathematics,"This course is an introduction to financial mathematics. Topics include interest theory, the time value of money, valuation of annuities, loan amortization, bond prices, general cash flows, and immunizations. Additional topics may be taken from general derivatives, options, and investment strategies.",STEM,undergraduate,False,False,False,False,False,True
findlay,2026,2025-2026,MATH,343,Abstract Algebra,"This course provides an introduction to algebraic structures. Equivalence relations, binary operations, isomorphisms, and homomorphisms will be studied. Binary operations and their properties in the context of groups, subgroups, rings, and fields are developed. This is an alternate-year course.",STEM,undergraduate,False,False,False,False,False,True
findlay,2026,2025-2026,MATH,410,Probability and Statistics,"This course offers a study of discrete and continuous random variables and their distribution functions. Topics will include discrete and continuous probability theory, random variables, sampling distributions, hypothesis testing and confidence intervals. A graphing calculator is required. This is an alternate-year course.",STEM,undergraduate,False,False,False,False,False,True
findlay,2026,2025-2026,MATH,345,Modern Geometry,This course offers an introduction to classical geometry and modern systems from the viewpoint of axiomatics. Other topics include historical foundations of Euclidean and non-Euclidean geometry. This is an alternate-year course.,STEM,undergraduate,False,True,False,False,False,True
findlay,2026,2025-2026,MGMT,380,Cross-Cultural Management,"This course is designed for students to understand the major concepts in managing people in both international and domestic environments. The course develops an understanding of key cultural differences and how these differences influence the management of individuals, teams, and organizations.",Professional,undergraduate,False,False,False,False,False,True
findlay,2026,2025-2026,MATH,400,Topics in Mathematics,"This course is a flexible multiple elective as a regular offering or for independent study. Topics include advanced calculus, number theory, statistics, regression analysis, complex variables, topology, etc. This is an alternate-year course. This is a repeatable course.",STEM,undergraduate,False,False,False,False,False,True
findlay,2026,2025-2026,MATH,420,Real Analysis,"This course in real analysis is designed specifically to present advanced calculus topics within a framework that will help students more effectively write and analyze proofs. Students will be able to gain a deeper understanding of the foundations of the real number system and its axioms. Also students will study proofs of theorems covering limits, functions, continuity, sequences, differentiation, and the Riemann integral. This is an alternate-year course.",STEM,undergraduate,False,False,False,False,False,True
findlay,2026,2025-2026,MATH,499,Mathematics Internship,This course provides guided work-study experiences. Students have the opportunity to apply their knowledge and skills in a work environment. The internship must be approved and supervised by the mathematics faculty. The student is also supervised on site by a representative of the business. Up to 12 hours of internship may count toward graduation requirements. This course is graded S/U and repeatable up to 12 semester hours.,STEM,undergraduate,False,False,False,False,False,True
findlay,2026,2025-2026,MATH,495,Directed Mathematical Investigations,"The student will develop, with the aid of a research mentor selected from one of the mathematics faculty, a question to be investigated. The student will then do what is necessary to answer the question and present the results to mathematics faculty and peers. This course is repeatable up to six credit hours.",STEM,undergraduate,False,False,False,False,False,True
findlay,2026,2025-2026,MGMT,420,Organizational Design and Change,"This course focuses on developing an understanding of the basics of organizational design and change.  The course addresses diagnosing the need for change, overcoming change resistance, and evaluating various organizational change interventions.",Professional,undergraduate,False,False,False,False,False,True
findlay,2026,2025-2026,MATH,342,Linear Algebra,"This course offers a study of matrix operations, vector spaces and transformations, and their applications to simultaneous linear equations and geometry. This is an alternate-year course.",STEM,undergraduate,False,False,False,False,False,True
findlay,2026,2025-2026,MRKT,049,Marketing Club,"The Marketing Club will network with other students at The University of Findlay by participating in student events and getting involved with the faculty and the business community. The student will learn different aspects of creating, implementing, and tracking marketing efforts. The Marketing Club will reach out to guest speakers who can discuss topics related to marketing in different organizations. This course is graded S/U. This is a repeatable course.",Other,undergraduate,False,False,False,False,False,True
findlay,2026,2025-2026,MRKT,220,Principles of Marketing,"This course covers the development of basic concepts and principles in the field of marketing. The fundamentals of the marketing mix and marketing's role in the community, company, and economy are emphasized.",Other,undergraduate,False,False,False,False,False,True
findlay,2026,2025-2026,MRKT,370,Principles of Social Media,This course will examine how marketers can utilize social media to communicate and engage the customer. It will also explore the various methods to integrate social media into the current marketing mix. Students will also assess and update their current personal brand.,Other,undergraduate,False,False,False,False,False,True
findlay,2026,2025-2026,MGMT,440,Decision-Making and Value Creation,"Decision makers need to know how to make effective decisions by understanding the influence of inputs used in decision analysis. This course addresses various models designed to maximize business excellence and create value for the firm.  The course will examine topics on visioning, value proposition, strategic planning, policy deployment, employee empowerment, and profit maximization.",Professional,undergraduate,False,False,False,False,False,True
findlay,2026,2025-2026,MRKT,480,Retail Management,"Principles of retail store management including pricing, profit determination, inventory decisions, and merchandise planning decisions are covered in this course. A managerial approach to retail strategy is emphasized.",Other,undergraduate,False,False,False,False,False,True
findlay,2026,2025-2026,MRKT,400,Topics in Marketing,"The content of this course will change and will cover such topics as sales management, promotional strategy, international marketing, marketing for non-profit organizations, and database marketing information systems. This course is repeatable.",Other,undergraduate,False,False,False,False,False,True
findlay,2026,2025-2026,MRKT,398,Digital Marketing,"This course provides a strategic approach to the practical application of today’s digital marketing strategy techniques. Students gain an understanding of current internet marketplace tools and digital marketing standards and develop techniques to adapt marketing strategy with technology advancements. This course combines classroom instruction, hands-on learning, and project-based strategy application with community businesses.",Other,undergraduate,False,False,False,False,False,True
findlay,2026,2025-2026,MRKT,477,Integrated Marketing Communications,"This course introduces various communication tools in marketing, including advertising, direct marketing, sales promotion, and more, with a focus on their integration to create cohesive communication campaigns. The analysis of objectives and effectiveness of these tools leads to the development of a comprehensive integrated marketing communications strategy.",Other,undergraduate,False,False,False,False,False,True
findlay,2026,2025-2026,MRKT,377,Consumer Behavior in Marketing,"The acts of individuals directly involved in obtaining and using economic goods and services, including the decision processes that precede and determine these acts. The consumer-firm relationship in terms of concepts drawn from contemporary social sciences as related to present and prospective business activities is covered.",Other,undergraduate,False,False,False,False,False,True
findlay,2026,2025-2026,MSL,2010,Leadership and Decision Making,Primarily is drawn from the Adaptability ALA. The outcomes are demonstrated through Critical and Creative Thinking and the ability to apply Troop Leading Procedures (TLP). Comprehension of the officer's role in Leading Change by applying Innovative Solutions to Problems in concert with the Principles of Mission Command. The Army Profession is also stressed through leadership forums and a leadership self-assessment. No military obligation.,Other,undergraduate,False,False,False,False,False,True
findlay,2026,2025-2026,MRKT,495,Seminar in Marketing,This course is designed for special studies and research in the student's major. This course is open for individual or seminar group work.,Other,undergraduate,False,False,False,False,False,True
findlay,2026,2025-2026,MSL,3010,Training Management and the Warfighting Functions,"Challenges cadets to study, practice, and apply the fundamentals of Army Leadership, Officership, Army Values and Ethics, Personal Development, and small unit tactics at the platoon level. Cadets receive systematic and specific feedback on their leadership attributes values, and core leader competencies from instructor, ROTC cadre, and MSL IV Cadets using the Cadet Officer Evaluation System (OES).",Other,undergraduate,False,True,False,False,False,True
findlay,2026,2025-2026,MRKT,499,Marketing Internship,"A one-semester work experience with a business firm supervised by the faculty. Details available from the program director/department chair, the business intern adviser, or the Center for Career and Professional Development. This course will be graded S/U and may be repeated with a maximum of 12 semester hours applying toward a degree.",Other,undergraduate,False,False,False,False,False,True
findlay,2026,2025-2026,MSL,2020,Army Doctrine and Team Development,"Begins the journey to understand and demonstrate Cross-Cultural Competencies as they relate to Army doctrine and how they apply in a combatant commander's Engagement Strategies. Army Values, Teamwork, and Warrior Ethos and their relationship to the Law of Land Warfare and philosophy of military service are also stressed. Students are then required to apply their knowledge outside the classroom in a hands-on performance-oriented environment during Leadership LABs (team building exercises, LTXs, VBS exercises). No military obligation.",Other,undergraduate,False,False,False,False,False,True
findlay,2026,2025-2026,MRKT,485,Marketing Management,A senior-management approach to general control of all marketing activities with detailed study of interrelationships between marketing and value chain activities is utilized. The case study method is used in this course.,Other,undergraduate,False,False,False,False,False,True
findlay,2026,2025-2026,MSL,3020,Applied Leadership in Small Unit Operations,"Builds on the lessons learned and leadership attributes gained and developed during MSL 3010 . This is an academically challenging course where Cadets will study, practice, and apply the fundamentals of Army Leadership, Officership, Army Values and Ethics, Personal Development, and small unit tactics at the platoon level. At the conclusion of this course, Cadets will be capable of planning, coordinating, navigating, motivating, and leading a squad and platoon in the execution of a mission during a classroom PE, a Leadership Lab, or during a Leader Training Exercise (LTX).",Other,undergraduate,False,True,False,False,False,True
findlay,2026,2025-2026,MSL,4010,The Army Officer,"Develops cadet proficiency in planning, executing, and assessing complex operations, functioning as a member of a staff, and providing performance feedback to subordinates. Cadets assess risk, make ethical decisions, and lead fellow Army ROTC cadets. They identify responsibilities of key staff, coordinate staff roles, and use situational opportunities to teach, train, and develop subordinates.",Other,undergraduate,False,False,False,False,False,True
findlay,2026,2025-2026,MSL,4700,Studies in Military Science,On demand. Detailed study of selected military subjects. Offered on lecture basis in seminar or independent study depending on students' needs and nature of material. May be repeated to six hours. There is an extra fee for taking this course.,Other,undergraduate,False,False,False,False,False,True
findlay,2026,2025-2026,MSL,4020,Company Grade Leadership,"Explores the dynamics of leading in the complex situations of current military operations in today's operational environment. Cadets examine differences in customs and courtesies, military law, principles of war, and rules of engagement in the face of international terrorism. They also explore aspects of interacting with nongovernmental organizations, civilians on the battlefield, and host nation support. The course places significant emphasis on preparing cadets for their first unit of assignment.",Other,undergraduate,False,False,False,False,False,True
