university,academic_year,academic_year_label,department_code,course_number,title,description,broad_area,level,progressive_signal,western_canon_signal,climate_narrow_signal,climate_broad_signal,cross_listed,deduplicated
vanguard,2026,2026-2027,ECED,200,Fundamentals of Early Childhood Education,"This course provides an overview of early childhood education for children ages 0 to 8 in developmental theories and history of early childhood education, developmentally appropriate practices based on Constructivism-based curricula, working with families in diverse communities, and becoming an early childhood education professional. (This course is cross listed with EDUC-250 in the residential undergraduate program.)",Other,undergraduate,True,False,False,False,False,True
vanguard,2026,2026-2027,ECED,300,Classroom Management and Guiding the Young Child's Behavior,"This course examines appropriate child guidance principles and practices. Positive teacher/child interactions along with guidance techniques, self-regulation and self-control concepts, the setting of clear expectations and affirming positive behavior, classroom management techniques, and conflict resolution strategies will be examined. Parental involvement and school/family partnerships will be incorporated to serve children in their supporting environments.",Other,undergraduate,False,False,False,False,False,True
vanguard,2026,2026-2027,ECED,301,Infant and Toddler: Development and Theory,This course examines and celebrates infant and toddler development from pre-birth through age 36 months. The course focuses on the importance of families' and caregivers' relationships and responsiveness in interactions with young children emphasizing the whole-child approach to development. Developmentally appropriate guidance using a relationship-based model is introduced. (School for Professional Studies Course).,Other,undergraduate,False,False,False,False,False,True
vanguard,2026,2026-2027,ECED,304,Foundations in Teaching for Early Childhood Educators,"This course features a look at every aspect of the field of early childhood education that covers children ages birth through age 8-various early childhood programs and its professionals, developmentally appropriate theories and practices, strategies for engaging and supporting diverse learners, effective learning environments, curriculum planning and assessing for all young children, and ethical decision making - to develop competent, informed early childhood professionals. Students will be introduced to the California PK-3 Early Childhood Education Specialist Instruction Credential Teacher Performance Expectations, the California Preschool Learning Foundations and Framework, and the California K-3 Student Content Standards and Framework.",Other,undergraduate,True,False,False,False,False,True
vanguard,2026,2026-2027,ECED,305,The Exceptional Child and the Inclusive Classroom,"The purpose of this course is to provide students with an in-depth look at the foundations of Early Childhood special education and to diagnose the various characteristics and best practices. It seeks to research various theoretical perspectives and the differences between typical and atypical development as well as the communities and family dynamics that place young children at risk. In this course, students will learn about the various types of disabilities and the characteristics and the interventions available to its subjects. It also delves into the birth-8th grade experience and looks at the broad spectrum of young children who need assistance with school to those that excel and need more academic challenges. This course addresses California PK-3 ECE TPE 1.1 for demonstrating knowledge of typical and atypical development and California PK-3 ECE TPE 2.3 for communicating and collaborating with peers and colleagues to support learning and development.",Other,undergraduate,True,False,False,False,False,True
vanguard,2026,2026-2027,ECED,306,"Exceptional Children: Teaching Language Arts, Math and Science for Students With Severe Disabilities","This course is designed to equip early childhood educators who teach special needs students to demonstrate best practices in his or her classroom. This course covers teaching common core Language Arts, Math and Science, and creating instructions and assessment. The concepts of embedding instruction and inclusion in the classroom are explored. Requirement for Special Education emphasis. (School for Professional Studies Course).",Other,undergraduate,True,False,False,False,False,True
vanguard,2026,2026-2027,ECED,316,STEM/STEAM: Math for the Young Child,"This course reviews developmental theory and research about mathematical education in the early childhood years. Early childhood educators will investigate the interrelationship of math concepts in cooperation with STEAM education, and explore an organized, sequential approach to creating a developmentally appropriate math curriculum for young children that incorporates the use of digital technologies. Educators will gain experience using digital tools appropriately with young learning to promote alternative modes of assessment, individualized learning, and enhance digital citizenship. Concepts of God as the creator and master designer will be presented as students construct knowledge through a dynamic, interactive process that facilitates their development of working theories relating to mathematics and STEAM education.",Other,undergraduate,False,False,False,False,False,True
vanguard,2026,2026-2027,ECED,322,STEM/STEAM: Science for the Young Child,"This course reviews developmental theory and research about science educatiuon in the early childhood years.  Early childhood educators will investigate the interrelationship of science concepts in cooperation with STEAM education, and explore an organized, sequential approach to creating developmentally appropraite science curriculum for young children. Concepts of God as the creator and master designer will be presented as students construct knowledge through a dynamic, interactive process that facilitates their development of working theories relating to science and STEAM education. (School for Professional Studies Course).",Other,undergraduate,False,False,False,False,False,True
vanguard,2026,2026-2027,ECED,327,STEM/STEAM: Arts and Creative Learning for the Young Child,"This course reviews developmental theory and research of art education and the development of creativity in the early childhood years. Early childhood educators will investigate the interrelationship of math, science, literature, and social studies in cooperation with STEAM education, in order to explore an organized, sequential approach to creating developmentally appropriate curriculum for young children that embraces creativity and self-expression through the arts. Concepts of God as the creator and master designer will be presented as students construct knowledge through a dynamic, interactive process that facilitates their development of working theories relating to creativity and STEAM education.",Other,undergraduate,True,False,False,False,False,True
vanguard,2026,2026-2027,ECED,330,Early Foundations for Moral and Character Development,"This course examines the role of educators in developing moral and ethical behavior in young children. Character traits that are reflective of a Spirit-filled classroom are defined and identified. Students explore different theories of moral development and identify knowledge, skills, and dispositions that can be integrated into the life of the classroom. Biblical principles of moral development are studied along with strategies that integrate these concepts into the curriculum content. Students examine early childhood education centers for moral and character development curriculum content, and a strategic plan is developed to enhance moral development. Students are challenged to be an effective role model and to identify their own personal strengths and growth areas. Developmentally-effective methods of instruction are discussed, including the use of a variety of hands-on materials to reinforce concrete learning. (School for Professional Studies Course).",Other,undergraduate,False,True,False,False,False,True
vanguard,2026,2026-2027,ECED,338,Advanced Administration of Early Childhood Education Programs,"This course provides information about the advanced skills needed to manage and lead in early childhood education settings. Students develop skills in personal and professional self-awareness, fiscal management, facilities management, family support and educational programming. Special emphasis is placed on management theory and decision making. Through this course, students develop an understanding of their own leadership and management style. (School for Professional Studies Course).",Other,undergraduate,False,False,False,False,False,True
vanguard,2026,2026-2027,ECED,340,Transitional Kindergarten Programs,"This course examines transitional kindergarten programs in the private and public sector. An in-depth look at the developmental needs of 4-1/2- to 6-year-olds is included. Aspects of current brain research on the connection of curriculum to targeted learning outcomes is reviewed. Specific strategies for measuring developmental milestones for learning are included, preparing early childhood educators to adequately assess developmentally-effective progression. Aspects of creating effective transitions from preschool to kindergarten programs, including perceptions, expectations, and practices that build strong partnerships with families and elementary schools, are covered. Appropriate levels of instruction and developmentally appropriate environments are explored. (School for Professional Studies Course).",Other,undergraduate,False,False,False,False,False,True
vanguard,2026,2026-2027,ECED,345,STEM/STEAM: Technology and Engineering for the Young Child,"This course introduces the use of technology in the early education setting to enhance STEAM (emphasis on engineering) teaching, learning, and program support. Topics will include the use of technology in the classroom, communication with families, and teacher training. With an emphasis on engineering, students will be able to understand and apply technology-enhanced instruction and utilize a variety of resources in order to create project-based STEAM learning experiences in the classroom.  Through learning the concepts of technology and engineering in the development of children ages 0-8, student will be able to create and design instruction that promotes problem solving, critical thinking, collaboration, and creativity in a cross-curricular learning experience. (School for Professional Studies Course).",Other,undergraduate,False,False,False,False,False,True
vanguard,2026,2026-2027,ECED,350,Ministering to Parents and Families,"This course emphasizes the significance of parents and families as the basic unit of society according to God's design. Significant issues surrounding the health of the family unit are discussed. Topics included in this course focus on the well-being of individuals and society supported by strong family units. Various parenting styles are examined for understanding family dynamics. Students learn how to minister effectively through the integration of faith practices, prayer, God's word, and Biblical insight that supports a strong home life for young children. Instilling Biblically-based values in the home and the supportive role of early childhood education programs in supporting children and their families are examined, including family education and advocacy. (School for Professional Studies Course).",Other,undergraduate,False,True,False,False,False,True
vanguard,2026,2026-2027,ECED,401,Infant/Toddler: Curriculum and Practicum,"This course explores the uniqueness of infant and toddler curriculum, and demonstrates a practical application of developmentally appropriate infant and toddler teaching techniques and skills. Emphasis is placed on designing, implementing, and evaluating classroom experiences for children ages 0 - 36 months. Observation and evaluation of classroom experiences, environmental design, classroom management, and parent communication are emphasized to promote optimal development for young children. Biblical perspectives are integrated throughout the course. Fieldwork is completed in the student's own classroom, or by approval of the instructor. Students videotape their teaching in order to be evaluated by the instructor and fellow classmates.",Other,undergraduate,False,True,False,False,False,True
vanguard,2026,2026-2027,ECED,405,Advanced Curriculum Design and Development in Early Childhood Education,"In this course, candidates will focus on curriculum planning, curriculum mapping, and lesson planning utilizing various documents and materials to support student engagement and assessment for Preschool through third grade learners. These learners include both general education and students identified as special education learners. Resources to be used for curriculum planning and lesson design focus include: California K-3 Student Content Standards and Frameworks, Preschool Learning Foundations, California Preschool Curriculum Framework, National Association for the Education of Young Children, and Multi-Tiered System of Support (MTSS). Candidates will focus on engagement strategies, meeting the needs of all learners, designing multiple approaches to curriculum, incorporating effective play-based models, and adjusting lessons based on student understanding for both individual lessons and long-term curriculum based projects.",Other,undergraduate,False,False,False,False,False,True
vanguard,2026,2026-2027,ECED,408,Advanced Practicum I,"This course is a supervised experience in working with young learners ages 3-5 in a preschool (PK) through transitional kindergarten (TK) setting. The primary purpose of this course is to practice and reflect on various teaching strategies and approaches under the guidance and support of a mentor teacher, University Supervisor, and the course instructor. The emphasis will be on designing, implementing, and evaluating classroom experiences for young learners. These experiences will be planned considering the funds of knowledge, cognitive and social-emotional development, and unique needs of each young learner based on constructivist approaches. Observation and evaluation of classroom experiences, environmental design, classroom management, and parent/family communication in culturally inclusive environments will be highlighted to promote optimal development for young learners.",Other,undergraduate,True,False,False,False,False,True
vanguard,2026,2026-2027,ECED,409,Advanced Practicum II,"This course is a supervised experience in working with young children ages 5-8 in a Kindergarten through third grade setting. The primary purpose of this course is to practice and reflect on various teaching strategies and approaches under the guidance and support of a mentor teacher. The emphasis will be on designing, implementing, and evaluating classroom experiences for young children. These experiences will be planned considering students' cognitive, social, emotional, linguistic, cultural, and special needs. Observation, and evaluation of classroom experiences, environmental design, classroom management, and parent communication will be emphasized to promote optimal development for young children. Biblical perspectives will be integrated throughout the course.",Other,undergraduate,False,True,False,False,False,True
vanguard,2026,2026-2027,ECED,410,Leadership and Advocacy in Early Childhood Education,"This course focuses on child and family advocacy, leadership, public policy, research, and advocacy initiatives in the field of early childhood education. Students analyze critical issues in early childhood education from a Biblical-worldview and develop strategies for articulating positions and becoming change agents. Students develop and implement strategies for change. A professional code of ethics that integrates Biblical standards and principles is discussed. (School for Professional Studies Course).",Other,undergraduate,False,True,False,False,False,True
vanguard,2026,2026-2027,ECED,420,Principles of Applied Behavior Analysis: Autism,"This course examines the introduction of Behavioral Analysis into daily life, and how the events in daily life affect autistic students' behavior. Students learn how to apply behavioral principles to their classes, deal with challenging behaviors, and build positive relationship with their students' families and other students. Requirement for Special Education emphasis. (School for Professional Studies Course).",Other,undergraduate,False,False,False,False,False,True
vanguard,2026,2026-2027,ECED,425,Functional Assessment and Evaluation for Exceptional Learners,"This course covers how to collect and use educational data to assess diverse learning needs in multiple developmental aspects, educational planning and progress monitoring, instructional models, curricular access, mapping, and development. Various types and uses of assessments to identify needs of exceptional learners are introduced. Requirement for Special Education emphasis. (School for Professional Studies Course).",Other,undergraduate,True,False,False,False,False,True
vanguard,2026,2026-2027,ECED,430,Lang/Lit for Young Child Multicultural Communities,"This course focuses on language and literacy development for young children in multicultural communities. Language learning development will be studied as an important part of thinking and communicating as God's design for each child. Students will learn the distinct differences between language, competence, and performance as it relates to multicultural communities. Students will examine theories of language development, including theories of second language acquisition and the needs of English language learners. They will also explore strategies for engaging children in integrated listening, speaking, reading, and writing experiences as well as specific strategies for working with multilingual families in meeting the functional needs of the child in the classroom setting.  Developmentally effective assessments will be discussed as a means of informing instruction. Additionally, evaluation of God-honoring children's literature will be covered.",Other,undergraduate,False,False,False,False,False,True
vanguard,2026,2026-2027,ECED,431,"Advanced Strategies of Observation, Documentation, and Assessment","In this course, PK-3 credential students will research and practice appropriate use of assessment, including observation tools and strategies to document students' development and learning between Preschool and Grade 3 (approximately, ages 3-8 years old). Students will apply the use of data to inform and plan learning environments and curricula. Utilizing the guidance from the California Teaching Performance Expectations on assessing young children's learning, students will create and practice with recording strategies, rating systems, portfolios, and multiple assessments, with further implementation of strategies for collaboration with families and professionals to support young learners within all domains of development, through all curriculum areas.",Other,undergraduate,False,False,False,False,False,True
vanguard,2026,2026-2027,ECED,432,Clinical Practice Seminar I and CalTPA Cycle 1,"This course provides support for teacher candidates to demonstrate their knowledge, skills, and abilities learned through the PK-3 Early Childhood Education Specialist Instruction Credential program to successfully pass the California Teaching Performance Assessment (CalTPA) Cycle 1 focusing on learning about the diverse assets and needs of students. Candidates create a math lesson based on the understanding of students' developmental level, needs, and interest utilizing the funds of knowledge of each student.",Other,undergraduate,True,False,False,False,False,True
vanguard,2026,2026-2027,ECED,433,Clinical Practice Seminar II and Caltpa Cycle 2,"This course provides support for teacher candidates to demonstrate their knowledge, skills, and abilities learned through the PK-3 Early Childhood Education Specialist Instruction Credential program to successfully pass the California Teaching Performance Assessment (CalTPA) Cycle 2 focusing on learning about assessment as an ongoing procedure of gathering evidence from multiple sources to determine what each student knows, understands, and can demonstrate. Candidates create a literacy lesson, with emphasis on the interaction between standards, assessment, and instructional decision-making in the PK-3 education setting.",Other,undergraduate,False,False,False,False,False,True
vanguard,2026,2026-2027,ECED,460,Advanced Practicum I,"This course is a supervised experience in working with young learners ages 3-5 in a preschool (PK) through transitional kindergarten (TK) setting. The primary purpose of this course is to practice and reflect on various teaching strategies and approaches under the guidance and support of a mentor teacher, University Supervisor, and the course instructor. The emphasis will be on designing, implementing, and evaluating classroom experiences for young learners. These experiences will be planned considering the funds of knowledge, cognitive and social-emotional development, and unique needs of each young learner based on constructivist approaches. Observation and evaluation of classroom experiences, environmental design, classroom management, and parent/family communication in culturally inclusive environments will be highlighted to promote optimal development for young learners.",Other,undergraduate,True,False,False,False,False,True
vanguard,2026,2026-2027,ECED,465,Advanced Practicum II,"This course is a supervised experience in working with young children ages 5-8 in a Kindergarten through third grade setting. The primary purpose of this course is to practice and reflect on various teaching strategies and approaches under the guidance and support of a mentor teacher. The emphasis will be on designing, implementing, and evaluating classroom experiences for young children. These experiences will be planned considering students' cognitive, social, emotional, linguistic, cultural, and special needs. Observation, and evaluation of classroom experiences, environmental design, classroom management, and parent communication will be emphasized to promote optimal development for young children. Biblical perspectives will be integrated throughout the course.",Other,undergraduate,False,True,False,False,False,True
vanguard,2026,2026-2027,ECED,470,Special Topic,,Other,undergraduate,False,False,False,False,False,True
vanguard,2026,2026-2027,ECED,499,Capstone for Early Childhood Education,"This course will provide students the opportunity to integrate theories of child development, faith and learning, and principles of effective early education practice as a culmination of their learning at the bachelor's degree-level. Students will reflect on their knowledge of, understanding about, and ability to apply their learning through the degree program to each of the Teaching Performance Expectations in their practice. Students will build a professional ePortfolio that will demonstrate their competence and achievement of the Teaching Performance Expectations, experience in the field, and preparedness to serve as highly-effective early childhood educators. The next steps in professional development will be discussed and a plan for further growth as a professional in the early education field will be developed.",Other,undergraduate,False,False,False,False,False,True
vanguard,2026,2026-2027,ECED,500,Classroom Management and Guiding the Young Child's Behavior,"This course examines appropriate child guidance principles and practices. Positive teacher/child interactions along with guidance techniques, self-regulation and self-control concepts, the setting of clear expectations and affirming positive behavior, classroom management techniques, and conflict resolution strategies will be examined. Parental involvement and school/family partnerships will be incorporated to serve children in their supporting environments.",Other,graduate,False,False,False,False,False,True
vanguard,2026,2026-2027,ECED,501,Fundamentals of Early Childhood Education: Focus on Grades PK-3,"This course provides a comprehensive overview of the field of early childhood education. It includes California State-adopted student content standards and frameworks for early childhood education (grades PK-3), developmentally appropriate theories and approaches, and subject specific-pedagogical strategies, with a focus on literacy and mathematics. Additionally, it explores diverse instructional strategies for English Language Development, tailored to multilingual and English learner students. The course emphasizes meeting the needs of every child and offers up-to-date information and strategies to cultivate competent, informed early childhood professionals. Foundational themes central to the field today are integrated throughout the course.",Other,graduate,True,False,False,False,False,True
