university,academic_year,academic_year_label,department_code,course_number,title,description,broad_area,level,progressive_signal,western_canon_signal,climate_narrow_signal,climate_broad_signal,cross_listed,deduplicated
vanguard,2026,2026-2027,OTG,670,Special Topic:,Study in a special topic in Old Testament.,Other,graduate,False,False,False,False,False,True
vanguard,2026,2026-2027,OTG,690,Seminar in Old Testament,"An investigation of one topic in the Old Testament of particular relevance to graduate students in religion. Examples are: Exodus, Isaiah, and Psalms.",Other,graduate,False,False,False,False,False,True
vanguard,2026,2026-2027,PLST,291,Special Topic:,Study of a special topic in pastoral leadership. May be repeated for credit.,Other,undergraduate,False,False,False,False,False,True
vanguard,2026,2026-2027,PLST,310,Intro/Christian Leadership,"An introduction to a theology of leadership through the development of a healthy interior life; an understanding of a situational approach to leadership; and knowledge of the leader's role in the corporate vision, spirituality, and mission of the Christian community. Core requirement for the religion major offered every semester.",Other,undergraduate,False,False,False,False,False,True
vanguard,2026,2026-2027,PLST,312,Intro/Pastoral Care,An introduction to a theology of care and counsel as a central focus of leadership-lay and vocational-in the mission and ministry of the Christian community. Core requirement for the religion major offered every spring.,Other,undergraduate,False,False,False,False,False,True
vanguard,2026,2026-2027,PLST,314,Intro/Preaching & Teaching,An introduction to the proclamation mission of communicating the gospel through teaching and preaching. Core requirement for the religion major offered every semester.,Other,undergraduate,False,False,False,False,False,True
vanguard,2026,2026-2027,PLST,420,Disciplines/Spiritual Life,"A study of the biblical and theological foundations of spirituality within the Pentecostal/charismatic tradition. The emphasis will be on building a functioning spiritual life by the exercise of spiritual disciplines such as prayer, worship, community, fasting, and other disciplines. Core requirement for the religion major offered every fall.",Other,undergraduate,False,True,False,False,False,True
vanguard,2026,2026-2027,PLST,425,Narrative/Expository Preaching,An examination of narrative and expository preaching methods as complementary styles of preaching to strengthen pulpit ministry.,Other,undergraduate,False,False,False,False,False,True
vanguard,2026,2026-2027,PLST,430,Management/Christian Organztns,"Exploring effective management from a systems perspective that examines the internal processes of a learning organization as well as its relationship with the environment. Selected topics will also include recruitment and training of volunteers, conflict management, team building, planning and financial management, and legal issues.",Other,undergraduate,False,False,False,False,False,True
vanguard,2026,2026-2027,PLST,432,Women in Ministry,"An overview of the biblical and contemporary views on the leadership roles of women in the church, and the relevance of women in ministry for the modern church.",Other,undergraduate,False,True,False,False,False,True
vanguard,2026,2026-2027,PLST,440,Pastoral Care/Counseling,"The application of counseling and guidance principles to the work of the pastor and other religious workers in the field of pastoral care, including the use of case studies in ministering to persons with illness, grief, home, youth, or other types of special problems.",Other,undergraduate,False,False,False,False,False,True
vanguard,2026,2026-2027,PLST,449,Denominational Polity,"Guided reading and discussion of official district and national constitutions and bylaws, and research in denominational history and doctrine. Designed for students seeking ministerial credentials with the Assemblies of God.",Other,undergraduate,False,False,False,False,False,True
vanguard,2026,2026-2027,PLST,450,Ministerial Internship,"The internship program is a full-time, one-semester course of intensive in-service ministerial training in an assigned church under the supervision of a pastor and religion faculty member. Specific internship modules may also be taken during two, three, or four semesters. A maximum number of twelve units may be taken for internship credit. Note: Application forms are available in the Department of Religion office.",Other,undergraduate,False,False,False,False,False,True
vanguard,2026,2026-2027,PLST,460,Practicum,"A learning experience which integrates classroom theory with practice through assigned responsibilities in local churches, hospitals, mission fields, or other appropriate institutions under supervision by both the on-scene administrator and the religion faculty member. May be repeated for credit. Note: Application forms are available in the Department of Religion office.",Other,undergraduate,False,False,False,False,False,True
vanguard,2026,2026-2027,PLST,461,Integrative Field Studies,"Highly Recommended: PLST 450 or PLST 460A course designed to integrate theory with guided field experience in the student's chosen field. The intent is to reflect theologically in a ministry setting with special attention given to examining one's spiritual gifts, calling, identity, and preparation.",Other,undergraduate,True,False,False,False,False,True
vanguard,2026,2026-2027,PLST,470,Special Topic:,Study of a special topic in pastoral leadership. May be repeated for credit.,Other,undergraduate,False,False,False,False,False,True
vanguard,2026,2026-2027,PHIL,201,Introduction to Philosophy,"An introductory study which aims to provide a basic understanding of the nature and aims of philosophy, an acquaintance with some representative philosophical problems, an introduction to the methodology of philosophical inquiry, and a mastery of some of the terminology employed in philosophical discussion. This course does not fulfill a core curriculum requirement. Core requirement for the religion major offered every semester.",Humanities,undergraduate,False,False,False,False,False,True
vanguard,2026,2026-2027,PHIL,470,Special Topic:,Study of a special topic in philosophy. May be repeated for credit.,Humanities,undergraduate,False,False,False,False,False,True
vanguard,2026,2026-2027,PSCI,130C,General Physics I,"This is a trigonometry based course in mechanics and heat. Topics include kinematics, Newton's Laws, rotational motion, fluid mechanics, and laws of thermodynamics. A knowledge of algebra, trigonometry, and vectors is necessary for success in this class. Should students not be prepared to succeed in general physics I, it is recommended that students complete MATH-170C or MATH-180C before taking general physics I.  Three hours of lecture. This course fulfills the core curriculum lecture requirement in natural sciences.",Other,undergraduate,False,False,False,False,False,True
vanguard,2026,2026-2027,PSCI,130CL,General Physics I Lab,"Laboratory experiments will demonstrate principles studied during lecture sessions. These experiments demonstrate principles in the areas of rotational motion, momentum, fluid mechanics, heat transfer, friction and conservation of mechanical energy. A knowledge of algebra, trigonometry, and vectors is necessary for success in this class. Should students not be prepared to succeed in general physics I lab, it is recommended that students complete MATH-170C or MATH-180C before taking general physics I lab. This course fulfills the core curriculum laboratory requirement in the natural sciences. Laboratory three hours. Lab fee.",Other,undergraduate,False,False,False,False,False,True
vanguard,2026,2026-2027,PSCI,131,General Physics II,"This is a trigonometry based course in electricity, magnetism, sound and light.  Topics include mechanical waves, sound, Coulomb's Law, electrostatics, electric circuits, introductory electronics, magnetic fields, induction, wave mechanics, geometrical optics, interference, diffraction and polarization.  Three hours of lecture.  This course fulfills the core curriculum lecture requirement in natural science.",Other,undergraduate,False,False,False,False,False,True
vanguard,2026,2026-2027,PSCI,131L,General Physics II Lab,"Laboratory experiments will demonstrate principles studied during lecture sessions.  These experiments demonstrate principles in the areas of electrical current, electrical potential, electrical circuits, magnetic fields, optics, wave motion, and optics.  This course fulfills the core curriculum laboratory requirement in the natural sciences.  Laboratory three hours.  Lab fee.",Other,undergraduate,False,False,False,False,False,True
vanguard,2026,2026-2027,PSCI,215,Fundamentals of Earth Science,"Earth science including physical and historical geology, meteorology, and descriptive astronomy; the economic, social, and philosophical aspects of the subject matter. Lab fee. (meets Natural Science/Math requirement). (Professional Education Course).",Other,undergraduate,False,False,False,False,False,True
vanguard,2026,2026-2027,PSCI,215C,Fundamentals of Earth Science,"Earth Science including physical and historical geology, oceanography, and descriptive astronomy; economic, social, and philosophical aspects of the subject matter. A three-day field trip is required. This course is recommended for Liberal Studies majors. Lecture three hours each week. This course fulfills the core curriculum lecture requirement in the natural sciences.  Fee for the field trip for those not concurrently enrolled in PSCI 215-CL.",Other,undergraduate,False,False,False,False,False,True
vanguard,2026,2026-2027,PSCI,215CL,Fundamentals of Earth Science Lab,"Classification of rocks, visiting various geological sites, use of topographic and geological maps, oceanographic sampling and techniques, climactic patterns, meteorological measurements, and the use of an astronomical telescope. This course fulfills the core curriculum laboratory requirement in the natural sciences. Lab and field trip fee",Other,undergraduate,False,False,False,False,False,True
vanguard,2026,2026-2027,PSCI,216,Fundamentals of Physical Science,"This course in physical science presents materials in physics, chemistry, and astronomy that are conceptual in nature with minimal reliance on the quantitative rules of mathematics as a tool for understanding. A strong emphasis is placed on proper use of vocabulary words to understand and explain topics in the fields of mechanics, properties of matter, heat, sound, electricity and magnetism, and light. Classroom demonstrations and videos are used to assist the student in learning the everyday principles of nature. Lab fee. (meets Natural Science/Math requirement) (Professional Education Course)",Other,undergraduate,False,False,False,False,False,True
vanguard,2026,2026-2027,PSCI,216C,Fundamentals of Physical Science,"This course in physical science considers topics in physics, chemistry, and astronomy that are conceptual in nature with minimal reliance on the quantitative rules of mathematics as a tool for understanding. A strong emphasis is placed on proper use of vocabulary words to understand and explain topics in the fields of mechanics, properties or matter, heat, sound, electricity and magnetism, and light. This course fulfills the core curriculum lecture requirement in the natural sciences.  Lecture three hours per week.",Other,undergraduate,False,False,False,False,False,True
vanguard,2026,2026-2027,PSCI,216CL,Fundamentals of Physical Science Lab,"An introduction to laboratory practice and procedure in physical science and excercises in mechanics, properties of matter, heat, sound electricity, magnetism, and light. This course fulfills the core curriculum laboratory requirement in the natural sciences. Laboratory Fee.",Other,undergraduate,False,False,False,False,False,True
vanguard,2026,2026-2027,PSCI,223C,Mechanics of Solids and Fluids,"This calculus-based course is designed for students with majors in the engineering and physical sciences.  The course focuses on the mechanics of solid and fluids.  Topics include statics, equilibrium of rigid bodies, free-body diagrams, pericle and rigid body kinematics, li near and angular motion, impluse and momentum, static and dynamic friction, elasticity, fluid properties, laminar and turbulent flow and fluid statics.",Other,undergraduate,False,False,False,False,False,True
vanguard,2026,2026-2027,PSCI,223CL,Mechanics of Solids and Fluids Lab,"Laboratory will include experiments in the areas of statics and dynamics of particles and ridgid bodies in two and three dimensions, static and dynamic friction, linear and angular momentum, fluid properties, laminar and turbulent flow and fluid statics. Laboratory three hours.  Lab fee.",Other,undergraduate,False,False,False,False,False,True
vanguard,2026,2026-2027,PSCI,225,Electricity and Magnetism,"This calculus-based course is designed for students with majors in the engineering and physical sciences. This course focuses on the mathematical and physical description of electrostatics, electric field and potential, electrical fundamentals (charge, current, voltage, resistance, power, energy), DC circuit analysis with Ohm's Law and Kirchhoff's Law, AC circuit analysis with phase diagrams, measuring devices (e.g., voltmeter, ammeter), capacitance, magnetic fields and their effect on moving charges and currents, magnetic fields produced by various current configurations, induced emf, mutual and self-inductance, basic theory of dielectrics, magnetic properties of materials and Maxwell's Equations in integral and differential form.",Other,undergraduate,False,False,False,False,False,True
vanguard,2026,2026-2027,PSCI,225L,Electricity and Magnetsm Lab,"Laboratory will include experiments in the areas of electrostatics, DC and AC circuits, magnetic fields, and electromagnetic induction.  Laboratory three hours.  Lab fee.",Other,undergraduate,False,False,False,False,False,True
vanguard,2026,2026-2027,PSCI,227,"Waves, Optics and Modern Physics","This course is designed for students with majors in the engineering and physical sciences. Topics covered include geometric and physical optics, waves and the interaction of light and matter, introductory quantum mechanics, solid state physics, nuclear physics and special relativity.",Other,undergraduate,False,False,False,False,False,True
vanguard,2026,2026-2027,PSCI,227L,"Waves, Optics, and Modern Physics Lab","Laboratory will include experiments in the areas of mechanical wave motion, sound, interference, geometrical optics, interference, diffraction and polarization of light, radioactivity and the photoelectric effect. Laboratory three hours. Lab fee.",Other,undergraduate,False,False,False,False,False,True
vanguard,2026,2026-2027,POLS,155C,American Democracy,"Designed to acquaint the student with the United States political system, including constitutional developments of the United States and of California, and stimulate reflection on the intersection of Christianity and citizenship. Strongly recommended as a prerequisite for upper-division U.S. Government classes.",Social Sciences,undergraduate,False,False,False,False,False,True
vanguard,2026,2026-2027,POLS,240,Economics,"The course begins with an examination of influential economic philosophies and the debates they have sparked.  How do societies encourage economic growth, allocate resources, protect and help the poor, and balance competing economic claims?  How do domestic policy choices affect other countries?  By studying basic economic principles and case studies that highlight economic challenges around the world, students will learn to see the complexity of economic and political choices.",Social Sciences,undergraduate,False,False,False,False,False,True
vanguard,2026,2026-2027,POLS,262,Research Methods in Hist/Poli Science,"This course is cross-listed with HIST-262 . Writing intensive class which will teach students proper research techniques and the different aspects of History and Political Science scholarship. Class will focus on how to write a major research paper. Strongly recommended before taking upper-division History and Political Science courses. Satisfies ENGL-220C requirement.  Students are expected to take HIST-262 or POLS-262 , but if ENGL-220C was taken before a History & Political Science major was declared, it will be an acceptable substitution. Must be passed with a ""C"" (not a ""C-"") or better to fulfill the core curriculum requirement.",Social Sciences,undergraduate,False,False,False,False,False,True
vanguard,2026,2026-2027,POLS,304,Political Psychology,"This course is cross-listed with PSYC-304 . This course evaluates theories from the field of Psychology to help us understand how people think and feel about politics. Students will investigate how social, cognitive, emotive, and physiological factors interact to influence political preferences and opinions.",Social Sciences,undergraduate,False,False,False,False,False,True
vanguard,2026,2026-2027,POLS,323,Christian Political Thought,"This class is a study of the complex relationship between church and state, the Kingdom of Heaven as it relates to earthly kingdoms, and what civil law means in light of grace, as understood by major Christian philosophers in church history.  Students examine scripture, as well as the writings of Augustine, Thomas Aquinas, Martin Luther, John Calvin, the American Puritans, and contemporary thinkers. (This course is currently in teach out. See POLS-324 .)",Social Sciences,undergraduate,True,True,False,False,False,True
vanguard,2026,2026-2027,POLS,324,Comparative Political Thought,"A historical review of Classical, American, Christian, and Modern political thought from Plato to present.",Social Sciences,undergraduate,False,True,False,False,False,True
vanguard,2026,2026-2027,POLS,330,"Race, Identity & Politics","Examines the impact of race, ethnicity, and identity in American politics and policy; surveys political attitudes, behavior, and experiences of Americans of African, Asian and Latinx descent.",Social Sciences,undergraduate,True,False,False,False,False,True
vanguard,2026,2026-2027,POLS,332,Gender & Politics,"Examines the relationship between gender and political participation and representation; explores inequalities and how gender hierarchy is produced and reproduced through socio-cultural, economic, and political practices and structures.",Social Sciences,undergraduate,True,False,False,False,False,True
vanguard,2026,2026-2027,POLS,345,U.S. Foreign Policy,"Principles, practice, and ethical issues of United States foreign policymaking. Particular emphasis on the policymaking process.",Social Sciences,undergraduate,False,False,False,False,False,True
vanguard,2026,2026-2027,POLS,361,"Political Parties, Campaigns & Elections","Organizations and function of political parties, nominations, elections, tactics of campaigning and campaign finance; explores mass political attitudes and behavior of American electorate.",Social Sciences,undergraduate,False,False,False,False,False,True
vanguard,2026,2026-2027,POLS,370,Constitutional Law,"This course is devoted to the U.S. Supreme Court.  We will examine the Court as an institution, its historical development, and the way it works today.  We will meet particular justices throughout the Court's history, and examine their roles and judicial philosophies.  The class will then study the Court's most important rulings, and consider how they shaped the power of the federal government, its relationship with the states, as well as its protection of civil rights and liberties, and the shape of our national life.",Social Sciences,undergraduate,False,False,False,False,False,True
vanguard,2026,2026-2027,POLS,438,Comparative Politics,"Comparative politics is the study of political systems around the world.  Students will examine the theoretical background of various regime types, the history of modern nation-states, and survey a variety of existing political systems.  Students will consider the difference between autocracy and democracy, the causes of poverty and development, and the consequences of the way power is distributed and checked within any society.",Social Sciences,undergraduate,False,False,False,False,False,True
vanguard,2026,2026-2027,POLS,446,Public Policy Issues,"A conclusion to the institutions classes (Congress, the Presidency and Constitutional Law), this course is a study of major laws and their effect on society, with particular attention devoted to immigration, poverty, education and healthcare.  Throughout, students will consider the cost-benefit analysis, public administration, policy assessment, and the various views about concepts of the public good.",Social Sciences,undergraduate,False,False,False,False,False,True
vanguard,2026,2026-2027,POLS,450,Political Science Teaching Internship,"Regular hours each week for classes and/or meetings are established at the beginning of the semester. The intern assists an instructor in planning and conducting a course and/or laboratory session. Maximum of three units. (Maximum six units for HIST-450 , POLS-450 , HIST-454 , POLS-454 , HIST-457 , and POLS-457 .)",Social Sciences,undergraduate,False,False,False,False,False,True
vanguard,2026,2026-2027,POLS,454,History/Political Science Internship,"Internship with Vanguard University, local museum, archives, government office, or political campaign. Maximum of three units. (Maximum six units for HIST-450 , POLS-450 , HIST-454 , POLS-454 , HIST-457 , and POLS-457 .)",Social Sciences,undergraduate,False,False,False,False,False,True
vanguard,2026,2026-2027,POLS,456,U.S. Congress and Representation,Exploration of theoretical concept of representation; motivations and behavior of Members of Congress; impact of money and interest groups on legislative bills and campaigning.,Social Sciences,undergraduate,False,False,False,False,False,True
vanguard,2026,2026-2027,POLS,457,Research Assistantship,"Advanced work in research in Political Science in an on-going project with the cooperation and supervision of a faculty member. Students will meet with instructor weekly to discuss findings and progress. Maximum three units. (Maximum six units for HIST-450 , POLS-450 , HIST-454 , POLS-454 , HIST-457 , and POLS-457 .)",Social Sciences,undergraduate,False,False,False,False,False,True
vanguard,2026,2026-2027,POLS,469,Special Topic: U.S.:,Experimental or occasional courses not offered on a regular basis. May be repeated for credit.,Social Sciences,undergraduate,False,False,False,False,False,True
vanguard,2026,2026-2027,POLS,470,Special Topic: Non-U.S.:,Experimental or occasional courses not offered on a regular basis. May be repeated for credit.,Social Sciences,undergraduate,False,False,False,False,False,True
vanguard,2026,2026-2027,POLS,472,U.S. Presidents and the Presidency,"Historical development and operation of the Presidency as an institution, examines sources of presidential power, recent leadership styles and decision-making within the presidency.",Social Sciences,undergraduate,False,False,False,False,False,True
vanguard,2026,2026-2027,POLS,482,International Politics,Examination of the concepts and principles of the international political system.,Social Sciences,undergraduate,False,False,False,False,False,True
vanguard,2026,2026-2027,PNSG,610,Theories of Human Behavior,"This course presents neurobiological, behavioral, and psychodynamic theories of behavior andpsychiatric/mental illnesses as they manifest among members of diverse cultural groups across the lifespan. A theoretical foundation for subsequent coursework in primary psychiatric/mentalhealth care is provided for the role of the psychiatric mental health nurse practitioner.",Other,graduate,True,False,False,False,False,True
vanguard,2026,2026-2027,PNSG,620,Role of PMHMP in Psychological Assessment,"This course introduces the role of the advanced practice psychiatric/mental health nurse practitioner (APRN). Focus will include interviewing, assessing, and utilizing data collection methods to analyze, and evaluate bio-sychosocial/spiritual information regarding an individual's mental health across the lifespan.  Assessment of potential and/or existing co-morbidities and health problems are integrated to promote optimal outcomes. Diagnostic reasoning is based on the Diagnostic Statistical Manual is essential to role development. Differential diagnoses, diseasemanagement, evidence-based practice, and health promotion that includes client and nurse practitioner collaboration is fundamental.",Other,graduate,False,False,False,False,False,True
