university,academic_year,academic_year_label,department_code,course_number,title,description,broad_area,level,progressive_signal,western_canon_signal,climate_narrow_signal,climate_broad_signal,cross_listed,deduplicated
vanguard,2026,2026-2027,ACCT,P225,Principles of Financial Accounting,"This course develops students' understanding and application of financial accounting concepts, the accounting cycle processes and documents, and United States accounting and external financial reporting standards. The course emphasizes understanding the financial statements: balance sheet, income statement, statement of retained earnings, and statement of cash flows. The course prepares students for financial analysis; ethical decision making, understanding fraud in the workplace and internal control.",Professional,undergraduate,False,False,False,False,False,True
vanguard,2026,2026-2027,ACCT,P226,Principles of Managerial Accounting,"This course is an introduction to managerial decision-making based on common accounting and financial models and analysis. The course topics include management's responsibility to stakeholders, how costs behave, cost-volume-profit analysis, activity-based costing, budgeting, standard costing, performance measurements, and financial analysis.",Professional,undergraduate,False,False,False,False,False,True
vanguard,2026,2026-2027,ACCT,225,Principles of Financial Accounting,"This course develops students' understanding and application of financial accounting concepts, accounting cycle processes and documents, and United States accounting and external financial reporting standards. The course emphasizes understanding financial statements: balance sheet, income statement, statement of retained earnings, and statement of cash flows. The course prepares students for financial analysis, ethical decision making, understanding fraud in the workplace and internal control.",Professional,undergraduate,False,False,False,False,False,True
vanguard,2026,2026-2027,ACCT,226,Principles of Managerial Accounting,"This course is an introduction to managerial decision-making based on common accounting, financial models and analysis. The course topics include management's responsibility to stakeholders, how costs behave, cost-volume-profit analysis, activity-based costing, budgeting, standard costing, performance measurements, and financial analysis.",Professional,undergraduate,False,False,False,False,False,True
vanguard,2026,2026-2027,ACCT,320,Accounting Information Systems,"This course introduces students to organization and implementation of information technology and the study of computer-based systems for the collection, organization, and presentation of accounting information.",Professional,undergraduate,False,False,False,False,False,True
vanguard,2026,2026-2027,ACCT,321,Accounting and Finance for Decision Making,"This course is on teach out. Please take ACCT-226 .  This course examines managerial decision-making based on common accounting and financial models and analysis.   The course topics include management's responsibility to stakeholders, how costs behave, cost-volume-profit analysis, activity based costing, budgeting, standard costing, performance measurements, and financial analysis.  The course continues to develop students' understanding of annual reports and financial statement analysis within the entity's industry.",Professional,undergraduate,False,False,False,False,False,True
vanguard,2026,2026-2027,ACCT,324,Intermediate Accounting I,"Studies accounting and reporting of complex business operating activities and financing activities according to generally accepted accounting principles in the United States. Compares United States accounting standards to international accounting standards. Topics include revenue recognition, inventory valuation, and debt and equity financing.",Professional,undergraduate,True,False,False,False,False,True
vanguard,2026,2026-2027,ACCT,325,Intermediate Accounting II,"Continues to study accounting and reporting of complex business activities and transactions. The focus is on the investing activities of business and financial reporting. Topics include investments, leases, earnings per share, and analysis of financial statements. The content includes the study of accounting and reporting standards in the United States with comparisons to international accounting standards.",Professional,undergraduate,False,False,False,False,False,True
vanguard,2026,2026-2027,ACCT,332,Cost Accounting,Pre-requisite: ACCT 226.  Accounting information for management; cost records; cost behavior and allocation; product costing and inventory valuation; flexible budgeting; standard costs; responsibility accounting; cost planning and control; and analytical procedures,Professional,undergraduate,False,False,False,False,False,True
vanguard,2026,2026-2027,ACCT,427,Auditing,"Studies how to conduct external audits or become internal financial managers of organizations that are audited. United States auditing standards are studied and compared to international standards. Course topics include generally accepted auditing standards, fraudulent financial reporting and audit failure, effective internal control procedures, and the influence of the Securities and Exchange Commission on oversight of the accounting profession.",Professional,undergraduate,False,False,False,False,False,True
vanguard,2026,2026-2027,ACCT,428,Advanced Accounting,"The course covers complex accounting and reporting for corporate and non-corporate entities, for profit and not-for-profit entities. It compares and contrasts accounting and financial reporting for partnerships, for-profit complex corporate entities, state and local governments, health and welfare organizations, and government and non-government universities.",Professional,undergraduate,False,False,False,False,False,True
vanguard,2026,2026-2027,ACCT,440,Federal Taxation-Individual,"The course covers federal income taxation as it applies to individuals. This is an introduction to the federal tax model and how to apply it to the components of taxable income, tax credits, and types of taxes.",Professional,undergraduate,False,False,False,False,False,True
vanguard,2026,2026-2027,ACCT,442,Federal Taxation-Corporate,"The subject matter of this course is federal income taxation as it applies to partnerships, fiduciaries and corporations. It builds on the federal tax model, emphasizing concepts about issues specific to corporations.",Professional,undergraduate,False,False,False,False,False,True
vanguard,2026,2026-2027,ACCT,470,Special Topics,topic courses are developed by faculty according to student interest and are offered periodically,Professional,undergraduate,False,False,False,False,False,True
vanguard,2026,2026-2027,ACCT,490,Seminar:,Mutual investigation of one topic in accounting of particular relevance to upper division majors.  May be repeated for credit provided topics are dissimilar.,Professional,undergraduate,False,False,False,False,False,True
vanguard,2026,2026-2027,ACCT,500,Research in Accounting,"This course provides an in-depth exploration of contemporary methodologies, theoretical frameworks, and empirical studies within the field. Students will engage with various research designs, data analysis techniques, and the ethical considerations inherent in accounting research. Students will learn to evaluate existing literature, formulate research questions, and develop their own research proposals, fostering a comprehensive understanding of the role of research in advancing accounting knowledge and practice.",Professional,graduate,False,False,False,False,False,True
vanguard,2026,2026-2027,ACCT,501,Auditing & Assurance,"This course is designed as a discussion-based seminar and case analysis to provide graduate students with an understanding of auditing theory, practice, and research methods. This course continues from the undergraduate auditing course by implementing the auditing principles, standards, procedures, and practices learned in that course and applying them in case analysis. Topics include research of professional accounting and auditing standards, technical memo writing, professional ethics, professional judgment, sampling, forensic examinations, integrated audits, quality control reviews, assurance services, and other contemporary issues in auditing.",Professional,graduate,False,False,False,False,False,True
vanguard,2026,2026-2027,ACCT,502,Federal Tax Research,"This course covers accounting and tax literature research with the use of technology and the communication of the findings in written and oral formats. It examines basic tax law and application of research tools, including the interpretation of statutes, cases, and rulings, within the context of the professional responsibilities of a tax practice.",Professional,graduate,False,False,False,False,False,True
vanguard,2026,2026-2027,ACCT,520,Advanced Taxation of Business,"The course will cover advanced federal taxation and planning of flow-through entities and other special entities. Topics such as tax law sources and tax research; the tax advantages and disadvantages of various business entities as well as how entrepreneurs may choose the optimal entity for tax purposes; taxable and nontaxable methods of mergers, acquisitions, and divestitures; fundamental concepts of consolidated tax returns for C Corporations; and the accounting for income taxes.",Professional,graduate,False,False,False,False,False,True
vanguard,2026,2026-2027,ACCT,521,Information Technology Auditing,"Students will focus on learning the components of information technology and how they are organized, developed and managed; how technology affects audit responsibilities; and the guidelines governing audits performed under the AICPA standards.",Professional,graduate,False,False,False,False,False,True
vanguard,2026,2026-2027,ACCT,522,International Accounting,"A comparative review of US GAAP and International Financial Reporting Standards (IFRS). This course examines methods of international accounting concepts, practices, and issues. The course focuses on the accounting issues encountered by multinational companies engaged in international trade and invested in foreign operations.",Professional,graduate,False,False,False,False,False,True
vanguard,2026,2026-2027,ACCT,523,Data Analytics for Accounting,"Students will understand the role that digital technologies and statistical analysis play in solving complex accounting issues. The students will develop an advanced accounting analytics skills needed for accounting professionals. Topics include data mining, data visualization, predictive analytics, and emerging technologies.",Professional,graduate,False,False,False,False,False,True
vanguard,2026,2026-2027,ACCT,524,Accounting for Income Taxes,"Students will learn about issues surrounding the timing of income and deductions for federal income tax purposes, including accounting periods, the cash receipts and disbursements and accrual methods, installment sales, interest income and deductions, and time value of money provisions.",Professional,graduate,False,False,False,False,False,True
vanguard,2026,2026-2027,ACCT,525,Sustainability & Corporate Governance Accounting,"This course provides students a high level of expertise in central areas of accounting and finance with a sustainability perspective, covering topics such as firm valuation, financing, ESG reporting, and risk management.",Professional,graduate,False,False,False,True,False,True
vanguard,2026,2026-2027,ACCT,560,Professional Development,"This course provides students with a hands-on opportunity to enhance and practice their communication skills and develop their ability to convey complex financial information clearly and persuasively. By engaging in peer reviews and receiving constructive feedback from industry professionals, students will refine their presentation techniques, improve their business writing, and gain confidence in their interpersonal communication abilities.",Professional,graduate,False,False,False,False,False,True
vanguard,2026,2026-2027,ACCT,600,Financial Statement Analysis & Valuation,"This course examines the tools and means to maximize business performance while exploring improvement alternatives. Topics such as financial statement analysis, budgeting, tax issues, restructuring, reengineering, and current topics in financial management are discussed. Learning focuses on methods used by managers such as ratio and profitability analysis, analysis of the statement of cash flows, pro forma forecasting, (credit and governance) risk analysis, earnings quality analysis, and valuation to guide management actions in ways that are both financially and biblically appropriate.",Professional,graduate,False,True,False,False,False,True
vanguard,2026,2026-2027,ACCT,601,Professional Ethics and Responsibilities in Accounting,"This course covers ethical issues and standards in the accounting profession with an emphasis on the AICPA Code of Professional Conduct. Students will discuss the conceptual framework and the necessity of ethics in the application of accounting principles, tax preparation and attest services. Throughout the course students will review actual cases where professional accountants have failed to uphold the moral and ethical code and subsequent social and economic damages. Students will learn what it means to be both independent in both fact and appearance.",Professional,graduate,False,False,False,False,False,True
vanguard,2026,2026-2027,ACCT,602,Integrated Capstone Review,"This course is designed to comprehensively prepare students for the CPA examination. This intensive program integrates advanced accounting concepts, ethical considerations, and practical applications, ensuring that students are well-equipped to tackle the complexities of the exam. The course emphasizes critical thinking and problem-solving, enabling students to synthesize knowledge from various accounting disciplines.",Professional,graduate,False,False,False,False,False,True
vanguard,2026,2026-2027,ACCT,620,Advanced Government & Not-for-Profit Accounting,"This course explores the fundamental principles of governmental accounting in accordance with Generally Accepted Accounting Principles (GAAP). It focuses on the state and local government financial reporting model as established by the Governmental Accounting Standards Board (GASB) Statement No. 34, along with its subsequent modifications and clarifications by the GASB. Additionally, the course introduces Accounting for Nonprofit Entities, covering their financial reporting objectives. The course concludes by examining the Government Auditing Standards set by the U.S. Government Accountability Office (GAO) and their relevance to audits of governmental and nonprofit entities.",Professional,graduate,False,False,False,False,False,True
vanguard,2026,2026-2027,ACCT,621,Advanced Auditing & Fraud Examination,"An in-depth study of advanced treatment of contemporary auditing topics and assurance services with a focus on fraud examination from an external auditor's perspective. The course utilizes problems, cases, and projects using digital evidence and analytical tools relating to fraud examination and forensic accounting.",Professional,graduate,False,False,False,False,False,True
vanguard,2026,2026-2027,ACCT,622,Advanced Accounting Topics,"Advanced accounting concepts for accounting professionals. Topics include examining examples of real-world complex transactions, and will include advanced revenue recognition, sophisticated financial instruments, complex lease accounting issues, advanced issues in consolidation, accounting for errors and changes in estimate, share-based payment pricing models and modifications, segment reporting, and partnership accounting.",Professional,graduate,False,False,False,False,False,True
vanguard,2026,2026-2027,ACCT,623,Advanced Managerial and Cost Accounting,"Advanced cost accounting from a managerial, conceptual and technical viewpoint; product, labor, material and overhead costing; planning and control processes; and analytical procedures. Topics include problems in planning, budgeting and cost control for decision making from a quantitative analysis approach.",Professional,graduate,False,False,False,False,False,True
vanguard,2026,2026-2027,ANTH,102C,Intro to Cultural Anthropology,The study of culture emphasizing culture's origins and processes.  Concepts and theories about culture that apply to life in both developing and developed societies with the aim of solving human problems.,Social Sciences,undergraduate,False,False,False,False,False,True
vanguard,2026,2026-2027,ANTH,453,"Language,Culture/Linguistics","This course is cross listed with ENGL-453 . This course surveys the acquisition and use of language within a cultural context. It examines the relationship of language to culture, language acquisition, and language analysis or linguistics, emphasizing the utility of such knowledge for educators. Stress is given to understanding language's reciprocal relation with culture, the nature of language systems, and linguistic analysis to enable educators a better comprehension of second language acquisition within learning environments.",Social Sciences,undergraduate,False,False,False,False,False,True
vanguard,2026,2026-2027,ART,252C,Hist/Appreciation of Art,"A survey of painting, sculpture, and architecture beginning with the Renaissance and concluding with Modern Art. Illustrated lectures, reading, and study of current exhibitions. Field trip fee.",Humanities,undergraduate,False,True,False,False,False,True
vanguard,2026,2026-2027,ART,330,Art Techniques for Teachers,"Art experiences for all grades. Understanding and creative use of materials, tools, ideas, and their sources as they apply to elementary education. Approximately one hour of lecture followed by two hours of laboratory projects. Lab fee.",Humanities,undergraduate,False,False,False,False,False,True
vanguard,2026,2026-2027,BINT,270,Interpreting the Bible,"An introductory examination of biblical exposition for ministry which includes an understanding of the theological foundations for preaching, an acquaintance with the basic secondary materials used in biblical interpretation, and an overview of the procedures of biblical exegesis. Core requirement for the religion major offered every semester.",Professional,undergraduate,False,True,False,False,False,True
vanguard,2026,2026-2027,BINT,440,New Testament Backgrounds,"A study of the Greek, Roman, and Jewish backgrounds of the New Testament is made in order to give the New Testament student an understanding of the world of Jesus and the early church. Extensive readings in representative texts from the New Testament period, including the Dead Sea Scrolls.",Professional,undergraduate,False,False,False,False,False,True
vanguard,2026,2026-2027,BINT,470,Special Topic:,Study in a special topic in the field of Biblical interpretation. May be repeated for credit.,Professional,undergraduate,False,True,False,False,False,True
vanguard,2026,2026-2027,BLAN,101,Introduction to Biblical Lang,An introduction to the Greek and Hebrew languages which prepares students to do basic lexical and grammatical research in both print and digital media. Core requirement for the religion major and prerequisite to BINT-270 . Offered every semester.,Other,undergraduate,False,True,False,False,False,True
vanguard,2026,2026-2027,BLAN,201,Beginning Greek I,A two-semester course of instruction in the grammar of the Greek New Testament. BLAN 201 or demonstrated proficiency serves as prerequisite to BLAN 202. By the end of the second semester the student should be translating portions of the Greek New Testament. Offered alternate years.,Other,undergraduate,False,False,False,False,False,True
vanguard,2026,2026-2027,BLAN,202,Beginning Greek II,A two-semester course of instruction in the grammar of the Greek New Testament. BLAN-201 or demonstrated proficiency serves as prerequisite to BLAN-202 . By the end of the second semester the student should be translating portions of the Greek New Testament. Offered alternate years.,Other,undergraduate,False,False,False,False,False,True
vanguard,2026,2026-2027,BLAN,204,Beginning Hebrew I,"Foundation in the basics of Hebrew morphology, vocabulary, and syntax. Exercises in reading, writing, and speaking. Three hours of lecture, two of laboratory per week. BLAN-204 or demonstrated proficiency serves as prerequisite to BLAN-205 . Offered alternate years.",Other,undergraduate,False,False,False,False,False,True
vanguard,2026,2026-2027,BLAN,205,Beginning Hebrew II,"Foundation in the basics of Hebrew morphology, vocabulary, and syntax. Exercises in reading, writing, and speaking. Three hours of lecture, two of laboratory per week. BLAN-204 or demonstrated proficiency serves as prerequisite to BLAN-205 . Offered alternate years.",Other,undergraduate,False,False,False,False,False,True
vanguard,2026,2026-2027,BLAN,301,Intermediate Greek I,"An advanced course in New Testament Greek. The student begins a translation and exegesis of the Gospel of John along with an intensive, systematic review of grammar and syntax from an advanced Greek grammar.",Other,undergraduate,False,False,False,False,False,True
vanguard,2026,2026-2027,BLAN,302,Intermediate Greek II,"An advanced course in New Testament Greek. The student begins a translation and exegesis of the Gospel of John along with an intensive, systematic review of grammar and syntax from an advanced Greek grammar.",Other,undergraduate,False,False,False,False,False,True
vanguard,2026,2026-2027,BLAN,306,Intermediate Hebrew I,Review and consolidation of grammar and syntax. Extensive reading in the narrative portions of the Old Testament for style and vocabulary. Offered alternate years.,Other,undergraduate,False,False,False,False,False,True
vanguard,2026,2026-2027,BLAN,307,Intermediate Hebrew II,Review and consolidation of grammar and syntax. Extensive reading in the narrative portions of the Old Testament for style and vocabulary. Offered alternate years.,Other,undergraduate,False,False,False,False,False,True
vanguard,2026,2026-2027,BLAN,480,Advanced Biblical Language Reading,"This course is designed for students who have previously studied a biblical language (Hebrew or Greek) and seek to maintain and strengthen their reading proficiency. Through guided readings, translation exercises, vocabulary reinforcement, and discussions on grammar and syntax, students will engage with biblical texts and related literature to sustain their language skills. The course emphasizes reading fluency and exegetical awareness. Recommended for students who wish to keep their biblical language skills active for research, teaching, or ministry. May be repeated for credit.",Other,undergraduate,False,True,False,False,False,True
vanguard,2026,2026-2027,BIOL,100C,Fundamentals of Biology for Non-Majors,An introduction to the structures and functions of the major plant and animal groups. Focus is directed toward biological principles and problems facing humans in dynamic ecosystems. Lecture three hours. This course fulfills the core curriculum lecture requirement in natural sciences.,STEM,undergraduate,False,False,False,True,False,True
vanguard,2026,2026-2027,BIOL,100CL,Fundamentals/Biology for Non-Majors Lab,"Introduction to biological laboratory procedures. Laboratory exercises in molecular biology, metabolism and physiology, structure, ecology, and taxomonic groups. Laboratory four hours. Lab fee. This course fulfills the core curriculum laboratory requirement in natural sciences.",STEM,undergraduate,False,False,False,False,False,True
vanguard,2026,2026-2027,BIOL,101,Fund. of Biology/Non-Majors with Lab,An introduction to the structures and functions of the major plant and animal groups. Focus is directed toward biological principles and problems facing humans in dynamic ecosystems. Includes three credit hours of lecture and one credit hour of lab. This course fulfills the general education science requirement for professional studies students. Students will be required to purchase lab materials directly from the service provider.,STEM,undergraduate,False,False,False,True,False,True
vanguard,2026,2026-2027,BIOL,111,Principles of Cell and Molecular Biology,"An introductory course for the biological sciences which covers the scientific method, basic biological chemistry, cell structure and function, metabolism and energy transformation, evolution, classification, and other related topics.",STEM,undergraduate,False,False,False,False,False,True
vanguard,2026,2026-2027,BIOL,111L,Principles of Cell/Molecular Biology Lab,"Topics in this course are designed to complement lectures presented in BIOL-111C.  Students will conduct a broad survey of investigations selected to optimize their understanding of basic laboratory techniques and biological principles including microscopy, chromatography, colorimetry and DNA analysis. Lab and field trip fee. This course fulfills the core curriculum laboratory requirement in Natural Sciences; however, this course is designed for Biology majors.",STEM,undergraduate,False,False,False,False,False,True
vanguard,2026,2026-2027,BIOL,112,Principles of Organismal Biology,"An introductory course for the biological sciences which covers the kingdoms of living organisms, plant and animal physiology, population genetics, biodiversity, ecology, and other related topics.",STEM,undergraduate,True,False,False,True,False,True
