university,academic_year,academic_year_label,department_code,course_number,title,description,broad_area,level,progressive_signal,western_canon_signal,climate_narrow_signal,climate_broad_signal,cross_listed,deduplicated
cornerstone,2026,2026-2027,MGT,322,SPORT FACIL/MGT & DESIGN,"This course is a comprehensive overview of facility design and management in the sport industry. The course will include planning and designing facilities that include all levels of sport from professional to recreational venues. Focus will also be placed on managing these facilities with emphasis on maintenance, supervision, scheduling, renovation and innovation. Management functions specific to sport will be explored. The course will be designed to focus on practical, hands-on experiential learning. This will include visits to a variety of sport facilities for knowledge and evaluation purposes. A sport management practicum will also be incorporated into the course.",Professional,undergraduate,False,False,False,False,False,True
cornerstone,2026,2026-2027,MGT,330,HUMAN RESOURCES MGT FOR NON-PROFITS,"This course provides the fundamental concepts, terminology and technical basics involved in public sector human resources management to deal effectively with the human issues in the workplace. Instructors and guest speakers use lectures, case studies and discussions to provide real world perspectives, along with a focus on ethics in human resources management.",Professional,undergraduate,False,False,False,False,False,True
cornerstone,2026,2026-2027,MGT,332,HUMAN RESOURCES MANAGEMENT,"The objectives, functions, and organization of personnel programs; recruitment, selection, training, evaluation, development, and promotion; wage incentives, fringe benefits, OSHA, and the collective bargaining process.",Professional,undergraduate,False,False,False,False,False,True
cornerstone,2026,2026-2027,MGT,333,OPERATIONS & SUPPLY CHAIN MGT,"This course surveys the field of operations management and focuses on the systematic planning, design and operation of processes to produce goods and services, including management tools, quality issues and process engineering and lean/continuous improvement.",Professional,undergraduate,False,False,False,False,False,True
cornerstone,2026,2026-2027,MGT,335,ORGANIZATIONAL BEHAVIOR,"Presents integrative theory of organization behavior and human motivation as influenced by leadership, the organization itself, and social environment.",Professional,undergraduate,False,False,False,False,False,True
cornerstone,2026,2026-2027,MGT,336,PROJECT MANAGEMENT,"This course will examine key factors related to successful completion of both large and small projects. Topics will include project selection, chartering, scope, resources, scheduling, budgeting, controlling, termination and team leadership. Students will approach learning through a semester-long project planning activity.",Professional,undergraduate,False,False,False,False,False,True
cornerstone,2026,2026-2027,MGT,337,ENTREPRENEURSHIP,"This course reviews and explores important skills and practices used to develop creative, innovative, and successful businesses. Entrepreneurial models focusing on sustainable business development are presented and evaluated to assess emerging customer needs, resource requirements, product and service development, marketing strategies, and economic and social contributions.",Professional,undergraduate,False,False,False,True,False,True
cornerstone,2026,2026-2027,MGT,338,LEADERSHIP IN ACTION,"This class focuses on how to make change.  It compares telling, forcing, participating and transcending strategies, and moves students beyond the textbook to consider a Christian perspective.  The primary learning techniques involve analyzing films and engaging in a real world project.",Professional,undergraduate,False,False,False,False,False,True
cornerstone,2026,2026-2027,MGT,339,INTERNATIONAL MANAGEMENT,A focus on management challenges associated with developing strategies and managing the operations of enterprises whose activities stretch across national boundaries. International firms will be examined with special emphasis on the management of resources and production.,Professional,undergraduate,False,False,False,False,False,True
cornerstone,2026,2026-2027,MGT,341,FUND DEVELOPMENT,"This course provides an overview of fund development, fund-raising strategies and sources to consider as part of a healthy fund-raising program. It will discuss the principles of non-profit finance. Grant writing will also be covered.",Professional,undergraduate,False,False,False,False,False,True
cornerstone,2026,2026-2027,MGT,361,SPORT MEDIA RELATIONS & EVENT MGT,"Creating the goals and philosophy of events, event planning and scripting, entertainment programming, security, traffic and first-aid services, managing relations with the media, connecting with the community and philanthropic alignment. Practical field experience would be included.",Professional,undergraduate,False,False,False,False,False,True
cornerstone,2026,2026-2027,MGT,364,SPORT IN SOCIETY,"Interaction between social institutions and sports. Inquiry into how various behavior, psychological and social variables interact in the culture of sport, trends and patterns of change in the culture of sport. Practical field experience would be included.",Professional,undergraduate,False,False,False,False,False,True
cornerstone,2026,2026-2027,MGT,380,INTERNSHIP,This course is aimed at practical work experience in a business setting. Students will have opportunities to apply classroom knowledge to business world situations in management or sports management.,Professional,undergraduate,False,False,False,False,False,True
cornerstone,2026,2026-2027,MGT,381,MANAGEMENT FIELD EXPERIENCE,This course is aimed at practical work experience in a business setting. Students will have opportunities to apply classroom knowledge to business world situations in management or sports management.  Students will acquire and document professional field experience and will receive 1 credit hour for every 40 hours of verified work.,Professional,undergraduate,False,False,False,False,False,True
cornerstone,2026,2026-2027,MGT,432,CAPSTONE SEMINAR: STRATEGIC MANAGEMENT,"This course is the senior level capping course designed to integrate the knowledge and techniques studied in other courses such as accounting, economics, finance, management, marketing, and quantitative methods. It is also designed to provide experience in formulating organizational strategies and policies for meeting specified organizational strategic and operational goals. The case and business game approach is used.",Professional,undergraduate,False,False,False,False,False,True
cornerstone,2026,2026-2027,MGT,433,STRATEGIC BUSINESS FOUNDATION,"A case study course with application made to major functions of business within the context of social, technological, economic, political and physical environment. Completion of all courses in the Bachelor of Science in Business Administration & Leadership program is necessary for the successful completion of this course.",Professional,undergraduate,False,False,False,False,False,True
cornerstone,2026,2026-2027,MGT,438,ORGANIZATIONAL STRATEGIC MANAGEMENT,"The study and application of tools and methodologies for strategic management of organizations. Course topics include SWOT analysis, internal and external factor analysis, competitive matrices and the development of appropriate organizational strategies.",Professional,undergraduate,False,False,False,False,False,True
cornerstone,2026,2026-2027,MGT,441,MANAGEMENT PROJECT,A course in which students produce an individual capstone paper and presentation demonstrating the ability to apply and integrate the knowledge and techniques studied in previous courses to a current business problem. Completion of all courses in the Bachelor of Science in Organizational Management program is necessary for the successful completion of this course.,Professional,undergraduate,False,False,False,False,False,True
cornerstone,2026,2026-2027,MGT,470,DIRECTED READINGS,,Professional,undergraduate,False,False,False,False,False,True
cornerstone,2026,2026-2027,MGT,480,ADVANCED TOPICS,,Professional,undergraduate,False,False,False,False,False,True
cornerstone,2026,2026-2027,MGT,490,INDEPENDENT STUDY,,Professional,undergraduate,False,False,False,False,False,True
cornerstone,2026,2026-2027,MGT,531,ORGANIZATIONAL BEHAVIOR & CHANGE,"The study of the behavior of individuals and teams within organizations based on current management theory. Emphasis is given to understanding, predicting, motivating and changing work-related behaviors in organizations. Key topics include organizational structure, understanding culture, power, diversity, leadership and communication within the organization.",Professional,undergraduate,True,False,False,False,False,True
cornerstone,2026,2026-2027,MGT,532,ORGANIZATIONAL LEADERSHIP,"A survey of current literature on the topic of leadership. A foundation of research and theory is laid to form the context for more specific topical study throughout the program. Special emphasis is placed on the knowledge, skills, attitudes and values in servant leadership.",Professional,undergraduate,False,False,False,False,False,True
cornerstone,2026,2026-2027,MGT,534,THEORY & QUALITY OUTCOMES MGT,"A study of lean quality management principles, theories and application to the health care environment. Focusing on managing health care quality, safety and outcomes, the course emphasizes the use of tools and techniques to manage and lead quality improvements and drive successful clinical outcomes.",Professional,undergraduate,False,False,False,False,False,True
cornerstone,2026,2026-2027,MGT,539,ENTREPRENEURSHIP/INNOVATION,"A focused study of the tools needed in identifying and capitalizing on entrepreneurial business opportunities, methods for managing those opportunities and critical thinking skills needed for innovation and growth. Students work with a team to design an entrepreneurial venture. Additional topics include stimulating new ideas, managing innovative ideas, adapting to change and individual and group roles in the creative process.",Professional,undergraduate,False,False,False,False,False,True
cornerstone,2026,2026-2027,MGT,540,ORGANIZATIONAL LEADERSHIP CAPSTONE,"An opportunity for students to synthesize information received throughout the degree program, create a leadership development plan for immediate and future use, and assess the impact of their personality and emotional intelligence (EI) on leadership performance. A distinctive feature of this class will be an assessment geared toward identifying each student's EI and a coaching session with a certified EI coach who will help the students identify leadership strengths and opportunities for growth. Prerequisites: All previous courses.",Professional,undergraduate,False,False,False,False,False,True
cornerstone,2026,2026-2027,MGT,542,ORGANIZATIONAL DECISION MAKING,"An opportunity to explore decision-making models within organizations for the purpose of improving problem-solving and individual performance within the context of working with, supervising and leading others. A specific emphasis in this course is on biases, unconscious judgments, cognitive blind spots and other limitations that mediate, moderate or impede effective decision-making within personal and professional contexts. Research, theories and models are presented to help improve organizational decision-making.",Professional,undergraduate,False,False,False,False,False,True
cornerstone,2026,2026-2027,MGT,543,TEAM LEADERSHIP & CONFLICT MANAGEMENT,"A course with an emphasis on research, theories and models that help learners understand and more effectively use strategies for improved leadership within a team-based context. Because it is inextricably tied to the challenges of working in teams, interpersonal conflict is investigated as part of the necessary leadership behavior that comes from working with and for others in addition to supervising and managing people and projects. Practical strategies are emphasized for improving leadership and conflict management.",Professional,undergraduate,False,False,False,False,False,True
cornerstone,2026,2026-2027,MGT,557,SPORT MARKETING,"Includes promotions, sales, fundraising, advertising, branding and sponsorship. Strategies need to be created for individuals, teams and/or events, depending on the marketing needs and projections.",Professional,undergraduate,False,False,False,False,False,True
cornerstone,2026,2026-2027,MGT,559,SPORT COMMUNICATIONS,"This course will explore the communication landscape in the sport industry. This includes fostering two-way communication with key stakeholders across a wide berth of platforms. This communication includes, but is not limited to social media, all aspects of media guides, press releases, websites, statistical archives, record keeping and game-day obligations.",Professional,undergraduate,False,False,False,False,False,True
cornerstone,2026,2026-2027,MGT,561,SPORT OPERATIONS,"This course will explore event and venue operations ranging from single to multi-day events. Focus will include strategic planning, situational analysis, emergency and risk management, execution and controlling of the operational functions by sport management professionals.",Professional,undergraduate,False,False,False,False,False,True
cornerstone,2026,2026-2027,MGT,620,HEALTH CARE INNOVATION & TECH MGMT,"This course explores the dynamic landscape of innovation and technology within the healthcare industry. It examines emerging technologies such as telehealth, artificial intelligence, wearable devices, big data analytics, and electronic health records, and analyzes their potential to transform healthcare delivery, improve patient outcomes, and enhance operational efficiency. The course will also delve into the strategic management of technology adoption and implementation in healthcare organizations, including considerations around cybersecurity, data privacy, interoperability, and the ethical implications of technological advancements. Students will develop an understanding of how to foster a culture of innovation and leverage technology to address key challenges and opportunities in the healthcare sector.",Professional,undergraduate,False,False,False,False,False,True
cornerstone,2026,2026-2027,MGT,630,GLOBAL HUMAN RESOURCE LEADERSHIP,"This course examines the critical role of human resources in achieving organizational strategy and competitive advantage in a global market for labor and capital. It focuses on developing a strategic mindset in HR leadership, aligning talent management practices with business goals, and understanding the impact of human capital on organizational performance for multinational corporations operating in a worldwide context. Topics include strategic workforce planning, international legal structures, the role of geopolitics in HR leadership, and change management that maximizes cultural competence to drive strategic decision-making. The Christian ethics surrounding employee engagement and development will be explored to uncover best practices and to plan for desirable business outcomes in an international setting.",Professional,undergraduate,False,False,False,False,False,True
cornerstone,2026,2026-2027,MGT,638,HUMAN RESOURCE LEADERSHIP,"A focus on current issues in the field of human resource management emphasizing legal issues, career development, job definition and job qualification. Labor/management conflict from behavioral and institutional viewpoints is also examined.",Professional,undergraduate,False,False,False,False,False,True
cornerstone,2026,2026-2027,MGT,639,STRATEGIC LEADERSHIP,"An in-depth analysis and evaluation of corporate and business strategies. Students are expected to demonstrate that they have the ability to integrate the various disciplines in the program and practical management experience for the purpose of solving a management and leadership problem through case analysis and critique. Topics include crafting an executive strategy, managing diversification, global market competition and analysis of resources and competitive position.",Professional,undergraduate,False,False,False,False,False,True
cornerstone,2026,2026-2027,MGT,640,EMPLOYMENT DEVELOPMENT/PERFORMANCE MGMT,"An extension of information presented in the human resource course. This course focuses on supervisory responsibilities of developing employees through the entire performance management process, which includes coaching and caring for others, developing those for whom one is responsible, and utilizing an appraisal process that includes feedback, expectations and evaluation. The role of feedback, listening and humble inquiry are emphasized. Complications in employee development and performance management are highlighted as are practical strategies for effectively carrying out these functions from a supervisory perspective.",Professional,undergraduate,False,False,False,False,False,True
cornerstone,2026,2026-2027,MGT,646,CONTEMPORARY ISSUES IN SPORT,"The major outcome of this course will be to acclimate the sport management professional to the ever-changing sports environment and help them establish vocational skills to navigate the ecosystem. Further, a career-focused role in sport must be embedded in scripture and lived out with an integrated Christian worldview. This course will explore the responsibility of the sport management professional and how they operate across multiple contexts in sport.",Professional,undergraduate,False,False,False,True,False,True
cornerstone,2026,2026-2027,MGT,650,AGILE & HYBRID PROJECT MANAGEMENT,"This course provides students with insights and practice with the dynamic and increasingly prevalent methodologies of Agile and Hybrid project management. Building upon foundational project management principles, students will explore various Agile frameworks such as Scrum and Kanban, and learn how to apply their core tenets in adaptive project environments. The course will also examine the strategies and techniques for effectively blending traditional (waterfall) and Agile approaches to create hybrid methodologies that best suit specific project needs and organizational contexts. Topics include Agile planning, iterative development, continuous improvement, stakeholder collaboration in Agile settings, and navigating the complexities of hybrid project governance.",Professional,undergraduate,False,False,False,False,False,True
cornerstone,2026,2026-2027,MGT,697,APPLIED HEALTHCARE PROJECT,A project-based capstone course in which the student will demonstrate the ability to integrate health care education and practical experience by selecting a problem of practice at work and implementing a plan for improvement and/or action research or a program evaluation to solve the problem or improve the issue.,Professional,undergraduate,False,False,False,False,False,True
cornerstone,2026,2026-2027,LIN,100,LANGUAGE IN CULTURE,This course gives strategies for students to develop the ability to communicate in a second language at a beginning level. Emphasis is on oral proficiency and listening skills. Students will also examine a Christian theology of language learning based on linguistic hospitality.,Other,undergraduate,False,False,False,False,False,True
cornerstone,2026,2026-2027,LIN,225,INTRODUCTION TO LINGUISTICS,"Provides an understanding of the nature and structure of human language and introduces students to the goals, techniques, and subject matter of modern linguistics. Presents the properties of human language, and the scientific methods for analyzing it. Topics include basic aspects of the structure of language, language change, dialects and language variation, language acquisition, language and the brain. This course will look at the data from English and a variety of languages.",Other,undergraduate,False,False,False,False,False,True
cornerstone,2026,2026-2027,LIN,280,TOPICS IN LINGUISTICS,,Other,undergraduate,False,False,False,False,False,True
cornerstone,2026,2026-2027,LIN,323,PHONETICS & PHONOLOGY,"This course explores the fundamental principles of the sound systems of human languages. The course covers the production, perception, and acoustics of speech sounds, as well as the organization and patterns of these sounds within languages.",Other,undergraduate,False,False,False,False,False,True
cornerstone,2026,2026-2027,LIN,325,MORPHOLOGY & SYNTAX,"This course is an introduction to the study of word structure and sentence structure. Students will learn to analyze word formation processes and identify different types of morphological structures. The course also explores the principles of syntax, including grammatical categories, phrase structure rules, and sentence structure.",Other,undergraduate,False,False,False,False,False,True
cornerstone,2026,2026-2027,LIN,327,CORPUS LINGUISTICS,"This course explores the use of large collections of text, known as corpora, to investigate linguistic patterns and variation. The course introduces students to the principles of corpus compilation, annotation, and analysis. Students will learn to use corpus software to search, extract, and analyze linguistic data. They will also gain hands-on experience with corpus-based research methods, such as frequency analysis, concordance analysis, and collocational analysis. The course will cover a variety of topics in corpus linguistics, including language variation, language change, and language acquisition.",Other,undergraduate,False,False,False,False,False,True
cornerstone,2026,2026-2027,LIN,329,COMPUTATIONAL LINGUISTICS,"Computational linguistics is the interdisciplinary study of language and computers. It draws on theories and methods from linguistics, computer science, and artificial intelligence to develop computational models of language and to build systems that can process and generate human language.",Other,undergraduate,False,False,False,False,False,True
cornerstone,2026,2026-2027,LIN,353,LINGUISTIC HISTORY OF ENGLISH,"The development of the English language from its Indo-European roots to the present, paying attention to the historical contexts and linguistic features of the language.",Other,undergraduate,False,False,False,False,False,True
cornerstone,2026,2026-2027,LIN,371,SECOND LANGUAGE ACQUISTION,"The objective of this course will be to examine the process of learning a second language. This course will survey current SLA theory and learning models. Linguistic, cognitive, affective, cultural, and social factors influencing the acquisition of another language will be explored.",Other,undergraduate,False,False,False,False,False,True
cornerstone,2026,2026-2027,LIN,372,SOCIOLINGUISTICS,"The objective of this course will be to look at language in its social and cultural contexts. This course presents the basic sociocultural variables (such as gender, age, and social status) and shows their relation to language use and language learning. Areas covered in this course will include bilingualism, dialectology, language variation and style with their relation to multi-cultural educational situations.",Other,undergraduate,True,False,False,False,False,True
cornerstone,2026,2026-2027,LIN,380,INTERNSHIP,Academic credit and evaluation for practical work-learning experience in the field of linguistics developed in cooperation with an internship coordinator and a sponsoring organization.,Other,undergraduate,False,False,False,False,False,True
cornerstone,2026,2026-2027,LIN,460,SELECTED LINGUISTS,An in-depth analysis of one or more important linguists. The course can be repeated for credit.,Other,undergraduate,False,False,False,False,False,True
cornerstone,2026,2026-2027,LIN,461,LINGUISTIC ANALYSIS,"Analysis and problem solving in phonology, morphology, and syntax using data from many languages. Emphasis is both practical (learning how to describe grammar and sound system of a language) and theoretical (understanding languages' behavior).",Other,undergraduate,False,False,False,False,False,True
cornerstone,2026,2026-2027,LIN,465,TESOL METHODOLOGY I,"This course will look at methods and techniques used to teach language components (grammar, vocabulary, pronunciation) and language skills (reading, writing, listening and speaking). Practice in developing and implementing balanced and effective language lesson plans will be provided along with evaluating and selecting appropriate ESL teaching materials. Special focus on the use of technology will be discussed.",Other,undergraduate,False,False,False,False,False,True
cornerstone,2026,2026-2027,LIN,466,TESOL METHODOLOGY II,"A continuation of methods study with a specific focus on aspects of course development, curiculum design and assessment, such as how to correctly assemble a specific curriculum for a class and implement it.  The course also reviews assessments available, how to decide which assessment to use and when to use it.  The students explore their own personal focus as well as the methodology and philosophy of teaching to help self-evaluate as teachers and to use the resources provided in class to address issues.",Other,undergraduate,False,False,False,False,False,True
cornerstone,2026,2026-2027,LIN,470,DIRECTED READINGS,Guided readings and reports in areas of interest and need. The student may complete an in-depth study of specific areas of linguistics. Prerequisites: LIN-225 and approval of the Division Chair.,Other,undergraduate,False,False,False,False,False,True
cornerstone,2026,2026-2027,LIN,480,ADVANCED TOPICS,"Seminars, groups, or independent studies and research on topics in linguistics.",Other,undergraduate,False,False,False,False,False,True
