university,academic_year,academic_year_label,department_code,course_number,title,description,broad_area,level,progressive_signal,western_canon_signal,climate_narrow_signal,climate_broad_signal,cross_listed,deduplicated
cornerstone,2026,2026-2027,RES,910,"QUALITATIVE INQUIRY, EVAL, ACTION RES","This course will focus on using classic qualitative research methods to address organizational problems. Along with narrative, phenomenological, case study, ethnographic, and grounded theory research, this course will also emphasize program evaluation and action research strategies. Learners will understand what qualitative research choices are available to help inform organizational decision making and problem solving. Specific emphasis will be given to conceptual understanding of the various qualitative techniques from a menu of choices so as to inform the culminating organizational leadership and development capstone. The second residency requirement will occur during this course.",Other,undergraduate,False,False,False,False,False,True
cornerstone,2026,2026-2027,RES,915,QUANTITATIVE RESEARCH DESIGN/DATA ANAYS,"An exploration of practical statistics and data analysis choices within the framework of the respective research designs.  Specific emphasis will be given to correlational (ex post facto) designs and quasi-experimental and experimental methods of organizational research.  This course will focus on choosing the appropriate research design and statistical analysis to match corresponding research problems.  In addition, ""Big Data"" and data analytics will be discussed briefly.",Other,undergraduate,False,False,False,False,False,True
cornerstone,2026,2026-2027,RES,917,COMPREHENSIVE EXAMINATION,In this course students will demonstrate competency in analyzing organizational and leadership issues and applying program concepts and skills to those organizational issues. Students will conduct a case study analysis and an organizational issue analysis. They will present their analysis in two papers that will be submitted to program faculty for evaluation. The papers will demonstrate doctoral level analysis and synthesis. This course will be graded on a pass/fail basis.,Other,undergraduate,False,False,False,False,False,True
cornerstone,2026,2026-2027,RES,921,PROJECT PROPOSAL I,"This course is designed at the end of the doctoral program course work to help students create a specific, relevant and realistic plan for the organizational leadership and development project. Using the prospectus developed in RES-905 and information learned in RES-910 and RES-915 , students will expand the initial research prospectus into a full proposal that will be carried out during the last year of the doctoral program.",Other,undergraduate,False,False,False,False,False,True
cornerstone,2026,2026-2027,RES,922,PROJECT PROPOSAL II,"This course is designed at the end of the doctoral program course work to help students create a specific, relevant and realistic plan for the organizational leadership and development project. Students will expand their initial research prospectus into a full proposal that has been refined and improved from the RES-921 proposal, which will constitute the material for their proposal defense.",Other,undergraduate,False,False,False,False,False,True
cornerstone,2026,2026-2027,RES,925,ORGN LEAD & DEVL PROJECT,"The final project in the doctoral curriculum is designed to address a practical, real-world, organizational problem or leadership issue in an applied setting. Projects will be theory- and research-informed yet practical and will be completed in consultation with a research project mentor, the student, and a cooperating sponsor in the workplace or professional setting. The final project will focus on synthesizing knowledge, theory, research, and practice in such a way to be of benefit in a professional or clinical setting. Candidates will also be required to defend their proposal and final manuscript before a capstone project committee. Completion of the capstone must occur within seven years after starting the program.",Other,undergraduate,False,False,False,False,False,True
cornerstone,2026,2026-2027,SWK,111,INTRODUCTION TO SOCIAL WORK,"An introduction to the history of social work as a profession from its Judeo-Christian origins to current trends and influences. An overview of professional social work education including an introduction to social work values and ethics, generalist practice theory, social welfare policy, populations at-risk, social work roles and various practice settings.",Other,undergraduate,False,False,False,False,False,True
cornerstone,2026,2026-2027,SWK,221,HUMAN BEHAVIOR AND SOCIAL ENVIRON I,"The study of theories and knowledge of human behavior and bio-psycho-social-spiritual development from birth to young adulthood. Application of social systems theory in the analysis of the interactions between human behavior and social environmental structures. Attention is given to the role of culture, race, ethnicity, social class, gender and sexual orientation in human development and behavior.  Course fee applied.",Other,undergraduate,True,False,False,False,False,True
cornerstone,2026,2026-2027,SWK,222,HUMAN BEHAV AND SOC ENV II,"The study of theories and knowledge of human behavior and bio-psycho-social-spiritual development from middle to late adulthood. Application of social systems theory in the analysis of the interactions between human behavior and social environmental structures. Attention is given to the role of culture, ethnicity, social class, race, gender and sexual orientation in human development and behavior.",Other,undergraduate,True,False,False,False,False,True
cornerstone,2026,2026-2027,SWK,280,TOPICS IN SOCIAL WORK,,Other,undergraduate,False,False,False,False,False,True
cornerstone,2026,2026-2027,SWK,311,SOCIAL WELFARE POLICY I: POLICY FOUNDAT,"This course examines the history of social welfare policy and the social, racial, cultural, economic, organizational, environmental and global influences on these policies.  Students examine the ways in which social welfare policy has affected at-risk populations.  Students explore the roles of different branches of government on the local, state and federal levels and the impact these roles have on social welfare policy.  The ability to identify, read and understand social welfare policy is developed. Course fee applied.",Other,undergraduate,True,False,False,False,False,True
cornerstone,2026,2026-2027,SWK,331,SOCIAL WORK PRACTICE I: INDIV/FAMILIES,"Direct practice skills essential for the generalist social worker. Interviewing and assessment skills, case management, crisis intervention, ethical decision making methods are applied to case situations. Students are introduced to the generalist Intervention Model with considerations for practice with diverse and vulnerable client populations.  Course fee applied.",Other,undergraduate,True,False,False,False,False,True
cornerstone,2026,2026-2027,SWK,332,SOCIAL WORK PRACTICE II: GROUPS,"This course builds on the first practice course emphasizing social work practice with individuals and families and provides greater focus on the application of generalist practice knowledge, values, and skills in service delivery to groups. Students review the origins of group work as a social work intervention method; stages of group development; and the group dynamics likely present during those stages. Additionally, students study and practice techniques for the implementation and facilitation of various types of groups at varying stages. This also includes discussion of knowledge and skills related to effective group work with diverse client populations.",Other,undergraduate,True,False,False,False,False,True
cornerstone,2026,2026-2027,SWK,333,SOCIAL WORK PRACTICE III: COMM/ORGAN,"Indirect practice and intervention skills essential for the generalist social worker: community organization and development, social planning, social action and social administration. Focuses on the interplay between the individual and the macro environment and viewed from the perspective of the direct service provider seeking resources for vulnerable or oppressed client populations.  Course fee applied.",Other,undergraduate,False,False,False,False,False,True
cornerstone,2026,2026-2027,SWK,344,SUBSTANCE ABUSE,"The impact of substances including alcohol, marijuana, and cocaine upon individuals, families, and communities is studied. The causes, scope, policy issues, and methods of preventing chemical dependence are investigated. Places emphasis upon developing assessment and treatment skills.",Other,undergraduate,False,False,False,False,False,True
cornerstone,2026,2026-2027,SWK,346,CHILD WELFARE,"The examination of the philosophy of child welfare as a specific field in human services and a comprehensive overview of the programs, legislative provisions, policies, and services which comprise child welfare institutions. This course emphasizes the importance of culture and diversity as a major force in the delivery of child services.",Other,undergraduate,True,False,False,False,False,True
cornerstone,2026,2026-2027,SWK,415,SOCIAL WELFARE POLICY II: PRACT & ADVOC,"Building off the knowledge and competency developed in SWK-311 , this course will teach students how to analyze existing policy and ethically advocate for new or improved social policies.  Students will learn about and apply various frameworks to critically evaluate social welfare policies.  Based on appropriate research, students will formulate new or improved policies that advance human rights and social, racial, economic and environmental justice.  Through ethical advocacy efforts, students will engage in social work policy practice.",Other,undergraduate,True,False,False,True,False,True
cornerstone,2026,2026-2027,SWK,417,HUMAN DIVERSITY,"This course explores the historical social construction of race, ethnicity, gender and social class, the history of majority-minority relationships and the current status of minorities in the United States. The course examines prejudice, discrimination, oppression, racism, and bias in addressing multi-level change. Students explore diversity and difference as well as the implications of those differences in multicultural practice settings. The course emphasizes a biblical foundation for cultural competency.",Other,undergraduate,True,True,False,False,False,True
cornerstone,2026,2026-2027,SWK,441,GERONTOLOGY,"An interdisciplinary approach to the study of aging. This course provides a comprehensive view of the physiological, social and psychological dimensions of the aging process.",Other,undergraduate,False,False,False,False,False,True
cornerstone,2026,2026-2027,SWK,450,FIELD PRACTICUM I,"Students are placed in a community agency (minimum of 200 hours) under the supervision of a professional social worker. Opportunities are provided to integrate the knowledge, values, and skills of generalist practice in the field setting with client systems that may include: individuals, families, small groups, organizations and communities. Emphasis is on the enhancement and well being of diverse and vulnerable populations and working towards the amelioration of environmental conditions that affect people adversely.",Other,undergraduate,True,False,False,False,False,True
cornerstone,2026,2026-2027,SWK,451,FIELD PRACTICUM SEMINAR I,"A seminar, held on campus, in which students may share practicum experiences, integrate theoretical knowledge, consider ethical and value issues, and practice mutual support and supervision. Emphasis is on the understanding of oneself in the helping role and developing cultural sensitivity in working with diverse individuals, families, groups, and communities.  Course fee applied.",Other,undergraduate,True,False,False,False,False,True
cornerstone,2026,2026-2027,SWK,460,FIELD PRACTICUM II,"Students are placed in a community agency (minimum of 200 hours) under the supervision of a professional social worker. Opportunities are provided to integrate the knowledge, values, and skills of generalist practice in the field setting with client systems that may include: individuals, families, small groups, organizations and communities. Emphasis is on the enhancement and well being of diverse and vulnerable populations and working towards the amelioration of environmental conditions that affect people adversely.",Other,undergraduate,True,False,False,False,False,True
cornerstone,2026,2026-2027,SWK,461,FIELD PRACTICUM SEMINAR II,"A seminar, held on campus, in which students may share practicum experiences, integrate theoretical knowledge, consider ethical and value issues, and practice mutual support and supervision. Emphasis is on the understanding of oneself in the helping role and developing cultural sensitivity in working with diverse individuals, families, groups, and communities.",Other,undergraduate,True,False,False,False,False,True
cornerstone,2026,2026-2027,SWK,462,CAPSTONE SEMINAR: SOCIAL WORK,"This course serves as the capstone to the Social Work Program. Its primary emphasis is on professional development and self-evaluation in the context of the social work competencies. Students complete a social work portfolio, capstone paper and project to demonstrate proficiency in all the social work competencies and their readiness to enter into professional social work practice at the undergraduate level or graduate school. Content related to Christian worldview and social work practice is infused throughout the full semester in order to encourage professional development. Course fee applied.",Other,undergraduate,False,False,False,False,False,True
cornerstone,2026,2026-2027,SWK,470,DIRECTED READINGS,,Other,undergraduate,False,False,False,False,False,True
cornerstone,2026,2026-2027,SWK,480,ADVANCED TOPICS,"An elective course on a selected topic related to social work generalist practice. May include current issues or trends, special populations or advanced practice skills.",Other,undergraduate,False,False,False,False,False,True
cornerstone,2026,2026-2027,SWK,490,INDEPENDENT STUDY,An elective course requiring student research and a written report on a specific area of interest related to social work practice. The topic is selected by the student with final approval and supervision by Social Work faculty.,Other,undergraduate,False,False,False,False,False,True
cornerstone,2026,2026-2027,SPA,101,ELEMENTARY SPANISH I,"An elementary-level Spanish course in which the four basic skills in language are taught: reading, writing, listening, and speaking.",Other,undergraduate,False,False,False,False,False,True
cornerstone,2026,2026-2027,SPA,102,ELEMENTARY SPANISH II,An elementary-level Spanish course that builds on SPA 101. More sophisticated grammar concepts are presented in a communicative setting.,Other,undergraduate,False,False,False,False,False,True
cornerstone,2026,2026-2027,SPA,201,INTERMEDIATE SPANISH I,"Intermediate Spanish I builds upon existing knowledge of Spanish grammar and vocabulary, propelling the student toward fluency and deeper cultural understanding.  This course focuses on developing all four language skills: speaking, listening, reading and writing, within a rich cultural context.  This course will explore diverse topics ranging from daily life and current events to art, literature and history.  Students will engage in interactive activies, discussions and presentations, gaining confidence in expressing themselves clearly and naturally in Spanish.",Other,undergraduate,True,False,False,False,False,True
cornerstone,2026,2026-2027,SPA,222,LITERARY ANALYSIS,"Students will expand literary vocabulary in order to appreciate literature in Spanish as well as English.  Through poems, short stories and short movies, students will learn to analyze in Spanish different narratives.",Other,undergraduate,False,False,False,False,False,True
cornerstone,2026,2026-2027,SPA,223,SPANISH FOR PROFESSIONS,Students will expand relevant vocational vocabulary and understanding the expectations of the Latino communities in particular professional settings.,Other,undergraduate,False,False,False,False,False,True
cornerstone,2026,2026-2027,SPA,225,LINGUISTICS THEMED COURSE,"Students will deepen their understanding of the Spanish language through the study of various topics in theoretical and applied linguistics, including phonetics, phonology, morphology, syntax, sociolinguistics or second language acquisition.",Other,undergraduate,False,False,False,False,False,True
cornerstone,2026,2026-2027,SPA,312,LATIN-AMERICAN VOICE,This course will submerge the student in the creation of the nation and identity in Latin-American from the beginning of the Colony up to end of it.  Native and Spaniard texts will be analyzed in Spanish.,Other,undergraduate,True,False,False,False,False,True
cornerstone,2026,2026-2027,SPA,313,SPANISH CONV AND COMP I,"A communicative-based course focusing on the development of advanced grammar, vocabulary and oral fluency through extensive written and oral practice, focusing on narrative and descriptive writing and speaking.  Special emphasis placed on linguistic variation within the broader Spanish-speaking community.",Other,undergraduate,False,False,False,False,False,True
cornerstone,2026,2026-2027,SPA,314,EVOLUTION DIVERSITY IN SPANISH,"This course will explore examples of Spanish literature from medieval times up to the XIX century.  The course will cover linguistic change, including an exploration of attitudes and perceptions that may still be present today.",Other,undergraduate,True,False,False,False,False,True
cornerstone,2026,2026-2027,SPA,315,LATIN AMERICAN DIVERSITY,"Spanish speaking Latin America is comprised of 20 countries.  In this class, students will embark on a journey to see commonalities, differences and uniqueness of many of these countries by interviewing native speakers on campus and in the surrounding cities as well as readings from Latin American texts (short stories, poems, essays, etc) from the XIX, XX and XXI centuries.",Other,undergraduate,True,False,False,False,False,True
cornerstone,2026,2026-2027,SPA,316,CONVERSATION IN THE CITY,"The course will allow students to connect with Latin American/Latino families in the city.  Students will interview them on a series of topics ranging from religious beliefs, cultural practices and personal history.  Students will also visit church with them, go to the supermarket, leisure activities, etc.   Conversations will be conducted in Spanish.",Other,undergraduate,False,False,False,False,False,True
cornerstone,2026,2026-2027,SPA,317,CULTURAL PERSPECTIVES,"This course explores the diverse perspectives, traditions, and values of Spanish-speaking cultures globally and locally. Through engaging discussions, students will exchange opinions about these cultures in relation to their own backgrounds, identifying both commonalities and unique differences. Integrating a biblical worldview, the course equips students with cross-cultural communication strategies and cultivates respect for cultural diversity.",Other,undergraduate,True,True,False,False,False,True
cornerstone,2026,2026-2027,SPA,318,WRITING WORKSHOP,"Students will develop written communication skills for a variety of purposes by analyzing different articles, excerpts from books, newspapers in order to identify patterns, format, context of idiomatic expressions, specific usage of grammatical structures and  contemporary use of vocabulary.  These will serve as examples to strengthen their writing as well as develop their editing skills.",Other,undergraduate,False,False,False,False,False,True
cornerstone,2026,2026-2027,SPA,323,SPANISH CONVERSATION & COMP II,"A communicative-based course focusing on the development of advanced grammar, vocabulary and oral fluency through extensive written and oral practice, focusing on opinion and essay writing.   Special emphasis placed on linguistic variation within the broader Spanish-speaking community.",Other,undergraduate,False,False,False,False,False,True
cornerstone,2026,2026-2027,SPA,334,SELECTED TOPICS IN SPANISH LIT & CULTUR,"Rotating course that will provide students an in-depth study of interesting and relevant topics ranging from Spanish Linguistics to Hispanic culture, literature and history. This course may be repeated for credit.",Other,undergraduate,False,False,False,False,False,True
cornerstone,2026,2026-2027,SPA,380,INTERNSHIP,"Academic credit and evaluation for practical work learning experience developed in cooperation with Spanish majors and minors, the internship coordinator and a sponsoring organization.",Other,undergraduate,False,False,False,False,False,True
cornerstone,2026,2026-2027,SPA,411,INTRO TO HISPANIC LIT,A survey course studying the major works of Spanish and Latin American literature.  Hispanic worldview will be contrasted with Christian worldview.,Other,undergraduate,False,False,False,False,False,True
cornerstone,2026,2026-2027,SPA,412,SPANISH CIV/CULTURE,A comprehensive study of Peninsular culture and society and the role of culture in the formation of Spanish national character and attitudes.,Other,undergraduate,False,False,False,False,False,True
cornerstone,2026,2026-2027,SPA,465,WORLD LANGUAGE TEACHING METHODOLOGY,"This course will look at methods and techniques used to teach language components (grammar, vocabulary, pronunciation) and language skills (reading, writing, listening and speaking). Practice in developing and implementing balanced and effective language lesson plans will be provided along with evaluating and selecting appropriate ESL and/or Spanish teaching materials. Special focus on the use of technology will be discussed.",Other,undergraduate,False,False,False,False,False,True
cornerstone,2026,2026-2027,SPA,470,DIRECTED READINGS,Guided faculty supervision in student areas of interest (Literature or language).,Other,undergraduate,False,False,False,False,False,True
cornerstone,2026,2026-2027,SPA,490,INDEPENDENT STUDY,"With faculty supervision, the student researches and/or writes on a specific area of interest.",Other,undergraduate,False,False,False,False,False,True
cornerstone,2026,2026-2027,THE,102,CHRISTIAN WORLDVIEW,"A study of the biblical story of creation, fall, redemption, and consummation, and how this authoritatively informs our understanding of God, others, and ourselves, specifically in regard to bearing God's image, sex and marriage, and pursuing God's call upon our lives as citizens of his kingdom.",Other,undergraduate,False,True,False,False,False,True
cornerstone,2026,2026-2027,THE,238,CHRISTIAN DOCTRINE 1,"A systematic study of the basic biblical doctrines of Christianity including revelation, God, humanity, Christ and sin. The course reviews relevant Bible passages and emphasizes the practical application of biblical teachings in Christian living.",Other,undergraduate,False,True,False,False,False,True
cornerstone,2026,2026-2027,THE,247,THE BIBLE & CONTEMPORARY CULTURE,A study of contemporary issues from a biblical perspective. Particular emphasis is given to the way in which systemic study of the Bible can provide a basis for addressing issues as part of a Christian worldview.,Other,undergraduate,False,True,False,False,False,True
cornerstone,2026,2026-2027,THE,345,CHRISTIAN DOCTRINE II,"A systematic study of the basic biblical doctrines of Christianity including the Holy Spirit, the Church, salvation and end times. The course reviews relevant Bible passages and emphasizes the practical application of biblical teachings in Christian living.",Other,undergraduate,False,True,False,False,False,True
cornerstone,2026,2026-2027,THE,351,CHRISTIAN BELIEFS FOR HUMAN FLOURISHING,"This course will explore the fundamental doctrines of the evangelical Christian faith and their impact on human flouishing. The importance of Scripture and the Church for our relationships with God, man, self, and nature will be emphasized throughout the course. The course reviews relevant bible passages and emphasizes practical application of doctrine within the church context.",Other,undergraduate,False,True,False,False,False,True
cornerstone,2026,2026-2027,THE,352,CHRISTIAN BELIEFS & HISTORY,A study of the major doctrines of Christianity. Consideration is given both to the biblical bases and the historical contexts out of which these beliefs were fashioned. The course also traces key developments in the history of Christianity that help explain the diversity of beliefs and practices among various Christian traditions.,Other,undergraduate,True,True,False,False,False,True
cornerstone,2026,2026-2027,THE,354,THEOLOGY I,"A biblical, historical, and systematic treatment of four theological topics: the doctrine of revelation, theology proper, anthropology and Christology. The relevance of these topics to the student's personal life, the corporate life of the Church, and the cultural milieu is emphasized.",Other,undergraduate,False,True,False,False,False,True
cornerstone,2026,2026-2027,THE,356,THEOLOGY II,"A biblical, historical, and systematic treatment of the remaining theological topics: pneumatology, soteriology, ecclesiology, and eschatology. Like THE-354 , the course emphasizes both orthodoxy and orthopraxy.",Other,undergraduate,False,True,False,False,False,True
cornerstone,2026,2026-2027,THE,441,APOLOGETICS,"Prepares students to meet a variety of current challenges to the credibility of the Christian faith. The course introduces the major types of apologetic methods, considers several arguments against the truth of Christianity and provides resources to rebut those arguments. It also enables students to give positive reasons for why they believe the Christian story.",Other,undergraduate,False,False,False,False,False,True
