university,academic_year,academic_year_label,department_code,course_number,title,description,broad_area,level,progressive_signal,western_canon_signal,climate_narrow_signal,climate_broad_signal,cross_listed,deduplicated
cornerstone,2026,2026-2027,ARB,101,INTRODUCTORY ARABIC I,"An elementary-level Arabic course in which the four basic skills in language learning are taught: speaking, reading, writing, and listening.",Other,undergraduate,False,False,False,False,False,True
cornerstone,2026,2026-2027,ARB,102,INTRODUCTORY ARABIC II,An elementary-level Arabic course that builds on ARB 101. More sophisticated grammar concepts are presented in a communicative setting.,Other,undergraduate,False,False,False,False,False,True
cornerstone,2026,2026-2027,ARB,201,INTERMEDIATE ARABIC I,An intermediate-level Arabic course that builds on material presented in ARB 102. The student will communicatively investigate the Arabic world with grammar integrated into the written and oral work.,Other,undergraduate,False,False,False,False,False,True
cornerstone,2026,2026-2027,ARB,202,INTERMEDIATE ARABIC II,"An intermediate-level Arabic course that builds on ARB 201. The student will communicatively investigate topics of interest (university life, home life, social issues, etc.) relevant to life in the Arabic-speaking world. The primary emphasis will be on conversation and composition with grammar integrated into the communicative framework. Respective worldviews will be highlighted.",Other,undergraduate,False,False,False,False,False,True
cornerstone,2026,2026-2027,ACC,221,ACCOUNTING I,"An introduction to the fundamental principles of financial accounting. Accounting cycle, asset valuation, short-term liabilities, payroll, income determination, and financial reporting are emphasized.",Professional,undergraduate,False,False,False,False,False,True
cornerstone,2026,2026-2027,ACC,222,ACCOUNTING II,"A continuation of ACC-221 and managerial accounting topics. Long-term liabilities, owner's equity, cash flow and interpretation of financial statements. Cost accounting and managerial accounting and analysis will be introduced.",Professional,undergraduate,True,False,False,False,False,True
cornerstone,2026,2026-2027,ACC,321,INTERMEDIATE ACCOUNTNG I,The practice and theory of accounting as applied to assets and liabilities. Emphasis on developing analytical abilities and applying accounting principles to a wide variety of business situations.,Professional,undergraduate,False,False,False,False,False,True
cornerstone,2026,2026-2027,ACC,322,INTERMEDIATE ACCOUNTING II,"The practice and theory of accounting as applied to stockholders' equity, leases, pensions, revenue recognition, tax allocation, and financial reporting and analysis.",Professional,undergraduate,True,False,False,False,False,True
cornerstone,2026,2026-2027,ACC,324,PRINCIPLES OF FINANCIAL ACCT,"An examination of the development and use of accounting information for the purposes of planning, control and decision-making. Topics include accounting cycles, asset valuation, liabilities, forms of owner's equity and income determination.",Professional,undergraduate,True,False,False,False,False,True
cornerstone,2026,2026-2027,ACC,327,TAXATION,"Federal income tax structure as related to individuals, partnerships, and corporations. Problems intended to provide an understanding of the theory, law, and regulations.",Professional,undergraduate,False,False,False,False,False,True
cornerstone,2026,2026-2027,ACC,331,COST ACCOUNTING,"Accounting functions in the manufacturing environment. Product costing, overhead cost analysis, standard costs, activity based costing, variance analysis, contribution accounting, flexible budgeting, and responsibility center accounting.",Professional,undergraduate,False,False,False,False,False,True
cornerstone,2026,2026-2027,ACC,332,ACCOUNTING INFORMATION SYSTEMS,"Students will learn to apply their knowledge about accounting transactions to various accounting information systems. Topics will include the sources of accounting data, entry, processing, storage and output. Students will be able to identify various internal controls throughout the flow. The need for and control of changes in accounting systems will be analyzed.",Professional,undergraduate,False,False,False,False,False,True
cornerstone,2026,2026-2027,ACC,380,INTERNSHIP,This course is aimed at practical work experience in a business setting. Students will have opportunities to apply classroom knowledge to business world situations in accounting.,Professional,undergraduate,False,False,False,False,False,True
cornerstone,2026,2026-2027,ACC,381,ACCOUNTING FIELD EXPERIENCE,This course is aimed at practical work experience in a business setting. Students will have opportunities to apply classroom knowledge to business world situations in accounting. Students will acquire and document professional field experience and will receive 1 credit hour for every 40 hours of verified work.,Professional,undergraduate,False,False,False,False,False,True
cornerstone,2026,2026-2027,ACC,421,ADVANCED ACCOUNTING,"A study of specialized accounting topics. Emphasis is placed on accounting for business combinations. Additional topics include partnerships, governmental, nonprofit organizations, estates and trusts, and accounting procedures for insolvency.",Professional,undergraduate,False,False,False,False,False,True
cornerstone,2026,2026-2027,ACC,423,AUDITING,"Functions of financial audits and auditors' reports, audit evidence and techniques, internal control review and evaluation, application to selected financial statement topics, applications of statistics, audit of EDP systems, auditors' ethical and legal responsibilities.",Professional,undergraduate,False,False,False,False,False,True
cornerstone,2026,2026-2027,ACC,490,INDEPENDENT STUDY,,Professional,undergraduate,False,False,False,False,False,True
cornerstone,2026,2026-2027,ACC,525,ACCOUNTING FOR DECISION MAKING,"An examination of contemporary accounting issues for managers, such as principles, techniques and uses of accounting in the planning and decision making of organizations. The use of information technology plays a key role in this course. Areas of emphasis include the budgetary process, performance evaluation techniques, product costing methods, constraint management and ethics.",Professional,undergraduate,False,False,False,False,False,True
cornerstone,2026,2026-2027,ACC,531,FRAUD EXAMINATION I,"An overview of fraud examination, equipping students with the skills necessary to detect, prevent, and investigate fraudulent activities in various contexts. Students will explore the types of fraud, common schemes, and the psychological factors that motivate fraudulent behavior.",Professional,undergraduate,False,False,False,False,False,True
cornerstone,2026,2026-2027,ACC,532,FRAUD EXAMINATION II,"A continuation of ACC-531 Fraud Examination I, this course will provide an overview of fraud examination, equipping students with the skills necessary to detect, prevent, and investigate fraudulent activities in various contexts. Students will explore the types of fraud, common schemes, and the psychological factors that motivate fraudulent behavior.",Professional,undergraduate,False,False,False,False,False,True
cornerstone,2026,2026-2027,BBL,103,BIBLICAL HERMENEUTICS,"This course examines the basic issues in biblical hermeneutics, including the nature of historical-grammatical interpretation, genre analysis, historical and cultural background, literary analysis, and application. This course examines what it means for humans to have God's word inscripturated into language.",Other,undergraduate,False,True,False,False,False,True
cornerstone,2026,2026-2027,BBL,104,OLD TESTAMENT LITERATURE,"This course focuses on the content of the Old Testament and introduces methods for studying the Bible. Particular attention is paid to learning the various genres of the Old Testament and to the introduction of critical issues for biblical studies. Alongside the coverage of the biblical narrative, the students will study major historical and cultural developments in the ancient near east that cast light on the Old Testament.",Other,undergraduate,False,True,False,False,False,True
cornerstone,2026,2026-2027,BBL,130,OT LITERATURE - BRM MAJORS,"This course focuses on the content of the Old Testament and introduces methods for studying the Bible. Particular attention is paid to learning the various genres of the Old Testament and to the introduction of critical issues for biblical studies. Alongside the coverage of the biblical narrative, the students will study major historical and cultural developments in the ancient near east that cast light on the Old Testament. Critical thinking and research skills are introduced.",Other,undergraduate,False,True,False,False,False,True
cornerstone,2026,2026-2027,BBL,204,NEW TESTAMENT LITERATURE,"New Testament Literature continues the purposes of Old Testament Literature and Biblical Hermeneutics: to integrate a Christian worldview with Bible study and scripture. In this course, the student will continue to learn how to read the Bible, while studying the inter-testamental period and the New Testament.",Other,undergraduate,False,True,False,False,False,True
cornerstone,2026,2026-2027,BBL,210,COVENANT & CALLING: DISC FLOURISHING IN OLD,"This course provides a survey of the Old Testament literature and theology. It equis students with skills in reading and interpreting the Bible. Students will explore the overarching storyline of the Old Testament, examining its historical and cultural context, literary genres, and major themes. Special attention is given to the theological significance of key passages and how they reveal God's character, covenant purposes, and redemptive plan, showing how the Old Testament fits within God's redemptive story.",Other,undergraduate,False,True,False,False,False,True
cornerstone,2026,2026-2027,BBL,218,INTRODUCTION TO THE BIBLE,A general introduction to the Bible and the principles of biblical interpretation.,Other,undergraduate,False,True,False,False,False,True
cornerstone,2026,2026-2027,BBL,220,CHRIST & COMMUNITY: NEW TEST VISION TO FLOU,"This course provides a survey of the New Testament literature and theology. Students will explore the historical and cultural context of the New Testament writings, their literary forms, and their place within the overarching biblical narrative. Special attention is given to major theological themes and how these shape Christian faith and practice. The coruse equips students to interpret New Testament texts faithfully and apply their message to contemporary life within a Christian worldview.",Other,undergraduate,False,True,False,False,False,True
cornerstone,2026,2026-2027,BBL,226,INDUCTIVE STUDY OF EPHESIANS,"An analysis of the epistle to the Ephesians designed to put into practice the inductive study skills learned in REL-228. The course reviews background, theme and analytical study of the epistle to understand and apply principles that are relevant in ministry leadership.",Other,undergraduate,False,False,False,False,False,True
cornerstone,2026,2026-2027,BBL,228,PRINCIPLES OF BIBLICAL STUDIES,An introduction to various methods of Bible study. Emphasis is placed upon inductive study with the intent to provide a method by which ministry leaders become independent students of Scripture. The inductive method is applied to various literary genres of both the Old and New Testaments.,Other,undergraduate,False,True,False,False,False,True
cornerstone,2026,2026-2027,BBL,231,MOSAIC LITERATURE,A study of the history of redemption from Adam to Moses as set forth in the Pentateuch. Special attention is given to God's purposes in the call of Abraham and the establishment of the Mosaic economy.,Other,undergraduate,False,False,False,False,False,True
cornerstone,2026,2026-2027,BBL,232,THE GOSPELS,"A study of the four Gospels including their backgrounds, themes, outlines and distinguishing features, distinctive portrayals of Christ and His life and ministry as set forth in the Gospel of Mark.",Other,undergraduate,False,False,False,False,False,True
cornerstone,2026,2026-2027,BBL,233,INTERP ANALYSIS OF OT LIT,"A study of the basic principles of biblical interpretation. Emphasis is placed upon the cultural, historical, grammatical and theological method of interpretation. The application of these principles is drawn specifically from the Old Testament scriptures. The course is designed to provide ministry leaders with a method to properly interpret the Bible.",Other,undergraduate,False,True,False,False,False,True
cornerstone,2026,2026-2027,BBL,234,WRITINGS OF PAUL,"A survey of the writings of Paul including backgrounds, themes, outlines and distinguishing features with special attention given to the book of Romans.",Other,undergraduate,False,False,False,False,False,True
cornerstone,2026,2026-2027,BBL,235,INTRO/OT WISDOM LIT,"An introductory survey of the Old Testament books of wisdom including a study of major themes, characteristics of Hebrew poetry and principles that can be applied to Christian living.",Other,undergraduate,False,False,False,False,False,True
cornerstone,2026,2026-2027,BBL,236,NT LITERATURE- BRM MAJOR,This course focuses on the content of the New Testament and continues developing methods for studying the Bible. Particular attention is paid to the various genres of the New Testament while introducing critical issues for biblical studies. Major historical and cultural developments in the Mediterranean area of the Hellenistic period are surveyed. Work will continue on critical thinking and research skills.,Other,undergraduate,False,True,False,False,False,True
cornerstone,2026,2026-2027,BBL,237,INTER ANALYSIS OF NT LITERATURE,"A study of the basic principles of biblical interpretation. Special emphasis is given to the method of reading Scripture through a range of New Testament texts. Aspects of this method include attention to cultural, historical, grammatical and theological interpretation.",Other,undergraduate,False,True,False,False,False,True
cornerstone,2026,2026-2027,BBL,242,OLD TESTAMENT SURVEY 1,"An overview of the Old Testament from Genesis to Job, noting its historical perspective and spiritual application.",Other,undergraduate,False,False,False,False,False,True
cornerstone,2026,2026-2027,BBL,244,OLD TESTAMENT SURVEY 2,"An overview of the Old Testament from Proverbs to Malachi, noting its historical perspective and spiritual application.",Other,undergraduate,False,False,False,False,False,True
cornerstone,2026,2026-2027,BBL,246,NEW TESTAMENT SURVEY 1,"An overview of the New Testament Scriptures, Matthew-Acts, guiding one to understand the historical and biblical context of the New Testament.",Other,undergraduate,False,True,False,False,False,True
cornerstone,2026,2026-2027,BBL,248,NEW TESTAMENT SURVEY 2,"An overview of the Pauline Letters, General Epistles, and Revelation, guiding one to understand the historical and biblical context of the New Testament.",Other,undergraduate,False,True,False,False,False,True
cornerstone,2026,2026-2027,BBL,330,PENTATEUCHAL LITERATURE,A study of the history of redemption from Adam to Moses as set forth in the Pentateuch. Special attention is given to God's purposes in the call of Abraham and the establishment of the Mosaic economy.,Other,undergraduate,False,False,False,False,False,True
cornerstone,2026,2026-2027,BBL,333,WISDOM LITERATURE,"An analysis of the form and content of the books of Proverbs, Job, Ecclesiastes, and of a number of Egyptian and Mesopotamian texts. The course explores wisdom's worldview and how wisdom literature deals with the issue of theodicy.",Other,undergraduate,False,False,False,False,False,True
cornerstone,2026,2026-2027,BBL,334,PROPHETIC LITERATURE,"An analysis of the form and content of the Old Testament prophets. The course contextualizes Old Testament prophecy within its Ancient Near Eastern background. Attention is paid to early prophetic traditions, the role of the monarchical prophets in the formation of Israel as a state, the emergence of the prophets in the eighth century BCE, and their continued function into the post-exilic period. Special attention is given to the role of social justice and the prophets.",Other,undergraduate,True,False,False,False,False,True
cornerstone,2026,2026-2027,BBL,335,PAULINE LITERATURE,"An analysis of the writings of Paul for the purposes of constructing a Pauline theology on such doctrines as man, redemption, incarnation, the church, and last things.",Other,undergraduate,False,False,False,False,False,True
cornerstone,2026,2026-2027,BBL,336,GENERAL EPISTOLARY LITERATURE,A synthetic study of the General Epistles from Hebrews through Jude. Places particular emphasis on the ethical contributions of James and the basic motifs of the Johannine and Petrine epistles.,Other,undergraduate,False,False,False,False,False,True
cornerstone,2026,2026-2027,BBL,339,GOSPEL LITERATURE,"A study of the four Gospels, including their backgrounds, themes, outlines and distinguishing features, and distinctive portraits of Christ, as well as a study of the life and ministry of Christ as set forth in the Gospel of Mark.",Other,undergraduate,False,False,False,False,False,True
cornerstone,2026,2026-2027,BBL,344,HIST/GEOGRAPHIC SETTING OF BIBLE,"A study tour in Israel that combines travel with lectures and relevant readings. Site visits throughout the country will focus on historical geography, archaeology, and the relationship between the land and the biblical stories attested in the Old and New Testaments. The trip also will provide context to understand the modern Israeli-Palestinian conflict.",Other,undergraduate,False,True,False,False,False,True
cornerstone,2026,2026-2027,BBL,357,O T HISTORY & THEOLOGY,"A study of the periods of Israel's history from the Patriarchs to the Restoration in relation to the surrounding nations of the Near East and the unfolding theological revelation of these periods centered in the Abrahamic Covenant, the Mosaic institutions, Israel's response of apostasy and formalism, and the prophetic reactions to that defection.",Other,undergraduate,False,False,False,False,False,True
cornerstone,2026,2026-2027,BBL,358,N T HISTORY & THEOLOGY,"The inter-testamental period is considered in its historical development as a bridge to the New Testament era. The New Testament is set in its historical, political, cultural, social, economic and religious environments. Considers the major biblical theological themes that emerge from the New Testament in their historical development and presentation.",Other,undergraduate,False,True,False,False,False,True
cornerstone,2026,2026-2027,BBL,380,INTERNSHIP,Practical field experience in a ministry context designed to help the student develop ministry skills and to clarify the student's sense of vocation.,Other,undergraduate,False,False,False,False,False,True
cornerstone,2026,2026-2027,BBL,434,JUDGES,"An examination of Judges in its historical context. Particular attention will be given to Hebrew narrative, the tribal system and societal structure in ancient Israel, Israelite religion, and various interpretative methodologies. The seminar will help students develop competency in research, Hebrew word studies, archaeological interpretation, and historical geography.",Other,undergraduate,False,False,False,False,False,True
cornerstone,2026,2026-2027,BBL,435,PSALMS,This course explores ancient Israel's expression of faith in different seasons and aspects of life. Students will develop a deeper understanding and appreciation of psalms by analyzing the form and content of a variety of psalms.,Other,undergraduate,False,False,False,False,False,True
cornerstone,2026,2026-2027,BBL,436,REVELATION,"A study of the historical, literary, and theological features of the Book of Revelation and the various schools of its interpretation. The course will examine various examples of apocalyptic literature as they inform our understanding of Revelation.",Other,undergraduate,False,False,False,False,False,True
cornerstone,2026,2026-2027,BBL,438,ROMANS,This course on Romans is built upon the hermeneutical and biblical literature courses. The seminar aims to develop the student's ability to grasp the textual content and application of this important book of the Bible. Emphasis is on the analytical and textual work of the student supplemented by the insight of the professor.,Other,undergraduate,False,True,False,False,False,True
cornerstone,2026,2026-2027,BBL,501,BIBLICAL HERMENEUTICS,"An introduction to the process of determining the original meaning and contemporary significance of biblical texts . The course includes lecture, discussion and individual research . The course must be completed within the first 15 credits of enrollment .",Other,undergraduate,False,True,False,False,False,True
cornerstone,2026,2026-2027,BBL,510,GREEK I,A study of the elements of Koine Greek.,Other,undergraduate,False,False,False,False,False,True
cornerstone,2026,2026-2027,BBL,511,GREEK II,"A continuation of Greek I with exercises in reading the Greek New Testament, introduction to NT Textual Criticism and the use of basic lexical and syntactical tools.",Other,undergraduate,False,False,False,False,False,True
cornerstone,2026,2026-2027,BBL,514,OLD TESTAMENT FOUNDATIONS,"An introduction to the historical and cultural contexts of the events and authors of the Old Testament, as well as an examination of the literary features and theological emphases of each book.",Other,undergraduate,False,False,False,False,False,True
cornerstone,2026,2026-2027,BBL,515,NEW TESTAMENT FOUNDATIONS,"An introduction to the historical and cultural contexts of the events and authors of the New Testament, as well as an examination of the literary features and theological emphases of each book.",Other,undergraduate,False,False,False,False,False,True
cornerstone,2026,2026-2027,BBL,516,HEBREW I,An introduction to the basic grammar and vocabulary of biblical Hebrew.,Other,undergraduate,False,True,False,False,False,True
cornerstone,2026,2026-2027,BBL,517,HEBREW II,"A continuation of Hebrew I with emphasis on grammar, syntax and expansion of vocabulary by means of translating simple texts.",Other,undergraduate,False,False,False,False,False,True
cornerstone,2026,2026-2027,BBL,520,GENESIS,"A study of the message of Genesis (English text), with emphasis on interpretive method as well as the foundational theology of this book for understanding the place of humanity in God's created order and the call on those of faith to be a blessing to all nations . For students with Hebrew, the course involves exegesis of selected portions of Hebrew text.",Other,undergraduate,False,False,False,False,False,True
cornerstone,2026,2026-2027,BBL,523,PSALMS,"A study of the Book of Psalms (English text), with emphasis on interpretive method as well as the continued relevance of psalms for individual spirituality, corporate worship and the cry for God's coming kingdom and its King, Jesus the Messiah. For students with Hebrew, the course involves exegesis of selected portions of Hebrew text.",Other,undergraduate,False,False,False,False,False,True
cornerstone,2026,2026-2027,BBL,524,DANIEL,"An analysis of the English test of Daniel, its structure and message, and its contributions to Old Testament biblical theology, especially eschatology.  Pre-requisite: BBL-501",Other,undergraduate,False,True,False,False,False,True
cornerstone,2026,2026-2027,BBL,529,GOSPEL OF MARK,"A literary and theological study of Mark with a focus on how the narrative configures the identity and mission of Jesus Christ in relation to the God of Israel and what it means to be disciples of Jesus. Special attention will be given to the Gospel's narrative devices, its use of the Scriptures and its relevance for discipleship and ministry.",Other,undergraduate,True,False,False,False,False,True
cornerstone,2026,2026-2027,BBL,550,GOSPEL OF MATTHEW,"Exposition of this Gospel with emphasis on its themes of Christology, kingdom and church.",Other,undergraduate,False,False,False,False,False,True
cornerstone,2026,2026-2027,BBL,552,GOSPEL OF LUKE,An examination of the Gospel of Luke with concentration on its message and preparation of narrative material for preaching and teaching.,Other,undergraduate,False,False,False,False,False,True
cornerstone,2026,2026-2027,BBL,553,ACTS OF THE APOSTLES,"An exegetical examination of the Acts of the Apostles with concentration on the biblical theology of the Book of the Acts, the historical background of events and the theological emphasis of the speeches. Special attention is given to the relationship between the church and Israel in the early church era.",Other,undergraduate,False,True,False,False,False,True
cornerstone,2026,2026-2027,BBL,554,ROMANS,An exposition of this letter in terms of its significance for biblical and systematic theology.,Other,undergraduate,False,True,False,False,False,True
cornerstone,2026,2026-2027,BBL,555,GALATIANS,"The course engages students in readings, critical reflection, online discussion and in reflective and exegetical writing related to the Book of Galatians . Consideration is given to the history of interpretation, exegetical method for interpretation, difficult issues related to interpretation and to theological development. The course culminates for the student in the development of a written exegetical research commentary on one section of the Book of Galatians.",Other,undergraduate,False,False,False,False,False,True
cornerstone,2026,2026-2027,BBL,556,PASTORAL EPISTLES,Interpretation of 1 and 2 Timothy and Titus in relationship to ministry and church life.,Other,undergraduate,False,False,False,False,False,True
