university,academic_year,academic_year_label,department_code,course_number,title,description,broad_area,level,progressive_signal,western_canon_signal,climate_narrow_signal,climate_broad_signal,cross_listed,deduplicated
cornerstone,2026,2026-2027,CRI,450,CREATIVE EMERGENCE,"This course is the culminating course of creativity content which is designed to help students integrate creative theory with their talents, career, and personal endeavors. Students will be required to complete a research paper based on current theories and present it both verbally and in writing.",Other,undergraduate,False,False,False,False,False,True
cornerstone,2026,2026-2027,CRI,480,ADVANCED TOPICS,,Other,undergraduate,False,False,False,False,False,True
cornerstone,2026,2026-2027,DES,615,PROJECT MANAGING THE DESIGN/INOV PROC I,"In this course, students identify a project in their work environment or other area of interest for which they would like to create new solutions and innovation through collaborative design. Students complete a project proposal, collaborative design process, and end-of-course reflection under the guidance of a faculty member.",Other,undergraduate,False,False,False,False,False,True
cornerstone,2026,2026-2027,DES,625,PROJECT MANAGING DES/INNO PROCESS II,"In this course, students identify a project in their work environment or other area of interest for which they would like to create new solutions and innovation through collaborative design. Students complete a project proposal, collaborative design process, and end-of-course reflection under the guidance of a faculty member.",Other,undergraduate,False,False,False,False,False,True
cornerstone,2026,2026-2027,DES,630,COLLABORATIVE DESIGN APPLIED,"A capstone designed for students to synthesize information received throughout the design program, create a plan for applying collaborative design in their workplace or area of interest, and write a real-world case study. Emphasis will be placed on personal integration of collaborative design principles and reflection on how to apply biblical principles of leadership and ethics to innovation processes. Pre-requisites: all other DES courses.",Other,undergraduate,False,True,False,False,False,True
cornerstone,2026,2026-2027,ECN,110,FOUNDATIONS OF A FREE SOCIETY,"This course introduces students to economic life through the biblical themes of image bearing, stewardship, voluntary exchange, and the moral limits of civil government. Attention is given to how Scripture frames questions of work, vocation, generosity, and governance. The course helps students develop a Christian understanding of property rights, and the emergence of markets and money. Students evaluate the causes and consequences of interventionism and examine how biblically grounded principles promote social cooperation, economic flourishing, and faithful civic engagement.",Other,undergraduate,False,True,False,False,False,True
cornerstone,2026,2026-2027,ECN,231,PRINCIPLES OF MACROECONOMICS,"Emphasis upon macroeconomic theories, principles and theories of national income determination, consumption, investment, savings, business cycles, prices and money, the banking system, and monetary and fiscal policy.",Other,undergraduate,False,False,False,False,False,True
cornerstone,2026,2026-2027,ECN,232,PRINCIPLES OF MICROECONOMICS,"Emphasis upon general microeconomic theory, an introduction to theories of consumer behavior, product demand, cost and supply, production, the firm and its markets, and capital and pricing factors.",Other,undergraduate,False,False,False,False,False,True
cornerstone,2026,2026-2027,ECN,321,INTERMEDIATE MICROECONOMICS,"This course is designed to provide students with the tools from intermediate microeconomics, game theory, and industrial organization that they need to make sound managerial decisions. Topics include present value analysis, supply and demand, regression, indifference curves, isoquants, production, costs, and the basic models of perfect competition. Readings include essays by several Nobel Prize-winning economists.",Other,undergraduate,False,False,False,False,False,True
cornerstone,2026,2026-2027,ECN,334,MONEY AND BANKING,"This course will focus on the role of money in the economy. Topics include money flows, the Federal Reserve System, banking regulation and performance.",Other,undergraduate,False,False,False,False,False,True
cornerstone,2026,2026-2027,ECN,335,INTERMEDIATE MACROECONOMICS,"A detailed study of international trade and finance with both macro and micro applications. Topics include international accounting standards, exchange rates, foreign direct investment, international markets and financial control in an international setting.",Other,undergraduate,False,False,False,False,False,True
cornerstone,2026,2026-2027,ECN,336,INTERNATIONAL DEVELOPMENT ECONOMICS,Theoretical and empirical investigation of economic development of under-developed countries. Includes a study into the nature and causes of poverty along with discussions on our role as Christians in the third world developing countries. The course includes a case-study of a low-income nation using various standard of living measures.,Other,undergraduate,False,False,False,False,False,True
cornerstone,2026,2026-2027,ECN,340,FAMILY ECONOMICS,"The purpose of this course is to utilize economic theory in order to analyze the decisions of households as well as how macroeconomic realities alter the decisions of families. The course will also examine the determinants of age at first marriage, family structure, fertility decisions and failure. In addition, the course will examine how intergenerational decision-making impacts children and their health, education and future family decisions. Special attention will be given to the Christian worldview of family structure while examining competing worldviews.",Other,undergraduate,False,False,False,False,False,True
cornerstone,2026,2026-2027,ECN,342,ECONOMICS OF SPORT,"This course applies concepts from principles of microeconomics to the analysis of the business of sport. Students will analyze the use of price controls and revenue sharing, ticket pricing and profit maximization, the economic impact and ethics of amateurism, collective bargaining and antitrust issues, monopsony and monopoly conditions, the determinants of professional salaries. Students will also be challenged to apply the Christian virtues of justice and wisdom in the midst of the economic realities of both amateur and professional sport.",Other,undergraduate,False,False,False,False,False,True
cornerstone,2026,2026-2027,ECN,344,HEALTH CARE ECONOMICS,"The purpose of this course is to introduce students to health economics, as well as the realities of scarcity, uncertainty, risk and government policy in the markets for health care. Attention will be given to U.S. health insurance markets and policy, preventative care, affordability for the poor via Medicare and Medicaid, asymmetric information between providers, insurers and consumers, pricing for pharmaceuticals under Medicare Part D, hospitalization and end of life care, as well as comparing the U.S. healthcare system with those of other nations. The Christian worldview will be articulated with respect to human dignity and mercy and how the Hippocratic principles compare to them.",Other,undergraduate,False,False,False,False,False,True
cornerstone,2026,2026-2027,ECN,380,INTERNSHIP,This course will be aimed at practical work experience in a business setting. Students will have opportunities to apply classroom knowledge to business world situations in economics.,Other,undergraduate,False,False,False,False,False,True
cornerstone,2026,2026-2027,ECN,381,ECONOMICS FIELD EXPERIENCE,This course will be aimed at practical work experience in a business setting. Students will have opportunities to apply classroom knowledge to business world situations in economics.  Students will acquire and document professional field experience and will receive 1 credit hour for every 40 hours of verified work.,Other,undergraduate,False,False,False,False,False,True
cornerstone,2026,2026-2027,ECN,470,DIRECTED READINGS,,Other,undergraduate,False,False,False,False,False,True
cornerstone,2026,2026-2027,ECN,480,ADVANCED TOPICS: ECONOMICS,,Other,undergraduate,False,False,False,False,False,True
cornerstone,2026,2026-2027,ECN,490,INDEPENDENT STUDY,,Other,undergraduate,False,False,False,False,False,True
cornerstone,2026,2026-2027,ECN,530,ECONOMICS,"A study of the decision-making skills necessary for managers and entrepreneurs in the context of the macroeconomic environment and the application of microeconomic price theory as it pertains to human capital issues. Readings include essays by several Nobel prize-winning economists. Further, the course challenges students to develop a Christ-centered worldview regarding economic issues pertinent to managers.",Other,undergraduate,False,False,False,False,False,True
cornerstone,2026,2026-2027,ECO,241,ENVIRONMENTAL SCIENCE,"Studies how ecological principles, philosophy, economics, sociology and politics interact with identifying and solving environmental issues. Topics include: air quality, water quantity and quality, population dynamics, energy sources, types of waste, sustainability, environmental policy and legislation, and pertinent government agencies. Lecture and lab. Course fee applied. This course satisfies the core requirement for lab science.",Social Sciences,undergraduate,False,False,False,True,False,True
cornerstone,2026,2026-2027,ECO,242,GEOGRAPHIC INFORMATION SYSTEMS,"This course introduces students to the theory and application of Geographic Information Systems (GIS), and the fundamentals of spatial data management. Students gain practical experience using ArcGIS software for mapping, modelling, and spatial analysis. Prerequisite: BIO-151 or BIO-233 .",Social Sciences,undergraduate,False,False,False,False,False,True
cornerstone,2026,2026-2027,ECO,243,NATURAL RESOURCES MGT,"An exploration of the role of natural resource agencies in developing, sustaining and protecting natural resources. Emphasis is placed on the history of natural resource management in Michigan, management philosophies, politics that impact natural resources, species and ecology management, sustainability and carrying capacity.",Social Sciences,undergraduate,False,False,False,True,False,True
cornerstone,2026,2026-2027,ECO,244,ENVIRONMENTAL SCIENCE,"Studies how ecological principles, philosophy, economics, sociology and politics interact with identifying and solving environmental issues. Topics include: air quality, water quantity and quality, population dynamics, energy sources, types of waste, sustainability, environmental policy and legislation, and pertinent government agencies.",Social Sciences,undergraduate,False,False,False,True,False,True
cornerstone,2026,2026-2027,ECO,245,ENVIRONMENTAL SCIENCE LAB,"Field and laboratory experiences related to lecture topics in sustainability, waste management, energy production, water quality and environmental policy and legislation. Course fee applied.",Social Sciences,undergraduate,False,False,False,True,False,True
cornerstone,2026,2026-2027,ECO,301,LAND & WATER RESOURCES - AUSABLE,"Systems-level perspective on land forms and ecosystems. Includes analysis and interpretation of on-site data recorded in the field, remote-sensing data derived from satellite and low-altitude aerial imagery and geographic information systems (GIS). Field trips to and analysis of forests, bogs, marshes, dunes, and rivers. Includes application to policy and land use planning.",Social Sciences,undergraduate,False,False,False,True,False,True
cornerstone,2026,2026-2027,ECO,302,LAKE ECOLOGY & MGMT - AUSABLE,Field study of lakes and streams with applications to planning and management. Includes an introduction to limnology and investigation of representative lakes and streams of the region.,Social Sciences,undergraduate,False,False,False,False,False,True
cornerstone,2026,2026-2027,ECO,303,ECOLOGICAL AGRICULTURE - AUSABLE,"Environmental analysis and natural resources in relation to people and policy. The focus is on ethnobotany, ecological agriculture, and land stewardship. It employs a discussion format both in classroom and field settings. Its emphasis is grappling with difficult practical and ethical problems and issues that require deep and persistent thought.",Social Sciences,undergraduate,False,False,False,True,False,True
cornerstone,2026,2026-2027,ECO,304,INTERNL DEVELOP & ENVIRON SUS - AUSABLE,"Global Development and Ecological Stewardship: Environmental analysis and natural resources in relation to society and development issues. The focus is on ecological sustainability and sustainable society in the context of the various factors that are bringing environmental degradation and impoverishment of people and cultures. It deals with topics of tropical agriculture, hunger, poverty, international debt, appropriate technology, relief programs, missionary earthkeeping, conservation of wild nature, land tenure, and land stewardship. It employs a discussion format both in classroom and field settings. Its emphasis is grappling with difficult practical and ethical problems and issues that require deep and persistent thought.",Social Sciences,undergraduate,False,False,False,True,False,True
cornerstone,2026,2026-2027,ECO,305,AGROECOLOGY,"Study a wide variety of current food production systems through visits with practicing farmers.  Evaluate agrosystems in terms of  soil quality, energy flow and nutrient cycling, pesticide fate, functional plant, animal, and genetic biodiversity, water use efficiency, energy flow, and population ecology.  Learn to recognize, design,  and implement sustainable agrosystems.  Engage current social and economic food production systems and norms in the context of Christian faith, to steward the natural resources God has entrusted with us more effectively, improving both global environmental health and food security.",Social Sciences,undergraduate,True,False,False,True,False,True
cornerstone,2026,2026-2027,ECO,308,ENVIRONMENTAL HEALTH,"Study of the interconnection between the health of people, animals, and their shared environment. This course includes topics such as toxicology, epidemiology, community health, radiation, and environmental justice. These topics are applied at the local, regional, and global scale.",Social Sciences,undergraduate,False,False,False,True,False,True
cornerstone,2026,2026-2027,ECO,310,ENVIRONMENTAL LAW & POLICY - AUSABLE,"Analysis of the policy-making process at a local, national, and international scales with examination of environmental policy challenges, including climate change, resource management, and energy development. Students will interact with regional policy-making and land managers in the field to consider linkages between policy and science and ways for science to inform the policy-making process. Environmental ethics, environmental justice, and environmental advocacy will also be considered.",Social Sciences,undergraduate,False,False,True,True,False,True
cornerstone,2026,2026-2027,ECO,311,FIELD BOTANY - AUSABLE,"Field identification and ecology of vascular plants as components of natural communities in Michigan. Emphasis is placed upon on-site examination of plants in communities such as bog, dune, forest, marsh, meadow, and swamp. Plants difficult to study under field conditions are brought to the laboratory for microscopic examination and identification. Ecological features such as community stratification and plant zonation along ecological gradients are examined.",Social Sciences,undergraduate,False,False,False,True,False,True
cornerstone,2026,2026-2027,ECO,314,ENVIRONMENTAL LAW & POLICY,"Study of the treatment and involvement of all people in the development and enforcement of environmental laws, regulations, and policies. This course discusses historical, contemporary, and emerging threats to the environment.",Social Sciences,undergraduate,False,False,False,False,False,True
cornerstone,2026,2026-2027,ECO,318,MARINE BIOLOGY - AUSABLE,"Marine Biology focuses on intertidal life and marine ecology in oceanic and geophysical contexts. Students study the biology of marine plants and animals in the field, specifically trophic dynamic relationships of eel grass communities and the intertidal zone, workings of the island systems of Puget Sound, ecological roles of sea birds and fishes, population and community structure dynamics, exploitation and oceanic microbialization and biogeochemical processes and their linkages with the biosphere. Marine stewardship and effects of human activity on the marine environment are integral to the course.",Social Sciences,undergraduate,False,False,False,True,False,True
cornerstone,2026,2026-2027,ECO,321,ANIMAL ECOLOGY - AUSABLE,Interrelationships between animals and their biotic and physical environments emphasizing behavioral aspects. A field course that centers on the ecology of northern Michigan fauna from a stewardship perspective. Included are individual student projects.,Social Sciences,undergraduate,False,False,False,False,False,True
cornerstone,2026,2026-2027,ECO,322,AQUATIC BIOLOGY - AUSABLE,"Ecology, identification, systematics, culture and care of aquatic plants and animals, and adaptations to freshwater environments. Aquatic life is studied in lakes, ponds, bogs, marshes, streams, and in the laboratory. The course assesses human impact on aquatic species and ecosystems, presents procedures for the stewardship of aquatic habitats, and introduces aquatic restoration ecology. Prerequisites: One year of general biology or one semester each of general zoology and general botany.",Social Sciences,undergraduate,False,False,False,True,False,True
cornerstone,2026,2026-2027,ECO,323,STREAM ECOLOGY - AUSABLE,,Social Sciences,undergraduate,False,False,False,False,False,True
cornerstone,2026,2026-2027,ECO,324,FISH ECOLOGY & MGMT-AUSABLE,"Introduction to the relation of freshwater fish species and their environments in lakes and streams with concurrent examination of techniques and technologies employed to manage populations and species for conservation, recreational use, and commercial harvest. This course will provide understanding of freshwater fish taxonomy and phylogenetic relationships, habitat requirements of major fish species by life stages, stream habitat assessment, population measuring and monitoring, and strategies for management of recreational and commercial species and conservation of threatened and endangered species.",Social Sciences,undergraduate,False,False,False,False,False,True
cornerstone,2026,2026-2027,ECO,330,GEOGRAPHIC INFO SYSTEMS/AUSAB,"An introduction to the theory and application of Geographic Information Systems (GIS) for applied social and ecological  problem-solving. Through a series of readings, videos, and hands-on exercises covering a variety of environmental themes,  issues, and scales, participants will learn the fundamentals of the types of maps, map projections, symbology, classification,  analysis, and web mapping applications, and gain skills and confidence to be able to conduct their own field studies, do  spatial analysis, and create their own maps and visualizations.",Social Sciences,undergraduate,False,False,False,True,False,True
cornerstone,2026,2026-2027,ECO,332,ENVIRONMENTAL CHMSTRY - AUSABLE,"Principles and analysis of chemical movement and distribution both natural and human-induced in natural environments. Sampling and analytical methods are included for water, soil, and air. Work is conducted both on site in natural habitats and the laboratory.",Social Sciences,undergraduate,False,False,False,False,False,True
cornerstone,2026,2026-2027,ECO,341,ECOLOGY,"The study of the interrelationships of living organisms, plant or animal, and their environments. These are studied with a view of discovering the principles that govern relationships. A special emphasis on the different ecosystems of Michigan bogs, marshes, streams, and sand dunes, and man's impact on them, will be studied. Lecture and lab. Course fee applied. This course satisfies the core requirement for lab science.",Social Sciences,undergraduate,False,False,False,True,False,True
cornerstone,2026,2026-2027,ECO,342,FIELD BIOLOGY,"First two weeks: Instruction and experience in the use of the tools of the field biologist, trips to different types of ecosystems: forest, field, stream, pond, lake, marsh, and bog. Final week: Travel experience covering points of interest in the Upper Peninsula and Lower Peninsula of Michigan, or the student may elect to work on a field problem in the Grand Rapids area. Course fee applied.",Social Sciences,undergraduate,False,False,False,True,False,True
cornerstone,2026,2026-2027,ECO,343,TROPICAL AGRICULTURE -AUSABLE,"An introduction to tropical agriculture for working with resource-poor farmers. Topics include the scientific basis behind successful low cost techniques, a survey of major tropical crops and their requirements, and on-site practical work. Selected issues in Christian missions and in community development, and some urban gardening and small animal techniques are also covered. Taught in a rural, mountainous village in Costa Rica in collaboration with a Christian organization aiding redevelopment after an earthquake, with several trips to different ecosystem regions of Costa Rica.",Social Sciences,undergraduate,False,False,False,True,False,True
cornerstone,2026,2026-2027,ECO,345,WILDLIFE ECOLOGY - AUSABLE,"Ecology, conservation and stewardship of wildlife species and their habitats. Includes growth and structure of natural and managed populations, environmental and human social factors affecting wildlife communities and wildlife conservation. The course is set in the context of the historical development of the field from management, to ecology, and to the land ethic of Leopold. Includes management and stewardship of non-game and endangered species, and long-term prospects of wildlife in changing environmental, climatic and social contexts.",Social Sciences,undergraduate,False,False,False,False,False,True
cornerstone,2026,2026-2027,ECO,354,ECOSYSTEM RESEARCH - AUSABLE,"Systems-level perspective on land forms and ecosystems. Includes analysis and interpretation of on-site data recorded in the field, remote-sensing data derived from satellite and low-altitude aerial imagery and geographic information systems (GIS). Field trips to and analysis of forests, bogs, marshes, dunes, and rivers. Includes application to policy and land use planning. Prerequisite: One year of introductory science.",Social Sciences,undergraduate,False,False,False,True,False,True
cornerstone,2026,2026-2027,ECO,355,WATERSHEDS IN GLOBAL DVLPT - AUSABLE,"Principles of watershed ecology. Includes principles and practice of community-based water monitoring and watershed management for developing and developed countries and data access and analysis using an online relational database and data-to-action strategies. Designed for students in science and public policy, including students interested in missions and development and agencies involved in environmental assessment and community development. Prerequisite: One year of general biology.",Social Sciences,undergraduate,False,False,False,False,False,True
cornerstone,2026,2026-2027,ECO,358,FIELD TECHNIQUES IN WETLANDS,"A comprehensive overview of wetland ecosystem processes, values, legislation and quantification. Students will learn to evaluate and quantify soils, hydrologic status and vegetation in a variety of wetland ecosystems including bogs, emergent marshes, forested wetlands and wetlands converted for agriculture, and to apply standard tools developed by the US Army Corps of Engineers and Michigan Department of Environmental Quality to assess wetland extent and habitat quality.",Social Sciences,undergraduate,False,False,False,True,False,True
cornerstone,2026,2026-2027,ECO,359,MARINE MAMMALS - AUSABLE,"Biology, behavior, ecology, identification and conservation of the marine mammals of the Pacific Rim. This study area covers some major habitats in Puget Sound and the Salish Sea, with attention to the diving physiology, social behavior, and communications of whales and seals. The course aims to develop a stewardship perspective rooted in biological principles and directed at the global conservation of marine mammals and their ecosystems. Special attention is given to their use by cultures of the region in order to understand current issues.",Social Sciences,undergraduate,False,False,False,True,False,True
cornerstone,2026,2026-2027,ECO,360,APPLIED BIODIVERSITY GENETICS - AUSABLE,"A field class introducing recent advances in molecular biology techniques, computation and storage for applied ecological work. The ability to utilize these techniques is becoming more and more important to scientists for addressing fundamental questions in biology. This course will expose you to a broad range of techniques and concepts in molecular biology and phylogenetics. Emphasis is placed on the strengths and limitations of each method and its application to a wide range of organisms, including plants, animals and microorganisms. It will provide a foundation for molecular applications to issues of environmental stewardship.  Prerequisites: Two years of biology, one year of chemistry.",Social Sciences,undergraduate,True,False,False,True,False,True
cornerstone,2026,2026-2027,ECO,361,FIELD BIOLOGY IN SPRING-AUSABLE,"Springtime plants and animals, their field identification, field biology, behavior and landscape context with a focus on spring flora, amphibia, and birds.",Social Sciences,undergraduate,False,False,False,False,False,True
