university,academic_year,academic_year_label,department_code,course_number,title,description,broad_area,level,progressive_signal,western_canon_signal,climate_narrow_signal,climate_broad_signal,cross_listed,deduplicated
marshall,2026,2026-2027,ACC,198,Accounting Professionalism,"Introduction to the accounting profession, career options, professional responsibilities, and codes of conduct. Professionalism, networking, interviewing, job search, and technical writing skills are developed.",Professional,lower,no,no,no,no,no,no
marshall,2026,2026-2027,ACC,215,Intro Financial Accounting(CT),"Introduction to financial accounting principles and procedures, including transaction analysis, journalizing, financial statement preparation, business formations, internal control, and financial statement analysis.  This course meets Core 1/Critical Thinking requirement.",Professional,lower,no,no,no,no,no,no
marshall,2026,2026-2027,ACC,216,Intro Managerial Accounting,"Introduction to managerial accounting for use in managerial control and decision making.  the course explores cost application methods, budgeting, profitability analysis, and decision-making models.",Professional,lower,no,no,no,no,no,no
marshall,2026,2026-2027,ACC,280,Special Topics,,Other,lower,no,no,no,no,no,no
marshall,2026,2026-2027,ACC,310,Acct for Entrepreneurs,"Principles, concepts and problems of accounting relevant to decision making for entrepreneurs
including: pro forma financial statements, cash flow, securing financing and cost structures.
NOT OPEN TO STUDENTS IN THE LEWIS COLLEGE OF BUSINESS",Professional,lower,no,no,no,no,no,no
marshall,2026,2026-2027,ACC,311,Intermediate Accounting I,Study of U.S. and International accounting standards related primarily to assets and financial statement preparation.  Accounting standards research and application of Excel are integrated throughout the course.,Professional,lower,no,no,no,no,no,no
marshall,2026,2026-2027,ACC,312,Intermediate Accounting II,Study of U.S. and International accounting standards related primarily to liabilities and revenue recognition.  Accounting standards research and application of Excel are integrated throughout the course.,Professional,lower,no,no,no,no,no,no
marshall,2026,2026-2027,ACC,318,Cost Accounting I,"A study of fundamental cost accounting concepts and objectives including project cost accumulation, cost-volume-profit analysis, direct costing, budget techniques, standard costing, and differential cost analysis.",Professional,lower,no,no,no,no,no,no
marshall,2026,2026-2027,ACC,341,Acc Information Systems,"Introduction to accounting systems. Emphasis on concepts of analysis, design, and implementation of accounting systems with attention on internal and audit trail.",Professional,lower,no,no,no,no,no,no
marshall,2026,2026-2027,ACC,348,Federal Taxation,Problems and procedures of income tax accounting.,Professional,lower,no,no,no,no,no,no
marshall,2026,2026-2027,ACC,364,Forensic & Investigative Acct,This course introduces students to forensic accounting focusing on criminal litigation and investigations of fraud.,Professional,lower,no,no,no,no,no,no
marshall,2026,2026-2027,ACC,412,Governmental Accounting,A study of the use of accounting information in the financial management of governmental and non-profit entities.,Professional,lower,no,no,no,no,no,no
marshall,2026,2026-2027,ACC,414,Adv Accounting Problems,Selected problems in advanced accounting principles and procedures.,Professional,lower,no,no,no,no,no,no
marshall,2026,2026-2027,ACC,418,Managerial Accounting,The managerial approach to budgetary control.,Professional,lower,no,no,no,no,no,no
marshall,2026,2026-2027,ACC,429,Auditing I,A study of the theory and procedures of auditing and the legal and social responsibilities of the auditor.,Other,lower,no,no,no,no,no,no
marshall,2026,2026-2027,ACC,435,Internal Auditing,"This course discusses the applicable current internal auditing theory and procedures, including a review of corporate governance and risk assessment.",Other,lower,no,no,no,no,no,no
marshall,2026,2026-2027,ACC,440,Accounting Analytics,This course studies the impact of data analytics on accounting and auditing and explores when and how various analytical procedures and tools can be used to address business questions.,Professional,lower,no,no,no,no,no,no
marshall,2026,2026-2027,ACC,448,Federal Income Tax II,"Advanced course in taxation with emphasis on corporations, partnerships, estates, trusts, gifts, valuation and liquidity problems, and tax administration and practice.",Other,lower,no,no,no,no,no,no
marshall,2026,2026-2027,ACC,480,Special Topics,"Study of an advanced topic not normally covered in other courses.  Accounting majors only, with permission of Department Chair.",Professional,lower,no,no,no,no,no,no
marshall,2026,2026-2027,ACC,485,Independent Study,,Other,lower,no,no,no,no,no,no
marshall,2026,2026-2027,ACC,490,Internship,A supervised internship in which the student works for a business firm/agency to gain practical experience in the student's major. The program of work and study will be defined in advance and the student's performance will be evaluated.,Professional,lower,no,no,no,no,no,no
marshall,2026,2026-2027,ACC,499,Professional and Ethics Sem,"Designed to increase the student's awareness of the accounting environment, emphasizing ethics.  Communication skills are improved through impromptu speaking, written reports, group projects and formal presentations.  Capstone Course.",Social Sciences,lower,no,no,no,no,no,no
marshall,2026,2026-2027,ACE,201,Intro to Career & Technical Ed,"Designed to provide the new teacher guidance and supervision in implementing strategies in instructional planning, student engagement, and classroom management. Incorporates reflection and basic assessment strategies for students and instruction.",Professional,lower,no,no,no,no,no,no
marshall,2026,2026-2027,ACE,301,Occupational Analysis,"This course assists the CTC instructor in analyzing, classifying, and describing occupations, analysis procedures for determining CTC education curriculum, course content, technical skills, and knowledge.",Professional,lower,no,no,no,no,no,no
marshall,2026,2026-2027,ACE,302,Course Const & Planning in CTE,"Analysis of procedures for determining appropriate CTE curriculum content, program goals and objectives. Involvement of advisory committees for CTE. Explore factors, principles, and techniques om developing a CTE course.",Other,lower,no,no,no,no,no,no
marshall,2026,2026-2027,ACE,304,Safety in CTE,"Establishment of the teacher role, liability and accountability in providing a safe learning/working environment for CTE students.  Study of best-practice approaches to accident prevention. Introduction to laws and regulatory agencies.",Professional,lower,no,no,no,no,no,no
marshall,2026,2026-2027,ACE,305,Methods of Examination in CTE,"This course prepares the CTE instructor to develop oral, written and performance evaluation instruments. The CTE instructor will develop and use progress monitoring strategies, feedback tools, and determine grading procedures.",Other,lower,no,no,no,no,no,no
marshall,2026,2026-2027,ACE,306,Coordination of Cooperative Ed,"Methods and techniques for evaluating and selecting work stations, student selection, placement and follow-up.  The WVDE Experiential Learning Guide is used for placement of students in structured work-based experiences.",Other,lower,no,no,no,no,no,no
marshall,2026,2026-2027,ACE,307,Computer Applications in CTE,"Introduction to computer-related terminology, internet concepts and types of software to be used by the CTE teacher. Assignments/Activities provide CTE teachers with assistance on using computer/software to enhance classroom productivity.",STEM,lower,no,no,no,no,no,no
marshall,2026,2026-2027,ACE,402,History and Philosophy of CTE,Historical influences in the development of Career and Technical education in America and Europe; motivating influences and the implications of philosophy in modern Career and Technical education.,Humanities,lower,no,no,no,no,no,no
marshall,2026,2026-2027,ACE,409,Coord CTE Youth Activities,Course is designed to help the teacher of a career technical or health education program to organize and develop a student organization that is co-curricular to their particular program area.,Professional,lower,no,no,no,no,no,no
marshall,2026,2026-2027,ACE,421,Teach Special Students in CTE,"A teacher and program approach to analyzing procedures for identifying CTE curriculum, support, instructional planning, student assessment in teaching students with special learning challenges and needs in career preparation programs.",Other,lower,no,no,no,no,no,no
marshall,2026,2026-2027,ACE,422,Occup Update Back to Industry,"An occupational specialization updating experience for the in-service, career technical teacher.  In-service teacher will gain new knowledge and skill in an occupational specialization through back-to-industry experience.",Other,lower,no,no,no,no,no,no
marshall,2026,2026-2027,ACE,423,Occup Update Bus./Ind. Enrich,"Seminars or workshops designed for specific occupational specializations updating.  Special topics designed to provide the in-service, CTE teacher with new knowledge and skill required of workers in business and industry.",Professional,lower,no,no,no,no,no,no
marshall,2026,2026-2027,ACE,424,Occup Update Instructor Dev,Special seminars or workshops designed for specific instruction strategies and teaching techniques updating.  Special topics shall be designed that are required of teachers in the classroom/lab/clinical/co-op setting.,Other,lower,no,no,no,no,no,no
marshall,2026,2026-2027,ACE,425,Occup Update Other,"Seminars, workshops, or other educational opportunities/events designed for increasing capacity and skill level for the CTE educator.  Special topics will recognize best-practices in the classroom, school, and extended learning community.",Professional,lower,no,no,no,no,no,no
marshall,2026,2026-2027,ACE,485,Teaching Methods in CTE,"Addresses shop/lab/classroom and individual/group instruction using multiple best practice strategies. The four modules in teaching in CTE is emphasized. Physical, social and academic factors relating to shop/lab/classroom techniques are addressed.",Humanities,lower,no,no,no,no,no,no
marshall,2026,2026-2027,ACE,499,Senior Project in CTE,"Student design and complete an interdisciplinary project as evidence of mastery of instructional planning and strategies, student assessment and classroom management skills in an individualized classroom or laboratory learning environment.",Professional,lower,no,no,no,no,no,no
marshall,2026,2026-2027,ANT,201,Cultural Anthropology (CT),Introduction to the scientific study of culture with emphasis on the cultures of small-scale societies. This class emphasizes critical thinking skills.,Social Sciences,lower,no,no,no,no,no,no
marshall,2026,2026-2027,ANT,201H,Cultural Anthropol Honors (CT),Introduction to the scientific study of culture with emphasis on the cultures of small-scale societies. This class emphasizes critical thinking skills. For the honors student.,Other,lower,no,no,no,no,no,no
marshall,2026,2026-2027,ANT,280,Special Topics,,Other,lower,no,no,no,no,no,no
marshall,2026,2026-2027,ANT,281,Special Topics,,Other,lower,no,no,no,no,no,no
marshall,2026,2026-2027,ANT,282,Special Topics,,Other,lower,no,no,no,no,no,no
marshall,2026,2026-2027,ANT,283,Special Topics,,Other,lower,no,no,no,no,no,no
marshall,2026,2026-2027,ANT,301,Social Statistics,Introduction to statistical analysis of social data.,STEM,lower,no,no,no,no,no,no
marshall,2026,2026-2027,ANT,322,Archaeology,Introduction to the methods and theory of archaeology.,Other,lower,no,no,no,no,no,no
marshall,2026,2026-2027,ANT,323,Archaeolog Field Train,"Supervised instruction in on-site archaeological data collection, survey and excavation techniques.",Other,lower,no,no,no,no,no,no
marshall,2026,2026-2027,ANT,324,Archaeological Analysis,Supervised instruction in processing and analyzing archaeological materials recovered by fieldwork.,Other,lower,no,no,no,no,no,no
marshall,2026,2026-2027,ANT,325,World Prehistory,"An introduction to the archaeology of pre-literate cultures, from the emergence of Homo Sapiens to the present.",Humanities,lower,no,no,no,no,no,no
marshall,2026,2026-2027,ANT,326,Classical Archaeology,"Archaeology of ancient Greece and Rome, and their colonies and imperial domains.",Other,lower,no,yes,no,no,no,no
marshall,2026,2026-2027,ANT,331,Biological Anthropology,"This course is the scientific study of humans and their closest extinct and extant relatives from evolutionary, biological, behavioral, and biocultural perspectives.",Social Sciences,lower,no,no,no,no,no,no
marshall,2026,2026-2027,ANT,336,Forensic Anthropology,"Forensic Anthropology is the study of human remains in medicolegal contexts. This course teaches students scene processing methods, analyzing human remains, estimating time since death, and determining manner of death.",Social Sciences,lower,no,no,no,no,no,no
marshall,2026,2026-2027,ANT,361,Ethnographic Research,A project-based introduction to ethnographic research design and practice.,Other,lower,no,no,no,no,no,no
marshall,2026,2026-2027,ANT,362,"Health, Culture & Society","A cross-cultural, historical, and bio-cultural examination through case-study of social and environmental factors that affect human health and disease.",Other,lower,no,no,no,no,no,no
marshall,2026,2026-2027,ANT,363,US Culture and the Family,"An historically and ethnographically informed consideration of the changing meaning and place of family and work in everyday American life, media, and politics.",Other,lower,no,no,no,no,no,no
marshall,2026,2026-2027,ANT,364,Expressive Culture,Exploration of expressive cultural forms in the construction of personal and communal identities and their meaningful attachment to particular geographic places.,Other,lower,no,no,no,no,no,no
marshall,2026,2026-2027,ANT,365,Anthropology through Film,"Exploration of film as general anthropological field of interest with emphasis on understanding selected films as cultural texts and association with particular and changing cultural, political, economics and historical contexts.",Social Sciences,lower,no,no,no,no,no,no
marshall,2026,2026-2027,ANT,371,Linguistic Anthropology,Introduction to the theories and methodologies of linguistic anthropology and to language as a cultural phenomenon and form of diversity.,Social Sciences,lower,yes,no,no,no,no,no
marshall,2026,2026-2027,ANT,372,Methods in Language & Culture,"In this course, students will learn a variety of methods for studying language and culture used in anthropology, sociolinguistics, and applied linguistics by collecting and analyzing actual linguistic data",Social Sciences,lower,no,no,no,no,no,no
marshall,2026,2026-2027,ANT,402,Principles of GIS,"Introduction to Geographic Information Systems (GIS) principles, techniques, and applications for the social and natural sciences with emphasis on foundational geographic principles in a lecture/lab format.",Other,lower,no,no,no,no,no,no
marshall,2026,2026-2027,ANT,411,Deconstructing Appalachia,Exploration of the historical and cultural significance of Appalachia in the American experience and imagination.,Other,lower,no,no,no,no,no,no
marshall,2026,2026-2027,ANT,412,Appalachian Field Exp I,Supervised fieldwork in an Appalachian community studying the social and cultural characteristics of the area.,Other,lower,no,no,no,no,no,no
marshall,2026,2026-2027,ANT,428,Arch Theory and Analysis,"An introduction to archaeological theory and its application to the material record of cultures, past and present.",Other,lower,no,no,no,no,no,no
marshall,2026,2026-2027,ANT,440,African Cultures,"Comparative analysis of the ethnic groups of Africa, using archaeological and ethnographic data.",Other,lower,no,no,no,no,no,no
marshall,2026,2026-2027,ANT,441,Oceania,"Comparative analysis of the indigenous peoples and cultures of Melanesia and Polynesia, using archaeological and ethnographic data.",Other,lower,no,no,no,no,no,no
marshall,2026,2026-2027,ANT,442,The Native Americans,"Comparative analysis of the indigenous inhabitants of North America, using archaeological and ethnographic data. PR: Six hours of anthropology or departmental permission.",Social Sciences,lower,no,no,no,no,no,no
marshall,2026,2026-2027,ANT,445,American Ethnicities,"Comparative overview of historical and contemporary patterns of immigration, settlement, and inter-ethnic relations in the United States.",Other,lower,no,no,no,no,no,no
marshall,2026,2026-2027,ANT,460,Crime and Custom,This course examines law and legal processes in diverse cultures from anthropological and law and society perspectives.,Professional,lower,no,no,no,no,no,no
marshall,2026,2026-2027,ANT,464,"Design, Planning & Health","Social scientific study of how places where people live, work, and recreate affect quality of life and overall health with an emphasis on design decisions within urban and regional planning.",Other,lower,no,no,no,no,no,no
marshall,2026,2026-2027,ANT,465,"Disaster, Culture & Health",Study of contemporary environmental and social problems emphasizing health impacts of natural and technological disasters on communities around the world.,Other,lower,no,no,no,no,no,no
marshall,2026,2026-2027,ANT,466,Culture and Environment,"This course will examine the symbolic and structural dimensions of struggles over defining, organizing, and controlling the natural environment from biocultural perspective.",Other,lower,no,no,no,no,no,no
marshall,2026,2026-2027,ANT,467,Culture in Ethnographies,In depth exploration and comparison of diverse cultural groups through reading and discussing ethnographic texts. PR: Six credit hours of anthropology or departmental permission.,Social Sciences,lower,no,no,no,no,no,no
marshall,2026,2026-2027,ANT,468,National Identity,"Exploration of cultural, political and economic processes that contribute to creation and maintenance of the modern national state as an imagined community.",Social Sciences,lower,no,no,no,no,no,no
marshall,2026,2026-2027,ANT,472,"Language, Gender and the Body","Uses methods and theories from anthropology, linguistics, and sociology to examine how gendered bodies in different cultures are constructed through ways of acting in the world.",Social Sciences,lower,no,no,no,no,no,no
marshall,2026,2026-2027,ANT,478,Intro to Sociolinguistics,"Sociolinguistics is the study of the effects of language in society relevant to discourse practices, language attitudes, variations, shifts and changes.",Humanities,lower,no,no,no,no,no,no
marshall,2026,2026-2027,ANT,480,Special Topics,Study of topics of interest not covered in regularly scheduled courses.,Other,lower,no,no,no,no,no,no
marshall,2026,2026-2027,ANT,481,Special Topics,Study of topics of interest not covered in regularly scheduled courses.,Other,lower,no,no,no,no,no,no
marshall,2026,2026-2027,ANT,482,Special Topics,Study of topics of interest not covered in regularly scheduled courses.,Other,lower,no,no,no,no,no,no
marshall,2026,2026-2027,ANT,483,Special Topics,Study of topics of interest not covered in regularly scheduled courses.,Other,lower,no,no,no,no,no,no
marshall,2026,2026-2027,ANT,485,Independent Study,Individual study of topics not offered in regularly scheduled courses. Advance permission required.,Other,lower,no,no,no,no,no,no
marshall,2026,2026-2027,ANT,486,Independent Study,Individual study of topics not offered in regularly scheduled courses. Advance permission required.,Other,lower,no,no,no,no,no,no
marshall,2026,2026-2027,ANT,487,Independent Study,Individual study of topics not offered in regularly scheduled courses. Advance permission required.,Other,lower,no,no,no,no,no,no
marshall,2026,2026-2027,ANT,488,Independent Study,Individual study of topics not offered in regularly scheduled courses. Advance permission required.,Other,lower,no,no,no,no,no,no
marshall,2026,2026-2027,ANT,489,Internship,Supervised practicum founded on anthropological knowledge in a host institution. 40-45 hours of internship work correspond with 1 credit hour.,Other,lower,no,no,no,no,no,no
marshall,2026,2026-2027,ANT,491,Anthropological Theory,Introduction to major theoretical traditions of anthropology with emphasis on the connection between fieldwork and development of theory.,Social Sciences,lower,no,no,no,no,no,no
marshall,2026,2026-2027,ANT,492,Senior Seminar I,Application of anthropological theory and practice to individually designed projects. This course fulfills the capstone requirement for undergraduate anthropology majors.,Social Sciences,lower,no,no,no,no,no,no
marshall,2026,2026-2027,ANT,493,Senior Seminar II,Application of anthropological theory and practice to individually designed projects.  Fulfills the capstone requirement for undergraduate majors.,Other,lower,no,no,no,no,no,no
marshall,2026,2026-2027,MUSA,180,Applied Composition,Individual studies in composition. May be repeated for credit.,Other,lower,no,no,no,no,no,no
marshall,2026,2026-2027,MUSA,181,Saxophone,Individual studies in saxophone. May be repeated for credit.,Other,lower,no,no,no,no,no,no
marshall,2026,2026-2027,MUSA,182,Flute,Individual studies in flute. May be repeated for credit.,Other,lower,no,no,no,no,no,no
marshall,2026,2026-2027,MUSA,183,Oboe,Individual studies in oboe. May be repeated for credit.,Other,lower,no,no,no,no,no,no
marshall,2026,2026-2027,MUSA,184,Clarinet,Individual studies in clarinet. May be repeated for credit.,Other,lower,no,no,no,no,no,no
marshall,2026,2026-2027,MUSA,185,Bassoon,Individual studies in bassoon. May be repeated for credit.,Other,lower,no,no,no,no,no,no
marshall,2026,2026-2027,MUSA,186,French Horn,Individual studies in French horn. May be repeated for credit.,Humanities,lower,no,no,no,no,no,no
marshall,2026,2026-2027,MUSA,187,Trumpet,Individual studies in trumpet. May be repeated for credit.,Other,lower,no,no,no,no,no,no
marshall,2026,2026-2027,MUSA,188,Trombone,Individual studies in trombone. May be repeated for credit.,Other,lower,no,no,no,no,no,no
marshall,2026,2026-2027,MUSA,189,Euphonium,Individual studies in euphonium. May be repeated for credit.,Other,lower,no,no,no,no,no,no
marshall,2026,2026-2027,MUSA,190,Tuba,Individual studies in tuba. May be repeated for credit.,Other,lower,no,no,no,no,no,no
marshall,2026,2026-2027,MUSA,191,Violin,Individual studies in violin. May be repeated for credit.,Other,lower,no,no,no,no,no,no
marshall,2026,2026-2027,MUSA,192,Viola,Individual studies in viola. May be repeated for credit.,Other,lower,no,no,no,no,no,no
marshall,2026,2026-2027,MUSA,193,Cello,Individual studies in cello. May be repeated for credit.,Other,lower,no,no,no,no,no,no
marshall,2026,2026-2027,MUSA,194,String Bass,Individual studies in string bass. May be repeated for credit.,Other,lower,no,no,no,no,no,no
marshall,2026,2026-2027,MUSA,195,Piano,Individual studies in piano. May be repeated for credit.,Other,lower,no,no,no,no,no,no
marshall,2026,2026-2027,MUSA,196,Voice,Individual studies in voice. May be repeated for credit.,Other,lower,no,no,no,no,no,no
marshall,2026,2026-2027,MUSA,197,Organ,Individual studies in organ. May be repeated for credit.,Other,lower,no,no,no,no,no,no
marshall,2026,2026-2027,MUSA,198,Percussion,Individual studies in percussion. May be repeated for credit.,Other,lower,no,no,no,no,no,no
marshall,2026,2026-2027,MUSA,199,Guitar,Individual studies in guitar. May be repeated for credit.,Other,lower,no,no,no,no,no,no
marshall,2026,2026-2027,MUSA,276,Sophomore Hearing,A special examination for admission to 300-level applied study. Maximum of two attempts. Must be taken with principal applied instrument course ( MUSA 180 - MUSA 199 ),Other,lower,no,no,no,no,no,no
marshall,2026,2026-2027,MUSA,376,Recital,"Serves as the summative recital for BA Music, Education and as the Junior level recital for the BFA, and as the Junior level recital for the BFA. Permission of applied instructor required. Must be taken with advanced principal instrument course ( MUSA 380 - MUSA 396 ).",Professional,lower,no,no,no,no,no,no
marshall,2026,2026-2027,MUSA,380,Applied Composition,Individual upper level studies in composition. May be repeated for credit.,Other,lower,no,no,no,no,no,no
marshall,2026,2026-2027,MUSA,381,Saxophone,Individual upper level studies in saxophone. May be repeated for credit.,Other,lower,no,no,no,no,no,no
marshall,2026,2026-2027,MUSA,382,Flute,Individual upper level studies in flute. May be repeated for credit.,Other,lower,no,no,no,no,no,no
marshall,2026,2026-2027,MUSA,383,Oboe,Individual upper level studies in oboe. May be repeated for credit.,Other,lower,no,no,no,no,no,no
marshall,2026,2026-2027,MUSA,384,Clarinet,Individual upper level studies in clarinet. May be repeated for credit.,Other,lower,no,no,no,no,no,no
marshall,2026,2026-2027,MUSA,385,Bassoon,Individual upper level studies in bassoon. May be repeated for credit.,Other,lower,no,no,no,no,no,no
marshall,2026,2026-2027,MUSA,386,French Horn,Individual upper level studies in French horn. May be repeated for credit.,Humanities,lower,no,no,no,no,no,no
marshall,2026,2026-2027,MUSA,387,Trumpet,Individual upper level studies in trumpet. May be repeated for credit.,Other,lower,no,no,no,no,no,no
marshall,2026,2026-2027,MUSA,388,Trombone,Individual upper level studies in trombone. May be repeated for credit.,Other,lower,no,no,no,no,no,no
marshall,2026,2026-2027,MUSA,389,Euphonium,Individual upper level studies in euphonium. May be repeated for credit.,Other,lower,no,no,no,no,no,no
marshall,2026,2026-2027,MUSA,390,Tuba,Individual upper level studies in tuba. May be repeated for credit.,Other,lower,no,no,no,no,no,no
marshall,2026,2026-2027,MUSA,391,Violin,Individual upper level studies in violin. May be repeated for credit.,Other,lower,no,no,no,no,no,no
