university,academic_year,academic_year_label,department_code,course_number,title,description,broad_area,level,progressive_signal,western_canon_signal,climate_narrow_signal,climate_broad_signal,cross_listed,deduplicated
marshall,2026,2026-2027,HST,407,Sex and Sexuality in the US,"Examines the history of sex and sexuality in North America in the context of cultural, legal, economic, political and social history from the 16th century to present.",Social Sciences,lower,no,no,no,no,no,no
marshall,2026,2026-2027,HST,409,American Revolution,A varied view of the American Revolution and its impact on the American people.,Other,lower,no,no,no,no,no,no
marshall,2026,2026-2027,HST,414,Am Civil War & Reconstruc,"A discussion of the economic, political, social, and cultural differences leading to the Civil War, the war itself, and an analysis of the political and economic importance of Reconstruction.",Social Sciences,lower,no,no,no,no,no,no
marshall,2026,2026-2027,HST,417,U.S. West to 1900,"A study of the social, cultural, political, and economic history of the US West to 1900, along with West's place in public memory.",Social Sciences,lower,no,no,no,no,no,no
marshall,2026,2026-2027,HST,421,Renaissance & Reformation,"The impact of the Renaissance upon esthetic, economic, and political developments especially in the 15th and 16th centuries.  The decline of Catholicism and the growth of the Protestant movement, and the influence of the two movements upon each other are stressed.",Social Sciences,lower,no,yes,no,no,no,no
marshall,2026,2026-2027,HST,425,European Hist 1814-1914,"A century of European political, economic and social history and its relationship to and influence upon the history of other world areas is noted. The impact of imperialistic rivalry is emphasized.",Social Sciences,lower,no,no,no,no,no,no
marshall,2026,2026-2027,HST,427,World War II,"This course explores the Second World War.  It probes the nexus of diplomacy, politics, ideology, military strategy and operations, economics, and technological innovation that generated a truly global ""total war.""",Social Sciences,lower,no,no,no,no,no,no
marshall,2026,2026-2027,HST,428,Age of Revolutions in Europe,A survey of European history through the study of various revolutions.,Humanities,lower,no,no,no,no,no,no
marshall,2026,2026-2027,HST,429,Russia to 1917,"A survey of Russian history to 1917 which examines Russia before the Russians, Kievan Russia, Appanage Russia, Muscovite Russia and Imperial Russia.",Humanities,lower,no,no,no,no,no,no
marshall,2026,2026-2027,HST,430,Soviet Russia and Beyond,"Rise and fall of the Soviet Union, with emphasis on political and economic changes and Soviet foreign policy, and including an examination of the aftermath of the Soviet Union's collapse.",Social Sciences,lower,no,no,no,no,no,no
marshall,2026,2026-2027,HST,433,In Our Time-Am Since 1945,"A study of America since World War II, focusing mainly on domestic politics, foreign affairs, the civil rights movement, the rise of minorities, and the fragmentation of American society.",Other,lower,no,no,no,no,no,no
marshall,2026,2026-2027,HST,434,The Vietnam War,"A study of the origin and escalation of American involvement in Vietnam, the domestic impact of the war within the United States and the collapse of the South Vietnamese government.",Other,lower,no,no,no,no,no,no
marshall,2026,2026-2027,HST,435,Modern Japan,Begins with the samurai revolution of the nineteenth century Japan and explores the rise of Japan to the position of world power.,Other,lower,no,no,no,no,no,no
marshall,2026,2026-2027,HST,436,Modern China,"This course will provide an overview of Chinese history in the modern era (1600 to present), including the major political, cultural, social and intellectual events and trends of this period.",Social Sciences,lower,no,no,no,no,no,no
marshall,2026,2026-2027,HST,437,Seminar in Public History,"Introduction to the basic theories, ideas, and approaches to the application of historical theory or methods to projects presented to non-student publics; local and economic development applications and projects emphasized.",Humanities,lower,no,no,no,no,no,no
marshall,2026,2026-2027,HST,438,Stuff and Things in History,"This course investigates the rich potential of""things"" -- objects, landscapes,
buildings, household utensils, furniture, foods, works of art, clothing, etc -- as
sources of insight about American history and culture.",Humanities,lower,no,no,no,no,no,no
marshall,2026,2026-2027,HST,440,West Virginia History,"An interdisciplinary study of the state, its people and its institutions within the national context.",Humanities,lower,no,no,no,no,no,no
marshall,2026,2026-2027,HST,445,Arab-Israeli Conflict,"This course will examine the historical developments of the modern Arab-Israeli conflict, with emphasis placed on political, socioeconomic, and cultural change and the prospects for peace.",Social Sciences,lower,no,no,no,no,no,no
marshall,2026,2026-2027,HST,447,Film and Empire,This course explores the nature and importance of empires through the reading of key texts and the study of selected films.,Other,lower,no,no,no,no,no,no
marshall,2026,2026-2027,HST,448,British History in Film,This course explores selected aspects of British history through the study of films and key texts.,Humanities,lower,no,no,no,no,no,no
marshall,2026,2026-2027,HST,449,World War I in Film,"This course explores the origins, course, and meaning of World War I (1914-1918) through the use of selected films and readings.",Other,lower,no,no,no,no,no,no
marshall,2026,2026-2027,HST,452,History of Sports in America,"Examines the effects of sports on American society and culture.  It explores the historical development of American sports and examine relationships between sports, nationalism, politics, economics, gender and American expansion.",Social Sciences,lower,no,no,no,no,no,no
marshall,2026,2026-2027,HST,453,The Kennedy Assassination,This course explores the events surrounding the assassination of President John F. Kennedy.,Other,lower,no,no,no,no,no,no
marshall,2026,2026-2027,HST,454,History of Ireland,This course explores the history of Ireland from the Middle Ages to the Present.,Humanities,lower,no,no,no,no,no,no
marshall,2026,2026-2027,HST,456,Intro to Genealogy,"This course offers a hands-on introduction to genealogical research methods, tools, and ethics. Students will interpret family histories using census records, oral histories, military files etc.",Other,lower,no,no,no,no,no,no
marshall,2026,2026-2027,HST,458,Spies in History,This course explores the role played by spies and espionage in modern history.,Humanities,lower,no,no,no,no,no,no
marshall,2026,2026-2027,HST,462,The Viking World,"By analyzing saga literature, poetry, and artifacts, students will examine the history of medieval Scandinavia.",Humanities,lower,no,no,no,no,no,no
marshall,2026,2026-2027,HST,464,Celtic Britain,"This course examines the history, literature, and languages of the peoples who lived on the fringes of ancient and medieval Britain.",Humanities,lower,no,no,no,no,no,no
marshall,2026,2026-2027,HST,465,Medieval Britain,An examination of mainland Britain from the pre-Roman era through the Hundred Years War.,Other,lower,no,no,no,no,no,no
marshall,2026,2026-2027,HST,466,Medieval Queens,"The evolution of power and rule from the late Roman Empire through medieval Europe, with a special focus on royal women.",Other,lower,no,no,no,no,no,no
marshall,2026,2026-2027,HST,467,Fashion and Textile History,Cross-cultural comparisons of textiles as primary sources for prehistoric cultures through the 1920's.,Humanities,lower,no,no,no,no,no,no
marshall,2026,2026-2027,HST,470,The Civil War in Myth & Memory,"In a small seminar-setting, this course will look at Union and Confederate (northern and southern), Black and white, male and female interpretations of the war between 1865 and the present.",Other,lower,no,no,no,no,no,no
marshall,2026,2026-2027,HST,473,Tracks through Time,"This course analyzes how railroads impacted global political, economic, social, and cultural development since 1800. It intertwines the local history of Huntington with global stories from Africa to China.",Social Sciences,lower,no,no,no,no,no,no
marshall,2026,2026-2027,HST,475,History Internship,History internships allow students to obtain real-world and hand-on job experience working with community partners.,Humanities,lower,no,no,no,no,no,no
marshall,2026,2026-2027,HST,480,Special Topics,,Other,lower,no,no,no,no,no,no
marshall,2026,2026-2027,HST,481,Special Topics,,Other,lower,no,no,no,no,no,no
marshall,2026,2026-2027,HST,482,Special Topics,,Other,lower,no,no,no,no,no,no
marshall,2026,2026-2027,HST,483,Special Topics,,Other,lower,no,no,no,no,no,no
marshall,2026,2026-2027,HST,485,Independent Study,,Other,lower,no,no,no,no,no,no
marshall,2026,2026-2027,HST,486,Independent Study,,Other,lower,no,no,no,no,no,no
marshall,2026,2026-2027,HST,487,Independent Study,,Other,lower,no,no,no,no,no,no
marshall,2026,2026-2027,HST,488,Independent Study,,Other,lower,no,no,no,no,no,no
marshall,2026,2026-2027,HON,200,Second Year Seminar,"An interdisciplinary seminar for second-year honors students that uses 
reflective inquiry to explore the interrelation and integration of leadership, ethics 
and civic engagement in a diverse, interconnected and changing world.",Other,lower,no,no,no,no,no,no
marshall,2026,2026-2027,HON,280,Special Topics,,Other,lower,no,no,no,no,no,no
marshall,2026,2026-2027,HON,290,Yeager Seminar I,Interdisciplinary seminar for first semester Yeager scholars.,Other,lower,no,no,no,no,no,no
marshall,2026,2026-2027,HON,291,Yeager Seminar II,Interdisciplinary seminar for second semester Yeager scholars.,Other,lower,no,no,no,no,no,no
marshall,2026,2026-2027,HON,292,Yeager Seminar III,Interdisciplinary seminar for third semester Yeager scholars.,Other,lower,no,no,no,no,no,no
marshall,2026,2026-2027,HON,293,Yeager Seminar IV,Interdisciplinary seminar for fourth semester Yeager scholars.,Other,lower,no,no,no,no,no,no
marshall,2026,2026-2027,HON,300,Honors Peer Mentors & Leaders,"An experiential learning course providing peer advisor and leadership training for work with college staff to provide student support services, including community building events.  May be repeated for credit.  (PR: Admitted Honors College 1)",Other,lower,no,no,no,no,no,no
marshall,2026,2026-2027,HON,301,Honors Engagement & Outreach,"An experiential learning course providing outreach and leadership training. Students engage in recruitment, student support, and community-building while developing durable skills. May be repeated for credit. (Course can be repeated an unlimited amount of times.)",Other,lower,no,no,no,no,no,no
marshall,2026,2026-2027,HON,480,Special Topics,A study of special topics not listed under current course offerings.,Other,lower,no,no,no,no,no,no
marshall,2026,2026-2027,HON,481,Special Topics,A study of special topics not listed under current course offerings.,Other,lower,no,no,no,no,no,no
marshall,2026,2026-2027,HON,483,Special Topics,A study of special topics not listed under current course offerings.,Other,lower,no,no,no,no,no,no
marshall,2026,2026-2027,HON,484,Honors College Newsletter,"An experiential learning course where students peer teach skills for and participate in information gathering, writing, editing, and designing the Honors College newsletter.  May be repeated for credit.",Other,lower,no,no,no,no,no,no
marshall,2026,2026-2027,HON,485,Independent Study,,Other,lower,no,no,no,no,no,no
marshall,2026,2026-2027,HON,486,Independent Study,,Other,lower,no,no,no,no,no,no
marshall,2026,2026-2027,HON,487,Independent Study,,Other,lower,no,no,no,no,no,no
marshall,2026,2026-2027,HON,488,Student Assoc Steering Comm,"Steering Committee is an experiential learning course in which students peer teach leadership and community building while organizing service, educational, and social events.  May be repeated for credit.",Professional,lower,no,no,no,no,no,no
marshall,2026,2026-2027,HON,489,Honors Internship,"Mentored experiential learning opportunity contracted with a business enterprise, professional organization, or government agency and the Honors College for honors students in good standing.  Requires mentor evaluation and student report.",Professional,lower,no,no,no,no,no,no
marshall,2026,2026-2027,HON,490,TedxMarshallU Honors Interns,An experiential learning course conducted as a team internship with faculty mentor and TED licensee to plan and conduct the TEDxMarshallU event. May be repeated for credit.,Other,lower,no,no,no,no,no,no
marshall,2026,2026-2027,IE,303,Work Design,Design of work systems and measurement of work.  Students are also introduced to ergonomics considerations in the design of manual operations.,Other,lower,no,no,no,no,no,no
marshall,2026,2026-2027,IE,305,System Engineering,This course introduces students to the fundamental principles of systems engineering and their application to the development of complex systems.,STEM,lower,no,no,no,no,no,no
marshall,2026,2026-2027,IE,401,Modeling & Quan Analysis,"Simulation of complex deterministic/stochastic systems.  Random number generation.  Input and output analyses.  Spreadsheet simulations Design of simulation experiments.  Applications in manufacturing, supply-chain, networks, military, health care, service systems.",Other,lower,no,no,no,no,no,no
marshall,2026,2026-2027,IE,404,Quality Control,"A comprehensive coverage of modern quality control techniques to include the design of statistical process control systems, lean 6 sigma, and process improvement.",Other,lower,no,no,no,no,no,no
marshall,2026,2026-2027,IE,480,Special Topics,,Other,lower,no,no,no,no,no,no
marshall,2026,2026-2027,IE,481,Special Topics,,Other,lower,no,no,no,no,no,no
marshall,2026,2026-2027,IE,482,Special Topics,,Other,lower,no,no,no,no,no,no
marshall,2026,2026-2027,IE,483,Special Topics,,Other,lower,no,no,no,no,no,no
marshall,2026,2026-2027,IE,485,Independent Study,,Other,lower,no,no,no,no,no,no
marshall,2026,2026-2027,IE,486,Independent Study,,Other,lower,no,no,no,no,no,no
marshall,2026,2026-2027,IE,487,Independent Study,,Other,lower,no,no,no,no,no,no
marshall,2026,2026-2027,IE,488,Independent Study,,Other,lower,no,no,no,no,no,no
marshall,2026,2026-2027,ITL,115,Intro to Info Lit Research,"Introduces students to basic research (including the use of the library and other resources), information literacy and information management skills needed to succeed in college, the online environment, and beyond.",Professional,lower,no,no,no,no,no,no
marshall,2026,2026-2027,ITL,280,Special Topics,,Other,lower,no,no,no,no,no,no
marshall,2026,2026-2027,ITL,281,Special Topics,,Other,lower,no,no,no,no,no,no
marshall,2026,2026-2027,ITL,282,Special Topics,,Other,lower,no,no,no,no,no,no
marshall,2026,2026-2027,ITL,283,Special Topics,,Other,lower,no,no,no,no,no,no
marshall,2026,2026-2027,ITL,301,RBA Career Preparation,"Preparation for career after completing a college degree, including self-assessment, career exploration in conjunction  with Marshall's Career Services, development of a resume, cover letter, and completion of mock interview.",Other,lower,no,no,no,no,no,no
marshall,2026,2026-2027,ITL,350,Adv Digital Literacy Skills,"Examination of online search/retrieval skills used to define, access, evaluate, manage, integrate, create, and use digital information ethically; emphasis on critical thinking and practical use of Web 2.0 tools.",Other,lower,no,no,no,no,no,no
marshall,2026,2026-2027,ITL,365,Instructional Technology Apps,"Utilization of various computer software applications with emphasis on practical usage to produce graphic aids such as charts, brochures, spreadsheets, drawings and audio or video clips.",STEM,lower,no,no,no,no,no,no
marshall,2026,2026-2027,ITL,400,Intro to New Literacies,"This course is an introduction to new literacies within the field of library science discussing meta, digital and visual literacy information trends and the current issues affecting these literacy types.",Other,lower,no,no,no,no,no,no
marshall,2026,2026-2027,ITL,403,RBA Adv Portfolio Development,Students are coached through the RBA portfolio development process.  This includes:  What a portfolio is; inventorying their work and life experience; and creating and submitting the portfolio.,Other,lower,no,no,no,no,no,no
marshall,2026,2026-2027,ITL,406,Digital Citizenship,"Introduction to skills that build digital citizenship literacy that will help students learn the cognitive, social and technical skills for navigating and evaluating the digital information ecosystem.",Other,lower,no,no,no,yes,no,no
marshall,2026,2026-2027,ITL,425,Library Organiza & Admin,"Principles of administration for elementary and secondary school library-media centers and public libraries, including personnel, facilities, budgets, program planning and evaluation, publicity and public relations, audiovisual equipment and materials, computer hardware and software, and methods and materials for teaching library skills.",STEM,lower,no,no,no,no,no,no
marshall,2026,2026-2027,ITL,430,Technology & the Library,"An introduction to the function, management, and the issues of computer and non-computer technology in the library. Students learn to use technology as an educational tool in the classroom.",STEM,lower,no,no,no,no,no,no
marshall,2026,2026-2027,ITL,455,Pedagogy of New Literacies,"This course expands on instruction techniques for new literacies in a variety of library types and information-related organizations including the learning needs of K-12, ESL, exceptional and adult learners.",Other,lower,no,no,no,no,no,no
marshall,2026,2026-2027,ITL,466,Prod of Instruct Tech Material,This course will assist students in designing multimedia instructional materials.  Focus will be on the development of web-based instructional materials.,Other,lower,no,no,no,no,no,no
marshall,2026,2026-2027,ITL,467,Media Skills Dev Inst,"Basic techniques in producing and using a variety of audiovisual  aids, i.e., photography, scipting,developing loges, audio-recording and layout design for manuals.  This This course also prepares one to produce a slide-tape presentation.",Other,lower,no,no,no,no,no,no
marshall,2026,2026-2027,ITL,468,Computer Graphics in ITL,A basic course designed to assist the student in becoming familiar with a variety of software graphics packages.,STEM,lower,no,no,no,no,no,no
marshall,2026,2026-2027,ITL,480,Special Topics,,Other,lower,no,no,no,no,no,no
marshall,2026,2026-2027,ITL,481,Special Topics,,Other,lower,no,no,no,no,no,no
marshall,2026,2026-2027,ITL,482,Special Topics,,Other,lower,no,no,no,no,no,no
marshall,2026,2026-2027,ITL,483,Special Topics,,Other,lower,no,no,no,no,no,no
marshall,2026,2026-2027,ITL,485,Independent Study,,Other,lower,no,no,no,no,no,no
marshall,2026,2026-2027,ITL,486,Independent Study,,Other,lower,no,no,no,no,no,no
marshall,2026,2026-2027,ITL,487,Independent Study,,Other,lower,no,no,no,no,no,no
marshall,2026,2026-2027,ITL,488,Independent Study,,Other,lower,no,no,no,no,no,no
marshall,2026,2026-2027,ITL,491,Workshop,,Other,lower,no,no,no,no,no,no
marshall,2026,2026-2027,ITL,492,Workshop,,Other,lower,no,no,no,no,no,no
marshall,2026,2026-2027,ITL,493,Workshop,,Other,lower,no,no,no,no,no,no
marshall,2026,2026-2027,ITL,494,Workshop,,Other,lower,no,no,no,no,no,no
marshall,2026,2026-2027,INT,499,Senior Seminar,"A capstone experience for International Affairs majors, intended to provide an integrated perspective on the field through the application of interdisciplinary theories, methods, and practices to global issues.",Other,lower,no,no,no,no,no,no
marshall,2026,2026-2027,JPN,101,Elementary Japanese I,"Pronunciation, conversation, reading and composition with emphasis on aural/oral devalopment.  This includes katakana, hiragana, and Chinese characters, used in context.",Humanities,lower,no,no,no,no,no,no
marshall,2026,2026-2027,JPN,102,Elementary Japanese II,"Pronunciation, conversation, reading and composition with emphasis on aural/oral development. This includes katakana, hiragana and Chinese characters, used in context.",Humanities,lower,no,no,no,no,no,no
marshall,2026,2026-2027,JPN,203,Intermediate Japanese III,"Continuation on the intermediate level of the basic skills: pronunciation, conversation, reading, and composition with emphasis on aural/oral development. More work on katakana, hiragana and Chinese characters, used in context.",Humanities,lower,no,no,no,no,no,no
marshall,2026,2026-2027,JPN,204,Intermediate Japanese IV,"Development of practical conversational skills, reading for comprehension, and directed compositions.",Humanities,lower,no,no,no,no,no,no
marshall,2026,2026-2027,JPN,240,Japanese Culture (CT),"An introduction course of Japanese society and culture through Japanese films, readings, and lectures. This course examines social, political and cultural themes in contemporary Japanese society. Course taught in English.",Social Sciences,lower,no,no,no,no,no,no
marshall,2026,2026-2027,JPN,245,Modern Japanese Lit (CT),"Taught in English, course examines Japanese literature from the mid-nineteenth century to the present day.",Humanities,lower,no,no,no,no,no,no
marshall,2026,2026-2027,JPN,250,Japanese Anime & Manga (CT),"Taught in English, this course examines the history and nature of Japanese animation (anime) and comics (manga).",Humanities,lower,no,no,no,no,no,no
marshall,2026,2026-2027,JPN,280,Japanese Special Topics,Study of a topic not normally covered in courses.,Humanities,lower,no,no,no,no,no,no
marshall,2026,2026-2027,JPN,281,Japanese Special Topics,Study of a topic not normally covered in courses.,Humanities,lower,no,no,no,no,no,no
marshall,2026,2026-2027,JPN,282,Japanese Special Topics,Study of a topic not normally covered in courses.,Humanities,lower,no,no,no,no,no,no
marshall,2026,2026-2027,JPN,283,Japanese Special Topics,Study of a topic not normally covered in courses.,Humanities,lower,no,no,no,no,no,no
marshall,2026,2026-2027,JPN,304,Premodern Japanese Literature,This course introduces a comprehensive overview of the history of Japanese literature from the earliest times to the mid-nineteenth century. Course taught in English.,Humanities,lower,no,no,no,no,no,no
marshall,2026,2026-2027,JPN,305,Advanced Japanese I,"Equal emphasis on listening, speaking, reading and writing. Students learn advanced new Kanji characters. The course includes preparation for the Japanese Proficiency Exam. Course taught in Japanese.",Humanities,lower,no,no,no,no,no,no
marshall,2026,2026-2027,JPN,307,Japanese Conversation,Speaking intensive course designed to develop communicative skills and review language fundamentals acquired in JPN 101 -204 course sequence. Course taught in Japanese.,Humanities,lower,no,no,no,no,no,no
marshall,2026,2026-2027,JPN,315,Advanced Japanese II,"Equal emphasis on listening, speaking, reading, and writing skills. Students learn advanced grammar and 100 Kanji characters. The course includes preparation for the Japanese Proficiency Exam. Course taught in Japanese.",Humanities,lower,no,no,no,no,no,no
marshall,2026,2026-2027,JPN,325,Business Japanese,Students learn conversational expressions and Japanese manners that can be used in actual business situations in Japanese companies.,Humanities,lower,no,no,no,no,no,no
marshall,2026,2026-2027,JPN,330,Japanese Grammar,"A review of intermediate level of Japanese grammar equivalent to N3 and N4 JLPT (Japanese Language Proficiency Test).  It familiarizes students with test components including vocabulary, reading, grammer, and listening.",Humanities,lower,no,no,no,no,no,no
marshall,2026,2026-2027,JPN,335,JPN Society & Culture,"Am introduction course of Japanese society and culture through Japanese films, readings and lectures. This course examines social, political and cultural themes in contemporary Japanese society. Course taught in Japanese.",Social Sciences,lower,no,no,no,no,no,no
marshall,2026,2026-2027,JPN,401,Readings in Adv Japanese I,Students learn comprehensive skills in contemporary Japanese at advanced level and 250 new kanji. Students conduct a presentation in Japanese. Course taught in Japanese.,Humanities,lower,no,no,no,no,no,no
marshall,2026,2026-2027,JPN,402,Readings in Adv Japanese II,Students continue to learn comprehensive skills in contemporary Japanese at advanced level and 250 new kanji. Students conduct survey research in Japanese. Course taught in Japanese.,Humanities,lower,no,no,no,no,no,no
marshall,2026,2026-2027,JPN,403,Japanese Film in English,"A survey of Japanese cinema from literary,historical, cultural and interdisciplinary perspectives. Readings and lectures introduce the director's work and the backgrounds of individual films. Course taught in English.",Humanities,lower,no,no,no,no,no,no
marshall,2026,2026-2027,JPN,408,Lit Asians in Americas,"Taught in English, this course explores Asian American literature in the U.S., Canada, Latin America, and the Caribbean, focusing on race, class and gender.",Humanities,lower,no,no,no,no,no,no
marshall,2026,2026-2027,JPN,480,Japanese Special Topics,Study of a topic not normally covered in courses.,Humanities,lower,no,no,no,no,no,no
marshall,2026,2026-2027,JPN,481,Japanese Special Topics,Study of a topic not normally covered in courses.,Humanities,lower,no,no,no,no,no,no
marshall,2026,2026-2027,JPN,482,Japanese Special Topics,Study of a topic not normally covered in courses.,Humanities,lower,no,no,no,no,no,no
marshall,2026,2026-2027,JPN,483,Japanese Special Topics,Study of a topic not normally covered in courses.,Humanities,lower,no,no,no,no,no,no
marshall,2026,2026-2027,JPN,485,Independent Study,,Other,lower,no,no,no,no,no,no
marshall,2026,2026-2027,JPN,486,Independent Study,,Other,lower,no,no,no,no,no,no
marshall,2026,2026-2027,JPN,487,Independent Study,,Other,lower,no,no,no,no,no,no
