university,academic_year,academic_year_label,department_code,course_number,title,description,broad_area,level,progressive_signal,western_canon_signal,climate_narrow_signal,climate_broad_signal,cross_listed,deduplicated
marshall,2026,2026-2027,CS,488,Independent Study,EMERGING TOPICS IN COMPUTER SCIENCE,STEM,lower,no,no,no,no,no,no
marshall,2026,2026-2027,CS,490,Senior Project,"Application of technical and professional skills in solving a real-world problem in a team
environment.  Discuss professional code of conduct, societal issues, and transition from
student to industry professional.",Other,lower,no,no,no,no,no,no
marshall,2026,2026-2027,COUN,263,AIDS Awareness,"Course designed to increase awareness of Human Immunodeficiency Virus and Acquired Immune Deficiency Syndrome, including:  the virus,psycho social aspects, legal and religious issues, prevention, treatment.",Humanities,lower,no,no,no,no,no,no
marshall,2026,2026-2027,COUN,264,Group Guid Resident Setting I,A Counselor Leadership training course focusing on basic peer helper and leadership skills.  Specific areas include an overview of theory and concerns for college students living in residence halls. (PR: Permission),Other,lower,no,no,no,no,no,no
marshall,2026,2026-2027,COUN,425,Counseling Theory & Tech,Principles and practices of the interviewing relationship in helping service settings.,Other,lower,no,no,no,no,no,no
marshall,2026,2026-2027,COUN,430,Case Devel Process/Manage,"Study of systematic development of casework to include case finding, follow-up provision of services, case recording and time management.",Professional,lower,no,no,no,no,no,no
marshall,2026,2026-2027,COUN,455,Crisis Inter & Conf Res,This course is directed to anyone who at some time has felt inadequate in responding effectively to people in crisis.  Topics will include situational and developmental crisis.,Other,lower,no,no,no,no,no,no
marshall,2026,2026-2027,COUN,456,Death & Grief Coun,Includes three areas of emphasis:  To enable the student to come to grips with personal attitudes toward death and dying; to explore attitudes of society toward death; and to develop skills in managing the crisis of death terminal illness and bereavement.,Other,lower,no,no,no,no,no,no
marshall,2026,2026-2027,COUN,461,Staff Development,,Other,lower,no,no,no,no,no,no
marshall,2026,2026-2027,COUN,470,Adv Practicum Counseling,Practical expriences in counseling interviews under professional supervision.,Other,lower,no,no,no,no,no,no
marshall,2026,2026-2027,COUN,476,Counseling with Parents,Consideration of effective parent counseling primarily from an Adlerian point of view.  Techniques for counselor intervention via lecture demonstration and laboratory  experiences.,Other,lower,no,no,no,no,no,no
marshall,2026,2026-2027,COUN,477,Stress Management Couns,Provides beginning counselors and others with comprehensive information and strategies for successful management of stress and its consequences.  Students explore theoretical and practical alternatives in counseling the stressed individual.,Professional,lower,no,no,no,no,no,no
marshall,2026,2026-2027,COUN,480,Special Topics,,Other,lower,no,no,no,no,no,no
marshall,2026,2026-2027,COUN,481,Special Topics,,Other,lower,no,no,no,no,no,no
marshall,2026,2026-2027,COUN,482,Special Topics,,Other,lower,no,no,no,no,no,no
marshall,2026,2026-2027,COUN,483,Special Topics,,Other,lower,no,no,no,no,no,no
marshall,2026,2026-2027,COUN,485,Independent Study,,Other,lower,no,no,no,no,no,no
marshall,2026,2026-2027,COUN,486,Independent Study,,Other,lower,no,no,no,no,no,no
marshall,2026,2026-2027,COUN,487,Independent Study,,Other,lower,no,no,no,no,no,no
marshall,2026,2026-2027,COUN,488,Independent Study,,Other,lower,no,no,no,no,no,no
marshall,2026,2026-2027,COUN,490,Counseling Internship,This is a capstone and field experience that requires 200 hours of field placement along with a weekly on-campus seminar.  This course is offered CR/NC.,Other,lower,no,no,no,no,no,no
marshall,2026,2026-2027,COUN,494,Counseling Workshop,"A practical, participatory course designed for advanced students and professionals in the counseling field or related areas.",Other,lower,no,no,no,no,no,no
marshall,2026,2026-2027,CJ,200,Intro to Criminal Justice,"This survey course examines the various components of the criminal justice system, including law enforcement, courts, and corrections. Students will be introduced to various criminal justice agencies and career possibilities.",Social Sciences,lower,no,no,no,no,no,no
marshall,2026,2026-2027,CJ,211,Intro to Law Enforcement,"Designed to examine the philosophical and historical background of law enforcement in the United States.  Addresses constitutional limitations on law enforcement, objectives of law enforcement, and processes of law enforcement.",Professional,lower,no,no,no,no,no,no
marshall,2026,2026-2027,CJ,221,Intro to Criminal Courts,"This course addresses the evolution of current functioning of the American criminal court system. Students are exposed to court administration, court procedures, and the state and federal court system.",Other,lower,no,no,no,no,no,no
marshall,2026,2026-2027,CJ,223,Introduction to Legal Research,An introduction to the processes and strategies involved in legal research.  Students will develop an understanding of the sources of legal information and judgment in selecting appropriate sources and formats for specific projects.,Other,lower,no,no,no,no,no,no
marshall,2026,2026-2027,CJ,231,Intro to Corrections,A survey of the historical development of the systems of punishment and rehabilitation.  Analysis of the reasons for incarceration of offenders.,Other,lower,no,no,no,no,no,no
marshall,2026,2026-2027,CJ,280,Special Topics,Lower level specialized courses of contemporary interest.,Other,lower,no,no,no,no,no,no
marshall,2026,2026-2027,CJ,281,Special Topics,Lower level specialized courses of contemporary interest.,Other,lower,no,no,no,no,no,no
marshall,2026,2026-2027,CJ,282,Special Topics,Lower level specialized courses of contemporary interest.,Other,lower,no,no,no,no,no,no
marshall,2026,2026-2027,CJ,283,Special Topics,Lower level specialized courses of contemporary interest.,Other,lower,no,no,no,no,no,no
marshall,2026,2026-2027,CJ,300,Admin of Criminal Justice,"This course provides an analysis of the theories of organization and the administration of criminal justice agencies, including management styles, techniques of leadership, and decision-making.",Social Sciences,lower,no,no,no,no,no,no
marshall,2026,2026-2027,CJ,302,CJ Research Methods,"Logic of social research methods, survey research, methods of evaluation, sampling, and the contrast between qualitative and quantitative CJ research.",Other,lower,no,no,no,no,no,no
marshall,2026,2026-2027,CJ,314,Crime Scene & Investigations,"This course exposes students to crime scene processing techniques and technology, criminal investigation procedures, sources of information, interrogation, victim and witness interviewing, legal issues in criminal investigations.",Other,lower,no,no,no,no,no,no
marshall,2026,2026-2027,CJ,322,Criminal Law & Procedure,"Examines the history of criminal law, elements of a crime, offense types, admissibility of evidence/confessions, recent civil rights decisions while reconciling individual rights and community interest in the justice system.",Humanities,lower,no,no,no,no,no,no
marshall,2026,2026-2027,CJ,325,Juvenile Justice,"A survey of the process--the police, the courts, and corrections--through which the juvenile delinquent passes.",Other,lower,no,no,no,no,no,no
marshall,2026,2026-2027,CJ,331,Probation & Parole,Organization of systems of after-care treatment of juvenile and adult offenders released under probation and parole.,Other,lower,no,no,no,no,no,no
marshall,2026,2026-2027,CJ,332,Correctional Rehab,"Examines the theories, treatment strategies and the role of the correctional counselor.  Special emphasis is given to the topics of classification, development of treatment plans and principles of effective intervention.",Other,lower,no,no,no,no,no,no
marshall,2026,2026-2027,CJ,340,Drugs and Crime,"Examines the history and consequences of mind-altering drugs, and criminal behavior as it is affected by drugs, the legal response to substance abuse, treatment and prevention of substance abuse.",Humanities,lower,no,no,no,no,no,no
marshall,2026,2026-2027,CJ,341,Victims of Crime,"Examines victims of crime, the process and consequences of victimization.  Also covered are victims' rights and services available for victims and victim compensation.",Other,lower,no,no,no,no,no,no
marshall,2026,2026-2027,CJ,400,Applied Ethics in CJ,"Examines ethical issues and moral dilemmas faced by criminal justice professionals.
Traditional ethical theories and practices designed to foster public trust in the criminal justice
system are examined and applied.",Social Sciences,lower,no,no,no,no,no,no
marshall,2026,2026-2027,CJ,403,Understanding Cybercrime,"Examination of hacking, piracy, cyber stalking, cyber bullying, identity theft, and other cybercrimes through the lens of various criminological theories with an emphasis on research methodology and criminal justice policy.",Social Sciences,lower,no,no,no,no,no,no
marshall,2026,2026-2027,CJ,404,Theoretical Criminology,A critical analysis of the major criminological theories and their empirical foundations.  Current theory and research receive greater emphasis than historical development.,Social Sciences,lower,no,no,no,no,no,no
marshall,2026,2026-2027,CJ,405,Women & the CJS,"Examines factors surrounding women and the criminal justice system from a theoretical and practical perspective.  Explores feminist ideologies, plus women as victims, offenders, and professionals in the justice system.",Social Sciences,lower,no,no,no,no,no,no
marshall,2026,2026-2027,CJ,406,"Race, Ethnicity, Class & Crime","Examines the impact and relationship of race, ethnicity, and social class within the criminal justice system.",Social Sciences,lower,no,no,no,no,no,no
marshall,2026,2026-2027,CJ,410,Police Administration,"Functions and activities of police agencies.  Police department organizations, responsibilities of upper level administrators.  Current administrative experimentation on law enforcement agencies.",Professional,lower,no,no,no,no,no,no
marshall,2026,2026-2027,CJ,415,Rural Criminology,"Critical analysis of rural crime and the criminological sub-field of rural criminology.  Examines the economic, racial, and cultural conditions in rural America which reproduce exploitive economies and overall destructive behaviors.",Social Sciences,lower,no,no,no,no,no,no
marshall,2026,2026-2027,CJ,416,Terrorism,"Provides students with a working knowledge of the history of terrorism, the current status of terrorist groups, terrorism tactics, and methods to counteract terrorism.",Humanities,lower,no,no,no,no,no,no
marshall,2026,2026-2027,CJ,417,CJ Decision Making,"Focuses on theories of criminal justice decision-making and decision points across the criminal justice system.  Topics include the decision to report crime, police decisions, jury decisions, and sentencing decisions.",Social Sciences,lower,no,no,no,no,no,no
marshall,2026,2026-2027,CJ,418,Crime and Pop Culture,"A critical examination of the popular cutlure presentation of crime, offenders, victims, and the criminal justice process.",Social Sciences,lower,no,no,no,no,no,no
marshall,2026,2026-2027,CJ,420,Homeland Security,"This course takes a comprehensive approach to studying the facets of homeland security, the complexity of homeland security and terrorism, defeating terrorists, and Homeland Security's response to terrorist threats.",Other,lower,no,no,no,no,no,no
marshall,2026,2026-2027,CJ,422,Law of Evidence,"Leading rules and principles of exclusion and selection; burden of proof, nature and effect of presumptions; proof of authenticity and contents of writings; examinations, compentency and privilege of witnesses.",Professional,lower,yes,no,no,no,no,no
marshall,2026,2026-2027,CJ,426,Civil Liability Issues CJ,"This course examines various theories of civil liability that relate to Criminal Justice professionals,
the civil justice system, and preventing and defending civil liability claims.",Social Sciences,lower,no,no,no,no,no,no
marshall,2026,2026-2027,CJ,427,Environmental Criminology,"Explores theoretical, methodological, and practical approaches about environmental crime from a critical lens.",Social Sciences,lower,no,no,no,no,no,no
marshall,2026,2026-2027,CJ,433,Correctional Administration,"Objectives of correctional institutions; records; personnel, program development, security; educational programs.",Professional,lower,no,no,no,no,no,no
marshall,2026,2026-2027,CJ,440,CJ Response to Dom Violence,"This course focuses on the legal response to child abuse, domestic violence, and elder abuse.
Examines dynamics of abusive relationships, the effects of victimization, and current
research on these issues.",Other,lower,no,no,no,no,no,no
marshall,2026,2026-2027,CJ,453,Seminar in Crime Prevention,"This course examines theory, operation, and evaluation of crime prevention as a function of the criminal justice system. Techniques for crime prevention are analyzed from various orientations, including environmental design.",Social Sciences,lower,no,no,no,no,no,no
marshall,2026,2026-2027,CJ,460,Miscarriages of Justice,"This course provides a critical examination of the processes and procedures used by police, prosecutors, defense attorneys, judges, and corrections agents which may potentially produce errors or ""miscarriages"" of justice.",Other,lower,no,no,no,no,no,no
marshall,2026,2026-2027,CJ,480,Special Topics,A study of special interest criminal justice topics under the supervision of a qualified faculty member.,Social Sciences,lower,no,no,no,no,no,no
marshall,2026,2026-2027,CJ,481,Special Topics,A study of special interest criminal justice topics under the supervision of a qualified faculty member.,Social Sciences,lower,no,no,no,no,no,no
marshall,2026,2026-2027,CJ,482,Special Topics,A study of special interest criminal justice topics under the supervision of a qualified faculty member.,Social Sciences,lower,no,no,no,no,no,no
marshall,2026,2026-2027,CJ,483,Special Topics,A study of special interest criminal justice topics under the supervision of a qualified faculty member.,Social Sciences,lower,no,no,no,no,no,no
marshall,2026,2026-2027,CJ,485,Independent Study,This course permits the student to undertake supervised research (field or library) in any area where there is no appropriate course.,Other,lower,no,no,no,no,no,no
marshall,2026,2026-2027,CJ,486,Independent Study,This course permits the student to undertake supervised research (field or library) in any area where there is no appropriate course.,Other,lower,no,no,no,no,no,no
marshall,2026,2026-2027,CJ,487,Independent Study,This course permits the student to undertake supervised research (field or library) in any area where there is no appropriate course.,Other,lower,no,no,no,no,no,no
marshall,2026,2026-2027,CJ,488,Independent Study,This course permits the student to undertake supervised research (field or library) in any area where there is no appropriate course.,Other,lower,no,no,no,no,no,no
marshall,2026,2026-2027,CJ,490,Internship,"The placement of an individual into a criminal justice ageny (police, probation, courts, jails) to observe and participate in its operation.  Grading is CR/NC only.",Social Sciences,lower,no,no,no,no,no,no
marshall,2026,2026-2027,CJ,492,Senior Seminar,Capstone course.  Integrates and applies material learned in the program of study.  Serves as a culminating experience in which students demonstrate what they have learned in the classroom.,Other,lower,no,no,no,no,no,no
marshall,2026,2026-2027,CISP,101,American Sign Language I,"This is the first of 4 courses in American Sign Language. This course emphasizes the learning of basic survival conversational signing skills, including use of all ASL grammatical structures.",Other,lower,no,no,no,no,no,no
marshall,2026,2026-2027,CISP,102,American Sign Language II,"This is the second of 4 courses in American Sign Language. This course emphasizes the learning of intermediate conversational signing skills, including use of all ASL grammatical structures.",Other,lower,no,no,no,no,no,no
marshall,2026,2026-2027,CISP,203,American Sign Language III,"This is the third of 4 courses in American Sign Language. This course emphasizes the learning of advanced conversational signing skills, including use of all ASL grammatical structures.",Other,lower,no,no,no,no,no,no
marshall,2026,2026-2027,CISP,204,American Sign Language IV,"This is the fourth of 4 courses in American Sign Language. This course emphasizes the learning of complex conversational signing skills, including use of all ASL grammatical structures.",Other,lower,no,no,no,no,no,no
marshall,2026,2026-2027,CISP,320,Survey Exceptional Child,"An introduction to the study of children who deviate from the average in mental, physical, and emotional characteristics, including a study of the characteristics of such children and the adaptation of educational procedures to their abilities and disabilities.",Professional,lower,no,no,no,no,no,no
marshall,2026,2026-2027,CISP,420,Survey Except Child II,"Examination of procedures needed for implementation of the Resource Room model for mildly handicapped children. The course includes a review of the Mainstreaming movement, interpersonal relations, and skills necessary for maintaining the resource room.",Other,lower,no,no,no,no,no,no
marshall,2026,2026-2027,CISP,421,Child with Exceptionalities,"Behavioral characteristics of children with exceptional development, dynamics of family- community interaction, and attitudes towards exceptional conditions. Implications for amelioration and educational planning.",Professional,lower,no,no,no,no,no,no
marshall,2026,2026-2027,CISP,422,Differentiate Instruction,"Research-based strategies for providing differentiated instruction to 
students with diverse learning, social, and behavioral needs who are being
educated in inclusive settings.",Other,lower,yes,no,no,no,no,no
marshall,2026,2026-2027,CISP,423,Sp Ed Learning Disability,,Other,lower,no,no,no,no,no,no
marshall,2026,2026-2027,CISP,424,Sp Ed Emotional Disturb,,Other,lower,no,no,no,no,no,no
marshall,2026,2026-2027,CISP,427,Introduction to Autism,This course is designed to survey current issues in education and the treatment of students with autism spectrum disorder (ASD).,Professional,lower,no,no,no,no,no,no
marshall,2026,2026-2027,CISP,428,Special Needs in Erly Child Ed,"Emphasis will be given to enhancing the success of diverse learners through intervention strategies, family involvement and interdisciplinary service delivery.",Other,lower,no,no,no,no,no,no
marshall,2026,2026-2027,CISP,429,Intro Developmental Disability,"Introduction to the characteristics and needs of young children with developmental disabilities addressing the physical, neurological, health , and environmental problems that impact atypical growth and development (PR: CISP 320 , CR:  Field Experience)",Other,lower,no,no,no,no,no,no
marshall,2026,2026-2027,CISP,433,Intro Intellect Disabilities,"Characteristics and needs of individuals with intellectual disabilites.  Current research, etiologic factors and the impact of intellectual disabilities on education are emphasized.  Includes a field experience. (PR: CISP 320 )",Professional,lower,no,no,no,no,no,no
marshall,2026,2026-2027,CISP,434,Sp Ed St Tch Phys Handicap,,Other,lower,no,no,no,no,no,no
marshall,2026,2026-2027,CISP,435,Gen Spec Ed Programming,,Other,lower,no,no,no,no,no,no
marshall,2026,2026-2027,CISP,438,Char/Behav Mild/Mod Disability,"An introduction to positive behavior supports at the school, classroom, and individual level to improve student behavior and academic engagement.",Other,lower,no,no,no,no,no,no
marshall,2026,2026-2027,CISP,439,Assessment in Sp Ed,,Other,lower,no,no,no,no,no,no
marshall,2026,2026-2027,CISP,440,Stu Teach Multicategorical,,Other,lower,no,no,no,no,no,no
marshall,2026,2026-2027,CISP,442,Residency II - Multicategoric,Residency II is a 500-hour all day/everyday teaching experience under supervision in the same approved elementary/secondary Residency I placement with periodic seminars.,Other,lower,no,no,no,no,no,no
marshall,2026,2026-2027,CISP,445,Intervent Preschool Sp Ed,"Curriculum development and methodology used to teach young children with special needs. Integration, program development, management, material and equipment adaptation are emphasized.",Professional,lower,no,no,no,no,no,no
marshall,2026,2026-2027,CISP,453,Curr Methods Mild to Moderate,"Principals and current trends in curriculum development and teaching methodology for individuals with mild to moderate disabilities are reviewed and evaluated (PR: CISP 320 , CISP 420 )",Other,lower,no,no,no,no,no,no
marshall,2026,2026-2027,CISP,454,Families of Except Students,Principles and information designed to give the student an understanding of the needs and rights of families of exceptional children and techniques to involve families successfully in their children’s education.,Professional,lower,no,no,no,no,no,no
marshall,2026,2026-2027,CISP,455,Field Exp Preschool Sp Ed,Supervised participation and directed teaching activities in a preschool special education program.,Professional,lower,no,no,no,no,no,no
marshall,2026,2026-2027,CISP,461,Staff Development,,Other,lower,no,no,no,no,no,no
marshall,2026,2026-2027,CISP,462,Staff Development,,Other,lower,no,no,no,no,no,no
marshall,2026,2026-2027,CISP,480,Special Topics,,Other,lower,no,no,no,no,no,no
marshall,2026,2026-2027,CI,100,Critical Thinking in Educ (CT),"An introduction to the critical thinking skills in education, an orientation of the teaching profession, and an overview of the historical, sociological, multicultural, and philosophical issues affecting schools and teachers.",Professional,lower,no,no,no,no,no,no
marshall,2026,2026-2027,CI,101,Math for Elem Teachers I,"The study of the foundations of elementary mathematics including numeration systems, number theory, and consumer mathematics with emphasis on problem solving and teaching strategies.",STEM,lower,no,no,no,no,no,no
marshall,2026,2026-2027,CI,102,Intro Comp in Classroom,"The introduction of selection and evaluation techniques of computer courseware and hardware for classrooms K-12 with consideration for CAI, CMI  and specific skills for K-12 students.",STEM,lower,no,no,no,no,no,no
marshall,2026,2026-2027,CI,201,Math for Elem Teachers II,"Study of elementary mathematics including structure of the real number system, statistics, probability, informal and transformational geometry, and basic algebraic operations with emphasis on problem solving and teaching strategies.",STEM,lower,no,no,no,no,no,no
marshall,2026,2026-2027,CI,248,Intro to Science Elem Ed,"Introduction to teaching science in elementary schools emphasizing inquiry-based science and engineering practices utilizing effective research-based teaching strategies including seminars, discussions and investigations.",STEM,lower,no,no,no,no,no,no
marshall,2026,2026-2027,CI,280,Special Topics,,Other,lower,no,no,no,no,no,no
marshall,2026,2026-2027,CI,281,Special Topics,,Other,lower,no,no,no,no,no,no
marshall,2026,2026-2027,CI,282,Special Topics,,Other,lower,no,no,no,no,no,no
marshall,2026,2026-2027,CI,283,Special Topics,,Other,lower,no,no,no,no,no,no
marshall,2026,2026-2027,CI,298,Itv,A course based upon an Instructional Television Series broadcast by public television.  The student is responsible for viewing the series on the air and satisfying all course requirements announced by the division.,Other,lower,no,no,no,no,no,no
marshall,2026,2026-2027,CI,301,Teach Elem/Middle Mathematics,This course is an investigation of techniques and approaches to helping children learn mathematics with special emphasis on the use of manipulative materials in a laboratory setting.,STEM,lower,no,no,no,no,no,no
marshall,2026,2026-2027,CI,321,ECE Curr and Methods,Study of factors shaping curriculum and exploration and assessment of appropriate curriculum for young children in transition from pre-operational to concrete operational stages of development.  Field experience included.,Other,lower,no,no,no,no,no,no
marshall,2026,2026-2027,CI,340,Tch Creatively in Elem Classrm,"This course equips teacher candidates with knowledge, skills, and practical strategies to integrate performance-based teaching (through music, drama, movement, and storytelling) into standards-aligned instruction.",Other,lower,no,no,no,no,no,no
marshall,2026,2026-2027,CI,342,Lit & Lang Arts Methods,"A study of literary genres' characteristics and implementation within the elementary classroom, with emphasis on methods of presentation and a review of English grammar and language.",Humanities,lower,no,no,no,no,no,no
marshall,2026,2026-2027,CI,343,The Process of Reading Part I,Study of modern techniques and practices in the teaching and assessment of reading and language arts: Part 1,Other,lower,no,no,no,no,no,no
marshall,2026,2026-2027,CI,345,Crit Read Writ & Think,"This course examines strategies for learning from text, studying different types of textual material, monitoring learning, and integrating oral and written discourse.",Other,lower,no,no,no,no,no,no
marshall,2026,2026-2027,CI,348,Phy Sci & Engr for Elem Ed,"General elementary education course with emphasis on Next Generation Science standards, methods, and content for Physical Science and Engineering practices.",STEM,lower,no,no,no,no,no,no
