university,academic_year,academic_year_label,department_code,course_number,title,description,broad_area,level,progressive_signal,western_canon_signal,climate_narrow_signal,climate_broad_signal,cross_listed,deduplicated
marshall,2026,2026-2027,NRE,323,Assessment II: Aquatic Ecology,Use of scientific procedures and current technology to characterize and quantify sensitive elements of aquatic ecosystems and to assess human impact on these systems.,Other,lower,no,no,no,yes,no,no
marshall,2026,2026-2027,NRE,400,Soil Fertility/Plant Nutrition,"This course will examine properties of soil fertility, its relationship to plan nutrition, and practices in nutrient management and fertilizer application.",Medical Sciences,lower,no,no,no,no,no,no
marshall,2026,2026-2027,NRE,401,Horticulture,This course will examine the principles and practices in horticulture and apply these practices through a semester service project.,Other,lower,no,no,no,no,no,no
marshall,2026,2026-2027,NRE,402,Sustainable Agriculture,This course will examine the principles of sustainable agriculture and its relationship with natural resources while identifying challenges to agricultural sustainability and frontiers in the field.,Other,lower,no,no,no,yes,no,no
marshall,2026,2026-2027,NRE,403,Agricultural Entomology,"Globally, insects have tremendous impacts on agriculture.  This course introduces students to insects and their roles in agriculture including integrated pest management and pollination ecology.",Professional,lower,no,no,no,no,no,no
marshall,2026,2026-2027,NRE,404,Compost Science & Operations,"An advanced exploration of composting systems, evaluation methods, sustainable management strategies, compost quality characteristics and analysis, and community, environmental, and operational aspects of compost production and utilization.",Professional,lower,no,no,no,yes,no,no
marshall,2026,2026-2027,NRE,423,GIS and Data Systems,"Course focuses on the relationships among the scientific method, data structures, and geographic images.  Students relate hypothesis formation and databases through the development of ARCMap documents.",Other,lower,no,no,no,no,no,no
marshall,2026,2026-2027,NRE,425,Water Policy and Regulations,Examination of how aquatic resources are protected for humans and species of concern by current regulatory framework.,Other,lower,no,no,no,no,no,no
marshall,2026,2026-2027,NRE,431,Aquatic Toxicology,"This course will introduce students to the principles of aquatic toxicology including regulations driving biological criteria, development of laboratory toxicity testing and test methodology.",Other,lower,no,no,no,no,no,no
marshall,2026,2026-2027,NRE,435,Biomonitoring,Biomonitoring is the use of organisms to assess habitat and water quality of a stream.  Current aquatic biomonitoring focuses on the utilization of benthic invertebrates and fishes communities.,Other,lower,no,no,no,no,no,no
marshall,2026,2026-2027,NRE,440,Fisheries Management,"The history, regulations, theory, and science behind the management/mismanagement of inland fisheries.",Humanities,lower,no,no,no,no,no,no
marshall,2026,2026-2027,NRE,445,Sustainable Tropical Ecology,"This course is designed to introduce the cultural components, human impacts, basic ecology, habitats types, biodiversity, plant communities, life histories, and conservation of tropical ecosystems.",Other,lower,yes,no,no,yes,no,no
marshall,2026,2026-2027,NRE,446L,Sustain Tropical Travel Lab,"Laboratory companion course to NRE 445 . Investigation of aquatic and terrestrial biota in the tropical environment and examination threats to tropical ecosystems. International trip, with an extra fee, required.",Other,lower,no,no,no,yes,no,no
marshall,2026,2026-2027,NRE,447L,Sustainable Tropical Lab,Laboratory companion course to NRE 445 . Investigation of aquatic and terrestrial biota in the tropical environment and examination threats to tropical ecosystems.,Other,lower,no,no,no,yes,no,no
marshall,2026,2026-2027,NRE,450,Aquatic Invertebrates,"A survey course of the freshwater invertebrates found in the eastern United States. This course focuses on the taxonomy, life histories, and ecology of crustaceans, mollusks, and insects.",Other,lower,no,no,no,no,no,no
marshall,2026,2026-2027,NRE,470,ES Internship,A supervised internship in an area of natural resources and the environment.,Other,lower,no,no,no,no,no,no
marshall,2026,2026-2027,NRE,480,Special Topics,A course covering topics not treated in regular course offerings.,Other,lower,no,no,no,no,no,no
marshall,2026,2026-2027,NRE,481,Special Topics,A course covering topics not treated in regular course offerings.,Other,lower,no,no,no,no,no,no
marshall,2026,2026-2027,NRE,482,Special Topics,A course covering topics not treated in regular course offerings.,Other,lower,no,no,no,no,no,no
marshall,2026,2026-2027,NRE,483,Special Topics,A course covering topics not treated in regular course offerings.,Other,lower,no,no,no,no,no,no
marshall,2026,2026-2027,NRE,485,Independent Study,Independent study for selected juniors and seniors under supervision of faculty; may be repeated only once.,Other,lower,no,no,no,no,no,no
marshall,2026,2026-2027,NRE,486,Independent Study,Independent study for selected juniors and seniors under supervision of faculty; may be repeated only once.,Other,lower,no,no,no,no,no,no
marshall,2026,2026-2027,NRE,487,Independent Study,Independent study for selected juniors and seniors under supervision of faculty; may be repeated only once.,Other,lower,no,no,no,no,no,no
marshall,2026,2026-2027,NRE,488,Independent Study,Independent study for selected juniors and seniors under supervision of faculty; may be repeated only once.,Other,lower,no,no,no,no,no,no
marshall,2026,2026-2027,NRE,490,ES/NRRM Capstone Prep,"Prepares students for the senior project, internship experience, and for careers beyond graduation.  Life skills are introduced by building on communication, organization, and project management skills (capstone).",Social Sciences,lower,no,no,no,no,no,no
marshall,2026,2026-2027,NRE,491,ES Senior Capstone,Students develop and complete a research project under the direction of a faculty member in the NRE department (capstone).,Other,lower,no,no,no,no,no,no
marshall,2026,2026-2027,NRRM,101,Intro Natural Res & Rec Mgmt,"An orientation to the profession and its settings, emphasizing history, trends, concepts, and relationships to other fields.",Humanities,lower,no,no,no,no,no,no
marshall,2026,2026-2027,NRRM,110,Outdoor Leadership:  Canoeing,This course is designed to give students the skills essential for the pursuit of employment in guiding participants on flat-water canoe courses in backcountry settings.,Other,lower,no,no,no,no,no,no
marshall,2026,2026-2027,NRRM,111,Outdoor Leadership:  Fly Fish,This course is designed to give students the skills essential for the pursuit of being able to guide participants on fly fishing excursions in the backcountry.,Other,lower,no,no,no,no,no,no
marshall,2026,2026-2027,NRRM,112,Outdoor Leadership: Bass Fish,This course is designed to give students the skills essential to pursue employment as a guide on bass fishing excursions in the backcountry.,Other,lower,no,no,no,no,no,no
marshall,2026,2026-2027,NRRM,113,Outdoor Leadership: Backpack,This course is designed to give students the foundation skills essential in the pursuit of being leading participants on backcountry backpacking experiences.  Leave No Trace ethics will be taught.,Other,lower,no,no,no,no,no,no
marshall,2026,2026-2027,NRRM,156,Bicycling,,Other,lower,no,no,no,no,no,no
marshall,2026,2026-2027,NRRM,158,Downhill Skiing,,Other,lower,no,no,no,no,no,no
marshall,2026,2026-2027,NRRM,200,Analytical Methods: Statistics,"Students develop an understanding of statistical reasoning through the use of software to generate, summarize, and draw conclusions from data.  Course enhances statistical technique dexterity through analysis of applied problems.",STEM,lower,no,no,no,no,no,no
marshall,2026,2026-2027,NRRM,201,Recreational Activities,,Other,lower,no,no,no,no,no,no
marshall,2026,2026-2027,NRRM,231,Nature Study,Designed to provide students with the fundamental understanding of and for the delivery of nature based educational programs offered through an experiential framework.,Professional,lower,no,no,no,no,no,no
marshall,2026,2026-2027,NRRM,280,Special Topics,,Other,lower,no,no,no,no,no,no
marshall,2026,2026-2027,NRRM,281,Special Topics,,Other,lower,no,no,no,no,no,no
marshall,2026,2026-2027,NRRM,282,Special Topics,,Other,lower,no,no,no,no,no,no
marshall,2026,2026-2027,NRRM,283,Special Topics,,Other,lower,no,no,no,no,no,no
marshall,2026,2026-2027,NRRM,301,Intro to Outdoor Recreation,"Organization, administration, and delivery of outdoor recreation activities and resources.  Emphasis upon federal, state, and local government programs and areas.",Other,lower,no,no,no,no,no,no
marshall,2026,2026-2027,NRRM,310,Environmental Interpretation,"Principles and techniques of environmental interpretation as practiced in federal, state, and private agencies.",Other,lower,no,no,no,no,no,no
marshall,2026,2026-2027,NRRM,311,Intro to Environmental Educ,"This course is the study of environmental education, its foundations, emergence in the 1960's, its evolution, the systems approach to it, and the application of it in the field.",Professional,lower,no,no,no,no,no,no
marshall,2026,2026-2027,NRRM,320,Sports & Campus Rec Mgmt,"This course will deal with the fields of recreational sports and campus recreation management.  It will present the foundations of both fields, the development, implementation, and trends in today's programs.",Professional,lower,no,no,no,no,no,no
marshall,2026,2026-2027,NRRM,330,Concepts Philosophies in NRRM,"A systematic approach to the concepts and philosophies for managing wildland, wilderness, and protected areas.",Other,lower,no,no,no,no,no,no
marshall,2026,2026-2027,NRRM,340,Special Event Managment,This course will study the processes for event facilitation.  Special attention will be given to the roles and skills utilized by a variety of recreation managers.,Other,lower,no,no,no,no,no,no
marshall,2026,2026-2027,NRRM,350,Adventure Education Leadership,"This course focuses on preparing students to be outdoor adventure education leaders, facilitating programs in both the front and back country utilizing adventure education techniques in an outdoor setting.",Professional,lower,no,no,no,no,no,no
marshall,2026,2026-2027,NRRM,360,Tourism Planning & Management,"The course will examine the critical issues addressed by tourism planning and management, which are the positive and negative influences of tourism on the destination's economy, society, culture, and environment.",Professional,lower,no,no,no,no,no,no
marshall,2026,2026-2027,NRRM,361,Visitor Behavior in NRRM,This course provides an overview and analysis of individual and group behavior as it pertains to consumer activity in the context of recreation and tourism resource environments.,Other,lower,no,no,no,no,no,no
marshall,2026,2026-2027,NRRM,362,Nature-based Tourism Mgmt,"This course will examine the theoretical foundations, applications and best management practices in nature-based tourism, including its sustainable development and economic, sociocultural, and environmental impacts.",Professional,lower,no,no,no,yes,no,no
marshall,2026,2026-2027,NRRM,380,Rec Resource Oper and Admin,"Focused on the management, operation, and administration practices of recreation resource areas.  Includes supervision of personnel, budgeting, and public relations for a variety of park and public land organizational structures.",Professional,lower,no,no,no,no,no,no
marshall,2026,2026-2027,NRRM,400,Leisure & Aging,"A course presenting an overview of leisure services for the elderly.  Topics include research results, theories, and modern day trends.  A wellness model will be included.",Other,lower,no,no,no,no,no,no
marshall,2026,2026-2027,NRRM,402,Research Eval & Assess in NRRM,"Theoretical & practical approach to research, evaluation and assessment of the social sciences of natural resources and recreational management.",Professional,lower,no,no,no,no,no,no
marshall,2026,2026-2027,NRRM,405,Park & Recreation Ecology,"The course is designed to help students identify and evaluate the level of resource impact, understand factors that cause impacts, and suggest management actions to minimize impacts under given conditions.",Professional,lower,no,no,no,no,no,no
marshall,2026,2026-2027,NRRM,410,Maint of Nat Res & Rec,A study of the knowledge and skills necessary to supervise and administer the general development and maintenance of park and recreation areas and facilities.,Other,lower,no,no,no,no,no,no
marshall,2026,2026-2027,NRRM,411,Rec Resource Planning & Design,"Basic considerations in the planning and design of natural areas, parks, forests, recreation, and sport area infrastructure, facilities and associated amenities.",Other,lower,no,no,no,no,no,no
marshall,2026,2026-2027,NRRM,432,Wilderness/Protected Area Mgmt,"This course will examine the historic and current philosophies of wilderness and protected area management as applicable to NGOs, local, state, and federal land management programs.",Professional,lower,no,no,no,no,no,no
marshall,2026,2026-2027,NRRM,433,GIS/RS in Natural Resources,"Focusing on natural resource management, the course will explore techniques and procedures required for spatially explicit data analysis in park and protected area applications.",Professional,lower,no,no,no,no,no,no
marshall,2026,2026-2027,NRRM,450,Intro OHV Recreation,,Other,lower,no,no,no,no,no,no
marshall,2026,2026-2027,NRRM,451,Plan Design OHV Trails,,Other,lower,no,no,no,no,no,no
marshall,2026,2026-2027,NRRM,452,Construction OHV Trails,A course designed to instruct students in contemporary methods and techniques of constructing OHV trails and related facilities.,Other,lower,no,no,no,no,no,no
marshall,2026,2026-2027,NRRM,453,Op Mgt OHV Trail Systems,,Other,lower,no,no,no,no,no,no
marshall,2026,2026-2027,NRRM,480,Special Topics,,Other,lower,no,no,no,no,no,no
marshall,2026,2026-2027,NRRM,481,Special Topics,,Other,lower,no,no,no,no,no,no
marshall,2026,2026-2027,NRRM,482,Special Topics,,Other,lower,no,no,no,no,no,no
marshall,2026,2026-2027,NRRM,483,Special Topics,,Other,lower,no,no,no,no,no,no
marshall,2026,2026-2027,NRRM,484,Special Topics,,Other,lower,no,no,no,no,no,no
marshall,2026,2026-2027,NRRM,485,Independent Study,,Other,lower,no,no,no,no,no,no
marshall,2026,2026-2027,NRRM,486,Independent Study,,Other,lower,no,no,no,no,no,no
marshall,2026,2026-2027,NRRM,487,Independent Study,,Other,lower,no,no,no,no,no,no
marshall,2026,2026-2027,NRRM,488,Independent Study,,Other,lower,no,no,no,no,no,no
marshall,2026,2026-2027,NRRM,490,Internship,"A supervised 40-hour per week, 6 week internship in which the students work with park and recreation agencies.  (PR:  NRRM major. Advisor approval required.)",Other,lower,no,no,no,no,no,no
marshall,2026,2026-2027,NUR,120,Introduction to Nursing,Indroduce the nursing role and use of the nursing process in assisting adult clients to meet basic needs.  Clinical included.,Medical Sciences,lower,no,no,no,no,no,no
marshall,2026,2026-2027,NUR,200,Intro to Professional Nursing,"Introduction to the concepts and processes basic to the nursing profession, including historical and legal aspects, career roles, medical terminology, and practical techniques to prepare for the baccalaureate nursing program.",Medical Sciences,lower,no,no,no,no,no,no
marshall,2026,2026-2027,NUR,219,Health Promotion Thru Lifespan,Study of nursing assessment of the individual through the life span in relation to wellness promotion and the impact of illness.,Medical Sciences,lower,no,no,no,no,no,no
marshall,2026,2026-2027,NUR,220,Health Alterations I,Focus is on nursing care of adult clients responding to potential and actual health alterations. Clinical included. (PR: NUR 120 ),Medical Sciences,lower,no,no,no,no,no,no
marshall,2026,2026-2027,NUR,221,Found of Prof Nursing I,"Introduction to philosophical and theoretical foundations of nursing, exploration and integration of concepts and processes basic to professional nursing practice.  Laboratory included.",Medical Sciences,lower,no,no,no,no,no,no
marshall,2026,2026-2027,NUR,222,Found of Prof Nursing II,Introduction to professional nursing practice in relation to potential and simple alterations in health.  Practicum included.,Medical Sciences,lower,no,no,no,no,no,no
marshall,2026,2026-2027,NUR,223,Intro Nur Pharm,"Focus is on role of the Associate degree nurse in understanding the human response to
pharmacological therapy.",Other,lower,no,no,no,no,no,no
marshall,2026,2026-2027,NUR,225,Psychiatric Nursing,Focus is on the nursing role in caring for clients with alterations of psychosocial functioning.  Clinical included. (PR: NUR 220 ),Medical Sciences,lower,no,no,no,no,no,no
marshall,2026,2026-2027,NUR,230,Health Alterations II,Focus is on nursing care of adult clients with health alterations of specific physiological systems.  Role requirements and processes utilized in managing groups of clients in introduced.  Clinical included.  (PR: NUR 220 ) 5 hours theory/ 2 hours lab.,Medical Sciences,lower,no,no,no,no,no,no
marshall,2026,2026-2027,NUR,235,Maternal-Child Nursing,Focus is on the nursing role utilized in promoting health and caring for the child bearing family and pediatric clients.  Clinical included.  (PR: NUR 220 ),Medical Sciences,lower,no,no,no,no,no,no
marshall,2026,2026-2027,NUR,241,Health Alterations III,focus is  on nursing care of adult clients with health alterations of specific physiological systems.  Clinical included.  (PR: NUR 230 ),Medical Sciences,lower,no,no,no,no,no,no
marshall,2026,2026-2027,NUR,280,Special Topics,,Other,lower,no,no,no,no,no,no
marshall,2026,2026-2027,NUR,281,Special Topics,,Other,lower,no,no,no,no,no,no
marshall,2026,2026-2027,NUR,282,Special Topics,,Other,lower,no,no,no,no,no,no
marshall,2026,2026-2027,NUR,283,Special Topics,,Other,lower,no,no,no,no,no,no
marshall,2026,2026-2027,NUR,300,Transition to Nursing Practice,"Intro to the concepts of professional nursing practice of legal, ethical, theory, research, evidence based practice and health promotion.",Medical Sciences,lower,no,no,no,no,no,no
marshall,2026,2026-2027,NUR,305,Concepts in Prof Nursing,Emphasizes concepts and processes essential to professional nursing practice. Philosophical and theoretical foundations of nursing are examined. Focus is on professional role and role transition. (PR: Admission to RN to B.S.N. nursing program),Medical Sciences,lower,no,no,no,no,no,no
marshall,2026,2026-2027,NUR,314,Fundamentals of Nursing Care,"Introduction to foundations of nursing including potential and simple health alterations, exploration and integration of concepts, and processes of nursing practice.  Laboratory and clinical included.",Medical Sciences,lower,no,no,no,no,no,no
marshall,2026,2026-2027,NUR,315,Med-Surg Nursing I,Focus is on the nursing care of young adult to geriatric patients with potential and actual alterations in health.  Practicum included.,Medical Sciences,lower,no,no,no,no,no,no
marshall,2026,2026-2027,NUR,318,Family and Chronic Illness,Focus in family nursing theory related to human responses utilizing theoretical models for assessment and health promotion.  Included is consideration of the impact of chronic illness.,Medical Sciences,lower,no,no,no,no,no,no
marshall,2026,2026-2027,NUR,319,Phys Assess Across Lifespan,Development of skills in taking health history and performing physical examination of clients throughout the life span.  Practicum included.,Humanities,lower,no,no,no,no,no,no
marshall,2026,2026-2027,NUR,321,Care of Childbearing Families,Focus of nursing is on the diagnosis and treatment of human responses to changes that occur in the expanding family. Practicum included.,Medical Sciences,lower,no,no,no,no,no,no
marshall,2026,2026-2027,NUR,322,Psych / Mental Health Nursing,Focus is upon nursing care of clients of all ages in relation to human responses to psychosocial problems.,Medical Sciences,lower,no,no,no,no,no,no
marshall,2026,2026-2027,NUR,327,Adult Nursing I,Focus is on nursing care of clients from young to geriatric adults responding to health problems. Practicum included.,Medical Sciences,lower,no,no,no,no,no,no
marshall,2026,2026-2027,NUR,328,Adult Nursing II,Focus is on nursing care of clients from young to geriatric adults responding to increasingly complex health care problems.  Practicum included.,Medical Sciences,lower,no,no,no,no,no,no
marshall,2026,2026-2027,NUR,333,Health Physical Assessment,"Focus on providing nurses with the knowledge base and clinical skills necessary to obtain in-depth health histories and complete physical assessments of clients of various ages and cultural backgrounds. 
(PR: admission to RN to B.S.N. nursing program or Permission)",Medical Sciences,lower,no,no,no,no,no,no
marshall,2026,2026-2027,NUR,350,Pharmacology for Nurses,"Focus in on the role of the nurse in drug therapy.  Specific drug classifications and
prototypical drugs, their actions, effects, and nursing  implications are described in-depth.",Medical Sciences,lower,no,no,no,no,no,no
marshall,2026,2026-2027,NUR,400,Transcultural Nursing,The focus is on health care practices and beliefs of a variety of cultures which interact with the United States health care system.  Transcultural nursing theories and concepts are addressed.,Medical Sciences,lower,no,no,no,no,no,no
marshall,2026,2026-2027,NUR,404,MGT and Leadership in Nursing,"The study of professional nursing, leadership, and the management of patient care.",Medical Sciences,lower,no,no,no,no,no,no
marshall,2026,2026-2027,NUR,408,Pediatric Nursing,"Nursing Care of Children
Focus is on nursing care of pediatric clients of all ages and their family's response to common and complex health problems.  Practicum included.",Medical Sciences,lower,no,no,no,no,no,no
marshall,2026,2026-2027,NUR,410,Community Nursing for RN,Focus is on the foundations of community-oriented nursing practice for the Registered Nurse with an emphasis on health promotion and disease prevention.,Medical Sciences,lower,no,no,no,no,no,no
marshall,2026,2026-2027,NUR,411,Med-Surg Nursing II,Focus is on the nursing care of young adult to geriatric patients with acute health conditions requiring critical care interventions.  Practicum included.,Medical Sciences,lower,no,no,no,no,no,no
marshall,2026,2026-2027,NUR,414,Adult Nursing III,Focus is on nursing care of young to geriatric adults responding to health problems requiring critical care intervention.  Practicum included.,Medical Sciences,lower,no,no,no,no,no,no
marshall,2026,2026-2027,NUR,416,Intro Research EBP,Focus is on research as it relates to evidence based practice. This course addresses the steps of research and evidence based practice to provide a basis for nursing practice.,Medical Sciences,lower,no,no,no,no,no,no
marshall,2026,2026-2027,NUR,418,Contemporary Nursing,Focus on foundational knowledge to competently address nursing issues in an ever-evolving healthcare landscape.,Medical Sciences,lower,no,no,no,no,no,no
marshall,2026,2026-2027,NUR,419,Prof Nursing Practice,"Focus on nursing leadership, the management of patient care, and issues inherent to
professional nursing practice.",Medical Sciences,lower,no,no,no,no,no,no
marshall,2026,2026-2027,NUR,421,Community / Public Health Nurs,Focus is upon public health principles and nursing practice with opportunity to provide health promotion for clients at risk and long term care for individuals and families in the home.,Medical Sciences,lower,no,no,no,no,no,no
marshall,2026,2026-2027,NUR,422,Nursing Capstone Practicum,"Focus in on leadership activities related to the roles of the professional nurse:  provider of care, coordinator of care, and member of the profession.  Practicum included.",Medical Sciences,lower,no,no,no,no,no,no
marshall,2026,2026-2027,NUR,425,NCLEX Success,"The purpose of this course is to assist the student to synthesize the content of the
baccalaureate nursing educational program.",Medical Sciences,lower,no,no,no,no,no,no
marshall,2026,2026-2027,NUR,427,Prof Engagement Nursing,"Focus is on evidence based practice and application of theoretical and empirical knowledge to address issues in management, health care policy, ethics, leadership, and health promotion of clients. 
(PR: NUR 305 and RN licensure; PR/CR: NUR 410 , NUR 416 , NUR 418 ))",Medical Sciences,lower,no,no,no,no,no,no
marshall,2026,2026-2027,NUR,480,Special Topics,Study of topics not available  in other courses.,Other,lower,no,no,no,no,no,no
marshall,2026,2026-2027,NUR,481,Special Topics,Study of topics not available in other courses.,Other,lower,no,no,no,no,no,no
marshall,2026,2026-2027,NUR,482,Special Topics,Study of topics not available in other courses.,Other,lower,no,no,no,no,no,no
marshall,2026,2026-2027,NUR,483,Special Topics,Study of topics not available in other courses.,Other,lower,no,no,no,no,no,no
marshall,2026,2026-2027,NUR,485,Independent Study,,Other,lower,no,no,no,no,no,no
marshall,2026,2026-2027,NUR,486,Independent Study,,Other,lower,no,no,no,no,no,no
marshall,2026,2026-2027,NUR,487,Independent Study,,Other,lower,no,no,no,no,no,no
marshall,2026,2026-2027,NUR,488,Independent Study,,Other,lower,no,no,no,no,no,no
marshall,2026,2026-2027,NUR,496,Reading for Honors,,Other,lower,no,no,no,no,no,no
marshall,2026,2026-2027,PHL,200,Intro Phil Ancient Period (CT),The origins of philosophical activity among the Greeks by means of a selective sounding of several major thinkers.,Other,lower,no,no,no,no,no,no
