university,academic_year,academic_year_label,department_code,course_number,title,description,broad_area,level,progressive_signal,western_canon_signal,climate_narrow_signal,climate_broad_signal,cross_listed,deduplicated
uwplatt,2026,2026-2027,BUSADMIN,2630,Introduction to Marketing,"The study of marketing encompasses the activities involved in anticipating, managing, and satisfying demand via the exchange process.  Activities include environmental analysis, marketing research, consumer analysis, product planning, distribution planning, promotion planning, price planning, and marketing management.  The dynamic nature of marketing, the complex environment surrounding today's marketers, and various marketing functions, performers, and strategies are examined. Components: Class Typically Offered: Fall - Spring",Professional,graduate,False,False,False,False,False,True
uwplatt,2026,2026-2027,BUSADMIN,2990,Business & Entrepreneurship Experiential Learning,"This course is an introduction to business and entrepreneurship and its many facets. The course begins with an overview of key concepts and then quickly transitions into experiential activity where the student will apply what they have learned to a real business or entrepreneurial endeavor. Components: Class, Field Studies, Laboratory Typically Offered: Fall",Professional,graduate,False,False,False,False,False,True
uwplatt,2026,2026-2027,BUSADMIN,3030,Introduction to Human Resource Management,"An introduction to topics such as human resource planning, equal employment opportunity, selection, training and development, performance appraisal, compensation, safety and health, and employee and labor relations.  The impact of laws and of societal and business trends on human resource functions is presented.  Each manager's role in dealing with human resources is emphasized. Components: Class Prereqs/Coreqs: P: BUSADMIN 2330 or AGBUS 1500 and completion of 15 credits Typically Offered: Fall - Spring",Professional,graduate,False,False,False,False,False,True
uwplatt,2026,2026-2027,BUSADMIN,3100,Total Rewards,"This course provides students with an understanding of the total rewards package including government and legal issues related to compensation. Students will learn to formulate and execute a compensation strategy, define internal alignment, conduct a job analysis, evaluate jobs for job-based and person-based structures, and define competitiveness while demonstrating the ability to design pay levels, mix, and pay structures. The course will also examine different types of pay-for-performance plans, evaluate the process of performance appraisals, design an employee benefits plan that fits into an organization's overall compensation package, and assess the compensation systems designed for special groups. Components: Class Prereqs/Coreqs: P: BUSADMIN 3030 and ( BUSADMIN 1810 or BUSADMIN 2110 ) Typically Offered: Fall",Professional,graduate,False,False,False,False,False,True
uwplatt,2026,2026-2027,BUSADMIN,3110,Strategic Promotions Management,"This course examines various approaches to managing a firm's promotional strategy. The concept is to manage a diverse array of promotional tools (advertising, public relations, Internet, direct mail, personal selling, sales promotions, coupons, direct response, celebrity spokespeople, premiums and other promotional tools) so that a cohesive, targeted, and integrated communication program is the result. This approach allows the firm to more effectively and efficiently use the tools of promotion to achieve marketing and sales objectives. Components: Class Prereqs/Coreqs: P: BUSADMIN 2630 or AGBUS 2430 Typically Offered: Fall",Professional,graduate,True,False,False,False,False,True
uwplatt,2026,2026-2027,BUSADMIN,3130,Business Law,"This course is a study of the legal and ethical environment of business. This course covers the U.S. Constitution's impact on business and the legislative process, contracts, property, debtor-creditor relationships, business organizational structures, wills, estates, trusts, principal-agent relationships, employment relationships, and the Foreign Corrupt Practices Act of 1977 (as amended). Components: Class Prereqs/Coreqs: P: Completion of 45 credit hours. Typically Offered: Every Term",Professional,graduate,False,False,False,False,False,True
uwplatt,2026,2026-2027,BUSADMIN,3230,Small Business Management,"This course acquaints the student with many aspects of owning and operating a small business.  Topics covered include the characteristics of small business managers, planning and organizing for a new or an ongoing business, staffing a business, producing and marketing a product or service, profit planning and control, security, and the specifics of developing a business plan. Components: Class Prereqs/Coreqs: P: BUSADMIN 2630 or AGBUS 2430 Typically Offered: Fall - Spring",Professional,graduate,False,False,False,False,False,True
uwplatt,2026,2026-2027,BUSADMIN,3240,Digital Marketing,"This course provides a comprehensive understanding of how a business can effectively market its products, services and ideas using digital technologies. Students will explore various topics such as e-commerce in the marketing mix, content marketing, search engine optimization, website design, online selling, social networking/selling, analytics, measuring results of the digital strategies and email marketing. This course will focus on modern digital marketing theories and their practical applications in today's dynamic business landscape. Components: Discussion, Class Prereqs/Coreqs: P: BUSADMIN 2630 or AGBUS 2430 Typically Offered: Fall",Professional,graduate,False,False,False,False,False,True
uwplatt,2026,2026-2027,BUSADMIN,3340,"Management, Gender & Race","This course reviews the changing nature of management and explains why gender and race/ethnicity have become important concerns of business.  It examines the status of women and people of color in managerial or administrative positions and discusses socialization processes, stereotypes, equal employment opportunity laws, diversity management, illegal harassment, and power in organizations.  Networking, mentoring, work/life balance, and career planning also are addressed. Components: Class Cross Offering: ETHNSTDY 3340 , WOMGENDR 3340 GE: CP Civics & Perspectives, CP-C Civics Prereqs/Coreqs: P:  45 credits Typically Offered: Fall - Spring",Professional,graduate,True,False,False,False,False,True
uwplatt,2026,2026-2027,BUSADMIN,3400,Personal Financial Planning,"A study of the major financial decisions encountered by individuals.  The course explores a variety of consumer problems found in a modern, complex economy.  Subjects covered include the financial planning process, money management, consumer borrowing, insurance planning, budgeting, investments, and retirement and estate planning. Components: Class Prereqs/Coreqs: P: Junior standing Typically Offered: Fall",Professional,graduate,False,False,False,False,False,True
uwplatt,2026,2026-2027,BUSADMIN,3430,Risk Management and Insurance,This course covers the theory of risk and introduces the basic concepts of risk management.  Special emphasis is placed on risk transfer to insurance companies.  The course also introduces basic insurance concepts for both the individual and corporate consumers because risk management decisions presuppose a thorough understanding of the nature and functions of insurance. Components: Class Prereqs/Coreqs: P: Junior standing Typically Offered: Fall - even year,Professional,graduate,False,False,False,False,False,True
uwplatt,2026,2026-2027,BUSADMIN,3450,Compliance and HR Risk Management,"Complying with laws, regulations, and policies, and educating stakeholders to identify, mitigate, and respond to organizational risk is an important functional area of Human Resource Management. In this course, students will learn about applicable laws, regulations, and legal processes related to talent acquisition, talent development, employee/employer rights-responsibilities, union environments, compensation and benefits, and workplace health, safety, security, and privacy. Students will learn about awareness of record management, storage, retention regulations, and reporting requirements. Additionally, students will assess different risk assessment and mitigation techniques to promote a safe, secure, and compliant workplace along with the understanding of organizational restructuring initiatives and their risks to business continuity (like mergers, acquisitions, divestitures, integration, offshoring, downsizing, and furloughs). Components: Class Prereqs/Coreqs: P: BUSADMIN 3030 Typically Offered: Occasionally",Professional,graduate,False,False,False,False,False,True
uwplatt,2026,2026-2027,BUSADMIN,3500,Talent Development,"This course focuses on the foundations of talent development. Students will discuss the strategic talent development process and the fundamentals of training design while addressing the different aspects of the Instructional System Design (ISD) model. Students will demonstrate the ability to conduct a needs assessment, design and develop a training program, and implement and evaluate a training program. Students will also learn about the important issues of employee development and career management while discussing talent development's role in social responsibility and the future of talent development. Components: Class Prereqs/Coreqs: P: BUSADMIN 3030 Typically Offered: Fall",Professional,graduate,False,False,False,False,False,True
uwplatt,2026,2026-2027,BUSADMIN,3530,Organizational Behavior,"Organizations, in and of themselves, do not behave; the people within them do.  This course will give students a comprehensive view of organizational theory and behavior by studying individual and group behaviors and how these interrelate with the organization's structure, systems and goals. Components: Class Prereqs/Coreqs: P: BUSADMIN 2330 or AGBUS 1500 Typically Offered: Fall - Spring",Professional,graduate,False,False,False,False,False,True
uwplatt,2026,2026-2027,BUSADMIN,3540,Quality Management,"Provides an understanding of the tools, language, and techniques used in the field of Quality Management.  The history of the quality movement, major tenets of the field, theorists and their philosophies, and the use of basic tools of Quality Management will be covered in this course.  The course focus will be project-based in a team environment. Components: Class Prereqs/Coreqs: P: BUSADMIN 2330 or AGBUS 1500 Typically Offered: Fall - Spring",Professional,graduate,False,False,False,False,False,True
uwplatt,2026,2026-2027,BUSADMIN,3550,Team Dynamics,"In today's complex organizational environments working within a team, whether in a leadership role or as an active participant, requires a different set of skills than 'going it alone.' Creativity, conflict resolution and facilitating innovation are some of the major themes. Other topics explore building a climate of accountability, reducing social loafing, and establishing conditions that create high performance. The course is highly interactive with case-based exercises as well as a focus on project-based learning intended to build students' skills as effective, contributing team members. Components: Class Prereqs/Coreqs: P: BUSADMIN 3530 Typically Offered: Fall",Professional,graduate,False,False,False,True,False,True
uwplatt,2026,2026-2027,BUSADMIN,3580,Principles of Project Management and Sustainable Development,"This is an upper division course that brings together business-minded students with STEM-minded students who are interested in project management, particularly understanding how sustainable development can be integrated with business models for selecting projects from a portfolio, and sustainable aspects related to project management.  Includes the ten knowledge areas within the discipline of project management.  Students also work in teams to analyze case studies for decision-making related to energy conservation and non-energy conservation projects. Components: Class Cross Offering: ENERGY 3580 Prereqs/Coreqs: P:  (""C-"" or better in ENERGY 2340 ) or (JR Standing in Business Administration major or Accounting major) Typically Offered: Fall",Professional,graduate,False,False,False,True,False,True
uwplatt,2026,2026-2027,BUSADMIN,3620,Corporate Finance,"An introduction to the finance function and financial management of the firm, including techniques of financial analysis, working capital management, capital budgeting, the acquisition and management of corporate capital, and dividend policy. Analysis of how the financial manager influences the decision-making process within the firm. Components: Class Prereqs/Coreqs: P: ACCTING 2010 and completion of university math requirement Typically Offered: Fall - Spring",Professional,graduate,False,False,False,False,False,True
uwplatt,2026,2026-2027,BUSADMIN,3630,Advertising,"This course examines the function of advertising as a communications and promotional tool. Although each organization is different, the course will provide numerous best practices that universally apply to generate interest in a product, cause, or company. Emphasis will be placed on strategic and persuasive messaging across multiple media. Components: Class Prereqs/Coreqs: P: BUSADMIN 2630 or AGBUS 2430 Typically Offered: Spring",Professional,graduate,False,False,False,False,False,True
uwplatt,2026,2026-2027,BUSADMIN,3640,Financial Markets and Institutions,"A macro-finance course that deals with the financial system of the United States.  Major emphasis is placed on financial markets, financial institutions, financial assets, and their interaction within the financial system framework.  The course also has a focus on the management and regulation of both markets and institutions.  Web assignments are an integral part of this course. Components: Class Prereqs/Coreqs: P: BUSADMIN 3620 Typically Offered: Spring",Professional,graduate,False,False,False,False,False,True
uwplatt,2026,2026-2027,BUSADMIN,3650,International Finance,"This course is a comprehensive study of the role of international finance in business.  Topics will include the foreign exchange market, determination of interest rates, international banking, international capital markets, international investments and international corporate finance. Components: Class Prereqs/Coreqs: P: BUSADMIN 3620 Typically Offered: Fall",Professional,graduate,False,False,False,False,False,True
uwplatt,2026,2026-2027,BUSADMIN,3660,Organizational Development and Change,"This course examines the major components of organization development and design: the evolution of organization development, the nature of change, and how to effectively manage and implement change in organizations. We will discuss the OD process in-depth to familiarize students with the process of contracting, data gathering, diagnosis, giving feedback, conducting interventions, and evaluating results. We will look at different options for structuring organizations, consider the advantages and disadvantages of each, and discuss how to implement an organizational design change. Components: Class Prereqs/Coreqs: P: BUSADMIN 3530 Typically Offered: Occasionally",Professional,graduate,False,False,False,False,False,True
uwplatt,2026,2026-2027,BUSADMIN,3700,Marketing Research,"Marketing is an evolving field that constantly looks for improvement. Research in its various forms is the tool to inform that evolution. This course will provide both theoretical foundations and direct experience in conducting informative marketing research. Topics include formal and impromptu marketing research projects that marketing professionals might encounter in a professional setting, the research process and designs, evaluation of data, and presentation of findings. Components: Class Prereqs/Coreqs: P:  ( BUSADMIN 2630 or AGBUS 2430 ) and ( MATH 1830 or BUSADMIN 2340 ) Typically Offered: Fall",Professional,graduate,False,False,False,False,False,True
uwplatt,2026,2026-2027,BUSADMIN,3710,Bank Management,"The purpose of the course is to analyze the issues involved in managing commercial banks and related financial institutions.  The theory and practice of bank management will be studied with particular emphasis on the topics of asset management, and capital adequacy.  Additionally, new dimensions in banking structure will be introduced. Components: Class Prereqs/Coreqs: P: BUSADMIN 3620 Typically Offered: Fall",Professional,graduate,False,False,False,False,False,True
uwplatt,2026,2026-2027,BUSADMIN,3720,International Marketing,"A conceptual focus on the breadth of the international marketing management area including problems, strategies and techniques, plus a survey background in such environmental factors as legal, cultural, economic, financial, and regional characteristics. The purpose is to prepare students and practicing business managers for successful operations in the world marketing environment of developing, industrial, and/or technological nations. Components: Class Prereqs/Coreqs: P: BUSADMIN 2630 or AGBUS 2430 Typically Offered: Fall - odd year",Professional,graduate,False,False,False,False,False,True
uwplatt,2026,2026-2027,BUSADMIN,3740,Consumer Behavior,"Consumer behavior reaches for a better understanding of the consumer buying process.  It begins with an examination of basic, standard steps that consumers take while making a purchasing decision and moves into consumer motives based on various consumer cohorts.  The marketing student -- after having studied consumer behavior -- will have a stronger appreciation for the basis of consumer needs and will be better prepared to serve them. Components: Class Prereqs/Coreqs: P: BUSADMIN 2630 or AGBUS 2430 Typically Offered: Fall",Professional,graduate,False,False,False,False,False,True
uwplatt,2026,2026-2027,BUSADMIN,3750,International Short Study,"The International Term Short Study course abroad is designed to help students develop an understanding of the world's economies, the globalization of technology, capital, industries, systems, goods, services, and inputs that have enhanced much of the international issues in business practices and cultures.  An overview of the International business environment, including business strategies, history, and cultures will be covered.  Credit numbers possible are 1-3.  Students who wish to use this course to fulfill Global Studies requirements, must request for 3 credit hours. Components: Class Typically Offered: Occasionally",Professional,graduate,False,False,False,False,False,True
uwplatt,2026,2026-2027,BUSADMIN,3810,Sports Marketing & Sales,"Sports Marketing  Sales is a specialized marketing course that is designed to prepare students to develop skills necessary to address marketing and sales issues specific to the sports industry. This course will analyze the field of sports in terms of the practices, applications, and strategies of mainstream marketing and sales. The subject includes Sponsorship, Endorsements, Licensing, Segmentation of the Sports Market, Promotional Strategy for the Marketing of Sports Products, Selling Sponsorships, Selling Tickets and Emerging Issues in Sports Marketing. Components: Class Prereqs/Coreqs: P: BUSADMIN 2630 or AGBUS 2430 Typically Offered: Occasionally",Professional,graduate,False,False,False,False,False,True
uwplatt,2026,2026-2027,BUSADMIN,3820,Introduction to Professional Selling,"Relationships provide the foundation for successful business and personal interactions. The course prepares students for success in building relationships that lead to customer acquisition and retention. Students learn how to build value, develop win-win scenarios, develop their leadership style, negotiating skills and managing the selling process. Course examples and strategies will canvas a wide range of industries that include business, agriculture, engineering, and sports marketing. The emphasis is on applying course content to the student's specific career direction. Components: Class Prereqs/Coreqs: P: SPEECH 1010 or SPEECH 1060 Typically Offered: Fall",Professional,graduate,False,False,False,False,False,True
uwplatt,2026,2026-2027,BUSADMIN,3830,Sales Management,"A study of the role of sales management in the total marketing structure examines the role of sales manager and how this role serves the sales department and the company.  Recruiting, selection, training, motivation leadership, compensation plans, and sales forecasting are studied with focus on the administration of these functions.  Evaluation and performance appraisal of the sales force are also included.  The course considers the many aspects of international selling and training salespersons for global territories. Components: Class Prereqs/Coreqs: P: BUSADMIN 2630 or AGBUS 2430 Typically Offered: Occasionally",Professional,graduate,False,False,False,False,False,True
uwplatt,2026,2026-2027,BUSADMIN,3840,Advanced Selling,Advanced Selling is the second selling-focused class of the professional selling emphasis. This class builds on the concepts that were presented in BUSADMIN 3820 and AGBUS 3410 . Advanced Selling continues to develop the concept of selling as a critical part of running a successful business. In this class we will be working on what it takes to be a successful professional salesperson. This class is designed to prepare the student for an entry-level sales position. Components: Class Prereqs/Coreqs: P: BUSADMIN 3820 or AGBUS 3410 Typically Offered: Spring,Professional,graduate,False,False,False,False,False,True
uwplatt,2026,2026-2027,BUSADMIN,3860,Accounting & Financial Analytics and Modeling,"The course focuses on valuation and understanding the value implications of investment and financing decisions that firms make. The course builds on the time value of money concepts and risk and return concepts from BUSADMIN 3620 Corporate Finance, but in more depth and rigor. There is an emphasis on the tools, analytical strategies, and techniques used to make financial decisions, including the use of spreadsheet financial modeling to aid in valuation and decision-making. Topics include working capital management, strategic and tactical financing decisions, and financial statement analysis. Components: Class Prereqs/Coreqs: P: BUSADMIN 3620 Typically Offered: Fall",Professional,graduate,False,False,False,False,False,True
uwplatt,2026,2026-2027,BUSADMIN,3930,Investments,"A contemporary study of investments with a focus on past and present investment decision making, sources of information, stock investing, modern portfolio theory, and mutual fund creation and selection. Components: Class Prereqs/Coreqs: P: BUSADMIN 3620 Typically Offered: Spring",Professional,graduate,False,False,False,False,False,True
uwplatt,2026,2026-2027,BUSADMIN,3940,International Human Resource Management,"This course explores challenges and intricacies of effectively obtaining, managing, and developing human resources to achieve strategic organizational objectives in international, global, and cross-cultural contexts. Major changes in this area of management in response to economic and political pressure and policies and practices in various countries also are covered. Issues for study include strategies for global talent acquisition and training, cross-cultural adjustment, expatriation and repatriation, performance management and career development for multinational employees, cross and multi-cultural compensation plans, and employee relations across countries and cultures. Components: Class Prereqs/Coreqs: P: BUSADMIN 3030 Typically Offered: Fall - odd year",Professional,graduate,False,False,False,False,False,True
uwplatt,2026,2026-2027,BUSADMIN,4020,Treasury Management,"Explores short-term financial management. Reviews institutional and legal aspects as a context for making decisions involving current assets and current liabilities. This working capital management, i.e., the management of cash, inventories, accounts receivable, and short-term credit arrangements by business firms, provides the basis of long-term survival of businesses. Components: Class Prereqs/Coreqs: P: BUSADMIN 3620 Typically Offered: Fall - odd year",Professional,graduate,False,False,False,False,False,True
uwplatt,2026,2026-2027,BUSADMIN,4030,Financial Decision Making,"An analysis of actual problems encountered by financial managers from major firms.  This course utilizes the case study methodology and requires heavy usage of computer application skills, particularly spreadsheet skills.  The goal is to identify the problem, analyze it, and finally make a well-justified recommendation to the firm. Components: Class Prereqs/Coreqs: P: BUSADMIN 3860 Typically Offered: Fall",Professional,graduate,False,False,False,False,False,True
uwplatt,2026,2026-2027,BUSADMIN,4040,Sports Finance,"This course is the application of principles and practices of financial management, as it applies to organizations in the sport industry. This course seeks to develop the financial skills necessary to gain an understanding of an array of financial concepts that impact sport managers. Students will examine financial strategies related to sport entities and organizations and will be introduced to current economic and financial issues that impact the sport industry. Topics include the demand for sports talent, capital allocation, impact of sporting organizations on local economies, valuation of sports franchises, and other sports-specific financing issues. Components: Class Prereqs/Coreqs: P: BUSADMIN 3620 Typically Offered: Spring - odd year",Professional,graduate,False,False,False,False,False,True
