university,academic_year,academic_year_label,department_code,course_number,title,description,broad_area,level,progressive_signal,western_canon_signal,climate_narrow_signal,climate_broad_signal,cross_listed,deduplicated
uwplatt,2026,2026-2027,ENGLISH,2120,Introduction to Creative Writing,"Introduction to Creative Writing develops students' knowledge of and appreciation for the historical evolution of poetry and fiction. Reading and responding to a range of texts, students establish vocabularies specific to both art forms. Via sustained explorations of these assigned texts, they foster an empathetic awareness of new subjectivities and consider the ways in which race, ethnicity, class and gender shape individual experience. Students also practice writing in a variety of poetic and prose structures, including lyric and narrative poetry and linear and non-linear styles of narration. Responding to one another's fiction and poetry, they develop creative and critical thinking skills and gain an appreciation for the ways in which creative writing engages lived experience. Components: Class GE: HA Humanities & Arts, HA-A Arts Prereqs/Coreqs: P or C: ENGLISH 1040 or ENGLISH 1130 Typically Offered: Fall - Spring",STEM,graduate,True,False,False,False,False,True
uwplatt,2026,2026-2027,ENGLISH,2150,Introduction to LGBTQ+ Studies,"Introduction to LGBTQ+ Studies is an interdisciplinary course covering the history, culture, and politics of LGBTQ+ persons around the world. The course seeks to theorize, document, uncover, and revise our existing knowledge about same-sex attraction and gender identity and also examine a wide range of related historical figures and events. Using the lenses of social science, science, and the humanities, the course explores ways in which sexual orientation and gender limit and expand individual experience. Components: Class Cross Offering: WOMGENDR 2150 GE: CP Civics & Perspectives, CP-C Civics Prereqs/Coreqs: P or C: ENGLISH 1230 or consent of the instructor. Typically Offered: Fall",STEM,graduate,True,False,False,False,False,True
uwplatt,2026,2026-2027,ENGLISH,2160,Comics and Graphic Novels,"Course focuses on comics and graphic novels, paying particular attention to the modes of visual storytelling that are unique to graphic narratives. Components: Class GE: HA Humanities & Arts, HA-H Humanities Prereqs/Coreqs: P or C: ENGLISH 1230 or consent of the instructor Typically Offered: Spring - odd year",STEM,graduate,False,False,False,False,False,True
uwplatt,2026,2026-2027,ENGLISH,2170,Horror,"Course focuses on texts from the horror genre in literature and media. Components: Class GE: HA Humanities & Arts, HA-H Humanities Prereqs/Coreqs: P or C: ENGLISH 1230 or consent of the instructor Typically Offered: Fall - even year",STEM,graduate,False,False,False,False,False,True
uwplatt,2026,2026-2027,ENGLISH,2180,The Romance Novel,"Study of the mass-market romance novel and its significance to women's literary and cultural history. Specific subgenres (historical, contemporary, paranormal, young adult, etc.), topics, or themes can be chosen by the instructor. Components: Class GE: HA Humanities & Arts, HA-H Humanities Prereqs/Coreqs: P or C: ENGLISH 1230 or consent of the instructor Typically Offered: Spring - odd year",STEM,graduate,False,False,False,False,False,True
uwplatt,2026,2026-2027,ENGLISH,2190,Young Adult Literature,"Course focuses on the analysis of literature for Young Adults. Components: Class GE: HA Humanities & Arts, HA-H Humanities Prereqs/Coreqs: P or C: ENGLISH 1230 or consent of the instructor Typically Offered: Spring - even year",STEM,graduate,False,False,False,False,False,True
uwplatt,2026,2026-2027,ENGLISH,2200,Crime and American Detective Fiction,"This course examines the origins of detective fiction by looking at select representative works of the earliest writers of the genre and then explores how American writers rejected the traditional mystery, creating a unique literary genre. Heavily influenced by an existing mixed tradition of American literature (e.g., gothic literature, historical romance), American writers of detective fiction formed a new hero, the hard-boiled private eye. Students will read works of writers who created and transcended the genre-Dashiell Hammett, Raymond Chandler, and Ross Macdonald-and writers who have continued the tradition, adding unique perspectives and previously marginalized voices. Components: Class GE: HA Humanities & Arts, HA-H Humanities Prereqs/Coreqs: P or C: ENGLISH 1230 or consent of instructor Typically Offered: Fall",STEM,graduate,True,False,False,False,False,True
uwplatt,2026,2026-2027,ENGLISH,2210,Introduction to Linguistics,"A general introduction to linguistics, the study of human language.  This course covers the core topics of linguistics, including phonetics, phonology, morphology, syntax, semantics, pragmatics, sociolinguistics, and language acquisition.  Examples will be drawn primarily from the English language. Components: Class GE: HA Humanities & Arts, HA-H Humanities Prereqs/Coreqs: P or C: ENGLISH 1230 or consent of the instructor. Typically Offered: Fall",STEM,graduate,False,False,False,False,False,True
uwplatt,2026,2026-2027,ENGLISH,2220,Literature and Science,"The sciences and the humanities are often positioned as two entirely separate knowledge domains. This course aims to bridge that gap by examining the intersections between literature and science. Students will investigate how literature engages with a variety of scientific practices and discoveries, as well as how scientific fields offers new readings of literary texts. Ultimately, the course aims to uncover the bidirectional influences of literature, culture, and science as they attempt to address the unknown. Components: Class GE: HA Humanities & Arts, HA-H Humanities Prereqs/Coreqs: P or C: ENGLISH 1230 Typically Offered: Every two years",STEM,graduate,False,False,False,False,False,True
uwplatt,2026,2026-2027,ENGLISH,2250,Introduction to Film,"Introduction to Film"" develops students' abilities to view films critically and deepen their understanding of the principal film genres through careful study of their historical contexts and cinematic techniques.  The course focuses on the study of different genres and aesthetic schools of film, such as the French New Wave, German Expressionism, westerns, war films, musicals, and film noir, in terms of how they present aesthetic detail, ideological points of view (such as issues of gender and race), as well as fulfill certain expectations of the spectator.  After a thorough grounding in the conventions of traditional genre in cinema, the class will also focus on the ways in which it has been revised by filmmakers in more recent periods of cinematic history. Components: Discussion, Class GE: HA Humanities & Arts, HA-H Humanities Prereqs/Coreqs: P or C: ENGLISH 1230 or consent of the instructor. Typically Offered: Spring",STEM,graduate,True,False,False,False,False,True
uwplatt,2026,2026-2027,ENGLISH,2260,Video Game Storytelling and Narrative Design,"An introduction to the study of video games as interactive narrative texts. Specific subgenres or themes (RPG, action-adventure, simulation, etc.) will be chosen by the individual instructor. Topics will include story progression, character construction, worldbuilding, genre conventions, and the emotional and ethical dimensions of player choice. Components: Class GE: HA Humanities & Arts, HA-H Humanities Prereqs/Coreqs: P: ENGLISH 1230 or consent of instructor Typically Offered: Every other semester",STEM,graduate,False,False,False,False,False,True
uwplatt,2026,2026-2027,ENGLISH,2270,Topics in Popular Culture,"Course focuses on a theme or topic in popular culture and may include analysis of texts from film, television, electronic media, or other areas of popular culture. Components: Class GE: HA Humanities & Arts, HA-H Humanities Prereqs/Coreqs: P or C: ENGLISH 1230 or consent of instructor Typically Offered: Occasionally",STEM,graduate,False,False,False,False,False,True
uwplatt,2026,2026-2027,ENGLISH,2480,Race and Ethnicity in Film,"This course will offer students a lens through which to study the changing role of race and ethnicity in society and will explore how the film industry reflects and often participates in the larger racial inequities in cultural, economic, and artistic structures. The course will also introduce students to a wide range of films written or directed by persons of color and will consider the ways in which filmmakers have used film as a means of asserting ethnic identity and challenging the status quo. The course will primarily focus on films made within the United States, but it may also entail an international component. Components: Discussion, Class Cross Offering: ETHNSTDY 2480 GE: HA Humanities & Arts, HA-H Humanities Prereqs/Coreqs: P or C: ENGLISH 1230 or consent of instructor",STEM,graduate,True,False,False,False,False,True
uwplatt,2026,2026-2027,ENGLISH,2490,Gender in Film,"This course will offer students a lens through which to study the complex role of gender in society and will explore how the film industry reflects the larger gender inequities in worldwide cultural, economic, and artistic structures.  The course will examine film representations of women and men to analyze stereotypes and misconceptions that continue to be disseminated.  The course will also introduce students to a wide range of films written or directed by women and will consider the ways in which female filmmakers have responded to, critiqued, or challenged dominant patriarchal representations. Components: Class, Discussion Cross Offering: WOMGENDR 2490 GE: HA Humanities & Arts, HA-H Humanities Prereqs/Coreqs: P or C: ENGLISH 1230 or consent of the instructor. Typically Offered: Fall - odd year",STEM,graduate,True,False,False,False,False,True
uwplatt,2026,2026-2027,ENGLISH,2770,International Cinema,"This course will offer students an avenue to satisfy global studies and humanities general education requirements via study of a wide range of films from different eras, nations, and cultures.  This course seeks to introduce students to global history of film as an art form and how international cinema both responds to and influences the film styles that are more familiar to American students.  Such a breadth of knowledge will both expand students' knowledge of world cinema and also enrich students' appreciation of American film by placing it in an international context.  Finally, the course will examine not only diverse films but will also seek to understand the cultural and historical context that gave rise to these films. Components: Class GE: HA Humanities & Arts, HA-H Humanities Prereqs/Coreqs: P or C: ENGLISH 1230 or consent of the instructor. Typically Offered: Spring",STEM,graduate,True,False,False,False,False,True
uwplatt,2026,2026-2027,ENGLISH,2830,Survey of Women Writers,"Survey of women writers in the English language with a focus on the themes, issues, and concerns that tie women's writing together and create a 'women's literary tradition.' British, American, and international writers are included. Components: Class Cross Offering: WOMGENDR 2830 GE: HA Humanities & Arts, HA-H Humanities Prereqs/Coreqs: P or C: ENGLISH 1230 or consent of the instructor. Typically Offered: Fall",STEM,graduate,False,False,False,False,False,True
uwplatt,2026,2026-2027,ENGLISH,2840,Science Fiction and/or Fantasy Literature,"A study of texts (e.g., fiction, nonfiction, poetry, drama, film) that speculate on alternative futures or worlds. Components: Class GE: HA Humanities & Arts, HA-H Humanities Prereqs/Coreqs: P or C: ENGLISH 1230 or consent of instructor. Typically Offered: Based on Student Demand",STEM,graduate,False,False,False,False,False,True
uwplatt,2026,2026-2027,ENGLISH,2850,Literature of Nature,"A study of texts characterizing the natural world as experienced primarily by American writers of the 19th and 20th centuries. Components: Class GE: HA Humanities & Arts, HA-H Humanities Prereqs/Coreqs: P or C: ENGLISH 1230 or consent of instructor. Typically Offered: Based on Student Demand",STEM,graduate,False,False,False,False,False,True
uwplatt,2026,2026-2027,ENGLISH,2950,Intro to Multi-Ethnic American Literature,"This course is designed to introduce students to a variety of ethnic American literatures, giving special emphasis to the four historically marginalized racial groups--Native American, African American, Asian American, and Latino/a. While close analysis of assigned literary texts will make up the bulk of class work, a number of historical and theoretical issues will also be examined.  These include the social construction of race/ethnicity; racism and white privilege, literary sub-culture versus literary canon; and the intersection of gender and class with race and ethnicity. Components: Class Cross Offering: ETHNSTDY 2950 GE: HA Humanities & Arts, HA-H Humanities Prereqs/Coreqs: P or C: ENGLISH 1230 or consent of instructor. Typically Offered: Fall - Spring",STEM,graduate,True,False,False,False,False,True
uwplatt,2026,2026-2027,ENGLISH,3000,Technical Writing,"Technical description and explanation, job applications and business correspondence, and reports suited to one's major (e.g. a criminal or safety investigation, feasibility study or grant proposal); oral presentations; technical editing. Emphasis on clarity, conciseness, precision and effective communication with lay audiences and management. Components: Class Prereqs/Coreqs: P: ENGLISH 1230 Typically Offered: Fall - Spring",STEM,graduate,False,False,False,False,False,True
uwplatt,2026,2026-2027,ENGLISH,3010,Writing for Science and Research,"This course familiarizes students with scientific writing and research. Students will practice writing in a variety of academic genres, such as research articles, review articles, conference proposals, research posters, conferences presentations, research funding proposals, and public communication of science. Components: Class Prereqs/Coreqs: P: ENGLISH 1230 Typically Offered: Spring - odd year",STEM,graduate,False,False,False,False,False,True
uwplatt,2026,2026-2027,ENGLISH,3030,Teaching of Composition,"The rhetorical principles and approaches to composition.  Includes practice in writing and evaluating composition with emphasis on practical ways to teach writing in the elementary, middle, and high school.  One hour of classroom participation is required. Components: Class Prereqs/Coreqs: P: ENGLISH 1230 Typically Offered: Fall",STEM,graduate,False,False,False,False,False,True
uwplatt,2026,2026-2027,ENGLISH,3090,Designing for Usability,"An advanced writing and editing course examining how information is conveyed through document design, usability, information architecture, and user experience. Students will create documents that combine both text and visuals in a variety of genres, which may include flyers, graphs, and experience maps. Components: Class Prereqs/Coreqs: P: ENGLISH 1230 Typically Offered: Spring - odd year",STEM,graduate,False,False,False,False,False,True
uwplatt,2026,2026-2027,ENGLISH,3110,LGBTQ+ Literature for Young Adults,"An analysis of selected LGBTQ+ literature and films especially suitable for young adults of high school age with an emphasis on approaches and methods for teaching literature and addressing the needs of LGBTQ+ students. Components: Class Cross Offering: WOMGENDR 3110 GE: HA Humanities & Arts, HA-H Humanities Prereqs/Coreqs: P: ENGLISH 1230 Typically Offered: Fall - odd year",STEM,graduate,True,False,False,False,False,True
uwplatt,2026,2026-2027,ENGLISH,3140,Poetry Writing,"Poetry writing is an exploration of the various elements and techniques involved in the craft and art of writing poems.  The course will focus primarily on writing workshops in which students and faculty learn to critique one another's work, but will also include in-class writing activities and class discussions of assigned readings.  Students will read, discuss, and analyze a range of poetry from traditional to contemporary poets. Components: Class GE: HA Humanities & Arts, HA-A Arts Prereqs/Coreqs: P: ENGLISH 1230 Typically Offered: Fall - even year",STEM,graduate,False,False,False,False,False,True
uwplatt,2026,2026-2027,ENGLISH,3150,Fiction Writing,"This is a fiction writing workshop in which students will study the techniques and art of fiction writing and will write fiction which they will submit to their professor, as well as their peers, for review. Components: Class GE: HA Humanities & Arts, HA-A Arts Prereqs/Coreqs: P: ENGLISH 1230 Typically Offered: Fall",STEM,graduate,False,False,False,False,False,True
uwplatt,2026,2026-2027,ENGLISH,3160,Creative Nonfiction Writing,"This is a creative nonfiction-writing workshop designed to teach students what creative nonfiction is and how to write it. Students will read examples of such creative nonfiction works as the personal essay, the memoir or nature writing, and will be required to write creative nonfiction, which they will submit to class for peer review. Components: Class GE: HA Humanities & Arts, HA-A Arts Prereqs/Coreqs: P: ENGLISH 1230 Typically Offered: Spring",STEM,graduate,False,False,False,False,False,True
uwplatt,2026,2026-2027,ENGLISH,3230,Victorian and 20th Century British Literature,"Course focuses on British literature written in the nineteenth and twentieth centuries. A specific topic or theme can be chosen by the instructor and announced when the course is scheduled. Components: Class GE: HA Humanities & Arts, HA-H Humanities Prereqs/Coreqs: P: ENGLISH 1230 Typically Offered: Spring",STEM,graduate,False,False,False,False,False,True
uwplatt,2026,2026-2027,ENGLISH,3240,Advanced Writing,"An advanced writing course concentrating on rhetorical and research stategies, prose styles, and their practical application to understanding and evaluating current and traditional essays as well as contemporary media such as film, television, and advertising. Components: Class Prereqs/Coreqs: P: ENGLISH 1230 Typically Offered: Spring",STEM,graduate,False,False,False,False,False,True
uwplatt,2026,2026-2027,ENGLISH,3250,Sociolinguistics,"An introduction to sociolinguistics, the study of language in its social context.  This course covers a wide range of topics, including dialects, stylistic variation, language and gender, language contact, language change, world Englishes, language planning, language and power, and the applications of sociolinguistics, to provide students with an understanding of the interaction between language and society.  Examples will be drawn from the United States and around the world. Components: Class GE: HA Humanities & Arts, HA-H Humanities Prereqs/Coreqs: P: ENGLISH 1230 Typically Offered: Spring - odd year",STEM,graduate,True,False,False,False,False,True
uwplatt,2026,2026-2027,ENGLISH,3260,Language and Culture,"Examines the theoretical and practical relationship between language and selected social and cultural aspects of human life.  Discusses contiguities of linguistic and cultural practices; examines how particular language practices create and maintain social structures, and how discourse reflects social structures and cultural values. Components: Class GE: HA Humanities & Arts, HA-H Humanities Prereqs/Coreqs: P: ENGLISH 1230 Typically Offered: Fall",STEM,graduate,False,False,False,False,False,True
uwplatt,2026,2026-2027,ENGLISH,3280,LGBTQ+ Literature,"While focusing primarily on contemporary LGBTQ+ fiction, this course also provides an overview of the evolution of international LGBTQ+ literatures from their beginnings to the present, including such authors as Sappho, Hafiz, Sadi, Whitman, Wilde, Cather, Woolf, Forster, Gide, Hughes, Lorca, Rimbaud, Stein, Baldwin, Bishop, Ginsberg, and Lorde. Components: Class Cross Offering: WOMGENDR 3280 GE: HA Humanities & Arts, HA-H Humanities Prereqs/Coreqs: P: ENGLISH 1230 Typically Offered: Fall - even year",STEM,graduate,True,False,False,False,False,True
uwplatt,2026,2026-2027,ENGLISH,3350,Contemporary Literature,"Course focuses on contemporary literary texts written post-1945. A specific topic or theme can be chosen by the instructor and announced when the course is scheduled. Components: Class GE: HA Humanities & Arts, HA-H Humanities Prereqs/Coreqs: P or C: ENGLISH 1230 or consent of instructor Typically Offered: Occasionally",STEM,graduate,False,False,False,False,False,True
uwplatt,2026,2026-2027,ENGLISH,3360,"Writing, Editing, and Publishing in Multiple Media","An advanced writing and editing course concentrating on planning, creating, and evaluating written copy for print and on-line magazines.  Emphasizes both preparing the student's work for trade publications, and studying and practicing the processes of those publications. Components: Class Prereqs/Coreqs: P: ENGLISH 1230 Typically Offered: Fall",STEM,graduate,False,False,False,False,False,True
uwplatt,2026,2026-2027,ENGLISH,3370,Medieval and Renaissance Literature,"Course offers an advanced study of British literature during the Medieval and Renaissance eras and may focus on a specific topic or theme. Components: Class GE: HA Humanities & Arts, HA-H Humanities Prereqs/Coreqs: P: ENGLISH 1230 Typically Offered: Spring - odd year",STEM,graduate,False,True,False,False,False,True
uwplatt,2026,2026-2027,ENGLISH,3380,Literary Magazine Production,"Students enrolled in this high-impact learning emphasis course collaborate to create the annual issue of our campus-based literary journal, Spirit Lake Review, by engaging in editorial, design, production, copyediting, promotional, and event planning processes. May be retaken for credit. Components: Class Prereqs/Coreqs: P or C: ENGLISH 1230 or consent of instructor Typically Offered: Spring",STEM,graduate,False,False,False,False,False,True
uwplatt,2026,2026-2027,ENGLISH,3610,Second Language Acquisition,"This course is concerned primarily with how people acquire a second language.  It examines cognitive, linguistic, psychological, and sociocultural aspects of second language acquisition and explores their implications for second language learning and teaching. Components: Class Prereqs/Coreqs: P: ENGLISH 1230 Typically Offered: Spring",STEM,graduate,False,False,False,False,False,True
uwplatt,2026,2026-2027,ENGLISH,3640,Early American Literature,"Course focuses on American literature prior to the Civil War. A specific topic or theme can be chosen by the instructor and announced when the course is scheduled. Components: Class GE: HA Humanities & Arts, HA-H Humanities Prereqs/Coreqs: P: ENGLISH 1230 or consent of the instructor Typically Offered: Occasionally",STEM,graduate,False,False,False,False,False,True
uwplatt,2026,2026-2027,ENGLISH,3650,Modern American Literature,"Course focuses on American literature since the Civil War. A specific topic or theme can be chosen by the instructor and announced when the course is scheduled. Components: Class GE: HA Humanities & Arts, HA-H Humanities Prereqs/Coreqs: P: ENGLISH 1230 or consent of the instructor Typically Offered: Occasionally",STEM,graduate,False,False,False,False,False,True
uwplatt,2026,2026-2027,ENGLISH,3660,Ancient World Literature,"Course focuses on international literary works of the premodern world. A specific topic or theme can be chosen by the instructor and announced when the course is scheduled. Components: Class GE: HA Humanities & Arts, HA-H Humanities Prereqs/Coreqs: P: ENGLISH 1230 or consent of the instructor Typically Offered: Occasionally",STEM,graduate,False,False,False,False,False,True
uwplatt,2026,2026-2027,ENGLISH,3670,Modern World Literature,"Course focuses on international literary works of the modern world. A specific topic or theme can be chosen by the instructor and announced when the course is scheduled. Components: Class GE: HA Humanities & Arts, HA-H Humanities Prereqs/Coreqs: P: ENGLISH 1230 or consent of the instructor Typically Offered: Occasionally",STEM,graduate,False,False,False,False,False,True
uwplatt,2026,2026-2027,ENGLISH,3680,18th Century British Literature,"Course focuses on British literature written between 1660-1800. A specific topic or theme can be chosen by the instructor and announced when the course is scheduled. Components: Class GE: HA Humanities & Arts, HA-H Humanities Prereqs/Coreqs: P: ENGLISH 1230 or consent of instructor Typically Offered: Spring - even year",STEM,graduate,False,False,False,False,False,True
uwplatt,2026,2026-2027,ENGLISH,3730,African-American Literature,"A survey of African-American literature beginning in the ante bellum period and continuing to the present, including oral forms (folk tales and spirituals), novels, poetry, drama, autobiography, and other selected non-fiction. Components: Class Cross Offering: ETHNSTDY 3730 GE: HA Humanities & Arts, HA-H Humanities Prereqs/Coreqs: P: ENGLISH 1230 Typically Offered: Spring",STEM,graduate,False,False,False,False,False,True
uwplatt,2026,2026-2027,ENGLISH,3840,Topics in US Minority Ethnic Literature,"This course will focus on a specific topic or theme related to minority ethnic literatures in the United States. Students may read literature from African American, Asian American, Latinx, and/or Native American Writers. In all sections, students will also learn basic concepts in Ethnic Studies, such as the social construction of race/ethnicity, privilege and oppression, and the intersection of race and ethnicity with gender, sexuality, and class. May be repeated once for credit, provided the content varies. Components: Class Cross Offering: ETHNSTDY 3840 GE: HA Humanities & Arts, HA-H Humanities Prereqs/Coreqs: P: ENGLISH 1230 Typically Offered: Spring",STEM,graduate,True,False,False,False,False,True
