university,academic_year,academic_year_label,department_code,course_number,title,description,broad_area,level,progressive_signal,western_canon_signal,climate_narrow_signal,climate_broad_signal,cross_listed,deduplicated
uwplatt,2026,2026-2027,MECHENG,3720,Measurements and Instrumentation Laboratory,"Introduction to engineering laboratory equipment, experimental procedures, report writing, automated data acquisition, including computer programming and statistical analysis.  Emphasis is on the experimental analysis of mechanical systems, including topics such as vibrations, strain gauges, and DC motors, along with the electronics used to instrument and measure these systems. Components: Laboratory, Class Prereqs/Coreqs: P: 'C-' or better in MATH 4030 , GENENG 2930 , MECHENG 3430 , and MATH 3630 Typically Offered: Fall - Spring",STEM,graduate,False,False,False,False,False,True
uwplatt,2026,2026-2027,MECHENG,3830,Mechanisms and Machines,"Design and analysis of mechanisms and machines. A study of simple machines such as linkages, geared systems, and cam-follower systems. Topics include mechanism motion and performance (position, velocity, acceleration, force transmission, etc.), actuators, and design considerations to improve machine performance.   The use of a customer-based, systematic design process to design and develop a working mechanism. Components: Laboratory, Discussion, Class Prereqs/Coreqs: P:  A grade of ""C-"" or better in GENENG 2230 or ENGRPHYS 3240 and GENENG 2030 Typically Offered: Fall - Spring",STEM,graduate,False,False,False,False,False,True
uwplatt,2026,2026-2027,MECHENG,3950,Mechanical Engineering Cooperative Education,"Work experience in industry under the direction of the College of Engineering, Mathematics and Science Cooperative Education and Internship Program. During the co-op, the student is expected to work for an industry for a semester and a summer. Components: Field Studies Prereqs/Coreqs: P: 'C-' or better in GENENG 2130 and MECHENG 2630 . Student must be in a degree granting program and must not have taken MECHENG 4930 Senior Design Typically Offered: Fall - Spring",STEM,graduate,False,False,False,False,False,True
uwplatt,2026,2026-2027,MECHENG,3970,Mechanical Engineering Internship,"Work experience in industry under the direction of the College of Engineering, Mathematics and Science Cooperative Education and Internship Program.  This program is designed to cover the summer work experience. The internship is designed to provide experiential learning to the student during the summer period. Components: Field Studies Prereqs/Coreqs: P: 'C-' or better in GENENG 2130 and MECHENG 2630 . Student must be in a degree granting program and must not have taken MECHENG 4930 Senior Design Typically Offered: Summer",STEM,graduate,False,False,False,False,False,True
uwplatt,2026,2026-2027,MECHENG,4330,Automatic Controls,"Modeling, characteristics, performance, and stability of feedback control systems including Nyquist stability. Design and analysis of feedback control systems using root locus and frequency response methods. Bode plots, PID controllers, and lead-lag compensators. Laboratory demonstrates the practical application of theoretical concepts. Components: Laboratory, Class Prereqs/Coreqs: P: ""C-"" or better in ( GENENG 2930 or ELECTENG 2210 ) and ( MECHENG 3030 or ENGRPHYS 3240 ). Typically Offered: Fall - Spring",STEM,graduate,False,False,False,False,False,True
uwplatt,2026,2026-2027,MECHENG,4440,Failure of Materials,"Various failure modes including fatigue and fracture of materials are covered. Included are stress-life and strain-life analysis, fracture mechanics, stress concentration influences and variable amplitude loading. Exposure to design using commercially available software gives the students experience designing realistic components subjected to variable fluctuating load histories. Mechanical testing principles and principles for recognition of fatigue failure from fracture surfaces are also introduced in the course. Components: Discussion, Laboratory, Class Prereqs/Coreqs: P: ""C-"" or better in MECHENG 3040 and MECHENG 3330 . Typically Offered: Occasionally",STEM,graduate,False,False,False,False,False,True
uwplatt,2026,2026-2027,MECHENG,4450,Composite Materials,"Introduction to composite materials and structures used in engineering applications. Topics may include the properties and microstructure of high-strength fiber and matrix materials, specific strength and stiffness of high-performance composites, rule of mixtures, stress and strain transformations, elastic properties of orthotropic plies, laminate theory, failure criteria, design of composite structures and components, and/or the effects of temperature and moisture on composite material performance. Composites studied may move beyond the traditional composites and include topics on nano-, bio-, and/or smart composites as well as recent developments in engineered composite materials. Components: Class Prereqs/Coreqs: P: ""C-"" or better in MECHENG 3330 Typically Offered: Every third semester",STEM,graduate,False,False,False,False,False,True
uwplatt,2026,2026-2027,MECHENG,4550,Heat Transfer Applications,"Review of conduction, convection, and radiation heat transfer.  Extension to variable properties and more complex geometries.  Current heat transfer problems and applications such as electronic cooling, heat pipes, capillary pumped loops, and cryogenic heat transfer.  Survey of currently used correlations and numerical techniques.  Application of current state-of-the-art to design problems. Components: Class Prereqs/Coreqs: P: ""C-"" or better in MECHENG 3640 . Typically Offered: Occasionally",STEM,graduate,False,False,False,False,False,True
uwplatt,2026,2026-2027,MECHENG,4560,Computational Fluid Dynamics,"Introduction to computational fluid dynamics (CFD) with emphasis on using a commercial software package. Concepts of consistency, stability, convergence, scheme order, and turbulence modeling from the practitioner's viewpoint are covered. Simulations of steady and unsteady flows, compressible and incompressible flows, forced and natural convection heat transfer, and internal and external flows are performed. The students will learn to interpret CFD results and validation techniques. Components: Laboratory, Class Prereqs/Coreqs: P: ""C-"" or better in MECHENG 3300 , ( MECHENG 3430 or COMPUTER 1430 ), and MATH 3630 . Typically Offered: Occasionally",STEM,graduate,False,False,False,False,False,True
uwplatt,2026,2026-2027,MECHENG,4600,Energy Systems Design,"Design and analysis of energy generation, conversion, and storage systems with emphasis on renewable energy such as solar, wind, biomass, geothermal and hydroelectric. Solar energy emphases may include electrical power generation, flat plate and concentrating collectors, and/or control systems. Wind energy emphases may include generation, storage and/or grid-connection. Biomass emphases may include primary sources, conversion and upgrading, and/or distribution. Components: Class Prereqs/Coreqs: P or C: MECHENG 3640 Typically Offered: Occasionally",STEM,graduate,False,False,False,True,False,True
uwplatt,2026,2026-2027,MECHENG,4630,Internal Combustion Engine Design,"Design of internal combustion engines for various applications. Gasoline engines, diesel engines, 4 stroke cycles and 2 stroke cycles. Components: Class Prereqs/Coreqs: P: ""C-"" or better in MECHENG 3640 . Typically Offered: Occasionally",STEM,graduate,False,False,False,False,False,True
uwplatt,2026,2026-2027,MECHENG,4650,HVAC Design for Buildings,"The theory and design of heating, air conditioning, and heat pump systems are central to this field of study. It includes an exploration of the fundamental principles and applications of psychometrics, which involves the study of the properties of air and its moisture content. The course also covers occupant thermal comfort, ensuring environments are maintained at optimal temperatures for human well-being. Additionally, the importance of ventilation for safety and health is emphasized, alongside strategies for improving energy efficiency in HVAC systems. Relevant industry standards and regulations are also discussed to ensure systems meet necessary performance and safety criteria. Components: Class Prereqs/Coreqs: P: ""C-"" or better in MECHENG 3640 Typically Offered: Occasionally",STEM,graduate,False,False,False,False,False,True
uwplatt,2026,2026-2027,MECHENG,4720,Thermal Systems Laboratory,"Instrumentation and measurement techniques in thermal systems; verification of basic principles; laboratory tests on  components of thermal systems; experimental approach for solving engineering problems; application of computer to data acquisition and data processing. Components: Laboratory Prereqs/Coreqs: P:  ""C-"" or better in MECHENG 3300 and MECHENG 3640 .  Must be in a degree granting program; C: MECHENG 3720 Typically Offered: Fall - Spring",STEM,graduate,False,False,False,False,False,True
uwplatt,2026,2026-2027,MECHENG,4730,Thermo-Fluid Systems Design,"A course treating the concepts of Thermodynamics, Fluid Mechanics, Heat Transfer, and mechanics in a unified presentation.  Particular emphasis will be directed towards applications to actual physical systems including the gas power cycles, refrigeration cycles, heat exchangers, ideal gas mixtures, psychrometrics and 1st law combustion.  Some design of devices involved in these applications will also be included. Components: Discussion, Laboratory, Class Prereqs/Coreqs: P: ""C-"" or better in MECHENG 3300 and MECHENG 3640 .  Must be in a degree granting program. Typically Offered: Fall - Spring",STEM,graduate,False,False,False,False,False,True
uwplatt,2026,2026-2027,MECHENG,4740,Advanced Machine Element Design,"Advanced topics in the design of machines and mechanical systems. Topics may include threaded fasteners, welded joints, journal bearings, helical, bevel, and worm gears, clutches, brakes, belts, flywheels, gyroscopes, governors, and/or dynamic force analysis. Additionally, topics such as optimization, geometric design, tolerancing, reliability, economics, and sensitivity analysis will be discussed in machine element design. The course will include at least one project culminating in a final working prototype. Components: Class Prereqs/Coreqs: P: ""C-"" or better in MECHENG 3330 . Typically Offered: Occasionally",STEM,graduate,False,False,False,False,False,True
uwplatt,2026,2026-2027,MECHENG,4750,Computational Methods in Engineering,"Use of digital computers to solve equations encountered in mechanical engineering problems. Numerical integration and differentiation, solution of linear and nonlinear equations, ordinary and partial differential equations (finite element and finite difference methods), systems of equations (matrix equations). Programming using Python. How to choose the proper numerical method, and pitfalls that lead to bad solutions. Components: Class Prereqs/Coreqs: P: ""C-"" or better in MATH 3630 and [( MECHENG 3430 ) or ( COMPUTER 1430 and ENGRPHYS 3240 )]. Typically Offered: Occasionally",STEM,graduate,False,False,False,False,False,True
uwplatt,2026,2026-2027,MECHENG,4800,Finite Element Method,"Introduction to the finite element method.  Emphasis on truss, beam and frame analysis, plane stress, plane strain, axisymmetric and three-dimensional stress analysis.  Dynamic analysis and field problems, such as heat transfer.  Readily available finite element computer programs utilized to solve stress analysis, heat transfer and other engineering related problems. Components: Discussion, Laboratory, Class Prereqs/Coreqs: P: ""C-"" or better in MATH 3630 , MECHENG 3330 , and ( MECHENG 3430 or COMPUTER 1430 ). Typically Offered: Occasionally",STEM,graduate,False,False,False,False,False,True
uwplatt,2026,2026-2027,MECHENG,4820,Advanced Manufacturing Processes,"The course covers non-traditional manufacturing processes.  Additive manufacturing for polymers, metals, ceramics and composite materials. Laser material processes such as laser welding, forming and surface modification. Friction stir welding, electro-chemical machining, and electric discharge machining and wire cutting. Components: Class Prereqs/Coreqs: P: ""C-"" or better in MECHENG 3230 . Typically Offered: Occasionally",STEM,graduate,False,False,False,False,False,True
uwplatt,2026,2026-2027,MECHENG,4830,Mechatronics,"Study of electro-mechanical systems and their interfaces.  Programming of microcontrollers, fractional-horsepower motors, sensors, programmable logic controllers (PLC's), and control electronics.  Binary number systems and logic are introduced.  Application of control theory.  Project. Components: Laboratory, Class Prereqs/Coreqs: C: MECHENG 4330 Typically Offered: Occasionally",STEM,graduate,False,False,False,False,False,True
uwplatt,2026,2026-2027,MECHENG,4840,Advanced Vibrations,"Modeling and analysis of single and multiple-degree of freedom systems. Free and forced vibrations. Vibrations applications such as rotating balancing, whirling, vibration instruments, vibration isolation, and suspension. Computer applications involving matrices, eigenvalues, eigenvectors, and differential equations. Design of mechanical systems involving vibrations. Vibration suppression design. Vibration of continuous systems. Components: Laboratory, Discussion, Class Prereqs/Coreqs: P: ""C-"" or better in MECHENG 3030 , or ENGRPHYS 3240 and ELECTENG 3220 . Typically Offered: Occasionally",STEM,graduate,False,False,False,False,False,True
uwplatt,2026,2026-2027,MECHENG,4850,Computer-Aided Engineering,"Use of current tools in the design, simulation, optimization, representation and manufacture of mechanical systems. Solid modeling and computer assembly of mechanical systems and top down assembly. Presentations by industry experts in technologies enabled by 3D CAD including additive manufacturing, tool path generation, computational fluid dynamics, finite element analysis, virtual reality, and rendering. Components: Laboratory, Class Prereqs/Coreqs: P: ""C-"" or better in MECHENG 3830 . Typically Offered: Occasionally",STEM,graduate,False,False,False,False,False,True
uwplatt,2026,2026-2027,MECHENG,4930,Senior Design Project,"Team based projects, primarily from industry.  Rigorous application of design processes and methods.  Consideration of real-life technical, economic, social, aesthetic, environmental and other constraints.  Consideration of several related topics such as creativity, analysis, synthesis, project management, scheduling, time management, engineering ethics, communication, personality types, product safety and liability, copyrights and patents, design for manufacture, economics, and robust engineering.  Integration of technical and management knowledge in an open-ended design environment.  Oral and written reports.  Open to graduating seniors only. Components: Discussion, Laboratory, Class Prereqs/Coreqs: P:  ""C-"" or better in MECHENG 3230 , MECHENG 3330 , MECHENG 3830 , BME 3030 (BME emphasis students only), and either MECHENG 3720 or BME 3230 .  Must be in a degree granting program; C: MECHENG 4330 , MECHENG 4720 , and MECHENG 4730 Typically Offered: Fall - Spring",STEM,graduate,False,False,False,False,False,True
uwplatt,2026,2026-2027,MECHENG,4940,Undergraduate Research,"Introduction to research methods in mechanical engineering, literature review, data analysis, and design. A written report will be submitted to the sponsoring faculty member. A student may register for two to three credits in a given semester for a maximum of three credits. Components: Research Prereqs/Coreqs: P: Junior standing and permission of department chair Typically Offered: Fall - Spring",STEM,graduate,False,False,False,False,False,True
uwplatt,2026,2026-2027,MECHENG,4980,Current Topics in Engineering,"In-depth study of a current topic of interest to the engineering profession. The topic to be covered will be identified in the course title. Components: Laboratory, Discussion, Class Typically Offered: Fall - Spring",STEM,graduate,False,False,False,False,False,True
uwplatt,2026,2026-2027,MECHENG,4990,Independent Study,Advanced study in the area of specialization. Components: Independent Study Prereqs/Coreqs: P:  senior standing and consent of department chair Typically Offered: Fall - Spring - Summer,STEM,graduate,False,False,False,False,False,True
uwplatt,2026,2026-2027,PHLSPHY,1130,Introduction to Philosophy,"An introduction to basic philosophical questions through a consideration of different types of philosophy as developed by some of history's most influential thinkers and as related to various aspects of human life. Components: Class GE: HA Humanities & Arts, HA-H Humanities Typically Offered: Fall - Spring",Other,graduate,False,False,False,False,False,True
uwplatt,2026,2026-2027,PHLSPHY,2050,"Philosophy of Love, Sex and Friendship","A philosophical examination of personal relationships and interactions such as family, friendship, sex, and romance, with an eye toward their relevance to the individual life and the pursuit of happiness, as well as society as a whole and the manner in which it is and ought to be structured around such relationships. Components: Class GE: HA Humanities & Arts, HA-H Humanities Typically Offered: Based on Student Demand",Other,graduate,False,False,False,False,False,True
uwplatt,2026,2026-2027,PHLSPHY,2100,Thinking Critically,"An introduction to critical thinking, with an emphasis on its importance to human life (e.g., education, employment, morality, politics, religion). The primary focus of the class is the practical application of critical thinking by way of competence in key reasoning methods, typically including the construction and analysis of informal arguments, the identification of fallacies, basic inductive logic, statistical reasoning, etc. Components: Class GE: HA Humanities & Arts, HA-H Humanities Typically Offered: Based on Student Demand",Other,graduate,False,False,False,False,False,True
uwplatt,2026,2026-2027,PHLSPHY,2530,Ethics,"The major types of theories of right and wrong that underlie moral evaluations. Components: Class GE: HA Humanities & Arts, HA-H Humanities Typically Offered: Fall",Other,graduate,False,False,False,False,False,True
uwplatt,2026,2026-2027,PHLSPHY,2550,Business Ethics,"This course explores ethical questions in business from the perspectives of employers, employees, and consumers, according to the methods of philosophy and grounded in philosophical ethical theories.  Students will be introduced to the basics of Kantian ethics, utilitarianism, and virtue ethics and will then apply these theories to various issues in business ethics. Components: Class GE: HA Humanities & Arts, HA-H Humanities Prereqs/Coreqs: P: sophomore standing or instructor consent. Typically Offered: Fall - Spring",Other,graduate,False,True,False,False,False,True
uwplatt,2026,2026-2027,PHLSPHY,2630,Logic,"An introductory study of the structure of reasoning and argumentation with practical applications in the socio-political sphere, science and philosophy. Components: Class Typically Offered: Spring",Other,graduate,False,False,False,False,False,True
uwplatt,2026,2026-2027,PHLSPHY,2930,Major Traditions in Eastern Religions,"An introductory study of Hinduism, Buddhism, Zoroastrianism, Islam, Confucianism, Taoism, Shinto and Zen, with outlines of their histories, developments of their doctrines and consideration of their contribution to the religious thought of the world. Components: Class GE: HA Humanities & Arts, HA-H Humanities Typically Offered: Fall - even year",Other,graduate,False,False,False,False,False,True
uwplatt,2026,2026-2027,PHLSPHY,2940,Special Topics in Philosophy,"A critical examination of a major theme, movement, period, philosopher, or philosophical issue.  This course is designed for students from any field or major, and does not presuppose an advanced stage of the study of philosophy. Components: Class Typically Offered: Occasionally",Other,graduate,False,False,False,False,False,True
uwplatt,2026,2026-2027,PHLSPHY,3030,Ancient and Medieval Philosophy,"Representative thinkers and the development of different traditions in Western philosophy from the pre-Socratics to the Renaissance. Components: Class GE: HA Humanities & Arts, HA-H Humanities Prereqs/Coreqs: P: Sophomore standing or consent by instructor. Typically Offered: Fall",Other,graduate,False,True,False,False,False,True
uwplatt,2026,2026-2027,PHLSPHY,3040,Modern Philosophy,"The principal thinkers and movements of Western philosophy from the Renaissance into the 20th century. Components: Class GE: HA Humanities & Arts, HA-H Humanities Prereqs/Coreqs: P: Sophomore standing or consent by instructor Typically Offered: Spring",Other,graduate,False,True,False,False,False,True
uwplatt,2026,2026-2027,PHLSPHY,3140,Philosophy of Sport,"An examination of philosophical questions raised by sports and games, with particular emphasis on the ethical issues that arise in professional and amateur sports. Components: Class GE: HA Humanities & Arts, HA-H Humanities Prereqs/Coreqs: P: Sophomore standing or consent of instructor Typically Offered: Fall - odd year",Other,graduate,False,False,False,False,False,True
uwplatt,2026,2026-2027,PHLSPHY,3230,Philosophy of Religion,"An examination of major topics in the philosophy of religion, including: the relationship of faith and reason, science and religion, arguments for the existence and attributes of God, the problem of evil, life after death, and religious diversity. Components: Class GE: HA Humanities & Arts, HA-H Humanities Prereqs/Coreqs: P:  sophomore standing or consent of instructor Typically Offered: Fall - odd year",Other,graduate,True,False,False,False,False,True
uwplatt,2026,2026-2027,PHLSPHY,3440,Environmental Ethics,"A philosophical examination of both traditional and recent concepts and values which structure human attitudes towards the natural environment, set in a global context, sensitive to cultural analysis and several national perspectives. Theories may include anthropocentrism, biocentrism, ecocentrism, Leopold's land ethic, deep ecology, social ecology, and ecofeminism. Topics, studied via an international lens, may include the ethics of using land for large-scale agricultural purposes, concentrated animal-feeding operations (CAFOs), fishing, ocean acidification, deforestation, species depletion, ozone depletion, fracking, and climate change. Components: Class GE: HA Humanities & Arts, HA-H Humanities Prereqs/Coreqs: P: Sophomore standing or consent by instructor Typically Offered: Based on Student Demand",Other,graduate,True,False,True,True,False,True
uwplatt,2026,2026-2027,PHLSPHY,3480,Biomedical Ethics,"Study of ethical issues pertaining to medicine and related biological sciences. Issues covered usually include abortion, euthanasia, truth telling, confidentiality, experimentation on human subjects, behavior modification, genetic engineering, criteria of death, organ transplants, professional relationships, and professional duties. Components: Class GE: HA Humanities & Arts, HA-H Humanities Prereqs/Coreqs: P: Sophomore standing or consent by instructor Typically Offered: Based on Student Demand",Other,graduate,False,False,False,False,False,True
uwplatt,2026,2026-2027,PHLSPHY,3530,Philosophy of Gender and Sexuality,"A philosophical examination of questions about gender and sexuality, such as: How do philosophers explain gender and sexuality? How do gender and sexuality influence one's reality, knowledge, experience autonomy, choices, and prospects for achieving a good, just, and meaningful life? How do new fields in philosophy (e.g. feminist epistemology, feminist ethics, etc.) open up new possibilities for gender and sexuality? Components: Class Cross Offering: WOMGENDR 3530 GE: HA Humanities & Arts, HA-H Humanities Prereqs/Coreqs: P:  three credits in philosophy or WOMGENDR 1130 or consent of instructor Typically Offered: Spring - even year",Other,graduate,True,False,False,False,False,True
uwplatt,2026,2026-2027,PHLSPHY,3540,"Science, Technology, and Ethics","This course explores the epistemological, ontological, and ethical questions raised by science and technology.  Among the topics addressed are:  various views of science and the different metaphysical views which are behind them, various views of nature and human nature, and the different kinds of ethics that result from these competing epistemologies and ontologies. Components: Class GE: HA Humanities & Arts, HA-H Humanities Prereqs/Coreqs: P: Sophomore standing or consent of instructor Typically Offered: Fall - Spring",Other,graduate,False,False,False,False,False,True
uwplatt,2026,2026-2027,PHLSPHY,3630,Philosophy of Law,"A critical study of major concepts of law with particular emphasis on how the various notions of law are governed by fundamental views concerning the nature of reality and the individual person. Components: Class GE: HA Humanities & Arts, HA-H Humanities Prereqs/Coreqs: P:  three credits in philosophy, CRIMLJUS 1130 or consent of instructor Typically Offered: Fall - even year",Other,graduate,False,False,False,False,False,True
uwplatt,2026,2026-2027,PHLSPHY,3840,Existentialism,"Examination of the various types of Existentialism and the major philosophical Existentialists, such as Kierkegaard, Nietzsche, Heidegger, Merleau-Ponty, Sartre, de Beauvoir, Jaspers, and Marcel. Components: Class GE: HA Humanities & Arts, HA-H Humanities Prereqs/Coreqs: P: Three credits in philosophy or consent of the instructor Typically Offered: Occasionally",Other,graduate,False,False,False,False,False,True
