university,academic_year,academic_year_label,department_code,course_number,title,description,broad_area,level,progressive_signal,western_canon_signal,climate_narrow_signal,climate_broad_signal,cross_listed,deduplicated
coloradomesa,2026,2026-2027,AGRS,100,Practical Crop Production,"Production and adaptation of cultivated crops. Emphasis on crops grown in the western region of the United States. Growth, development, production, and use covered.",Other,undergraduate,False,False,False,False,False,True
coloradomesa,2026,2026-2027,AGRS,100L,Practical Crop Production Laboratory,"Production and adaptation of cultivated crops. Emphasis on crops grown in the western region of the United States. Growth, development, production, and use covered.",Other,undergraduate,False,False,False,False,False,True
coloradomesa,2026,2026-2027,AGRS,102,Agriculture Economics,"Focus on economic principles applied to agriculture through price discovery with producer supply and consumer demand, governmental politics, rural development, and resource management.",Other,undergraduate,False,False,False,False,False,True
coloradomesa,2026,2026-2027,AGRS,105,Animal Science,"Fundamentals of livestock production.  Principles of breeding, genetics, nutrition, health, and physiology of beef, sheep, swine, dairy, and horses.  Focus on the animal science industry in general and each species industry in regard to history, current situation, and future.",Other,undergraduate,False,False,False,False,False,True
coloradomesa,2026,2026-2027,AGRS,108,Making Compost,Exploration of the microbiology behind composting and procedures for various types of composting. Evaluation of quality compost and its applications (including compost tea making) for soil health and plant fertility needs. Also included is making compost inoculants and fermenting plant juices for sustainable fertility applications.,Other,undergraduate,False,False,False,True,False,True
coloradomesa,2026,2026-2027,AGRS,110,Integrated Pest Management,"Identification and control of economically important insects and diseases. Use of ecological systems management approach and concepts, including physical, biological and pesticidal control mechanisms.",Other,undergraduate,False,False,False,True,False,True
coloradomesa,2026,2026-2027,AGRS,118,Farm Structures and Green Houses,"Safety, hand and power tool use, farm building planning and site location, concrete, farm building design and construction, and materials of construction.  Greenhouse design, systems, management, and major greenhouse crops and their cultural needs.",Other,undergraduate,False,False,False,False,False,True
coloradomesa,2026,2026-2027,AGRS,125,Agricultural Machinery and Technology,"Emphasizes the safe operation, construction, purpose, maintenance, and adjustment of farm machinery.",Other,undergraduate,False,False,False,False,False,True
coloradomesa,2026,2026-2027,AGRS,131,Water and Irrigation: Principles and Practices,"Exploration of water, soil, and plant relationships; water quality assessment; principles of irrigation, methods, and systems.",Other,undergraduate,False,False,False,False,False,True
coloradomesa,2026,2026-2027,AGRS,131L,Water and Irrigation: Principles and Practices Laboratory,"Exploration of water, soil, and plant relationships; water quality assessment; principles of irrigation, methods, and systems.",Other,undergraduate,False,False,False,False,False,True
coloradomesa,2026,2026-2027,AGRS,195,Independent Study,,Other,undergraduate,False,False,False,False,False,True
coloradomesa,2026,2026-2027,AGRS,196,Topics,,Other,undergraduate,False,False,False,False,False,True
coloradomesa,2026,2026-2027,AGRS,205,Farm and Ranch Management,"Practical experience in applying principles of economics, business, marketing, and finance to the management of a farm/ranch operation.",Other,undergraduate,False,False,False,False,False,True
coloradomesa,2026,2026-2027,AGRS,208,Agricultural Finance,"Principles of finance and their application to agriculture and agribusiness, including: the time value of money, net present value analysis, interest, credit lending institutions, financial statements, and financial ratios.",Other,undergraduate,False,False,False,False,False,True
coloradomesa,2026,2026-2027,AGRS,210,Agricultural Marketing,Applied study of the agricultural marketing system.  Methods of marketing crops and livestock.  Hedging with futures and options will be covered along with direct sales marketing and building a business brand.,Other,undergraduate,False,False,False,False,False,True
coloradomesa,2026,2026-2027,AGRS,224,Integrated Ranch Management,"Management pertaining to the economics of a ranching enterprise.  Includes principles of system management, resource inventory and management, ranch decision making, nutrition, selection, record keeping, financial management, and marketing.",Other,undergraduate,False,False,False,False,False,True
coloradomesa,2026,2026-2027,AGRS,225,Feeds and Feeding,"Basic nutrients, common feeds and feed additives, anatomy of digestive systems, and basic feeding practices for beef, sheep, and dairy.  Lab devoted to calculating and balancing rations to fulfill nutrient requirement of farm animals for growth, finishing, reproduction, lactation, work, and wool production.  Explores least cost ratio balancing.",Other,undergraduate,False,False,False,False,False,True
coloradomesa,2026,2026-2027,AGRS,230,Farm Animal Anatomy and Physiology,"Introduction to basic concepts of farm animal anatomy and physiology. Emphasizes nutrition, reproduction, immunology, and growth of the basic farm species. Anatomy and physiology is taught in the context of applying basic principles to production practices in the industry, including reproductive management, livestock nutrition management, and animal health practices.",Other,undergraduate,False,False,False,False,False,True
coloradomesa,2026,2026-2027,AGRS,240,Introduction to Soil Science,"Formation, physical properties, chemical properties, and management of soils, emphasizing conditions affecting plant growth. Defining the components of soil health and how to manage them.",Other,undergraduate,False,False,False,False,False,True
coloradomesa,2026,2026-2027,AGRS,240L,Introduction to Soil Science Laboratory,"Formation, physical properties, chemical properties, and management of soils, emphasizing conditions affecting plant growth. Defining the components of soil health and how to manage them.",Other,undergraduate,False,False,False,False,False,True
coloradomesa,2026,2026-2027,AGRS,250,Live Animal and Carcass Evaluation,"Exploration of meat carcass evaluation and the related yield and quality grading system. Emphasizes selection of breeding stock based on performance data. Covers comparative selection, grading, and judging of market and breeding classes of livestock based on knowledge of phenotype, performance, information, and/or carcass merit.",Other,undergraduate,False,False,False,False,False,True
coloradomesa,2026,2026-2027,AGRS,250L,Live Animal and Carcass Evaluation Laboratory,"Exploration of meat carcass evaluation and the related yield and quality grading system. Emphasizes selection of breeding stock based on performance data. Covers comparative selection, grading, and judging of market and breeding classes of livestock based on knowledge of phenotype, performance, information, and/or carcass merit.",Other,undergraduate,False,False,False,False,False,True
coloradomesa,2026,2026-2027,AGRS,260,Plant Propagation,"Theory, biology, and practical applications of plant propagation technologies. Propagation by seed, cuttings, budding, grafting, and layering. Propagation environment, techniques of stock plant management, and seed handling along with production calculations and a complete production calendar will be investigated.",Other,undergraduate,False,False,False,False,False,True
coloradomesa,2026,2026-2027,AGRS,265,Integrated Plant Health Management,"Multi-faceted approaches to the management of plant health through analysis of soil characteristics, nutrients, irrigation, and integrated pest management techniques for reducing pest susceptibility and enhancing crop production yield and quality.",Other,undergraduate,False,False,False,False,False,True
coloradomesa,2026,2026-2027,AGRS,288,Livestock Practicum,"Experiential learning with beef cattle, dairy cattle, swine, and sheep.",Other,undergraduate,False,False,False,False,False,True
coloradomesa,2026,2026-2027,AGRS,293,Cooperative Experience/Internship,"Employment in an agricultural production setting.  Work experience in all facets of the operation.  Guidance and supervision is the responsibility of the supervising employer and Coordinator of Production Agriculture.  Emphasis on records, managerial decisions, and production agriculture skills.",Other,undergraduate,False,False,False,False,False,True
coloradomesa,2026,2026-2027,AGRS,295,Independent Study,,Other,undergraduate,False,False,False,False,False,True
coloradomesa,2026,2026-2027,AGRS,296,Topics:,,Other,undergraduate,False,False,False,False,False,True
coloradomesa,2026,2026-2027,ACCT,201,Principles of Financial Accounting,"Introduction to bookkeeping, generally accepted accounting principles, and financial statements.",Professional,undergraduate,False,False,False,False,False,True
coloradomesa,2026,2026-2027,ACCT,202,Principles of Managerial Accounting,"Introduction to the use of accounting information in managerial decision making, control, and planning.",Professional,undergraduate,False,False,False,False,False,True
coloradomesa,2026,2026-2027,ACCT,311,Advanced Managerial Accounting,"An advanced course primarily for non-accounting majors that provides in-depth coverage on the applications of accounting information in decision-making, organization, control and planning.",Professional,undergraduate,False,False,False,False,False,True
coloradomesa,2026,2026-2027,ACCT,321,Intermediate Accounting I,Development of an intermediate understanding of Generally Accepted Accounting Principles and their application to external financial statements.,Professional,undergraduate,False,False,False,False,False,True
coloradomesa,2026,2026-2027,ACCT,322,Intermediate Accounting II,Continued exploration of Generally Accepted Accounting Principles and their application to more advanced financial statement components.,Professional,undergraduate,False,False,False,False,False,True
coloradomesa,2026,2026-2027,ACCT,331,Cost Accounting,"Costs and their relationship to planning, controlling, inventory valuation, and decision making.",Professional,undergraduate,False,False,False,False,False,True
coloradomesa,2026,2026-2027,ACCT,350,Ethics for Accounting Professionals,"The field of ethics as applied to the accounting and finance professions.  Ethical standards of the profession, accounting and finance scandals in recent history, and methods to overcome ethical dilemmas encountered as professionals.",Professional,undergraduate,False,False,False,False,False,True
coloradomesa,2026,2026-2027,ACCT,360,Professional Preparation I,"Communication skills and other soft skills needed to be successful as an accounting professional, including higher order thinking, written and oral communication, effective and responsible use of social and other electronic media, and ethical considerations of the communication process.",Professional,undergraduate,False,False,False,False,False,True
coloradomesa,2026,2026-2027,ACCT,392,Accounting Information Systems,"A study of the concepts and design of the Accounting Information System with emphasis on the internal control structures, requirements, and professional standards.",Professional,undergraduate,False,False,False,False,False,True
coloradomesa,2026,2026-2027,ACCT,393,Cooperative Education,"Cooperative Education provides students an opportunity to put their education to practical use in the workplace under the joint supervision of an employer participating in the Cooperative Education program and a faculty member designated by the institution. (See ""Cooperative Education"" in this
catalog).",Professional,undergraduate,False,False,False,False,False,True
coloradomesa,2026,2026-2027,ACCT,395,Independent Study,,Professional,undergraduate,False,False,False,False,False,True
coloradomesa,2026,2026-2027,ACCT,396,Topics,,Professional,undergraduate,False,False,False,False,False,True
coloradomesa,2026,2026-2027,ACCT,399,Internship,,Professional,undergraduate,False,False,False,False,False,True
coloradomesa,2026,2026-2027,ACCT,401,Governmental & Nonprofit Accounting,Accounting principles as they apply to governmental and not-for-profit entities.,Professional,undergraduate,False,False,False,False,False,True
coloradomesa,2026,2026-2027,ACCT,402,Advanced Accounting,"Consolidated financial statements, partnership accounting, bankruptcy, and international operations.",Professional,undergraduate,False,False,False,False,False,True
coloradomesa,2026,2026-2027,ACCT,411,Auditing I,"Scope and purposes of the attestation work of a certified public accountant focusing on generally accepted auditing standards (GAAS).  Includes theory of auditing, professional ethics, legal liability of the auditor, and internal control.",Professional,undergraduate,False,False,False,False,False,True
coloradomesa,2026,2026-2027,ACCT,412,Auditing II,"Continuation of ACCT 411 . This course provides coverage of the application of auditing theory to financial statements, including examination of the audit programs, procedures, and work papers used in each phase of an audit.",Professional,undergraduate,False,False,False,False,False,True
coloradomesa,2026,2026-2027,ACCT,441,Individual Income Tax,In-depth treatment of federal income tax law as it relates to individual taxpayers.  Introduction to basic tax research.,Professional,undergraduate,False,False,False,False,False,True
coloradomesa,2026,2026-2027,ACCT,442,Advanced Tax and Tax Research,"Federal income tax law for C corporations, S corporations, and partnerships. Introduction to federal gift transfer tax. Required participation in the Volunteer Income Tax Assistance Program to acquire practical experience in communication with taxpayers and preparation of tax returns.",Professional,undergraduate,False,False,False,False,False,True
coloradomesa,2026,2026-2027,ACCT,460,Professional Preparation II,This course is a concentrated review of accounting subjects in preparation for the CPA exam using self-study techniques and professor-led discussions and review.,Professional,undergraduate,False,False,False,False,False,True
coloradomesa,2026,2026-2027,ACCT,470,Fraud and Forensic Accounting,"Exploration of investigative techniques, interviewing techniques, and reporting processes at different levels of judicial and prosecutorial environments.  Specific skills in detecting and investigating fraud developed and various reporting methodologies explored.  Includes presentations and speakers from fraud investigative environments.",Professional,undergraduate,False,False,False,False,False,True
coloradomesa,2026,2026-2027,ACCT,471,Data Analytics for Accounting,"Study of the use of big data and analytics for accounting, including its history and current trends.  Application of data analysis techniques to transform raw data into useful decision-making information and communicate those results in a meaningful way for stakeholders.",Professional,undergraduate,False,False,False,False,False,True
coloradomesa,2026,2026-2027,ACCT,473,Fraud Legalities,"Study of both civil and criminal systems, procedures, and laws, as well as related areas that pertain to criminal financial activity and fraud.",Professional,undergraduate,False,False,False,False,False,True
coloradomesa,2026,2026-2027,ACCT,475,Fraud Examination,"Study of financial transactions and schemes, law, and investigations, as well as fraud prevention and deterrence in preparation for the Certified Fraud Examination (CFE) administered through the Association of Certified Fraud Examiners.",Professional,undergraduate,False,False,False,False,False,True
coloradomesa,2026,2026-2027,ACCT,480,Accounting Externship,"Practical, staff-level experience creating accounting work products for an employer. Further development of skills learned in completed accounting baccalaureate coursework.",Professional,undergraduate,False,False,False,False,False,True
coloradomesa,2026,2026-2027,ACCT,493,Cooperative Education,See description of ACCT 393 .,Professional,undergraduate,False,False,False,False,False,True
coloradomesa,2026,2026-2027,ACCT,495,Independent Study,,Professional,undergraduate,False,False,False,False,False,True
coloradomesa,2026,2026-2027,ACCT,496,Topics,,Professional,undergraduate,False,False,False,False,False,True
coloradomesa,2026,2026-2027,ACCT,499,Internship,,Professional,undergraduate,False,False,False,False,False,True
coloradomesa,2026,2026-2027,ACCT,500,Managerial Accounting,"Provides students with an understanding of management information systems which are used in the decision-making process. The class is designed with a ""hands-on"" approach.  It will encourage student participation and interaction through the use of computer projects, case studies, and classroom discussion. Topics covered include basic cost accounting concepts and terminology, product costing and pricing, planning and controlling a business operation through budgets and variance analysis, and managerial decision-making using such techniques as cost-volume-profit analysis and variable costing.",Professional,graduate,False,False,False,False,False,True
coloradomesa,2026,2026-2027,ACCT,505,Advanced Fraud and Forensic Accounting,"Exploration of investigative techniques, interviewing techniques, and reporting processes at different levels of judicial and prosecutorial environments. Specific skills in detecting and investigating fraud are developed, and various reporting methodologies are explored. Includes presentations and speakers from fraud investigative environments.",Professional,graduate,False,False,False,False,False,True
coloradomesa,2026,2026-2027,ADAP,301,Foundations of Addictions Counseling,"Provides a foundation for the theoretical, practical, and applied addictions counseling skills necessary for individuals wanting to work in the addictions field.",Other,undergraduate,False,False,False,False,False,True
coloradomesa,2026,2026-2027,ADAP,350,Cultural and Ethical Issues in Addictions Treatment,"Provides an overview of ethical, cultural, and legal considerations associated with the field of addictions.",Other,undergraduate,False,False,False,False,False,True
coloradomesa,2026,2026-2027,ADAP,380,Pharmacology and Addictions,Provides an overview of pharmacology and infectious diseases associated with the field of addictions.,Other,undergraduate,False,False,False,False,False,True
coloradomesa,2026,2026-2027,ADAP,401,Special Populations and Addictions,Outlines the unique treatment needs of special addiction populations and the promising new practices within the addictions field.,Other,undergraduate,False,False,False,False,False,True
coloradomesa,2026,2026-2027,ADAP,420,Addiction Counseling Approaches,Outlines the different evidence-based treatment approaches in the addictions field.,Other,undergraduate,False,False,False,False,False,True
coloradomesa,2026,2026-2027,ADAP,450,Addictions Assessment and Group Counseling,"Exploration of the approaches to addictions clinical assessment, treatment planning and group counseling skills as outlined by the Colorado Office of Behavioral Health. Meets the educational requirements for becoming a Certified Addictions Counselor Level II.",Other,undergraduate,False,False,False,False,False,True
coloradomesa,2026,2026-2027,ADAP,460,Advanced Addictions Practice,Exploration of the clinical addictions practices and advanced motivational interviewing as outlined by the Colorado Office of Behavioral Health (OBH). Meets the educational requirements for becoming a Certified Addictions Counselor Level III.,Other,undergraduate,False,False,False,False,False,True
coloradomesa,2026,2026-2027,ADAP,470,Addictions Clinical Supervision,Introduction to the core competencies for addictions supervision. Meets the Certified Addictions Counselor Level three (CAC III) requirements as outlined by the Colorado Office of Behavioral Health (OBH) for Clinical Supervision I and II.,Other,undergraduate,False,False,False,False,False,True
coloradomesa,2026,2026-2027,ADAP,499,Internship,"Professional practice with individuals, groups, and communities in various sites under professional supervision.",Other,undergraduate,False,False,False,False,False,True
coloradomesa,2026,2026-2027,ARKE,395,Independent Study,,Humanities,undergraduate,False,False,False,False,False,True
coloradomesa,2026,2026-2027,ARKE,396,Topics:,,Humanities,undergraduate,False,False,False,False,False,True
coloradomesa,2026,2026-2027,ARKE,496,Topics:,,Humanities,undergraduate,False,False,False,False,False,True
coloradomesa,2026,2026-2027,ARKE,499,Internship,,Humanities,undergraduate,False,False,False,False,False,True
coloradomesa,2026,2026-2027,ANTH,196,Topics,,Social Sciences,undergraduate,False,False,False,False,False,True
coloradomesa,2026,2026-2027,ANTH,202,Introduction to Anthropology-GTSS3,"Human nature and behavior from the broad perspective of contemporary anthropology.  Four primary subfields of anthropology, biology, cultural, linguistics, and archaeology discussed to integrate various aspects of the human condition.",Social Sciences,undergraduate,False,False,False,False,False,True
coloradomesa,2026,2026-2027,ANTH,220,Principles of Archaeology-GTSS3,"Investigation of modern archaeology as an interdisciplinary anthropological science. Explores the objectives, methodologies, and ethics of reconstructing prehistoric life. Examples are drawn from around the world.",Social Sciences,undergraduate,False,False,False,False,False,True
coloradomesa,2026,2026-2027,ANTH,222,World Prehistory-GTSS3,"Exploration of human cultural evolution as documented through global archaeology. Topics to be discussed include foraging and early agriculture, the rise of complex states, and the origin of civilization in both the eastern and western hemispheres.",Social Sciences,undergraduate,False,False,False,False,False,True
coloradomesa,2026,2026-2027,ANTH,225,North American Archaeology,"Survey of Pre-Columbian North America, highlighting the cultural evolution of indigenous societies in all North American culture areas. The state-level societies of Mesoamerica are also discussed. Development of archaeological theory and its application to the study of prehistoric sites in North America.",Social Sciences,undergraduate,True,False,False,False,False,True
coloradomesa,2026,2026-2027,ANTH,231,Survey of Biological Anthropology-GTSS3,Exploration of culture through the lens of evolutionary biology. Students will study culture as a changing entity that helps our biological species adapt to multiple physical and social environments. Includes discussion of non-human primates and the application of biological anthropology to forensic science.,Social Sciences,undergraduate,False,False,False,False,False,True
coloradomesa,2026,2026-2027,ANTH,231L,Survey of Biological Anthropology Laboratory-GTSS3,Exploration of culture through the lens of evolutionary biology. Students will study culture as a changing entity that helps our biological species adapt to multiple physical and social environments. Includes discussion of non-human primates and the application of biological anthropology to forensic science.  Lab component for ANTH 231 .,Social Sciences,undergraduate,False,False,False,False,False,True
coloradomesa,2026,2026-2027,ANTH,240,Cultural Anthropology,"Introduction to cultural anthropology and ethnography. Social and political institutions, ritual, gender, culture change, and major theoretical perspectives are explored.",Social Sciences,undergraduate,True,False,False,False,False,True
coloradomesa,2026,2026-2027,ANTH,270,Death and Forensic Science,"Exploration of forensic science, emphasizing medico-legal death investigation. Includes an overview of the sciences in death investigation (pathology, anthropology, entomology, toxicology) and the forensic sciences common in a crime laboratory (pattern evidence, chemistry, biology). Emphasizes professional standards and ethics.",Social Sciences,undergraduate,False,False,False,False,False,True
coloradomesa,2026,2026-2027,ANTH,270L,Death and Forensic Science Laboratory,"Exploration of forensic science, emphasizing medico-legal death investigation. Includes an overview of the sciences in death investigation (pathology, anthropology, entomology, toxicology) and the forensic sciences common in a crime laboratory (pattern evidence, chemistry, biology). Emphasizes professional standards and ethics.",Social Sciences,undergraduate,False,False,False,False,False,True
coloradomesa,2026,2026-2027,ANTH,296,Topics,,Social Sciences,undergraduate,False,False,False,False,False,True
coloradomesa,2026,2026-2027,ANTH,321,Paleoindian Archaeology,Multidisciplinary analysis of the controversies surrounding the colonization of the western hemisphere and the Pleistocene and early Holocene archaeology of North America.,Social Sciences,undergraduate,False,False,False,False,False,True
coloradomesa,2026,2026-2027,ANTH,326,Colorado Archaeology: A Geographical Perspective,"Survey of Colorado prehistory using a geographic perspective, including adjacent portions of the Great Plains, Intermountain West, and Great Basin.  The focus is on regional sequences in their environment settings and major research questions from the Paleoindian to Protohistoric and Historic Euroamerican periods.",Social Sciences,undergraduate,False,False,False,False,False,True
