university,academic_year,academic_year_label,department_code,course_number,title,description,broad_area,level,progressive_signal,western_canon_signal,climate_narrow_signal,climate_broad_signal,cross_listed,deduplicated
coloradomesa,2026,2026-2027,KINA,161,Two-Person Outdoor Volleyball,Exploration of the game of sand volleyball as a lifetime activity. Students build on their basic understanding of volleyball skills and game strategies.,Other,undergraduate,False,False,False,False,False,True
coloradomesa,2026,2026-2027,KINA,162,Volleyball,"Introduction course of the fundamentals of volleyball including passing, serving, setting, and spiking.  Students will learn rules and court strategies involved in the game and be able to demonstrate their skills in game-play.",Other,undergraduate,False,False,False,False,False,True
coloradomesa,2026,2026-2027,KINA,163,Intermediate Volleyball,"Enhancement of basic skills of volleyball learned as a beginner volleyball player. Advanced techniques taught such as, blocking, setting, and hitting. Different strategies of offense and serving will be emphasized.",Other,undergraduate,False,False,False,False,False,True
coloradomesa,2026,2026-2027,KINA,164,Beginning Basketball,Introduction to the fundamental skills of basketball. Acquaints the student with the knowledge and skills necessary to participate in the game of basketball while acquiring the necessary physical fitness to play the sport.,Other,undergraduate,False,False,False,False,False,True
coloradomesa,2026,2026-2027,KINA,165,Intermediate Basketball,Development of basketball skills and knowledge at an intermediate level. This course covers the implementation of set plays and skills through drills and game play.,Other,undergraduate,False,False,False,False,False,True
coloradomesa,2026,2026-2027,KINA,166,Flag Football,"Introduction to the fundamental skills, rules, and strategies of flag football. Students will learn the safety and etiquette of the game.",Other,undergraduate,False,False,False,False,False,True
coloradomesa,2026,2026-2027,KINA,166A,Touch Rugby,Introduction to the basic skills of touch rugby. This course emphasizes ball handling and attacking strategies. Students will learn the rules and the history of the game.,Other,undergraduate,False,False,False,False,False,True
coloradomesa,2026,2026-2027,KINA,167,Tai Chi,"Introduction to the ancient Chinese traditional martial art of Tai Chi as an effective way to reduce stress levels, improve health, and increase the ability to focus. Students will develop a relaxed sequence of moves that emphasize proper alignments and release muscular tension, aiding in preventing and recovering from injuries.",Other,undergraduate,False,False,False,False,False,True
coloradomesa,2026,2026-2027,KINA,168,Introduction to Yoga,"Fundamental poses for the practice of yoga, stress reduction techniques, and strength and flexibility development.",Other,undergraduate,False,False,False,False,False,True
coloradomesa,2026,2026-2027,KINA,169,Hatha Yoga & Relaxation,"Participation in the practice of Hatha yoga, including the integration of mind-body, stress reduction techniques, strength and flexibility enhancement.",Other,undergraduate,False,False,False,False,False,True
coloradomesa,2026,2026-2027,KINA,169A,Flow Yoga,Participation in the practice of Vinyasa yoga with an emphasis on synchronizing breath and movement to enhance strength and focus.,Other,undergraduate,False,False,False,False,False,True
coloradomesa,2026,2026-2027,KINA,170,Zumba,"Introduction to Zumba, Latin dance styles, through a variety of choreographed songs. Topics include basic information about aerobic training, how to perform basic Latin steps, and how to design a choreographed Latin-based dance routine.",Other,undergraduate,False,False,False,False,False,True
coloradomesa,2026,2026-2027,KINA,171,Adaptive Skiing/Snowboarding,"Adaptive snowsports for students with all types of disabilities. Students will develop knowledge, techniques, and an understanding of the safety involved in skiing/snowboarding. Specialized equipment will be available and customized depending on abilities.",Other,undergraduate,False,False,False,False,False,True
coloradomesa,2026,2026-2027,KINA,174,Social Dance,Introduction to partner dancing in common styles of social dance. Styles for each course will be specific to instructor expertise.,Other,undergraduate,False,False,False,False,False,True
coloradomesa,2026,2026-2027,KINA,175,Snorkeling/Free Diving,"Introduction to snorkeling and free diving.  Topics include how to handle the equipment and the physics involved in free diving. Takes basic snorkelers to an advanced level of knowledge, skills, and safety.",Other,undergraduate,False,False,False,False,False,True
coloradomesa,2026,2026-2027,KINA,180V,Varsity Sport Participation,"Participation in a varsity sport for credit. Course focuses on countable athletic-related activities, rules associated with sport, and maintenance of physical health.",Other,undergraduate,False,False,False,False,False,True
coloradomesa,2026,2026-2027,KINA,196,Topics:,,Other,undergraduate,False,False,False,False,False,True
coloradomesa,2026,2026-2027,KINA,396,Topics:,,Other,undergraduate,False,False,False,False,False,True
coloradomesa,2026,2026-2027,MANG,121,Human Relations In Business,"Human side of organizations: morale, motivation, human needs, minorities as working partners, leadership styles, organizational environment, and other human forces having an impact on business structures.",Other,undergraduate,False,False,False,False,False,True
coloradomesa,2026,2026-2027,MANG,201,Principles of Management,Management as the process of achieving organizational goals or objectives by and through others. Emphasizes functions performed by managers and how they are influenced by forces both within and outside the organization. Managers' use of resources will be investigated.,Other,undergraduate,False,False,False,False,False,True
coloradomesa,2026,2026-2027,MANG,201A,Principles of Management : Part 1 of 3,"Introduction to the activities of management and decision making in the global environment, with an emphasis on leadership and managing change and innovation.",Other,undergraduate,False,False,False,False,False,True
coloradomesa,2026,2026-2027,MANG,201B,Principles of Management: Part 2 of 3,"Introduction to management planning, goal setting, organizing, human resources, teams, and organizational behavior.",Other,undergraduate,False,False,False,False,False,True
coloradomesa,2026,2026-2027,MANG,201C,Principles of Management: Part 3 of 3,"Introduction to management control, quality, the role of information technology, and electronic business.",Other,undergraduate,False,False,False,False,False,True
coloradomesa,2026,2026-2027,MANG,221,Supervisory Concepts and Practices,"For practicing or potential supervisors and managers who hold or will hold first-line to middle-level management positions. Focuses on the management functions of planning, organizing, staffing, directing, and controlling and their relation to the daily job of the supervisor.",Other,undergraduate,False,False,False,False,False,True
coloradomesa,2026,2026-2027,MANG,242,Intro to The Point: Experiential Management I,"Introduction to experiential management through operation of The Point, CMU’s student run bar and pub.  The class offers hands on experience applying the principles of developing/operating a functioning business. Students assist in tracking and analyzing records of a student-run business.  Class combines application theory and practical experience to effect positive change.  All students must work paid shifts in the business.",Other,undergraduate,False,False,False,False,False,True
coloradomesa,2026,2026-2027,MANG,296,Topics:,,Other,undergraduate,False,False,False,False,False,True
coloradomesa,2026,2026-2027,MANG,299,Internship,Practical workplace experience under the joint supervision of the employer and the internship coordinator. Designed for business majors working in the business environment.,Other,undergraduate,False,False,False,False,False,True
coloradomesa,2026,2026-2027,MANG,301,Organizational Behavior,"Human behavior, its causes, and its effects in organizational settings.",Other,undergraduate,False,False,False,False,False,True
coloradomesa,2026,2026-2027,MANG,370,Leadership,Review of current leadership literature with an emphasis in application and skill building.,Other,undergraduate,False,False,False,False,False,True
coloradomesa,2026,2026-2027,MANG,395,Independent Study,,Other,undergraduate,False,False,False,False,False,True
coloradomesa,2026,2026-2027,MANG,396,Topics,,Other,undergraduate,False,False,False,False,False,True
coloradomesa,2026,2026-2027,MANG,401,Strategic Consulting,"Students are placed in the role of consultant for an area business furnishing management  assistance to the small business community. Businesses benefit from the insight of student recommendations. Provides students practical training, supplementing academic theory by handling problems in a real business environment.",Other,undergraduate,False,False,False,False,False,True
coloradomesa,2026,2026-2027,MANG,402,Advanced Problems in Small Business Operations II,Continuation of MANG 401 .,Other,undergraduate,False,False,False,False,False,True
coloradomesa,2026,2026-2027,MANG,410,Effective Workplace Communication,"Application of communication methods including:  personal selling, negotiation, interviewing, and individual and group presentations.  Emphasis placed upon application of effective practices used in communicating in today's business world.",Other,undergraduate,False,False,False,False,False,True
coloradomesa,2026,2026-2027,MANG,421,Credit and Collection Management,"Consumer and commercial credit in relationship to the management of credit by business firms, legal aspects of credit extension, and current legislation. Information on credit operations of business for both students of business and practicing businessmen.",Other,undergraduate,False,False,False,False,False,True
coloradomesa,2026,2026-2027,MANG,442,Experiential Management: Student Run Business,"Principles of developing/operating a functioning business. Track and analyze records of a student-run business. Analyze data, apply theory and practical experience to effect positive change. Work with CMU administration and government regulators to assure rules and regulations followed.",Other,undergraduate,False,False,False,False,False,True
coloradomesa,2026,2026-2027,MANG,451,Career Research and Development,"Principles and techniques involved in a job search with emphasis on conducting career research, identification of goals, preparing a job campaign, and elements of a job interview. Preparation of a job kit including a prospect list, resume, cover letter, advertisements, prospect letters, and sales and follow-up letters which can be used in a job search.",Other,undergraduate,False,False,False,False,False,True
coloradomesa,2026,2026-2027,MANG,471,Operations Management,"The use of resources in producing goods and services; concepts of planning, scheduling, and controlling productive activities and physical resources.",Other,undergraduate,False,False,False,False,False,True
coloradomesa,2026,2026-2027,MANG,491,Business Strategy,"Duties and responsibilities of decision makers in analyzing the organization, its operating environment and the subsequent development of objectives, policies, and long term planning for organizations. Includes complex cases taken from actual experiences in situations involving analysis, planning, and decision making.",Other,undergraduate,False,False,False,False,False,True
coloradomesa,2026,2026-2027,MANG,495,Independent Study,,Other,undergraduate,False,False,False,False,False,True
coloradomesa,2026,2026-2027,MANG,496,Topics,,Other,undergraduate,False,False,False,False,False,True
coloradomesa,2026,2026-2027,MANG,499,Internship,Provides BBA students with an opportunity to learn more about management functions and activities through exposure to an actual business or agency environment. Observation and participation in management activities enable students to relate classroom theory to on-the-job experiences.,Other,undergraduate,False,False,False,False,False,True
coloradomesa,2026,2026-2027,MANG,500,Advanced Management Theory,Designed to advance the student's understanding of management theories and the application of these theories to the business world. Contemporary issues will be discussed.,Other,graduate,False,False,False,False,False,True
coloradomesa,2026,2026-2027,MANG,501,Operations Management,"Competitive strategies and strategic impact of the transformation process in a global economy. Operations management issues, including quality, inventory management, management of technology, manufacturing planning and control, just-in-time manufacturing, and optimized production technology. Impact of business system on productivity and profits.",Other,graduate,False,False,False,False,False,True
coloradomesa,2026,2026-2027,MANG,510,Leading Organizations,"Designed to encourage the application of diverse conceptual and theoretical perspectives to the analysis and control of behavior in organizations. Practice in diagnosing organizational problems is gained by combining the use of theories, texts, readings, cases and exercise. The course focuses on problems related to perception, motivation, leadership, cultural diversity, interpersonal and group conflict, stress, work-family conflict, influence, decision-making, ethics, international management issues and change.",Other,graduate,True,False,False,False,False,True
coloradomesa,2026,2026-2027,MANG,540,Advanced Quantitative Methods,"Analytical models to support decision making. Topics include linear optimization, sensitivity analysis, linear regression, decision making under uncertainty, decision making under risk, project management, transportation and assignment methods, and forecasting.",Other,graduate,False,False,False,False,False,True
coloradomesa,2026,2026-2027,MANG,590,Business Strategy,"The capstone course in the MBA program. The purpose of this course is to develop an understanding of strategic management and the ""how"" and ""why"" of strategic decisions. Emphasis is also placed on how the manager goes about translating strategy into action and achieves integration in the organization. Integration involves the functional areas of management and how to balance the trade-offs from the perspective of strategic decision making at the top management level.",Other,graduate,False,False,False,False,False,True
coloradomesa,2026,2026-2027,MASS,110,Mass Media: Impact and History-GTAH2,"Investigation of the role played by media in everyday life and media's social, economic, and historical influence on society.",Other,undergraduate,False,False,False,False,False,True
coloradomesa,2026,2026-2027,MASS,140,Media Theory Introduction,"Introduction to theories of Mass Communication. Exploration of theory constructs, audience research, effects of emerging media and technologies, and message content.",Other,undergraduate,False,False,False,False,False,True
coloradomesa,2026,2026-2027,MASS,144,Multimedia Storytelling,"Journalism-based techniques and methods for modern storytelling of accurately written information through the use of the internet, video, and audio.",Other,undergraduate,False,False,False,False,False,True
coloradomesa,2026,2026-2027,MASS,196,Topics,,Other,undergraduate,False,False,False,False,False,True
coloradomesa,2026,2026-2027,MASS,213,Introduction to Media Writing and Reporting,Fundamentals of news gathering and reporting through a variety of media. Exploration of ethical and legal aspects of journalistic endeavors.,Other,undergraduate,False,False,False,False,False,True
coloradomesa,2026,2026-2027,MASS,251,Mass Media: Advertising and Promotions,"Principles of media advertising and promotions. Considers research, analysis, strategy, advertising barriers, design, and perspective.",Other,undergraduate,False,False,False,False,False,True
coloradomesa,2026,2026-2027,MASS,261,Audio Announcing and Production,Exploration of the art and science of announcing for media and the importance and use of the spoken word in persuasive messages.  Creation and execution of programs and formats for audio source distribution both traditional and emerging.,Other,undergraduate,False,False,False,False,False,True
coloradomesa,2026,2026-2027,MASS,271,Video Production,"Fundamentals of electronic field production and non-linear editing with hands-on experience with broadcast-quality equipment. Creation and execution of productions involving videography, scripting, graphic layout, and editing.",Other,undergraduate,False,False,False,False,False,True
coloradomesa,2026,2026-2027,MASS,296,Topics,,Other,undergraduate,False,False,False,False,False,True
coloradomesa,2026,2026-2027,MASS,310,Media Law and Ethics,"Ethical principles and laws affecting media.  Includes study and application of ethics and laws involved in print, broadcasting, and emerging media.",Other,undergraduate,False,False,False,False,False,True
coloradomesa,2026,2026-2027,MASS,313,Broadcast Journalism Reporting,"Introduction to broadcast writing styles and history. Specific applications for radio, television, and internet. Emphasis on formatting, newsgathering, interviewing, and researching.",Other,undergraduate,False,False,False,False,False,True
coloradomesa,2026,2026-2027,MASS,315A,Specialized Writing for Media: Science,Specialized writing about science for various media platforms.,Other,undergraduate,False,False,False,False,False,True
coloradomesa,2026,2026-2027,MASS,315B,Specialized Writing for Media: Sports,Specialized writing about sports for various media platforms.,Other,undergraduate,False,False,False,False,False,True
coloradomesa,2026,2026-2027,MASS,315C,Specialized Writing for Media: Health,Specialized writing about health for various media platforms.,Other,undergraduate,False,False,False,False,False,True
coloradomesa,2026,2026-2027,MASS,315D,Specialized Writing for Media: Crime,Specialized writing about crime for various media platforms.,Other,undergraduate,False,False,False,False,False,True
coloradomesa,2026,2026-2027,MASS,315E,Specialized Writing for Media: Arts Journalism,"Specialized writing about the arts for various media platforms. Subjects include: theory and creation of art critiques, fluency in a broad range of arts journalism contexts, and the law and ethics of arts journalism.",Other,undergraduate,False,False,False,False,False,True
coloradomesa,2026,2026-2027,MASS,317,Writing Opinion for Impact,"Persuasive and insightful writing.  Subjects include public issues, supporting beliefs, analysis, and documentation for targeted audiences through broadcast, print, and internet/web.",Other,undergraduate,False,False,False,False,False,True
coloradomesa,2026,2026-2027,MASS,342,Photojournalism I,"Fundamentals of camera techniques, qualities of print and digital images, history and ethics of photojournalism, uses of software in image acquisition and use, and development of esthetic values.",Other,undergraduate,False,False,False,False,False,True
coloradomesa,2026,2026-2027,MASS,350,Public Relations Concepts,"Historical and theoretical approach to contemporary public relations with 
emphasis on the persuasion process 
and ethics, propaganda, and advertising 
techniques in mass media.",Other,undergraduate,False,False,False,False,False,True
coloradomesa,2026,2026-2027,MASS,352,Print Design and Production for Editors,"Various essential processes and duties editors face in preparing articles, graphics, and photos for print publication - including digital design and pre-press, typography, press-ready PDFs, CMYK offset printing, writing headlines and cutlines, and meeting all expectations in the printed final product. Adobe InDesign also is introduced and utilized.",Other,undergraduate,False,False,False,False,False,True
coloradomesa,2026,2026-2027,MASS,357,Documentary and News Producing,"Creation of multimedia content for students to develop their skills as producers, researchers, interviewers, writers, and videographers, as well as on-camera and voice talent. The focus of study will be on analyzing and practicing the aesthetic and technical elements of documentary and news content in order to create original stories for broadcast, print, and web.",Other,undergraduate,False,False,False,False,False,True
coloradomesa,2026,2026-2027,MASS,372,TV Studio Production,"Combination of multi-camera studio and electronic field productions. Includes videography, live-editing, non-linear editing, graphic creation, audio manipulation, and script writing, culminating in broadcast-quality programming.",Other,undergraduate,False,False,False,False,False,True
coloradomesa,2026,2026-2027,MASS,387,Structured Research,,Other,undergraduate,False,False,False,False,False,True
coloradomesa,2026,2026-2027,MASS,395,Independent Study,,Other,undergraduate,False,False,False,False,False,True
coloradomesa,2026,2026-2027,MASS,396,Topics,,Other,undergraduate,False,False,False,False,False,True
coloradomesa,2026,2026-2027,MASS,397,Practicum,Practical experience with student media outlets under faculty advisor supervision or with CMU Sports Information.  Practicum coordinator must be consulted in first week of term.,Other,undergraduate,False,False,False,False,False,True
coloradomesa,2026,2026-2027,MASS,415,Advanced Media Writing and Reporting,"In-depth journalism writing and reporting course. Focuses on the development of long-form journalism pieces, including magazine features, public affairs reporting, news analysis, and news investigations using public records and interviews. Emphasis on fair and accurate reporting and writing under deadline, with critical attention paid to law and ethics.",Other,undergraduate,False,False,False,False,False,True
coloradomesa,2026,2026-2027,MASS,417,Writing for Public Relations and Advertising,Copywriting function in public relations and advertising for organizations and agencies.,Other,undergraduate,False,False,False,False,False,True
coloradomesa,2026,2026-2027,MASS,441,Emerging Media,"Experimentation with tools, techniques, and concepts of social and new media resulting in the creation of online content.",Other,undergraduate,False,False,False,False,False,True
coloradomesa,2026,2026-2027,MASS,442,Photojournalism II,"Advanced skills to capture and edit images to high aesthetic values, professionalism, news photography, photo illustration, creation of image portfolios for public display or potential employers, and use of image management software.",Other,undergraduate,False,False,False,False,False,True
coloradomesa,2026,2026-2027,MASS,450,Public Relations Campaigns,"Survey of campaigns and case histories representing the scope of public relations (PR), research methodology, and audience targeting. Practical application of PR theory.",Other,undergraduate,False,False,False,False,False,True
coloradomesa,2026,2026-2027,MASS,452,Designing for Brand and Message,"Publication of attractive and effective content. Includes designing print materials, such as company newsletters, logos, brochures, magazines, as well as electronic publishing.",Other,undergraduate,False,False,False,False,False,True
coloradomesa,2026,2026-2027,MASS,471,Advanced Video Production,Aesthetic values of electronic field productions and post-production projects. Builds upon concepts and skills acquired in MASS 271 to create and execute high quality video  and creative productions for air and/or web use.,Other,undergraduate,False,False,False,False,False,True
coloradomesa,2026,2026-2027,MASS,493,Senior Project Portfolio,"Identification and preparation of projects that highlight mass communication skills, abilities, talents, and applications.",Other,undergraduate,False,False,False,False,False,True
coloradomesa,2026,2026-2027,MASS,494,Seminar: Advanced Theory and Research,Capstone course. Examination and exploration of mass communication theories. Focus on research and its importance to media disciplines and industries.,Other,undergraduate,False,False,False,False,False,True
coloradomesa,2026,2026-2027,MASS,495,Independent Study,,Other,undergraduate,False,False,False,False,False,True
coloradomesa,2026,2026-2027,MASS,496,Topics,,Other,undergraduate,False,False,False,False,False,True
coloradomesa,2026,2026-2027,MASS,497,Practicum,Practical experience with student media outlets under faculty advisor supervision or with CMU Sports Information.  Practicum coordinator must be consulted in first week of term.,Other,undergraduate,False,False,False,False,False,True
coloradomesa,2026,2026-2027,MASS,499,Internship,"Work in media industry
 positions.",Other,undergraduate,False,False,False,False,False,True
coloradomesa,2026,2026-2027,MATH,101,Review in Mathematics,"Review of mathematical concepts and computations. Content will vary, but topics will be chosen in each case to prepare students for a specific subsequent course.",STEM,undergraduate,False,False,False,False,False,True
coloradomesa,2026,2026-2027,MATH,105,Elements of Mathematics I,"Mathematics for the prospective elementary teacher with an emphasis on mathematical reasoning and processes. Topics include problem solving, set theory, number theory, numeration systems, the integers, and rational numbers.",STEM,undergraduate,False,False,False,False,False,True
coloradomesa,2026,2026-2027,MATH,107,Career Math,"Covers material designed for career technical or general studies students who need to study particular mathematical topics.  Topics include measurement, algebra, geometry, trigonometry, graphs, and/or finance.  These are presented on an introductory level and the emphasis is on applications.",STEM,undergraduate,False,False,False,False,False,True
