university,academic_year,academic_year_label,department_code,course_number,title,description,broad_area,level,progressive_signal,western_canon_signal,climate_narrow_signal,climate_broad_signal,cross_listed,deduplicated
coloradomesa,2026,2026-2027,RADS,323,Digital Imaging,"Exploration of components, principles, and operation of digital imaging systems found in diagnostic radiology. Factors affecting image acquisition, display, archiving, and retrieval are discussed.",Other,undergraduate,False,False,False,False,False,True
coloradomesa,2026,2026-2027,RADS,329,Radiographic Clinical Experience I,"Introduction to the radiographic clinical education experience in the clinical education site. Designed to provide patient care and assessment, competent performance of radiologic imaging, and total quality management. Levels of competency and outcomes measurement ensure the well-being of the patient prior to, during, and following the radiologic procedure.",Other,undergraduate,False,False,False,False,False,True
coloradomesa,2026,2026-2027,RADS,331,Radiographic Anatomy and Positioning II,"Continuation of RADS 321 with instruction in every phase of radiography of the spinal column, digestive system, urinary system, cranium, and facial bones. Radiographic anatomy, positioning, and procedures are discussed and applied in the energized laboratory.",Other,undergraduate,False,False,False,False,False,True
coloradomesa,2026,2026-2027,RADS,331L,Radiographic Anatomy and Positioning II Laboratory,Lab component required for RADS 331 .,Other,undergraduate,False,False,False,False,False,True
coloradomesa,2026,2026-2027,RADS,332,Specialized Imaging,"Introduction to medical imaging modalities and treatment, including equipment, dose differences, types of radiation, patient preparations, indications, and contraindications. Educational and certification requirements are included. Mobile and trauma radiography also are discussed. The course includes an introduction to sectional anatomy of head/brain, chest, mediastinum, abdomen, pelvis, and musculoskeletal system.",Other,undergraduate,True,False,False,False,False,True
coloradomesa,2026,2026-2027,RADS,333,Imaging Equipment and Quality Assurance,"Introduction to radiographic, fluoroscopic, and mobile equipment requirements and design. Applied practice of equipment maintenance, quality control, and testing performed in lab.",Other,undergraduate,False,False,False,False,False,True
coloradomesa,2026,2026-2027,RADS,333L,Imaging Equipment and Quality Assurance Laboratory,Lab component required for RADS 333 .,Other,undergraduate,False,False,False,False,False,True
coloradomesa,2026,2026-2027,RADS,334,Image Analysis I,"Principles of analyzing radiographic images of the appendicular skeleton, chest, and abdomen. The importance of optimal imaging standards, as well as discussion of a problem-solving technique for image evaluation and the factors that can affect image quality are also addressed. Actual images will be included for analysis.",Other,undergraduate,False,False,False,False,False,True
coloradomesa,2026,2026-2027,RADS,335,Radiation Biology and Protection,"Principles of radiation interaction in cells and factors affecting cell response to radiation. The course also addresses acute and chronic effects of radiation, dose equivalent limits, and regulatory involvement. Responsibility by the radiographer to patients, personnel, the public, and self are also discussed.",Other,undergraduate,False,False,False,False,False,True
coloradomesa,2026,2026-2027,RADS,339,Radiographic Clinical Experience II,"Exploration of additional concepts correlating skills with academic courses in radiographic clinical education. Designed to provide patient care and assessment, competent performance of radiologic imaging, and total quality management. Levels of competency and outcomes measurement ensure the well-being of the patient prior to, during, and following the radiologic procedure.",Other,undergraduate,False,False,False,False,False,True
coloradomesa,2026,2026-2027,RADS,354,Image Analysis II,"Principles of analyzing radiographic images of the axial skeleton (including the spine, sternum, ribs, and cranium), facial bones, paranasal sinuses, and the digestive system. The importance of optimal imaging standards, as well as discussion of a problem-solving technique for image evaluation and the factors that can affect image quality are also addressed. Actual images will be included for analysis.",Other,undergraduate,False,False,False,False,False,True
coloradomesa,2026,2026-2027,RADS,449,Radiographic Clinical Experience III,"Further exploration of clinical education. Designed to provide patient care and assessment, competent performance of radiologic imaging and total quality management. Levels of competency and outcomes measurement ensure the well-being of the patient prior to, during, and following the radiologic procedure.",Other,undergraduate,False,False,False,False,False,True
coloradomesa,2026,2026-2027,RADS,451,Imaging Pathology,Introduction to concepts related to the disease process with emphasis on the radiographic appearance of disease.,Other,undergraduate,False,False,False,False,False,True
coloradomesa,2026,2026-2027,RADS,452,Sectional Anatomy,"Exploration of the location and identification of structures in multiple anatomical planes. Function, orientation, imaging, and pathology will be discussed.",Other,undergraduate,False,False,False,False,False,True
coloradomesa,2026,2026-2027,RADS,453,Advanced Patient Care,"Development of patient care knowledge and skills required for advanced medical imaging procedures.  Focus is on legal and ethical considerations, drug administration, patient monitoring, emergency care, and sterile technique.",Other,undergraduate,False,False,False,False,False,True
coloradomesa,2026,2026-2027,RADS,459,Radiographic Clinical Experience IV,"Further exploration of clinical education. Designed to provide patient care and assessment, competent performance of radiologic imaging and total quality management. Levels of competency and outcomes measurement ensure the well-being of the patient prior to, during, and following the radiologic procedure.",Other,undergraduate,False,False,False,False,False,True
coloradomesa,2026,2026-2027,RADS,460,Principles of Magnetic Resonance Imaging,"Introduction to the operation of a magnetic resonance imaging (MRI) scanner. Includes magnetic resonance imaging instrumentation, safety, physics, and contract media. Does not include clinical experience.",Other,undergraduate,False,False,False,False,False,True
coloradomesa,2026,2026-2027,RADS,461,Principles of Computed Tomography,"Introduction to the operation of computed tomography equipment. Includes instrumentation, image display, radiation safety, and contrast media. Does not include clinical experience.",Other,undergraduate,False,False,False,False,False,True
coloradomesa,2026,2026-2027,RADS,462,Leadership and Management,"Identification of skills necessary to work within an effective interdisciplinary health care team. Includes principles of leadership, quality management, and health care law.",Other,undergraduate,False,False,False,False,False,True
coloradomesa,2026,2026-2027,RADS,463,Information Literacy in Radiologic Sciences,"Development of life-long learning skills necessary to function competently in the continually changing medical imaging environment. Content includes intellectual inquiry, information literacy, and scholarly research methods.",Other,undergraduate,False,False,False,False,False,True
coloradomesa,2026,2026-2027,RADS,464,Senior Capstone,"Synthesis of radiologic science concepts, principles, and procedures. Includes development of resume and interview skills.",Other,undergraduate,False,False,False,False,False,True
coloradomesa,2026,2026-2027,RADS,469,Radiographic Clinical Experience V,"Further exploration of clinical education. Designed to provide patient care and assessment, competent performance of radiologic imaging and total quality management. Levels of competency and outcomes measurement ensure the well-being of the patient prior to, during, and following the radiologic procedure.",Other,undergraduate,False,False,False,False,False,True
coloradomesa,2026,2026-2027,RADS,470,Applied Magnetic Resonance Imaging,"Continuation of RADS 460 .  Development of knowledge and cognitive skills underlying the intelligent performance of tasks typically required of technologists who perform magnetic resonance imaging procedures.  Includes patient care, image production, procedures, artifacts, and quality control.  Does not include clinical experience.",Other,undergraduate,False,False,False,False,False,True
coloradomesa,2026,2026-2027,RADS,471,Applied Computed Tomography,"Continuation of RADS 461 . Development of knowledge and cognitive skills underlying the intelligent performance of tasks typically required of technologists who perform computed tomography procedures.  Includes patient care and safety, imaging procedures, and image assessment.  Does not include clinical experience.",Other,undergraduate,False,False,False,False,False,True
coloradomesa,2026,2026-2027,RADS,480,Clinical Specialization I,"Demonstration of clinical competency in Radiologic Science imaging modality. Practical experience gained and demonstrations of competency in positioning, machine control, patient care and image quality in chosen modality.",Other,undergraduate,False,False,False,False,False,True
coloradomesa,2026,2026-2027,RADS,490,Clinical Specialization II,"Continuation of RADS 480 . Demonstration of clinical competency in Radiologic Science imaging modality. Practical experience gained and demonstrations of competency in positioning, machine control, patient care and image quality in chosen modality.",Other,undergraduate,False,False,False,False,False,True
coloradomesa,2026,2026-2027,RADS,495,Independent Study,,Other,undergraduate,False,False,False,False,False,True
coloradomesa,2026,2026-2027,READ,092,College Reading Studio,"This course is designed to offer supplemental support for students in reading intensive courses across the disciplines.  Daily mini-lessons will be provided based on Ten Steps to Advanced College Reading Skills, and will follow with individual assistance with discipline-specific vocabulary from college texts.  This is a corequisite with social science 100 discipline strands for students with Accuplacer scores of 62-79.",Other,undergraduate,False,False,False,False,False,True
coloradomesa,2026,2026-2027,READ,096,Topics:,,Other,undergraduate,False,False,False,False,False,True
coloradomesa,2026,2026-2027,RESP,201,Introduction to Respiratory Care,"Introduction to respiratory therapy.  Respiratory history, patient assessment, infection prevention, medical record documentation, cultural, legal, and ethical considerations, and Health Insurance Portability and Accountability Act (HIPAA).",Medical Sciences,undergraduate,False,False,False,False,False,True
coloradomesa,2026,2026-2027,RESP,202,Cardiopulmonary Anatomy and Physiology,"Disease processes of the respiratory system. Pathophysiology in disorders of the brain, heart, skeletal muscles, and kidneys affecting oxygenation and ventilation.",Medical Sciences,undergraduate,False,False,False,False,False,True
coloradomesa,2026,2026-2027,RESP,203,Respiratory Procedures I,"Equipment and technology in respiratory therapy. Critical thinking, decision-making, demonstration of equipment and procedural skills, and ensuring patient safety.",Medical Sciences,undergraduate,False,False,False,False,False,True
coloradomesa,2026,2026-2027,RESP,203L,Respiratory Procedures I Laboratory,"Equipment and technology in respiratory therapy. Critical thinking, decision-making, demonstration of equipment and procedural skills, and ensuring patient safety.",Medical Sciences,undergraduate,False,False,False,False,False,True
coloradomesa,2026,2026-2027,RESP,204,Respiratory Pharmacology,"Introduction to medication for respiratory therapy. Explores respiratory, cardiac, neuromuscular, sedative, analgesics, and diuretic medications. Also covers drug actions, interactions, chemical composition, and treatments focusing on the respiratory system.",Medical Sciences,undergraduate,False,False,False,False,False,True
coloradomesa,2026,2026-2027,RESP,205,Cardiopulmonary Pathophysiology,Common disease/disorder processes in respiratory therapy patients. Investigation of case studies determining appropriate respiratory care. Development of communication and interdisciplinary collaboration skills.,Medical Sciences,undergraduate,False,False,False,False,False,True
coloradomesa,2026,2026-2027,RESP,206,Cardiopulmonary Diagnostics,"Survey of diagnostic techniques used to determine the quality of the patient’s respiratory status. Non-invasive monitoring, imaging studies, pulmonary mechanics, cardiac testing, and hemodynamics.",Medical Sciences,undergraduate,False,False,False,False,False,True
coloradomesa,2026,2026-2027,RESP,207,Noninvasive Care Management,Identification of respiratory failure. Noninvasive modalities and approaches used to manage patients in respiratory distress of failure.,Medical Sciences,undergraduate,False,False,False,False,False,True
coloradomesa,2026,2026-2027,RESP,208,Respiratory Procedures II,"Advanced respiratory therapy equipment technology. Development of critical thinking, decision-making, equipment, and procedural skills, as well as ensuring patient safety. Also covers lung expansion, inspiratory training, pulmonary hygiene, and heated high flow processes. Completion of Basic Life Support (BLS) training.",Medical Sciences,undergraduate,False,False,False,False,False,True
coloradomesa,2026,2026-2027,RESP,208L,Respiratory Procedures II Laboratory,"Advanced respiratory therapy equipment technology. Development of critical thinking, decision-making, equipment, and procedural skills, as well as ensuring patient safety. Also covers lung expansion, inspiratory training, pulmonary hygiene, and heated high flow processes. Completion of Basic Life Support (BLS) training.",Medical Sciences,undergraduate,False,False,False,False,False,True
coloradomesa,2026,2026-2027,RESP,209,Respiratory Clinical I,"Introductory acute care clinical training. Hospital care experience in patient assessment, oxygen therapy, bland aerosol, medication, and noninvasive respiratory modalities.",Medical Sciences,undergraduate,False,False,False,False,False,True
coloradomesa,2026,2026-2027,RESP,211,Mechanical Ventilation,"Mechanical ventilation physics and functions. Ventilator modes, management techniques, waveforms, and bundle strategies. Laboratory critical care scenarios of patient disease/disorder processes and protocols. Completion of Advanced Cardiac Life Support (ACLS).",Medical Sciences,undergraduate,False,False,False,False,False,True
coloradomesa,2026,2026-2027,RESP,211L,Mechanical Ventilation Laboratory,"Mechanical ventilation physics and functions. Ventilator modes, management techniques, waveforms, and bundle strategies. Laboratory critical care scenarios of patient disease/disorder processes and protocols. Completion of Advanced Cardiac Life Support (ACLS).",Medical Sciences,undergraduate,False,False,False,False,False,True
coloradomesa,2026,2026-2027,RESP,213,Fundamentals of Pediatric and Neonatal Care,"Exploration of care for antenatal, neonatal, and pediatric patients. Assessment of fetal development, neonatal, and pediatric diseases. Addresses causes of prematurity and high-risk delivery. Completion of Neonatal Resuscitation Provider (NRP) and Pediatric Advanced Life Support (PALS).",Medical Sciences,undergraduate,False,False,False,False,False,True
coloradomesa,2026,2026-2027,RESP,214,Professional Development for Respiratory Care Practitioners,"Health care professional development. Preparation for the state and national board exams, and state licensure. Focus on professionalism, interview techniques, hiring, and ethical standards.",Medical Sciences,undergraduate,False,False,False,False,False,True
coloradomesa,2026,2026-2027,RESP,219,Respiratory Clinical II,"Advanced acute care clinical training. Hospital critical care experience in patient assessment, mechanical ventilation, medication delivery, lung expansion, and advanced diagnostic testing.",Medical Sciences,undergraduate,False,False,False,False,False,True
coloradomesa,2026,2026-2027,RESP,229,Respiratory Clinical III,"Critical and specialty care training. Intensive care, emergency room, and specialty care evaluation of respiratory therapy.",Medical Sciences,undergraduate,False,False,False,False,False,True
coloradomesa,2026,2026-2027,SOCI,101,"Introduction to Lesbian, Gay, Bisexual, and Transgender Studies-GTSS3","Introduction to lesbian, gay, bisexual, and transgender studies. Exploration of LGBT studies as an academic field and consideration of the experience of being lesbian, gay, bisexual, or transgender.",Social Sciences,undergraduate,True,False,False,False,False,True
coloradomesa,2026,2026-2027,SOCI,102,Introduction to Women's and Gender Studies-GTSS3,"Introduction to major themes, methods, and works in women and gender studies. Overview of the contributions that women’s history, queer studies, and feminist theory have made to a variety of academic disciplines.",Social Sciences,undergraduate,True,False,False,False,False,True
coloradomesa,2026,2026-2027,SOCI,120,Technology and Society-GTSS3,"Overview of technological innovations and human societies throughout modern history.  Emphasizes impacts of technology within a social, political, economic, and environmental context.",Social Sciences,undergraduate,False,False,False,False,False,True
coloradomesa,2026,2026-2027,SOCI,196,Topics,,Social Sciences,undergraduate,False,False,False,False,False,True
coloradomesa,2026,2026-2027,SOCI,270,Introduction to Pre-Law Studies,Exploration of the path to law school. Dispels myths about the practice of law and law school acceptance. Understanding of skills needed to succeed in law school. Career outlook and resources available to applicants. Open to all majors.,Social Sciences,undergraduate,False,False,False,False,False,True
coloradomesa,2026,2026-2027,SOCI,296,Topics,,Social Sciences,undergraduate,False,False,False,False,False,True
coloradomesa,2026,2026-2027,SOCI,395,Independent Study,,Social Sciences,undergraduate,False,False,False,False,False,True
coloradomesa,2026,2026-2027,SOCI,396,Topics,,Social Sciences,undergraduate,False,False,False,False,False,True
coloradomesa,2026,2026-2027,SOCI,397,Structured Research,,Social Sciences,undergraduate,False,False,False,False,False,True
coloradomesa,2026,2026-2027,SOCI,401,LSAT Preparation,Preparation for the Law School Admissions Test (LSAT).,Social Sciences,undergraduate,False,False,False,False,False,True
coloradomesa,2026,2026-2027,SOCI,410,"Death, Dying & Bereavement","Provides an in-depth overview of the issues surrounding death, dying and bereavement.  The social and psychological processes of death using interdisciplinary readings from psychology, sociology, anthropology, history, medicine and philosophy.",Social Sciences,undergraduate,False,False,False,False,False,True
coloradomesa,2026,2026-2027,SOCI,470,Pre-Law in Practice,"Prepare for law school. Information about types of law, career outlook, making connections, and selecting the right school. Building skills needed for law school. Understanding what is expected, how to apply. Hear from attorneys in the community. Open to all majors.",Social Sciences,undergraduate,False,False,False,False,False,True
coloradomesa,2026,2026-2027,SOCI,495,Independent Study,,Social Sciences,undergraduate,False,False,False,False,False,True
coloradomesa,2026,2026-2027,SOCI,496,Topics,,Social Sciences,undergraduate,False,False,False,False,False,True
coloradomesa,2026,2026-2027,SOCI,497,Structured Research,Social or behavioral science research under the directed guidance of a faculty member. Designed for junior and senior level students.,Social Sciences,undergraduate,False,False,False,False,False,True
coloradomesa,2026,2026-2027,SOCI,499,Internship,,Social Sciences,undergraduate,False,False,False,False,False,True
coloradomesa,2026,2026-2027,REAL,350,Real Estate Fundamentals,Overview of basic components of the real estate industry. Includes industry terminology and basic real estate concepts and principles.,Other,undergraduate,False,False,False,False,False,True
coloradomesa,2026,2026-2027,REAL,410,Real Estate Finance and Development,"Exploration of the process of land development, land packaging and land banking. Analyzes and evaluates real estate financing transactions and opportunities.",Other,undergraduate,False,False,False,False,False,True
coloradomesa,2026,2026-2027,REAL,415,Real Estate Valuation and Investment,Examination of real estate appraisals using the current industry practices. Calculate and analyze real estate investment opportunities and strategies using current industry investment analysis tools.,Other,undergraduate,False,False,False,False,False,True
coloradomesa,2026,2026-2027,REAL,496,Topics:,,Other,undergraduate,False,False,False,False,False,True
coloradomesa,2026,2026-2027,SOWK,150,Introduction to Social Work,"Exploration of professional social work, including its history, purpose, goals, values, ethics, and mission to enhance human well-being and alleviate poverty and oppression. Includes areas of practice, child welfare, mental health, developmental disabilities, health care, criminal justice, the workplace, diversity, aging, housing, and homelessness through a generalist framework. Special focus on diversity, social justice, and impacts/mechanisms of oppression and discrimination.",Other,undergraduate,True,False,False,False,False,True
coloradomesa,2026,2026-2027,SOWK,210,"Justice, Equity, Diversity, and Inclusion (JEDI) in Social Work","Examination of power, privilege, and oppression through an intersectional lens. Incorporation of a social justice lens unique to social work. Special focus on advocacy and activism in social work as key components of anti-racist and anti-oppressive practice. Utilization of critical theories to understand the root causes of local, national, and global inequality and inequity.",Other,undergraduate,True,False,False,False,False,True
coloradomesa,2026,2026-2027,SOWK,296,Topics:,,Other,undergraduate,False,False,False,False,False,True
coloradomesa,2026,2026-2027,SOWK,301,Child Welfare,"Signs and symptoms of abuse and neglect of children. Family dynamics in abuse and neglect, and programs of prevention and intervention. Explores foster care, adoptions, delinquency problems, poverty and homelessness, and related issues in child welfare. Examines the crime of human trafficking.",Other,undergraduate,False,False,False,False,False,True
coloradomesa,2026,2026-2027,SOWK,308,Medical Social Work,"Explores interface of social work and patients' rights, medical decision-making, case management, process of diagnosis and treatment, palliative and end-of-life care, and the concept of health care consumer. Focus on the current health care system in the United State, the interface of health care and populations-at-risk, and role of the social worker in medical settings.",Other,undergraduate,False,False,False,False,False,True
coloradomesa,2026,2026-2027,SOWK,311,Ethical Issues in Social Work,"Analysis of specific ethical dilemmas from personal, professional, and policy perspectives. Focus on ethical issues common to the social work profession. Practice of ethical decision-making and connections to ethical theories. Utilization of National Association of Social Work (NASW) Code of Ethics as guide to decision making.",Other,undergraduate,False,False,False,False,False,True
coloradomesa,2026,2026-2027,SOWK,320,Social Work Practices in Mental Health,"Study of mental health diagnoses, the diagnostic process, impacts of mental health on social problems, and issues related to mental health diagnoses in wider-scope systems and culture. Exploration of research on mental health diagnoses and discussions on treatment and impacts of mental health issues on culture and systemic capacity.",Other,undergraduate,False,False,False,False,False,True
coloradomesa,2026,2026-2027,SOWK,325,Nature-Based Interventions for Individual and Community Health,"Principles that promote physical and emotional wellbeing, social connectedness, and resilience through access to nature and the outdoors. Assessment of equitable access to community outdoor recreation resources. Synthesis of data on the health benefits of nature. Investigation of cross-sector partnerships, with a focus on identifying funding for community health goals.",Other,undergraduate,True,False,False,False,False,True
coloradomesa,2026,2026-2027,SOWK,340,Case Management,"Exploration of the role of case management in the context of mental health and human services delivery systems. Attention paid to the ways in which social workers identify and use social work values, ethics, and practice models within the context of the diverse and competing needs present in case management service systems.",Other,undergraduate,True,False,False,False,False,True
coloradomesa,2026,2026-2027,SOWK,344,School Social Work,"Overview of social work practice in an educational setting. Cooperative work with school personnel in the identification, prevention and treatment of social, emotional and behavioral problems of children and intervention techniques with parents.",Other,undergraduate,False,False,False,False,False,True
coloradomesa,2026,2026-2027,SOWK,350,Legal Aspects of Social Work,"Exploration of the roles of the social worker in the legal field.  Legal terms, procedures, state and federal court systems studied.  The legal aspects of protective services for children and adults, the child support laws and the juvenile justice system examined.",Other,undergraduate,False,False,False,False,False,True
