university,academic_year,academic_year_label,department_code,course_number,title,description,broad_area,level,progressive_signal,western_canon_signal,climate_narrow_signal,climate_broad_signal,cross_listed,deduplicated
coloradomesa,2026,2026-2027,DANC,390,Choreography Practice and Production II,Practice of skills in choreography and dance production elements in both traditional and non-traditional contexts at the intermediate level. Only students who have participated in at least one dance concert through the CMU Dance Program are eligible to enroll in this course.,Other,undergraduate,False,False,False,False,False,True
coloradomesa,2026,2026-2027,DANC,395,Independent Study,,Other,undergraduate,False,False,False,False,False,True
coloradomesa,2026,2026-2027,DANC,396,Topics:,,Other,undergraduate,False,False,False,False,False,True
coloradomesa,2026,2026-2027,DANC,430,Contemporary Modern IVA,Study of contemporary modern dance at the advanced level.,Other,undergraduate,False,False,False,False,False,True
coloradomesa,2026,2026-2027,DANC,431,Contemporary Modern IVB,Continued study of contemporary modern dance at the advanced level.,Other,undergraduate,False,False,False,False,False,True
coloradomesa,2026,2026-2027,DANC,432,Jazz IVA,Study of jazz dance at the advanced level.,Other,undergraduate,False,False,False,False,False,True
coloradomesa,2026,2026-2027,DANC,433,Jazz IVB,Continued study of jazz dance at the advanced level.,Other,undergraduate,False,False,False,False,False,True
coloradomesa,2026,2026-2027,DANC,434,Ballet IVA,Study of ballet technique at the advanced level.,Other,undergraduate,False,False,False,False,False,True
coloradomesa,2026,2026-2027,DANC,435,Ballet IVB,Continued study of ballet technique at the advanced level.,Other,undergraduate,False,False,False,False,False,True
coloradomesa,2026,2026-2027,DANC,436,Tap IVA,Study of tap dance at the advanced level.,Other,undergraduate,False,False,False,False,False,True
coloradomesa,2026,2026-2027,DANC,437,Tap IVB,Continued study of tap dance at the advanced level.,Other,undergraduate,False,False,False,False,False,True
coloradomesa,2026,2026-2027,DANC,440,Dance Company and Production,"Experience in elements that go into creating a production, including: rehearsal, choreography, performance, collaboration, and community engagement. For fourth year students.",Other,undergraduate,False,False,False,False,False,True
coloradomesa,2026,2026-2027,DANC,454,Dance Team,Participation on the Mavettes Dance Team at the senior standing level.,Other,undergraduate,False,False,False,False,False,True
coloradomesa,2026,2026-2027,DANC,456,Dance Performance,"Student participation in the creation and performance of a dance choreographed by faculty, guest artist, and/or student choreographer. Students must participate in an audition. For fourth year students.",Other,undergraduate,False,False,False,False,False,True
coloradomesa,2026,2026-2027,DANC,490,Choreography Practice and Production III,Practice of skills in choreography and dance production elements in both traditional and non-traditional contexts at the advanced level. Intended for students who have already participated in at least one dance concert through the CMU dance program.,Other,undergraduate,False,False,False,False,False,True
coloradomesa,2026,2026-2027,DANC,494,Senior Dance Capstone,Research and sharing of a creative and/or scholarly project to demonstrate skills necessary to enter the professional field of dance. Completion of a professional portfolio.,Other,undergraduate,False,False,False,False,False,True
coloradomesa,2026,2026-2027,DANC,495,Independent Study,,Other,undergraduate,False,False,False,False,False,True
coloradomesa,2026,2026-2027,DANC,496,Topics,,Other,undergraduate,False,False,False,False,False,True
coloradomesa,2026,2026-2027,DANC,499,Internship,,Other,undergraduate,False,False,False,False,False,True
coloradomesa,2026,2026-2027,DMSO,400L,Introduction to Cardiac Sonography Laboratory,"Introduction to cardiac sonography procedures. The topics of exam room set-up, patient preparation and education, and body ergonomics will be explored. Various echocardiography settings and their influence on a sonographer’s approach and preparation will be discussed.",Other,undergraduate,False,False,False,False,False,True
coloradomesa,2026,2026-2027,DMSO,409,Sonography Clinical Experience I,"Introduction to sonography clinical education in the clinical environment. The course provides hands-on training in performing sonographic procedures, providing patient care, assessment, and clinical safety.",Other,undergraduate,False,False,False,False,False,True
coloradomesa,2026,2026-2027,DMSO,410,Sonography Principles and Instrumentation I,"Introduction to the physical principles of ultrasound in diagnostic medical sonography. Analysis of the interaction of ultrasound and matter, the operation of the transducers, and the Doppler concepts. Skills associated with image acquisition and optimization will be developed.",Other,undergraduate,False,False,False,False,False,True
coloradomesa,2026,2026-2027,DMSO,411,Cardiac Sonography Procedures I,"Introduction to sonography of the heart. The topics of basic embryology, anatomy, physiology, conduction system, and great vessels will be explored. Basic scanning positions, techniques, image protocols, and modes will be discussed. Principles of hemodynamics, cardiac cycle, ventricular function for a normal heart, and abnormal pathology.",Other,undergraduate,False,False,False,False,False,True
coloradomesa,2026,2026-2027,DMSO,419,Sonography Clinical Experience II,"Exploration of sonography clinical education in the clinical environment. The course provides hands-on training in performing sonographic procedures, providing competent patient care, assessment, and clinical safety.",Other,undergraduate,False,False,False,False,False,True
coloradomesa,2026,2026-2027,DMSO,420,Sonography Principles and Instrumentation II,"Study of the physical principles of ultrasound in diagnostic medical sonography. Analysis of the advanced scanning techniques, image artifacts, and processing. Skills associated with image optimization and quality assurance will be developed.",Other,undergraduate,False,False,False,False,False,True
coloradomesa,2026,2026-2027,DMSO,421,Cardiac Sonography Procedures II,"Introduction to advanced cardiac sonography procedures. Topics of transesophageal echocardiograms, treadmill, bicycle, pharmacological stress echograms, intracardiac imaging, structural heart interventions, cardiac surgeries, and common adult congenital deformities will be explored. Criteria, protocols, scanning requirements, measurements, and quantifications will be analyzed for each procedure.",Other,undergraduate,False,False,False,False,False,True
coloradomesa,2026,2026-2027,DMSO,429,Sonography Clinical Experience III,"Advancement of sonography clinical education in the clinical environment. The course provides hands-on training in performing sonographic procedures, providing patient care, assessment, and clinical safety.",Other,undergraduate,False,False,False,False,False,True
coloradomesa,2026,2026-2027,DMSO,430,Sonography Registry Review,"Synthesis of diagnostic medical sonography concepts, principles, and procedures. The course includes preparation for the national certification examinations.",Other,undergraduate,False,False,False,False,False,True
coloradomesa,2026,2026-2027,DMSO,439,Sonography Clinical Experience IV,"Demonstration of competency in the sonography clinical education. The course provides hands-on training in performing sonographic procedures with a higher level of autonomy, providing advanced patient care, assessment, and clinical safety.",Other,undergraduate,False,False,False,False,False,True
coloradomesa,2026,2026-2027,ECSE,320,Learner Development and Individual Differences,Exploration of child development and individual differences to respond to the unique and individualized needs of young children with exceptionalities.,Other,undergraduate,False,False,False,False,False,True
coloradomesa,2026,2026-2027,ECSE,410,Building Family and Community Partnerships,"Introduction to the concept of family systems, the impact of children with diverse needs upon the family system, and the role of the educator in partnering with families and the community.",Other,undergraduate,True,False,False,False,False,True
coloradomesa,2026,2026-2027,ECSE,430,"Instructional Strategies for Inclusion and Intervention, Birth-8 Years","Exploration of evidence-based instructional strategies, focused on communication and sensory processing, to advance learning of young children with exceptionalities.",Other,undergraduate,True,False,False,False,False,True
coloradomesa,2026,2026-2027,ECSE,435,"Assessment and Evaluation of the Young Child, Birth-8 Years","Exploration and application of technically sound formal and informal assessments that minimize bias, and  measurement principles and practices to evaluate and guide educational decisions through collaboration with colleagues and families. Includes a minimum of 20 hours of field experience.",Other,undergraduate,False,False,False,False,False,True
coloradomesa,2026,2026-2027,ECSE,450,Individual Behavior Support and Guidance with Young Learners,"Exploration of behavioral theories and their application to individual and classroom management of young learners, with an emphasis on the principles of applied behavior analysis.",Other,undergraduate,False,False,False,False,False,True
coloradomesa,2026,2026-2027,ECSE,493,Senior Capstone,"Teaching experience in an inclusive classroom, with opportunities to apply standards-based education, theories, and philosophies acquired in professional education coursework. Provides support in teaching and learning of early childhood students, ages birth - prekindergarten.",Other,undergraduate,True,False,False,False,False,True
coloradomesa,2026,2026-2027,FILM,110,Film Expression,"Critical examination of the nature and structure of motion picture expression. Concentrates on directors', editors', and cinematographers' use of various storytelling and visual techniques.",Other,undergraduate,False,False,False,False,False,True
coloradomesa,2026,2026-2027,FILM,111,Animation Expression,"Critical exploration of the evolution and impact of animated storytelling through history. Focus on how animators, studios, and artists have used innovative techniques, unique styles, and emerging technologies to shape animated expression. By examining the work of influential studios and creators, students will gain insight into the development of storytelling, character design, and visual artistry that define the animation industry.",Other,undergraduate,False,False,False,False,False,True
coloradomesa,2026,2026-2027,FILM,114,Introduction to Animation I,"Exploration of the foundational principles and techniques of animation. Topics include: squash-and-stretch, timing, anticipation, and other techniques to create dynamic and engaging animations, development of proficiency in industry-standard digital animation software, and the foundations of visual storytelling.",Other,undergraduate,False,False,False,False,False,True
coloradomesa,2026,2026-2027,FILM,115,Cinema Design Tools,"Exploration of Digital SLR camera use, raster photo-editing software, and vector drawing software for narrative video production.",Other,undergraduate,False,False,False,False,False,True
coloradomesa,2026,2026-2027,FILM,120,Film Script Analysis,"Study of film scripts by critically focusing on story techniques and analytical methods of summarizing, describing, interpreting, discussing and evaluating story narrative.",Other,undergraduate,False,False,False,False,False,True
coloradomesa,2026,2026-2027,FILM,124,Drawing for Animation,"Essential principles of drawing, with a strong emphasis on kinetic drawing and gesture drawing, to create compelling and expressive animated characters and scenes.",Other,undergraduate,False,False,False,False,False,True
coloradomesa,2026,2026-2027,FILM,125,Production Drawing & Design,Foundational methods of digital drawing to create characters and scenery for filmmaking concept art and previsualization.,Other,undergraduate,False,False,False,False,False,True
coloradomesa,2026,2026-2027,FILM,130,Short-Form Screenwriting,"Project- and activity-based introduction in screenwriting. Write, rewrite, and polish short-form scripts through collaboration. Build a portfolio to use in student productions.",Other,undergraduate,False,False,False,False,False,True
coloradomesa,2026,2026-2027,FILM,134,Storyboarding,"Development of a comprehensive understanding of the role of storyboarding in animation production. From concept to execution, explore the process of visualizing stories, characters, and scenes, ensuring that the storytelling vision is effectively communicated to the entire production team. Camera movements, framing, lighting, actor movement, and professional diagramming will also be explored.",Other,undergraduate,False,False,False,False,False,True
coloradomesa,2026,2026-2027,FILM,135,Cinema Editing Aesthetics,"Foundations of video editing theory. Find a personal editorial voice by uncovering the building blocks, personal decisions, and practices that make up the craft of narrative editing.",Other,undergraduate,False,False,False,False,False,True
coloradomesa,2026,2026-2027,FILM,139,Professional Documentary Production,"Proposing, researching, writing, and shooting original documentary projects. Students will be introduced to basic digital single-lens reflex camera cinematography theory and techniques.",Other,undergraduate,False,False,False,False,False,True
coloradomesa,2026,2026-2027,FILM,140,Commercial & Corporate Production,Introduction to basic digital single-lens reflex camera cinematography theory and techniques through commercial and corporate collaborative production.,Other,undergraduate,False,False,False,False,False,True
coloradomesa,2026,2026-2027,FILM,141,Film Production Assistant I,Foundational film production assistant skills. Assist in all phases of on-location production of second-year student films. Students may assist at nights and weekends.,Other,undergraduate,False,False,False,False,False,True
coloradomesa,2026,2026-2027,FILM,142,Film Production Assistant II,"Development of production coordinator leadership skills. In addition, assisting in all phases of on-location production of second-year student films. Students may assist at nights and weekends.",Other,undergraduate,False,False,False,False,False,True
coloradomesa,2026,2026-2027,FILM,143,Cinema Lighting,"Theoretical examination of cinematic lighting techniques for interior, exterior, and location settings. Analyze cinematic lighting examples to plan, design, and implement their re-creation.",Other,undergraduate,False,False,False,False,False,True
coloradomesa,2026,2026-2027,FILM,144,Sound Design for Film,"Principles and applications of basic audio recording, location mixing principles, Foley, and sound effects, which enhance soundtracks for media productions.",Other,undergraduate,False,False,False,False,False,True
coloradomesa,2026,2026-2027,FILM,145,Commercial & Corporate Video Editing,"Basic editing, manipulating and delivery of narrative video. Explore non-linear editing techniques including media management, editing tools, titles, motion control, and transitions.",Other,undergraduate,False,False,False,False,False,True
coloradomesa,2026,2026-2027,FILM,150,Episodic Screenwriting,Practical experience of writing realizable television and web series scripts. Emphasis on workshopping a pilot episode and creating the ancillary materials required to produce and market it.,Other,undergraduate,False,False,False,False,False,True
coloradomesa,2026,2026-2027,FILM,151,Cinematography,"Visual storytelling and mastery of the lens. Includes camera operation, lighting techniques, cinematic aesthetics, and other skills to capture stunning visuals and create compelling narratives. Hands-on experience to master the principles of cinematography, explore equipment and technology, and work on practical projects, culminating in the ability to produce professional-quality footage and tell captivating stories through the lens.",Other,undergraduate,False,False,False,False,False,True
coloradomesa,2026,2026-2027,FILM,154,Introduction to Animation II,"In-depth exploration of traditional animation techniques, equipping students with the expertise needed to create captivating and dynamic animated sequences. Students will be trained in all innovations in digital animation software that reduce workload and allow them to gain an advantage in the digital market.",Other,undergraduate,False,False,False,False,False,True
coloradomesa,2026,2026-2027,FILM,155,Commercial Audio Design,Principles and application of basic audio recording and mixing principles by enhancing soundtracks for media productions.,Other,undergraduate,False,False,False,False,False,True
coloradomesa,2026,2026-2027,FILM,160,Cinema Previsualization,Preproduction development in a digital environment. Includes traditional storyboarding and modern techniques using 3D or photo manipulation software.,Other,undergraduate,False,False,False,False,False,True
coloradomesa,2026,2026-2027,FILM,162,Animation Environments and Backgrounds,"Crafting of immersive environments for animation. This course focuses on digital drawing techniques to create dynamic backgrounds, emphasizing perspective, lighting, and atmospheric effects. Develop skills in color theory and consistency to enhance storytelling through compelling animated settings.",Other,undergraduate,False,False,False,False,False,True
coloradomesa,2026,2026-2027,FILM,164,Character Animation,"Exploration of the intricate nuances of bringing animated characters to life, with a strong emphasis on gesture animation, expressive character design, and infusing personality into animated creations. Solid drawing and consistent animation are further built upon as well as design and technique to both teach repetitive and stylistic characters in motion.",Other,undergraduate,False,False,False,False,False,True
coloradomesa,2026,2026-2027,FILM,165,Cinema Production Design,"Determination of emotional content of artistic choices in set design, locations, props, wardrobe and makeup through script and character analysis techniques, the research and previsualization process, and color theory.",Other,undergraduate,False,False,False,False,False,True
coloradomesa,2026,2026-2027,FILM,170,Short-Form Production,Basic techniques and tools of short-form video production. Use of narrative visual storytelling components and expressive visual elements.,Other,undergraduate,False,False,False,False,False,True
coloradomesa,2026,2026-2027,FILM,171,Animation Shorts,"Exploration of fundamental techniques and tools for creating short animated projects. Focus on narrative visual storytelling and the use of expressive, dynamic, visual elements to convey character, mood, and story in short-form animation.",Other,undergraduate,False,False,False,False,False,True
coloradomesa,2026,2026-2027,FILM,175,Short-Form Video Editing,"Intermediate short-form video editing. Refine workflows and production pipelines, advanced audio integration, transitions, and motion graphics.",Other,undergraduate,False,False,False,False,False,True
coloradomesa,2026,2026-2027,FILM,196,Topics:,,Other,undergraduate,False,False,False,False,False,True
coloradomesa,2026,2026-2027,FILM,200,Directing Film Actors,"Processes and techniques of directing film actors. Focus on script interpretation, working with actors, rehearsal, blocking for the camera, preparation for shooting, camera motivation, and dynamics.",Other,undergraduate,False,False,False,False,False,True
coloradomesa,2026,2026-2027,FILM,209,Production Budget and Scheduling,"Planning, scheduling, and budgeting for film production. Predict, calculate, and estimate insurance requirements, unions, and guilds. Use basic accounting practices to complete a budget and schedule.",Other,undergraduate,False,False,False,False,False,True
coloradomesa,2026,2026-2027,FILM,210,Cinema Production Management,"Processes and techniques of film and television producing. Predict, calculate, and estimate for insurance requirements, unions and guilds. Use basic accounting practices to complete a budget and schedule.",Other,undergraduate,False,False,False,False,False,True
coloradomesa,2026,2026-2027,FILM,211,Short-Form Production II,"Techniques and tools of short-form and independent film production. Use of narrative visual storytelling components and expressive visual elements. Emphasis on collaborative production during the various pre-production, production, and post-production stages.",Other,undergraduate,False,False,False,False,False,True
coloradomesa,2026,2026-2027,FILM,220,Cinema Audio Design,"Advanced cinematic audio recording techniques. Practice location recording, Foley, looping/ADR, sound effects layering, synchronization techniques, and surround sound mixing.",Other,undergraduate,False,False,False,False,False,True
coloradomesa,2026,2026-2027,FILM,225,Cinema Capstone I,First part of a two-semester sequence for the Cinema Capstone. Collaborate with Production Design students during a production's preproduction. Create a production's marketing plan.,Other,undergraduate,False,False,False,False,False,True
coloradomesa,2026,2026-2027,FILM,226,Technical Capstone I,First part of a two-semester sequence for the Technical Capstone. Collaborate with Writing/Directing students in the preproduction process. Help create a production marketing plan.,Other,undergraduate,False,False,False,False,False,True
coloradomesa,2026,2026-2027,FILM,230,Episodic Production,Continuation of collaborative development of advanced learn-by-doing productions. Develop and demonstrate the skills necessary to make effective and successful TV or web series.,Other,undergraduate,False,False,False,False,False,True
coloradomesa,2026,2026-2027,FILM,240,Digital Cinematic Effects,Digital cinematic effects development in the post-production environment. Analyze style and emotional aesthetic and learn to support story by synthesizing video elements.,Other,undergraduate,False,False,False,False,False,True
coloradomesa,2026,2026-2027,FILM,250,Episodic Video Editing,"Further exploration of advanced digital editing techniques. Edit a final episodic narrative production. Master collaborative workflows, advanced audio production, and special effects.",Other,undergraduate,False,False,False,False,False,True
coloradomesa,2026,2026-2027,FILM,260,Freelancing for Creatives,"Examination of self-employment.  Explore networking, financing, basic business law, insurance, intellectual property rights, government regulations, time management, record keeping, taxes, and work-life balance.",Other,undergraduate,False,False,False,False,False,True
coloradomesa,2026,2026-2027,FILM,264,Multimedia and Special Effects,"Exploration of the art of visual storytelling through the creation of multimedia content enriched with digital special effects and innovative techniques. The course covers a wide range of key topics, including: digital special effects, compositing 2D and 3D elements into live-action footage, motion graphics, 3D object import, advanced digital lighting, and advance rendering.",Other,undergraduate,False,False,False,False,False,True
coloradomesa,2026,2026-2027,FILM,265,Producing Indie Films,"Basic principles to produce independent films. Create a business plan that includes marketing, financing, and distribution and measuring, analyzing, and assessing the industry, box office, markets, and risk factors.",Other,undergraduate,False,False,False,False,False,True
coloradomesa,2026,2026-2027,FILM,270,Cinema Capstone II,"Second part of a two-semester sequence for the Cinema Capstone. Collaborate with Production Design students during shooting, post, and presentation of either a narrative, corporate, or series production.",Other,undergraduate,False,False,False,False,False,True
coloradomesa,2026,2026-2027,FILM,271,Technical Capstone II,"Second part of a two-semester sequence for the Technical Capstone. Collaborate with Writing/Directing students on either a short-form narrative, corporate, or series production.",Other,undergraduate,False,False,False,False,False,True
coloradomesa,2026,2026-2027,FILM,295,Independent Study,,Other,undergraduate,False,False,False,False,False,True
coloradomesa,2026,2026-2027,FILM,299,Internship,Application of classroom theory to on-the-job experiences. Work at approved professional positions related to film and TV production.,Other,undergraduate,False,False,False,False,False,True
coloradomesa,2026,2026-2027,EDUT,250,Career and Technical Education in Colorado,"Explores common elements of Career and Technical Education philosophy and current practices.  It details the philosophy of Career and Technical Education (CTE), the federal Carl D. Perkins legislation and related guidelines for CTE, the Colorado Technical Act, national and state regulatory agencies, the CCCS program approval process, enrollment management and advising strategies, relevant local and national issues, and quality assurance principles.",Other,undergraduate,False,False,False,False,False,True
coloradomesa,2026,2026-2027,EDUT,251,Secondary CTE Capstone,"This capstone course in the secondary CTE credentialing sequence offers an in-depth analysis of secondary career and technical student organizations and competitions, the Colorado Technical Act, working with exceptional students, creating and effectively deploying program advisory committees, and an overview of educational and political systems in Colorado.  The final project is an analysis of the efficiency with which one's employing school district funds, operates and assesses CTE programs.",Other,undergraduate,False,False,False,False,False,True
